-- tests for 
-- see https://www.postgresql.org/docs/current/multibyte.html
-- EUC_CN, not tested
-- EUC_JP
-- EUC_JIS_2004, not tested
-- EUC_KR
-- EUC_TW, not tested
-- ISO_8859_5
-- ISO_8859_6
-- ISO_8859_7
-- ISO_8859_8
-- KOI8R, not tested
-- KOI8U, not tested
-- LATIN1
-- LATIN2
-- LATIN3
-- LATIN4
-- LATIN5
-- LATIN6
-- LATIN7
-- LATIN8
-- LATIN9
-- LATIN10
-- MULE_INTERNAL, not tested
-- SQL_ASCII
-- WIN866, not tested
-- WIN874, not tested
-- WIN1250
-- WIN1251
-- WIN1252
-- WIN1253
-- WIN1254
-- WIN1255
-- WIN1256
-- WIN1257
-- WIN1258, not tested
\! redis-cli < test/redis_utf8
OK
OK
OK
OK
OK
OK
OK
OK
OK
OK
OK
OK
OK
OK
OK
OK
OK
OK
OK
OK
OK
-- ================
-- check all data in UTF8
-- ================
CREATE EXTENSION redis_fdw;
CREATE SERVER redis_testing_server FOREIGN DATA WRAPPER redis_fdw;
CREATE FOREIGN TABLE "Unicode data"(i text, t text)
SERVER redis_testing_server
OPTIONS (database '15');
CREATE USER MAPPING FOR public SERVER redis_testing_server;
SELECT * FROM "Unicode data" ORDER BY i;
    i    |                                                           t                                                            
---------+------------------------------------------------------------------------------------------------------------------------
 utf_ara | أبجد هوَّز حُطّي كلَمُن سَعْفَص قُرِشَت ثَخَدٌ ضَظَغ
 utf_arm | Բել դղյակի ձախ ժամն օֆ ազգությանը ցպահանջ չճշտած վնաս էր եւ փառք։
 utf_aze | Zəfər, jaketini də, papağını da götür, bu axşam hava çox soyuq olacaq.
 utf_bel | У рудога вераб’я ў сховішчы пад фатэлем ляжаць нейкія гаючыя зёлкі.
 utf_bul | Ах, чудна българска земьо, полюшвай цъфтящи жита.
 utf_cze | Zvlášť zákeřný učeň s ďolíčky běží podél zóny úlů.
 utf_epo | Laŭ Ludoviko Zamenhof bongustas freŝa ĉeĥa manĝaĵo kun spicoj.
 utf_eus | Permin gox dabiltzu yoskiñ.
 utf_fra | Dès Noël où un zéphyr haï me vêt de glaçons würmiens je dîne d’exquis rôtis de bœuf au kir à l’aÿ d’âge mûr & cætera !
 utf_gle | Chuaigh bé mhórshách le dlúthspád fíorfhinn trí hata mo dhea-phorcáin bhig.
 utf_gre | Τάχιστη αλώπηξ βαφής ψημένη γη, δρασκελίζει υπέρ νωθρού κυνός
 utf_heb | עטלף אבק נס דרך מזגן שהתפוצץ כי חם
 utf_jap | いろはにほへと ちりぬるを わかよたれそ つねならむ うゐのおくやま けふこえて あさきゆめみし ゑひもせす.
 utf_kor | 키스의 고유조건은 입술끼리 만나야 하고 특별한 기술은 필요치 않다.
 utf_lav | Ķieģeļu cepējs Edgars Buls fraku un hūti žāvē uz čīkstošām eņģēm.
 utf_pol | Pchnąć w tę łódź jeża lub ośm skrzyń fig.
 utf_rus | Широкая электрификация южных губерний даст мощный толчок подъёму сельского хозяйства.
 utf_spa | Quiere la boca exhausta vid, kiwi, piña y fugaz jamón.
 utf_srp | Ljubavi, Olga, hajde pođi u Fudži i čut ćeš nježnu muziku srca.
 utf_ukr | Гей, хлопці, не вспію — на ґанку ваша файна їжа знищується бурундучком.
(20 rows)

DROP FOREIGN TABLE "Unicode data";
DROP SERVER redis_testing_server CASCADE;
NOTICE:  drop cascades to user mapping for public on server redis_testing_server
DROP EXTENSION redis_fdw;
-- euc_jp
CREATE DATABASE "contrib_regression_EUC_JP" ENCODING EUC_JP LC_CTYPE='ja_JP.eucjp' LC_COLLATE='ja_JP.eucjp' template template0;
\connect "contrib_regression_EUC_JP"
CREATE EXTENSION redis_fdw;
CREATE SERVER redis_testing_server FOREIGN DATA WRAPPER redis_fdw;
CREATE FOREIGN TABLE "Unicode data"(i text, t text)
SERVER redis_testing_server
OPTIONS (database '15');
CREATE USER MAPPING FOR public SERVER redis_testing_server; 
-- EUC_JP
SELECT * FROM "Unicode data" WHERE i = 'jap';
 i | t 
---+---
(0 rows)

SELECT * FROM "Unicode data" WHERE t LIKE 'いろはにほ%';
 i | t 
---+---
(0 rows)

INSERT INTO "Unicode data" (i, t) VALUES ('jap+', 'いろはにほへと ちりぬるを わかよたれそ つねならむ うゐのおくやま けふこえて あさきゆめみし ゑひもせす._');
DELETE FROM "Unicode data" WHERE t = 'いろはにほへと ちりぬるを わかよたれそ つねならむ うゐのおくやま けふこえて あさきゆめみし ゑひもせす._';
SELECT count(*) n FROM "Unicode data" WHERE i = 'jap+';
 n 
---
 0
(1 row)

-- 1251, ISO_8859_5
SELECT * FROM "Unicode data" WHERE i = 'bel';
 i | t 
---+---
(0 rows)

SELECT * FROM "Unicode data" WHERE i = 'bul';
 i | t 
---+---
(0 rows)

SELECT * FROM "Unicode data" WHERE i = 'rus';
 i | t 
---+---
(0 rows)

SELECT * FROM "Unicode data" WHERE i = 'ukr';
 i | t 
---+---
(0 rows)

SELECT * FROM "Unicode data" WHERE t LIKE 'У руд%';
 i | t 
---+---
(0 rows)

SELECT * FROM "Unicode data" WHERE t LIKE 'Ах, ч%';
 i | t 
---+---
(0 rows)

SELECT * FROM "Unicode data" WHERE t LIKE 'Широк%';
 i | t 
---+---
(0 rows)

SELECT * FROM "Unicode data" WHERE t LIKE 'Гей, %';
 i | t 
---+---
(0 rows)

INSERT INTO "Unicode data" (i, t) VALUES ('bel+', 'У рудога вераб’я ў сховішчы пад фатэлем ляжаць нейкія гаючыя зёлкі._');
SELECT * FROM "Unicode data" WHERE i = 'bel+';
  i   |                                  t                                   
------+----------------------------------------------------------------------
 bel+ | У рудога вераб’я ў сховішчы пад фатэлем ляжаць нейкія гаючыя зёлкі._
(1 row)

DELETE FROM "Unicode data" WHERE t = 'У рудога вераб’я ў сховішчы пад фатэлем ляжаць нейкія гаючыя зёлкі._';
SELECT count(*) n FROM "Unicode data" WHERE i = 'bel+';
 n 
---
 0
(1 row)

INSERT INTO "Unicode data" (i, t) VALUES ('bul+', 'Ах, чудна българска земьо, полюшвай цъфтящи жита._');
SELECT * FROM "Unicode data" WHERE i = 'bul+';
  i   |                         t                          
------+----------------------------------------------------
 bul+ | Ах, чудна българска земьо, полюшвай цъфтящи жита._
(1 row)

DELETE FROM "Unicode data" WHERE t = 'Ах, чудна българска земьо, полюшвай цъфтящи жита._';
SELECT count(*) n FROM "Unicode data" WHERE i = 'bul+';
 n 
---
 0
(1 row)

INSERT INTO "Unicode data" (i, t) VALUES ('rus+', 'Широкая электрификация южных губерний даст мощный толчок подъёму сельского хозяйства._');
SELECT * FROM "Unicode data" WHERE i = 'rus+';
  i   |                                           t                                            
------+----------------------------------------------------------------------------------------
 rus+ | Широкая электрификация южных губерний даст мощный толчок подъёму сельского хозяйства._
(1 row)

DELETE FROM "Unicode data" WHERE t = 'Широкая электрификация южных губерний даст мощный толчок подъёму сельского хозяйства._';
SELECT count(*) n FROM "Unicode data" WHERE i = 'rus+';
 n 
---
 0
(1 row)

INSERT INTO "Unicode data" (i, t) VALUES ('ukr+', 'Гей, хлопці, не вспію — на ґанку ваша файна їжа знищується бурундучком._');
ERROR:  character with byte sequence 0xe2 0x80 0x94 in encoding "UTF8" has no equivalent in encoding "EUC_JP"
SELECT * FROM "Unicode data" WHERE i = 'ukr+';
 i | t 
---+---
(0 rows)

DELETE FROM "Unicode data" WHERE t = 'Гей, хлопці, не вспію — на ґанку ваша файна їжа знищується бурундучком._';
ERROR:  character with byte sequence 0xe2 0x80 0x94 in encoding "UTF8" has no equivalent in encoding "EUC_JP"
SELECT count(*) n FROM "Unicode data" WHERE i = 'ukr+';
 n 
---
 0
(1 row)

-- 1256, ISO_8859_6
SELECT * FROM "Unicode data" WHERE i = 'ara';
 i | t 
---+---
(0 rows)

SELECT * FROM "Unicode data" WHERE t LIKE '%ضَظَغ%';
ERROR:  character with byte sequence 0xd8 0xb6 in encoding "UTF8" has no equivalent in encoding "EUC_JP"
INSERT INTO "Unicode data" (i, t) VALUES ('ara+', 'أبجد هوَّز حُطّي كلَمُن سَعْفَص قُرِشَت ثَخَدٌ ضَظَغ_');
ERROR:  character with byte sequence 0xd8 0xa3 in encoding "UTF8" has no equivalent in encoding "EUC_JP"
SELECT * FROM "Unicode data" WHERE i = 'ara+';
 i | t 
---+---
(0 rows)

DELETE FROM "Unicode data" WHERE t = 'أبجد هوَّز حُطّي كلَمُن سَعْفَص قُرِشَت ثَخَدٌ ضَظَغ_';
ERROR:  character with byte sequence 0xd8 0xa3 in encoding "UTF8" has no equivalent in encoding "EUC_JP"
SELECT count(*) n FROM "Unicode data" WHERE i = 'ara+';
 n 
---
 0
(1 row)

-- 1253, ISO_8859_7
SELECT * FROM "Unicode data" WHERE i = 'gre';
 i | t 
---+---
(0 rows)

SELECT * FROM "Unicode data" WHERE t LIKE 'Τάχισ%';
 i | t 
---+---
(0 rows)

INSERT INTO "Unicode data" (i, t) VALUES ('gre+', 'Τάχιστη αλώπηξ βαφής ψημένη γη, δρασκελίζει υπέρ νωθρού κυνός_');
SELECT * FROM "Unicode data" WHERE i = 'gre+';
  i   |                               t                                
------+----------------------------------------------------------------
 gre+ | Τάχιστη αλώπηξ βαφής ψημένη γη, δρασκελίζει υπέρ νωθρού κυνός_
(1 row)

DELETE FROM "Unicode data" WHERE t = 'Τάχιστη αλώπηξ βαφής ψημένη γη, δρασκελίζει υπέρ νωθρού κυνός_';
-- 1255, ISO_8859_8
SELECT * FROM "Unicode data" WHERE i = 'heb';
 i | t 
---+---
(0 rows)

SELECT * FROM "Unicode data" WHERE t LIKE '%כי ח%';
ERROR:  character with byte sequence 0xd7 0x9b in encoding "UTF8" has no equivalent in encoding "EUC_JP"
INSERT INTO "Unicode data" (i, t) VALUES ('heb+', 'עטלף אבק נס דרך מזגן שהתפוצץ כי חם_');
ERROR:  character with byte sequence 0xd7 0xa2 in encoding "UTF8" has no equivalent in encoding "EUC_JP"
SELECT * FROM "Unicode data" WHERE i = 'heb+';
 i | t 
---+---
(0 rows)

DELETE FROM "Unicode data" WHERE t = 'עטלף אבק נס דרך מזגן שהתפוצץ כי חם_';
ERROR:  character with byte sequence 0xd7 0xa2 in encoding "UTF8" has no equivalent in encoding "EUC_JP"
SELECT count(*) n FROM "Unicode data" WHERE i = 'heb+';
 n 
---
 0
(1 row)

-- 1252, LATIN1
SELECT * FROM "Unicode data" WHERE i = 'eus';
 i | t 
---+---
(0 rows)

SELECT * FROM "Unicode data" WHERE i = 'fra';
 i | t 
---+---
(0 rows)

SELECT * FROM "Unicode data" WHERE i = 'spa';
 i | t 
---+---
(0 rows)

SELECT * FROM "Unicode data" WHERE t LIKE 'Permi%';
    i    |              t               
---------+------------------------------
 utf_eus | Permin gox dabiltzu yoski単.
(1 row)

SELECT * FROM "Unicode data" WHERE t LIKE 'Dès N%';
 i | t 
---+---
(0 rows)

SELECT * FROM "Unicode data" WHERE t LIKE 'Quier%';
    i    |                            t                             
---------+----------------------------------------------------------
 utf_spa | Quiere la boca exhausta vid, kiwi, pi単a y fugaz jam坦n.
(1 row)

INSERT INTO "Unicode data" (i, t) VALUES ('eus+', 'Permin gox dabiltzu yoskiñ._');
SELECT * FROM "Unicode data" WHERE i = 'eus+';
  i   |              t               
------+------------------------------
 eus+ | Permin gox dabiltzu yoskiñ._
(1 row)

DELETE FROM "Unicode data" WHERE t = 'Permin gox dabiltzu yoskiñ._';
SELECT count(*) n FROM "Unicode data" WHERE i = 'eus+';
 n 
---
 0
(1 row)

INSERT INTO "Unicode data" (i, t) VALUES ('fra+', 'Dès Noël où un zéphyr haï me vêt de glaçons würmiens je dîne d’exquis rôtis de bœuf au kir à l’aÿ d’âge mûr & cætera !_');
SELECT * FROM "Unicode data" WHERE i = 'fra+';
  i   |                                                            t                                                            
------+-------------------------------------------------------------------------------------------------------------------------
 fra+ | Dès Noël où un zéphyr haï me vêt de glaçons würmiens je dîne d’exquis rôtis de bœuf au kir à l’aÿ d’âge mûr & cætera !_
(1 row)

DELETE FROM "Unicode data" WHERE t = 'Dès Noël où un zéphyr haï me vêt de glaçons würmiens je dîne d’exquis rôtis de bœuf au kir à l’aÿ d’âge mûr & cætera !_';
SELECT count(*) n FROM "Unicode data" WHERE i = 'fra+';
 n 
---
 0
(1 row)

INSERT INTO "Unicode data" (i, t) VALUES ('spa+', 'Quiere la boca exhausta vid, kiwi, piña y fugaz jamón._');
SELECT * FROM "Unicode data" WHERE i = 'spa+';
  i   |                            t                            
------+---------------------------------------------------------
 spa+ | Quiere la boca exhausta vid, kiwi, piña y fugaz jamón._
(1 row)

DELETE FROM "Unicode data" WHERE t = 'Quiere la boca exhausta vid, kiwi, piña y fugaz jamón._';
SELECT count(*) n FROM "Unicode data" WHERE i = 'spa+';
 n 
---
 0
(1 row)

-- 1250, LATIN2
SELECT * FROM "Unicode data" WHERE i = 'cze';
 i | t 
---+---
(0 rows)

SELECT * FROM "Unicode data" WHERE i = 'pol';
 i | t 
---+---
(0 rows)

SELECT * FROM "Unicode data" WHERE i = 'srp';
 i | t 
---+---
(0 rows)

SELECT * FROM "Unicode data" WHERE t LIKE 'Zvláš%';
 i | t 
---+---
(0 rows)

SELECT * FROM "Unicode data" WHERE t LIKE 'Pchną%';
 i | t 
---+---
(0 rows)

SELECT * FROM "Unicode data" WHERE t LIKE 'Ljuba%';
ERROR:  invalid byte sequence for encoding "EUC_JP": 0xc4 0x91
INSERT INTO "Unicode data" (i, t) VALUES ('cze+', 'Zvlášť zákeřný učeň s ďolíčky běží podél zóny úlů._');
SELECT * FROM "Unicode data" WHERE i = 'cze+';
  i   |                          t                          
------+-----------------------------------------------------
 cze+ | Zvlášť zákeřný učeň s ďolíčky běží podél zóny úlů._
(1 row)

DELETE FROM "Unicode data" WHERE t = 'Zvlášť zákeřný učeň s ďolíčky běží podél zóny úlů._';
SELECT count(*) n FROM "Unicode data" WHERE i = 'cze+';
 n 
---
 0
(1 row)

INSERT INTO "Unicode data" (i, t) VALUES ('pol+', 'Pchnąć w tę łódź jeża lub ośm skrzyń fig._');
SELECT * FROM "Unicode data" WHERE i = 'pol+';
  i   |                     t                      
------+--------------------------------------------
 pol+ | Pchnąć w tę łódź jeża lub ośm skrzyń fig._
(1 row)

DELETE FROM "Unicode data" WHERE t = 'Pchnąć w tę łódź jeża lub ośm skrzyń fig._';
SELECT count(*) n FROM "Unicode data" WHERE i = 'pol+';
 n 
---
 0
(1 row)

INSERT INTO "Unicode data" (i, t) VALUES ('srp+', 'Ljubavi, Olga, hajde pođi u Fudži i čut ćeš nježnu muziku srca._');
SELECT * FROM "Unicode data" WHERE i = 'srp+';
  i   |                                t                                 
------+------------------------------------------------------------------
 srp+ | Ljubavi, Olga, hajde pođi u Fudži i čut ćeš nježnu muziku srca._
(1 row)

DELETE FROM "Unicode data" WHERE t = 'Ljubavi, Olga, hajde pođi u Fudži i čut ćeš nježnu muziku srca._';
SELECT count(*) n FROM "Unicode data" WHERE i = 'srp+';
 n 
---
 0
(1 row)

-- 1257, LATIN7
SELECT * FROM "Unicode data" WHERE i = 'lav';
 i | t 
---+---
(0 rows)

SELECT * FROM "Unicode data" WHERE t LIKE 'Ķieģeļu%';
ERROR:  character with byte sequence 0xc4 0xa3 in encoding "UTF8" has no equivalent in encoding "EUC_JP"
INSERT INTO "Unicode data" (i, t) VALUES ('lav+', 'Ķieģeļu cepējs Edgars Buls fraku un hūti žāvē uz čīkstošām eņģēm._');
ERROR:  character with byte sequence 0xc4 0xa3 in encoding "UTF8" has no equivalent in encoding "EUC_JP"
SELECT * FROM "Unicode data" WHERE i = 'lav+';
 i | t 
---+---
(0 rows)

DELETE FROM "Unicode data" WHERE t = 'Ķieģeļu cepējs Edgars Buls fraku un hūti žāvē uz čīkstošām eņģēm._';
ERROR:  character with byte sequence 0xc4 0xa3 in encoding "UTF8" has no equivalent in encoding "EUC_JP"
SELECT count(*) n FROM "Unicode data" WHERE i = 'lav+';
 n 
---
 0
(1 row)

-- EUC_KR
SELECT * FROM "Unicode data" WHERE i = 'kor';
 i | t 
---+---
(0 rows)

SELECT * FROM "Unicode data" WHERE t LIKE '키스의 고%';
ERROR:  character with byte sequence 0xed 0x82 0xa4 in encoding "UTF8" has no equivalent in encoding "EUC_JP"
INSERT INTO "Unicode data" (i, t) VALUES ('kor+', '키스의 고유조건은 입술끼리 만나야 하고 특별한 기술은 필요치 않다._');
ERROR:  character with byte sequence 0xed 0x82 0xa4 in encoding "UTF8" has no equivalent in encoding "EUC_JP"
SELECT * FROM "Unicode data" WHERE i = 'kor+';
 i | t 
---+---
(0 rows)

DELETE FROM "Unicode data" WHERE t = '키스의 고유조건은 입술끼리 만나야 하고 특별한 기술은 필요치 않다._';
ERROR:  character with byte sequence 0xed 0x82 0xa4 in encoding "UTF8" has no equivalent in encoding "EUC_JP"
SELECT count(*) n FROM "Unicode data" WHERE i = 'kor+';
 n 
---
 0
(1 row)

-- 1254, LATIN5
SELECT * FROM "Unicode data" WHERE i = 'aze';
 i | t 
---+---
(0 rows)

SELECT * FROM "Unicode data" WHERE t LIKE 'Zəfər%';
ERROR:  character with byte sequence 0xc9 0x99 in encoding "UTF8" has no equivalent in encoding "EUC_JP"
INSERT INTO "Unicode data" (i, t) VALUES ('aze+', 'Zəfər, jaketini də, papağını da götür, bu axşam hava çox soyuq olacaq._');
ERROR:  character with byte sequence 0xc9 0x99 in encoding "UTF8" has no equivalent in encoding "EUC_JP"
SELECT * FROM "Unicode data" WHERE i = 'aze+';
 i | t 
---+---
(0 rows)

DELETE FROM "Unicode data" WHERE t = 'Zəfər, jaketini də, papağını da götür, bu axşam hava çox soyuq olacaq._';
ERROR:  character with byte sequence 0xc9 0x99 in encoding "UTF8" has no equivalent in encoding "EUC_JP"
SELECT count(*) n FROM "Unicode data" WHERE i = 'aze+';
 n 
---
 0
(1 row)

-- etc
INSERT INTO "Unicode data" (i, t) VALUES ('arm+', 'Բել դղյակի ձախ ժամն օֆ ազգությանը ցպահանջ չճշտած վնաս էր եւ փառք։_');
ERROR:  character with byte sequence 0xd4 0xb2 in encoding "UTF8" has no equivalent in encoding "EUC_JP"
SELECT * FROM "Unicode data" WHERE i = 'arm+';
 i | t 
---+---
(0 rows)

DELETE FROM "Unicode data" WHERE t = 'Բել դղյակի ձախ ժամն օֆ ազգությանը ցպահանջ չճշտած վնաս էր եւ փառք։_';
ERROR:  character with byte sequence 0xd4 0xb2 in encoding "UTF8" has no equivalent in encoding "EUC_JP"
SELECT count(*) n FROM "Unicode data" WHERE i = 'arm+';
 n 
---
 0
(1 row)

INSERT INTO "Unicode data" (i, t) VALUES ('gle+', 'Chuaigh bé mhórshách le dlúthspád fíorfhinn trí hata mo dhea-phorcáin bhig._');
SELECT * FROM "Unicode data" WHERE i = 'gle+';
  i   |                                      t                                       
------+------------------------------------------------------------------------------
 gle+ | Chuaigh bé mhórshách le dlúthspád fíorfhinn trí hata mo dhea-phorcáin bhig._
(1 row)

DELETE FROM "Unicode data" WHERE t = 'Chuaigh bé mhórshách le dlúthspád fíorfhinn trí hata mo dhea-phorcáin bhig._';
SELECT count(*) n FROM "Unicode data" WHERE i = 'gle+';
 n 
---
 0
(1 row)

INSERT INTO "Unicode data" (i, t) VALUES ('epo+', 'Laŭ Ludoviko Zamenhof bongustas freŝa ĉeĥa manĝaĵo kun spicoj._');
SELECT * FROM "Unicode data" WHERE i = 'epo+';
  i   |                                t                                
------+-----------------------------------------------------------------
 epo+ | Laŭ Ludoviko Zamenhof bongustas freŝa ĉeĥa manĝaĵo kun spicoj._
(1 row)

DELETE FROM "Unicode data" WHERE t = 'Laŭ Ludoviko Zamenhof bongustas freŝa ĉeĥa manĝaĵo kun spicoj._';
SELECT count(*) n FROM "Unicode data" WHERE i = 'epo+';
 n 
---
 0
(1 row)

DROP FOREIGN TABLE "Unicode data";
DROP SERVER redis_testing_server CASCADE;
NOTICE:  drop cascades to user mapping for public on server redis_testing_server
DROP EXTENSION redis_fdw;
\connect contrib_regression;
DROP DATABASE "contrib_regression_EUC_JP";
-- ko_KR.euckr
CREATE DATABASE "contrib_regression_EUC_KR" ENCODING EUC_KR LC_CTYPE='ko_KR.euckr' LC_COLLATE='ko_KR.euckr' template template0;
\connect "contrib_regression_EUC_KR"
CREATE EXTENSION redis_fdw;
CREATE SERVER redis_testing_server FOREIGN DATA WRAPPER redis_fdw;
CREATE FOREIGN TABLE "Unicode data"(i text, t text)
SERVER redis_testing_server
OPTIONS (database '15');
CREATE USER MAPPING FOR public SERVER redis_testing_server; 
-- EUC_JP
SELECT * FROM "Unicode data" WHERE i = 'jap';
 i | t 
---+---
(0 rows)

SELECT * FROM "Unicode data" WHERE t LIKE 'いろはにほ%';
 i | t 
---+---
(0 rows)

INSERT INTO "Unicode data" (i, t) VALUES ('jap+', 'いろはにほへと ちりぬるを わかよたれそ つねならむ うゐのおくやま けふこえて あさきゆめみし ゑひもせす._');
DELETE FROM "Unicode data" WHERE t = 'いろはにほへと ちりぬるを わかよたれそ つねならむ うゐのおくやま けふこえて あさきゆめみし ゑひもせす._';
SELECT count(*) n FROM "Unicode data" WHERE i = 'jap+';
 n 
---
 0
(1 row)

-- 1251, ISO_8859_5
SELECT * FROM "Unicode data" WHERE i = 'bel';
 i | t 
---+---
(0 rows)

SELECT * FROM "Unicode data" WHERE i = 'bul';
 i | t 
---+---
(0 rows)

SELECT * FROM "Unicode data" WHERE i = 'rus';
 i | t 
---+---
(0 rows)

SELECT * FROM "Unicode data" WHERE i = 'ukr';
 i | t 
---+---
(0 rows)

SELECT * FROM "Unicode data" WHERE t LIKE 'У руд%';
 i | t 
---+---
(0 rows)

SELECT * FROM "Unicode data" WHERE t LIKE 'Ах, ч%';
 i | t 
---+---
(0 rows)

SELECT * FROM "Unicode data" WHERE t LIKE 'Широк%';
 i | t 
---+---
(0 rows)

SELECT * FROM "Unicode data" WHERE t LIKE 'Гей, %';
 i | t 
---+---
(0 rows)

INSERT INTO "Unicode data" (i, t) VALUES ('bel+', 'У рудога вераб’я ў сховішчы пад фатэлем ляжаць нейкія гаючыя зёлкі._');
ERROR:  character with byte sequence 0xd1 0x9e in encoding "UTF8" has no equivalent in encoding "EUC_KR"
SELECT * FROM "Unicode data" WHERE i = 'bel+';
 i | t 
---+---
(0 rows)

DELETE FROM "Unicode data" WHERE t = 'У рудога вераб’я ў сховішчы пад фатэлем ляжаць нейкія гаючыя зёлкі._';
ERROR:  character with byte sequence 0xd1 0x9e in encoding "UTF8" has no equivalent in encoding "EUC_KR"
SELECT count(*) n FROM "Unicode data" WHERE i = 'bel+';
 n 
---
 0
(1 row)

INSERT INTO "Unicode data" (i, t) VALUES ('bul+', 'Ах, чудна българска земьо, полюшвай цъфтящи жита._');
SELECT * FROM "Unicode data" WHERE i = 'bul+';
  i   |                         t                          
------+----------------------------------------------------
 bul+ | Ах, чудна българска земьо, полюшвай цъфтящи жита._
(1 row)

DELETE FROM "Unicode data" WHERE t = 'Ах, чудна българска земьо, полюшвай цъфтящи жита._';
SELECT count(*) n FROM "Unicode data" WHERE i = 'bul+';
 n 
---
 0
(1 row)

INSERT INTO "Unicode data" (i, t) VALUES ('rus+', 'Широкая электрификация южных губерний даст мощный толчок подъёму сельского хозяйства._');
SELECT * FROM "Unicode data" WHERE i = 'rus+';
  i   |                                           t                                            
------+----------------------------------------------------------------------------------------
 rus+ | Широкая электрификация южных губерний даст мощный толчок подъёму сельского хозяйства._
(1 row)

DELETE FROM "Unicode data" WHERE t = 'Широкая электрификация южных губерний даст мощный толчок подъёму сельского хозяйства._';
SELECT count(*) n FROM "Unicode data" WHERE i = 'rus+';
 n 
---
 0
(1 row)

INSERT INTO "Unicode data" (i, t) VALUES ('ukr+', 'Гей, хлопці, не вспію — на ґанку ваша файна їжа знищується бурундучком._');
ERROR:  character with byte sequence 0xd1 0x96 in encoding "UTF8" has no equivalent in encoding "EUC_KR"
SELECT * FROM "Unicode data" WHERE i = 'ukr+';
 i | t 
---+---
(0 rows)

DELETE FROM "Unicode data" WHERE t = 'Гей, хлопці, не вспію — на ґанку ваша файна їжа знищується бурундучком._';
ERROR:  character with byte sequence 0xd1 0x96 in encoding "UTF8" has no equivalent in encoding "EUC_KR"
SELECT count(*) n FROM "Unicode data" WHERE i = 'ukr+';
 n 
---
 0
(1 row)

-- 1256, ISO_8859_6
SELECT * FROM "Unicode data" WHERE i = 'ara';
 i | t 
---+---
(0 rows)

SELECT * FROM "Unicode data" WHERE t LIKE '%ضَظَغ%';
ERROR:  character with byte sequence 0xd8 0xb6 in encoding "UTF8" has no equivalent in encoding "EUC_KR"
INSERT INTO "Unicode data" (i, t) VALUES ('ara+', 'أبجد هوَّز حُطّي كلَمُن سَعْفَص قُرِشَت ثَخَدٌ ضَظَغ_');
ERROR:  character with byte sequence 0xd8 0xa3 in encoding "UTF8" has no equivalent in encoding "EUC_KR"
SELECT * FROM "Unicode data" WHERE i = 'ara+';
 i | t 
---+---
(0 rows)

DELETE FROM "Unicode data" WHERE t = 'أبجد هوَّز حُطّي كلَمُن سَعْفَص قُرِشَت ثَخَدٌ ضَظَغ_';
ERROR:  character with byte sequence 0xd8 0xa3 in encoding "UTF8" has no equivalent in encoding "EUC_KR"
SELECT count(*) n FROM "Unicode data" WHERE i = 'ara+';
 n 
---
 0
(1 row)

-- 1253, ISO_8859_7
SELECT * FROM "Unicode data" WHERE i = 'gre';
 i | t 
---+---
(0 rows)

SELECT * FROM "Unicode data" WHERE t LIKE 'Τάχισ%';
ERROR:  character with byte sequence 0xce 0xac in encoding "UTF8" has no equivalent in encoding "EUC_KR"
INSERT INTO "Unicode data" (i, t) VALUES ('gre+', 'Τάχιστη αλώπηξ βαφής ψημένη γη, δρασκελίζει υπέρ νωθρού κυνός_');
ERROR:  character with byte sequence 0xce 0xac in encoding "UTF8" has no equivalent in encoding "EUC_KR"
SELECT * FROM "Unicode data" WHERE i = 'gre+';
 i | t 
---+---
(0 rows)

DELETE FROM "Unicode data" WHERE t = 'Τάχιστη αλώπηξ βαφής ψημένη γη, δρασκελίζει υπέρ νωθρού κυνός_';
ERROR:  character with byte sequence 0xce 0xac in encoding "UTF8" has no equivalent in encoding "EUC_KR"
-- 1255, ISO_8859_8
SELECT * FROM "Unicode data" WHERE i = 'heb';
 i | t 
---+---
(0 rows)

SELECT * FROM "Unicode data" WHERE t LIKE '%כי ח%';
ERROR:  character with byte sequence 0xd7 0x9b in encoding "UTF8" has no equivalent in encoding "EUC_KR"
INSERT INTO "Unicode data" (i, t) VALUES ('heb+', 'עטלף אבק נס דרך מזגן שהתפוצץ כי חם_');
ERROR:  character with byte sequence 0xd7 0xa2 in encoding "UTF8" has no equivalent in encoding "EUC_KR"
SELECT * FROM "Unicode data" WHERE i = 'heb+';
 i | t 
---+---
(0 rows)

DELETE FROM "Unicode data" WHERE t = 'עטלף אבק נס דרך מזגן שהתפוצץ כי חם_';
ERROR:  character with byte sequence 0xd7 0xa2 in encoding "UTF8" has no equivalent in encoding "EUC_KR"
SELECT count(*) n FROM "Unicode data" WHERE i = 'heb+';
 n 
---
 0
(1 row)

-- 1252, LATIN1
SELECT * FROM "Unicode data" WHERE i = 'eus';
 i | t 
---+---
(0 rows)

SELECT * FROM "Unicode data" WHERE i = 'fra';
 i | t 
---+---
(0 rows)

SELECT * FROM "Unicode data" WHERE i = 'spa';
 i | t 
---+---
(0 rows)

SELECT * FROM "Unicode data" WHERE t LIKE 'Permi%';
    i    |              t               
---------+------------------------------
 utf_eus | Permin gox dabiltzu yoski챰.
(1 row)

SELECT * FROM "Unicode data" WHERE t LIKE 'Dès N%';
ERROR:  character with byte sequence 0xc3 0xa8 in encoding "UTF8" has no equivalent in encoding "EUC_KR"
SELECT * FROM "Unicode data" WHERE t LIKE 'Quier%';
    i    |                            t                             
---------+----------------------------------------------------------
 utf_spa | Quiere la boca exhausta vid, kiwi, pi챰a y fugaz jam처n.
(1 row)

INSERT INTO "Unicode data" (i, t) VALUES ('eus+', 'Permin gox dabiltzu yoskiñ._');
ERROR:  character with byte sequence 0xc3 0xb1 in encoding "UTF8" has no equivalent in encoding "EUC_KR"
SELECT * FROM "Unicode data" WHERE i = 'eus+';
 i | t 
---+---
(0 rows)

DELETE FROM "Unicode data" WHERE t = 'Permin gox dabiltzu yoskiñ._';
ERROR:  character with byte sequence 0xc3 0xb1 in encoding "UTF8" has no equivalent in encoding "EUC_KR"
SELECT count(*) n FROM "Unicode data" WHERE i = 'eus+';
 n 
---
 0
(1 row)

INSERT INTO "Unicode data" (i, t) VALUES ('fra+', 'Dès Noël où un zéphyr haï me vêt de glaçons würmiens je dîne d’exquis rôtis de bœuf au kir à l’aÿ d’âge mûr & cætera !_');
ERROR:  character with byte sequence 0xc3 0xa8 in encoding "UTF8" has no equivalent in encoding "EUC_KR"
SELECT * FROM "Unicode data" WHERE i = 'fra+';
 i | t 
---+---
(0 rows)

DELETE FROM "Unicode data" WHERE t = 'Dès Noël où un zéphyr haï me vêt de glaçons würmiens je dîne d’exquis rôtis de bœuf au kir à l’aÿ d’âge mûr & cætera !_';
ERROR:  character with byte sequence 0xc3 0xa8 in encoding "UTF8" has no equivalent in encoding "EUC_KR"
SELECT count(*) n FROM "Unicode data" WHERE i = 'fra+';
 n 
---
 0
(1 row)

INSERT INTO "Unicode data" (i, t) VALUES ('spa+', 'Quiere la boca exhausta vid, kiwi, piña y fugaz jamón._');
ERROR:  character with byte sequence 0xc3 0xb1 in encoding "UTF8" has no equivalent in encoding "EUC_KR"
SELECT * FROM "Unicode data" WHERE i = 'spa+';
 i | t 
---+---
(0 rows)

DELETE FROM "Unicode data" WHERE t = 'Quiere la boca exhausta vid, kiwi, piña y fugaz jamón._';
ERROR:  character with byte sequence 0xc3 0xb1 in encoding "UTF8" has no equivalent in encoding "EUC_KR"
SELECT count(*) n FROM "Unicode data" WHERE i = 'spa+';
 n 
---
 0
(1 row)

-- 1250, LATIN2
SELECT * FROM "Unicode data" WHERE i = 'cze';
 i | t 
---+---
(0 rows)

SELECT * FROM "Unicode data" WHERE i = 'pol';
 i | t 
---+---
(0 rows)

SELECT * FROM "Unicode data" WHERE i = 'srp';
 i | t 
---+---
(0 rows)

SELECT * FROM "Unicode data" WHERE t LIKE 'Zvláš%';
ERROR:  character with byte sequence 0xc3 0xa1 in encoding "UTF8" has no equivalent in encoding "EUC_KR"
SELECT * FROM "Unicode data" WHERE t LIKE 'Pchną%';
ERROR:  character with byte sequence 0xc4 0x85 in encoding "UTF8" has no equivalent in encoding "EUC_KR"
SELECT * FROM "Unicode data" WHERE t LIKE 'Ljuba%';
ERROR:  invalid byte sequence for encoding "EUC_KR": 0xc4 0x91
INSERT INTO "Unicode data" (i, t) VALUES ('cze+', 'Zvlášť zákeřný učeň s ďolíčky běží podél zóny úlů._');
ERROR:  character with byte sequence 0xc3 0xa1 in encoding "UTF8" has no equivalent in encoding "EUC_KR"
SELECT * FROM "Unicode data" WHERE i = 'cze+';
 i | t 
---+---
(0 rows)

DELETE FROM "Unicode data" WHERE t = 'Zvlášť zákeřný učeň s ďolíčky běží podél zóny úlů._';
ERROR:  character with byte sequence 0xc3 0xa1 in encoding "UTF8" has no equivalent in encoding "EUC_KR"
SELECT count(*) n FROM "Unicode data" WHERE i = 'cze+';
 n 
---
 0
(1 row)

INSERT INTO "Unicode data" (i, t) VALUES ('pol+', 'Pchnąć w tę łódź jeża lub ośm skrzyń fig._');
ERROR:  character with byte sequence 0xc4 0x85 in encoding "UTF8" has no equivalent in encoding "EUC_KR"
SELECT * FROM "Unicode data" WHERE i = 'pol+';
 i | t 
---+---
(0 rows)

DELETE FROM "Unicode data" WHERE t = 'Pchnąć w tę łódź jeża lub ośm skrzyń fig._';
ERROR:  character with byte sequence 0xc4 0x85 in encoding "UTF8" has no equivalent in encoding "EUC_KR"
SELECT count(*) n FROM "Unicode data" WHERE i = 'pol+';
 n 
---
 0
(1 row)

INSERT INTO "Unicode data" (i, t) VALUES ('srp+', 'Ljubavi, Olga, hajde pođi u Fudži i čut ćeš nježnu muziku srca._');
ERROR:  character with byte sequence 0xc5 0xbe in encoding "UTF8" has no equivalent in encoding "EUC_KR"
SELECT * FROM "Unicode data" WHERE i = 'srp+';
 i | t 
---+---
(0 rows)

DELETE FROM "Unicode data" WHERE t = 'Ljubavi, Olga, hajde pođi u Fudži i čut ćeš nježnu muziku srca._';
ERROR:  character with byte sequence 0xc5 0xbe in encoding "UTF8" has no equivalent in encoding "EUC_KR"
SELECT count(*) n FROM "Unicode data" WHERE i = 'srp+';
 n 
---
 0
(1 row)

-- 1257, LATIN7
SELECT * FROM "Unicode data" WHERE i = 'lav';
 i | t 
---+---
(0 rows)

SELECT * FROM "Unicode data" WHERE t LIKE 'Ķieģeļu%';
ERROR:  character with byte sequence 0xc4 0xb6 in encoding "UTF8" has no equivalent in encoding "EUC_KR"
INSERT INTO "Unicode data" (i, t) VALUES ('lav+', 'Ķieģeļu cepējs Edgars Buls fraku un hūti žāvē uz čīkstošām eņģēm._');
ERROR:  character with byte sequence 0xc4 0xb6 in encoding "UTF8" has no equivalent in encoding "EUC_KR"
SELECT * FROM "Unicode data" WHERE i = 'lav+';
 i | t 
---+---
(0 rows)

DELETE FROM "Unicode data" WHERE t = 'Ķieģeļu cepējs Edgars Buls fraku un hūti žāvē uz čīkstošām eņģēm._';
ERROR:  character with byte sequence 0xc4 0xb6 in encoding "UTF8" has no equivalent in encoding "EUC_KR"
SELECT count(*) n FROM "Unicode data" WHERE i = 'lav+';
 n 
---
 0
(1 row)

-- EUC_KR
SELECT * FROM "Unicode data" WHERE i = 'kor';
 i | t 
---+---
(0 rows)

SELECT * FROM "Unicode data" WHERE t LIKE '키스의 고%';
 i | t 
---+---
(0 rows)

INSERT INTO "Unicode data" (i, t) VALUES ('kor+', '키스의 고유조건은 입술끼리 만나야 하고 특별한 기술은 필요치 않다._');
SELECT * FROM "Unicode data" WHERE i = 'kor+';
  i   |                                 t                                  
------+--------------------------------------------------------------------
 kor+ | 키스의 고유조건은 입술끼리 만나야 하고 특별한 기술은 필요치 않다._
(1 row)

DELETE FROM "Unicode data" WHERE t = '키스의 고유조건은 입술끼리 만나야 하고 특별한 기술은 필요치 않다._';
SELECT count(*) n FROM "Unicode data" WHERE i = 'kor+';
 n 
---
 0
(1 row)

-- 1254, LATIN5
SELECT * FROM "Unicode data" WHERE i = 'aze';
 i | t 
---+---
(0 rows)

SELECT * FROM "Unicode data" WHERE t LIKE 'Zəfər%';
ERROR:  character with byte sequence 0xc9 0x99 in encoding "UTF8" has no equivalent in encoding "EUC_KR"
INSERT INTO "Unicode data" (i, t) VALUES ('aze+', 'Zəfər, jaketini də, papağını da götür, bu axşam hava çox soyuq olacaq._');
ERROR:  character with byte sequence 0xc9 0x99 in encoding "UTF8" has no equivalent in encoding "EUC_KR"
SELECT * FROM "Unicode data" WHERE i = 'aze+';
 i | t 
---+---
(0 rows)

DELETE FROM "Unicode data" WHERE t = 'Zəfər, jaketini də, papağını da götür, bu axşam hava çox soyuq olacaq._';
ERROR:  character with byte sequence 0xc9 0x99 in encoding "UTF8" has no equivalent in encoding "EUC_KR"
SELECT count(*) n FROM "Unicode data" WHERE i = 'aze+';
 n 
---
 0
(1 row)

-- etc
INSERT INTO "Unicode data" (i, t) VALUES ('arm+', 'Բել դղյակի ձախ ժամն օֆ ազգությանը ցպահանջ չճշտած վնաս էր եւ փառք։_');
ERROR:  character with byte sequence 0xd4 0xb2 in encoding "UTF8" has no equivalent in encoding "EUC_KR"
SELECT * FROM "Unicode data" WHERE i = 'arm+';
 i | t 
---+---
(0 rows)

DELETE FROM "Unicode data" WHERE t = 'Բել դղյակի ձախ ժամն օֆ ազգությանը ցպահանջ չճշտած վնաս էր եւ փառք։_';
ERROR:  character with byte sequence 0xd4 0xb2 in encoding "UTF8" has no equivalent in encoding "EUC_KR"
SELECT count(*) n FROM "Unicode data" WHERE i = 'arm+';
 n 
---
 0
(1 row)

INSERT INTO "Unicode data" (i, t) VALUES ('gle+', 'Chuaigh bé mhórshách le dlúthspád fíorfhinn trí hata mo dhea-phorcáin bhig._');
ERROR:  character with byte sequence 0xc3 0xa9 in encoding "UTF8" has no equivalent in encoding "EUC_KR"
SELECT * FROM "Unicode data" WHERE i = 'gle+';
 i | t 
---+---
(0 rows)

DELETE FROM "Unicode data" WHERE t = 'Chuaigh bé mhórshách le dlúthspád fíorfhinn trí hata mo dhea-phorcáin bhig._';
ERROR:  character with byte sequence 0xc3 0xa9 in encoding "UTF8" has no equivalent in encoding "EUC_KR"
SELECT count(*) n FROM "Unicode data" WHERE i = 'gle+';
 n 
---
 0
(1 row)

INSERT INTO "Unicode data" (i, t) VALUES ('epo+', 'Laŭ Ludoviko Zamenhof bongustas freŝa ĉeĥa manĝaĵo kun spicoj._');
ERROR:  character with byte sequence 0xc5 0xad in encoding "UTF8" has no equivalent in encoding "EUC_KR"
SELECT * FROM "Unicode data" WHERE i = 'epo+';
 i | t 
---+---
(0 rows)

DELETE FROM "Unicode data" WHERE t = 'Laŭ Ludoviko Zamenhof bongustas freŝa ĉeĥa manĝaĵo kun spicoj._';
ERROR:  character with byte sequence 0xc5 0xad in encoding "UTF8" has no equivalent in encoding "EUC_KR"
SELECT count(*) n FROM "Unicode data" WHERE i = 'epo+';
 n 
---
 0
(1 row)

DROP FOREIGN TABLE "Unicode data";
DROP SERVER redis_testing_server CASCADE;
NOTICE:  drop cascades to user mapping for public on server redis_testing_server
DROP EXTENSION redis_fdw;
\connect contrib_regression;
DROP DATABASE "contrib_regression_EUC_KR";
-- ISO_8859_5
CREATE DATABASE "contrib_regression_ISO_8859_5" ENCODING ISO_8859_5 LC_CTYPE='POSIX' LC_COLLATE='POSIX' template template0;
\connect "contrib_regression_ISO_8859_5"
CREATE EXTENSION redis_fdw;
CREATE SERVER redis_testing_server FOREIGN DATA WRAPPER redis_fdw;
CREATE FOREIGN TABLE "Unicode data"(i text, t text)
SERVER redis_testing_server
OPTIONS (database '15');
CREATE USER MAPPING FOR public SERVER redis_testing_server; 
-- EUC_JP
SELECT * FROM "Unicode data" WHERE i = 'jap';
 i | t 
---+---
(0 rows)

SELECT * FROM "Unicode data" WHERE t LIKE 'いろはにほ%';
ERROR:  character with byte sequence 0xe3 0x81 0x84 in encoding "UTF8" has no equivalent in encoding "ISO_8859_5"
INSERT INTO "Unicode data" (i, t) VALUES ('jap+', 'いろはにほへと ちりぬるを わかよたれそ つねならむ うゐのおくやま けふこえて あさきゆめみし ゑひもせす._');
ERROR:  character with byte sequence 0xe3 0x81 0x84 in encoding "UTF8" has no equivalent in encoding "ISO_8859_5"
DELETE FROM "Unicode data" WHERE t = 'いろはにほへと ちりぬるを わかよたれそ つねならむ うゐのおくやま けふこえて あさきゆめみし ゑひもせす._';
ERROR:  character with byte sequence 0xe3 0x81 0x84 in encoding "UTF8" has no equivalent in encoding "ISO_8859_5"
SELECT count(*) n FROM "Unicode data" WHERE i = 'jap+';
 n 
---
 0
(1 row)

-- 1251, ISO_8859_5
SELECT * FROM "Unicode data" WHERE i = 'bel';
 i | t 
---+---
(0 rows)

SELECT * FROM "Unicode data" WHERE i = 'bul';
 i | t 
---+---
(0 rows)

SELECT * FROM "Unicode data" WHERE i = 'rus';
 i | t 
---+---
(0 rows)

SELECT * FROM "Unicode data" WHERE i = 'ukr';
 i | t 
---+---
(0 rows)

SELECT * FROM "Unicode data" WHERE t LIKE 'У руд%';
 i | t 
---+---
(0 rows)

SELECT * FROM "Unicode data" WHERE t LIKE 'Ах, ч%';
 i | t 
---+---
(0 rows)

SELECT * FROM "Unicode data" WHERE t LIKE 'Широк%';
 i | t 
---+---
(0 rows)

SELECT * FROM "Unicode data" WHERE t LIKE 'Гей, %';
 i | t 
---+---
(0 rows)

INSERT INTO "Unicode data" (i, t) VALUES ('bel+', 'У рудога вераб’я ў сховішчы пад фатэлем ляжаць нейкія гаючыя зёлкі._');
ERROR:  character with byte sequence 0xe2 0x80 0x99 in encoding "UTF8" has no equivalent in encoding "ISO_8859_5"
SELECT * FROM "Unicode data" WHERE i = 'bel+';
 i | t 
---+---
(0 rows)

DELETE FROM "Unicode data" WHERE t = 'У рудога вераб’я ў сховішчы пад фатэлем ляжаць нейкія гаючыя зёлкі._';
ERROR:  character with byte sequence 0xe2 0x80 0x99 in encoding "UTF8" has no equivalent in encoding "ISO_8859_5"
SELECT count(*) n FROM "Unicode data" WHERE i = 'bel+';
 n 
---
 0
(1 row)

INSERT INTO "Unicode data" (i, t) VALUES ('bul+', 'Ах, чудна българска земьо, полюшвай цъфтящи жита._');
SELECT * FROM "Unicode data" WHERE i = 'bul+';
  i   |                         t                          
------+----------------------------------------------------
 bul+ | Ах, чудна българска земьо, полюшвай цъфтящи жита._
(1 row)

DELETE FROM "Unicode data" WHERE t = 'Ах, чудна българска земьо, полюшвай цъфтящи жита._';
SELECT count(*) n FROM "Unicode data" WHERE i = 'bul+';
 n 
---
 0
(1 row)

INSERT INTO "Unicode data" (i, t) VALUES ('rus+', 'Широкая электрификация южных губерний даст мощный толчок подъёму сельского хозяйства._');
SELECT * FROM "Unicode data" WHERE i = 'rus+';
  i   |                                           t                                            
------+----------------------------------------------------------------------------------------
 rus+ | Широкая электрификация южных губерний даст мощный толчок подъёму сельского хозяйства._
(1 row)

DELETE FROM "Unicode data" WHERE t = 'Широкая электрификация южных губерний даст мощный толчок подъёму сельского хозяйства._';
SELECT count(*) n FROM "Unicode data" WHERE i = 'rus+';
 n 
---
 0
(1 row)

INSERT INTO "Unicode data" (i, t) VALUES ('ukr+', 'Гей, хлопці, не вспію — на ґанку ваша файна їжа знищується бурундучком._');
ERROR:  character with byte sequence 0xe2 0x80 0x94 in encoding "UTF8" has no equivalent in encoding "ISO_8859_5"
SELECT * FROM "Unicode data" WHERE i = 'ukr+';
 i | t 
---+---
(0 rows)

DELETE FROM "Unicode data" WHERE t = 'Гей, хлопці, не вспію — на ґанку ваша файна їжа знищується бурундучком._';
ERROR:  character with byte sequence 0xe2 0x80 0x94 in encoding "UTF8" has no equivalent in encoding "ISO_8859_5"
SELECT count(*) n FROM "Unicode data" WHERE i = 'ukr+';
 n 
---
 0
(1 row)

-- 1256, ISO_8859_6
SELECT * FROM "Unicode data" WHERE i = 'ara';
 i | t 
---+---
(0 rows)

SELECT * FROM "Unicode data" WHERE t LIKE '%ضَظَغ%';
ERROR:  character with byte sequence 0xd8 0xb6 in encoding "UTF8" has no equivalent in encoding "ISO_8859_5"
INSERT INTO "Unicode data" (i, t) VALUES ('ara+', 'أبجد هوَّز حُطّي كلَمُن سَعْفَص قُرِشَت ثَخَدٌ ضَظَغ_');
ERROR:  character with byte sequence 0xd8 0xa3 in encoding "UTF8" has no equivalent in encoding "ISO_8859_5"
SELECT * FROM "Unicode data" WHERE i = 'ara+';
 i | t 
---+---
(0 rows)

DELETE FROM "Unicode data" WHERE t = 'أبجد هوَّز حُطّي كلَمُن سَعْفَص قُرِشَت ثَخَدٌ ضَظَغ_';
ERROR:  character with byte sequence 0xd8 0xa3 in encoding "UTF8" has no equivalent in encoding "ISO_8859_5"
SELECT count(*) n FROM "Unicode data" WHERE i = 'ara+';
 n 
---
 0
(1 row)

-- 1253, ISO_8859_7
SELECT * FROM "Unicode data" WHERE i = 'gre';
 i | t 
---+---
(0 rows)

SELECT * FROM "Unicode data" WHERE t LIKE 'Τάχισ%';
ERROR:  character with byte sequence 0xce 0xa4 in encoding "UTF8" has no equivalent in encoding "ISO_8859_5"
INSERT INTO "Unicode data" (i, t) VALUES ('gre+', 'Τάχιστη αλώπηξ βαφής ψημένη γη, δρασκελίζει υπέρ νωθρού κυνός_');
ERROR:  character with byte sequence 0xce 0xa4 in encoding "UTF8" has no equivalent in encoding "ISO_8859_5"
SELECT * FROM "Unicode data" WHERE i = 'gre+';
 i | t 
---+---
(0 rows)

DELETE FROM "Unicode data" WHERE t = 'Τάχιστη αλώπηξ βαφής ψημένη γη, δρασκελίζει υπέρ νωθρού κυνός_';
ERROR:  character with byte sequence 0xce 0xa4 in encoding "UTF8" has no equivalent in encoding "ISO_8859_5"
-- 1255, ISO_8859_8
SELECT * FROM "Unicode data" WHERE i = 'heb';
 i | t 
---+---
(0 rows)

SELECT * FROM "Unicode data" WHERE t LIKE '%כי ח%';
ERROR:  character with byte sequence 0xd7 0x9b in encoding "UTF8" has no equivalent in encoding "ISO_8859_5"
INSERT INTO "Unicode data" (i, t) VALUES ('heb+', 'עטלף אבק נס דרך מזגן שהתפוצץ כי חם_');
ERROR:  character with byte sequence 0xd7 0xa2 in encoding "UTF8" has no equivalent in encoding "ISO_8859_5"
SELECT * FROM "Unicode data" WHERE i = 'heb+';
 i | t 
---+---
(0 rows)

DELETE FROM "Unicode data" WHERE t = 'עטלף אבק נס דרך מזגן שהתפוצץ כי חם_';
ERROR:  character with byte sequence 0xd7 0xa2 in encoding "UTF8" has no equivalent in encoding "ISO_8859_5"
SELECT count(*) n FROM "Unicode data" WHERE i = 'heb+';
 n 
---
 0
(1 row)

-- 1252, LATIN1
SELECT * FROM "Unicode data" WHERE i = 'eus';
 i | t 
---+---
(0 rows)

SELECT * FROM "Unicode data" WHERE i = 'fra';
 i | t 
---+---
(0 rows)

SELECT * FROM "Unicode data" WHERE i = 'spa';
 i | t 
---+---
(0 rows)

SELECT * FROM "Unicode data" WHERE t LIKE 'Permi%';
    i    |              t               
---------+------------------------------
 utf_eus | Permin gox dabiltzu yoskiУБ.
(1 row)

SELECT * FROM "Unicode data" WHERE t LIKE 'Dès N%';
ERROR:  character with byte sequence 0xc3 0xa8 in encoding "UTF8" has no equivalent in encoding "ISO_8859_5"
SELECT * FROM "Unicode data" WHERE t LIKE 'Quier%';
    i    |                            t                             
---------+----------------------------------------------------------
 utf_spa | Quiere la boca exhausta vid, kiwi, piУБa y fugaz jamУГn.
(1 row)

INSERT INTO "Unicode data" (i, t) VALUES ('eus+', 'Permin gox dabiltzu yoskiñ._');
ERROR:  character with byte sequence 0xc3 0xb1 in encoding "UTF8" has no equivalent in encoding "ISO_8859_5"
SELECT * FROM "Unicode data" WHERE i = 'eus+';
 i | t 
---+---
(0 rows)

DELETE FROM "Unicode data" WHERE t = 'Permin gox dabiltzu yoskiñ._';
ERROR:  character with byte sequence 0xc3 0xb1 in encoding "UTF8" has no equivalent in encoding "ISO_8859_5"
SELECT count(*) n FROM "Unicode data" WHERE i = 'eus+';
 n 
---
 0
(1 row)

INSERT INTO "Unicode data" (i, t) VALUES ('fra+', 'Dès Noël où un zéphyr haï me vêt de glaçons würmiens je dîne d’exquis rôtis de bœuf au kir à l’aÿ d’âge mûr & cætera !_');
ERROR:  character with byte sequence 0xc3 0xa8 in encoding "UTF8" has no equivalent in encoding "ISO_8859_5"
SELECT * FROM "Unicode data" WHERE i = 'fra+';
 i | t 
---+---
(0 rows)

DELETE FROM "Unicode data" WHERE t = 'Dès Noël où un zéphyr haï me vêt de glaçons würmiens je dîne d’exquis rôtis de bœuf au kir à l’aÿ d’âge mûr & cætera !_';
ERROR:  character with byte sequence 0xc3 0xa8 in encoding "UTF8" has no equivalent in encoding "ISO_8859_5"
SELECT count(*) n FROM "Unicode data" WHERE i = 'fra+';
 n 
---
 0
(1 row)

INSERT INTO "Unicode data" (i, t) VALUES ('spa+', 'Quiere la boca exhausta vid, kiwi, piña y fugaz jamón._');
ERROR:  character with byte sequence 0xc3 0xb1 in encoding "UTF8" has no equivalent in encoding "ISO_8859_5"
SELECT * FROM "Unicode data" WHERE i = 'spa+';
 i | t 
---+---
(0 rows)

DELETE FROM "Unicode data" WHERE t = 'Quiere la boca exhausta vid, kiwi, piña y fugaz jamón._';
ERROR:  character with byte sequence 0xc3 0xb1 in encoding "UTF8" has no equivalent in encoding "ISO_8859_5"
SELECT count(*) n FROM "Unicode data" WHERE i = 'spa+';
 n 
---
 0
(1 row)

-- 1250, LATIN2
SELECT * FROM "Unicode data" WHERE i = 'cze';
 i | t 
---+---
(0 rows)

SELECT * FROM "Unicode data" WHERE i = 'pol';
 i | t 
---+---
(0 rows)

SELECT * FROM "Unicode data" WHERE i = 'srp';
 i | t 
---+---
(0 rows)

SELECT * FROM "Unicode data" WHERE t LIKE 'Zvláš%';
ERROR:  character with byte sequence 0xc3 0xa1 in encoding "UTF8" has no equivalent in encoding "ISO_8859_5"
SELECT * FROM "Unicode data" WHERE t LIKE 'Pchną%';
ERROR:  character with byte sequence 0xc4 0x85 in encoding "UTF8" has no equivalent in encoding "ISO_8859_5"
SELECT * FROM "Unicode data" WHERE t LIKE 'Ljuba%';
    i    |                                          t                                           
---------+--------------------------------------------------------------------------------------
 utf_srp | Ljubavi, Olga, hajde poФ\u0091i u FudХОi i Ф\u008Dut Ф\u0087eХЁ njeХОnu muziku srca.
(1 row)

INSERT INTO "Unicode data" (i, t) VALUES ('cze+', 'Zvlášť zákeřný učeň s ďolíčky běží podél zóny úlů._');
ERROR:  character with byte sequence 0xc3 0xa1 in encoding "UTF8" has no equivalent in encoding "ISO_8859_5"
SELECT * FROM "Unicode data" WHERE i = 'cze+';
 i | t 
---+---
(0 rows)

DELETE FROM "Unicode data" WHERE t = 'Zvlášť zákeřný učeň s ďolíčky běží podél zóny úlů._';
ERROR:  character with byte sequence 0xc3 0xa1 in encoding "UTF8" has no equivalent in encoding "ISO_8859_5"
SELECT count(*) n FROM "Unicode data" WHERE i = 'cze+';
 n 
---
 0
(1 row)

INSERT INTO "Unicode data" (i, t) VALUES ('pol+', 'Pchnąć w tę łódź jeża lub ośm skrzyń fig._');
ERROR:  character with byte sequence 0xc4 0x85 in encoding "UTF8" has no equivalent in encoding "ISO_8859_5"
SELECT * FROM "Unicode data" WHERE i = 'pol+';
 i | t 
---+---
(0 rows)

DELETE FROM "Unicode data" WHERE t = 'Pchnąć w tę łódź jeża lub ośm skrzyń fig._';
ERROR:  character with byte sequence 0xc4 0x85 in encoding "UTF8" has no equivalent in encoding "ISO_8859_5"
SELECT count(*) n FROM "Unicode data" WHERE i = 'pol+';
 n 
---
 0
(1 row)

INSERT INTO "Unicode data" (i, t) VALUES ('srp+', 'Ljubavi, Olga, hajde pođi u Fudži i čut ćeš nježnu muziku srca._');
ERROR:  character with byte sequence 0xc4 0x91 in encoding "UTF8" has no equivalent in encoding "ISO_8859_5"
SELECT * FROM "Unicode data" WHERE i = 'srp+';
 i | t 
---+---
(0 rows)

DELETE FROM "Unicode data" WHERE t = 'Ljubavi, Olga, hajde pođi u Fudži i čut ćeš nježnu muziku srca._';
ERROR:  character with byte sequence 0xc4 0x91 in encoding "UTF8" has no equivalent in encoding "ISO_8859_5"
SELECT count(*) n FROM "Unicode data" WHERE i = 'srp+';
 n 
---
 0
(1 row)

-- 1257, LATIN7
SELECT * FROM "Unicode data" WHERE i = 'lav';
 i | t 
---+---
(0 rows)

SELECT * FROM "Unicode data" WHERE t LIKE 'Ķieģeļu%';
ERROR:  character with byte sequence 0xc4 0xb6 in encoding "UTF8" has no equivalent in encoding "ISO_8859_5"
INSERT INTO "Unicode data" (i, t) VALUES ('lav+', 'Ķieģeļu cepējs Edgars Buls fraku un hūti žāvē uz čīkstošām eņģēm._');
ERROR:  character with byte sequence 0xc4 0xb6 in encoding "UTF8" has no equivalent in encoding "ISO_8859_5"
SELECT * FROM "Unicode data" WHERE i = 'lav+';
 i | t 
---+---
(0 rows)

DELETE FROM "Unicode data" WHERE t = 'Ķieģeļu cepējs Edgars Buls fraku un hūti žāvē uz čīkstošām eņģēm._';
ERROR:  character with byte sequence 0xc4 0xb6 in encoding "UTF8" has no equivalent in encoding "ISO_8859_5"
SELECT count(*) n FROM "Unicode data" WHERE i = 'lav+';
 n 
---
 0
(1 row)

-- EUC_KR
SELECT * FROM "Unicode data" WHERE i = 'kor';
 i | t 
---+---
(0 rows)

SELECT * FROM "Unicode data" WHERE t LIKE '키스의 고%';
ERROR:  character with byte sequence 0xed 0x82 0xa4 in encoding "UTF8" has no equivalent in encoding "ISO_8859_5"
INSERT INTO "Unicode data" (i, t) VALUES ('kor+', '키스의 고유조건은 입술끼리 만나야 하고 특별한 기술은 필요치 않다._');
ERROR:  character with byte sequence 0xed 0x82 0xa4 in encoding "UTF8" has no equivalent in encoding "ISO_8859_5"
SELECT * FROM "Unicode data" WHERE i = 'kor+';
 i | t 
---+---
(0 rows)

DELETE FROM "Unicode data" WHERE t = '키스의 고유조건은 입술끼리 만나야 하고 특별한 기술은 필요치 않다._';
ERROR:  character with byte sequence 0xed 0x82 0xa4 in encoding "UTF8" has no equivalent in encoding "ISO_8859_5"
SELECT count(*) n FROM "Unicode data" WHERE i = 'kor+';
 n 
---
 0
(1 row)

-- 1254, LATIN5
SELECT * FROM "Unicode data" WHERE i = 'aze';
 i | t 
---+---
(0 rows)

SELECT * FROM "Unicode data" WHERE t LIKE 'Zəfər%';
ERROR:  character with byte sequence 0xc9 0x99 in encoding "UTF8" has no equivalent in encoding "ISO_8859_5"
INSERT INTO "Unicode data" (i, t) VALUES ('aze+', 'Zəfər, jaketini də, papağını da götür, bu axşam hava çox soyuq olacaq._');
ERROR:  character with byte sequence 0xc9 0x99 in encoding "UTF8" has no equivalent in encoding "ISO_8859_5"
SELECT * FROM "Unicode data" WHERE i = 'aze+';
 i | t 
---+---
(0 rows)

DELETE FROM "Unicode data" WHERE t = 'Zəfər, jaketini də, papağını da götür, bu axşam hava çox soyuq olacaq._';
ERROR:  character with byte sequence 0xc9 0x99 in encoding "UTF8" has no equivalent in encoding "ISO_8859_5"
SELECT count(*) n FROM "Unicode data" WHERE i = 'aze+';
 n 
---
 0
(1 row)

-- etc
INSERT INTO "Unicode data" (i, t) VALUES ('arm+', 'Բել դղյակի ձախ ժամն օֆ ազգությանը ցպահանջ չճշտած վնաս էր եւ փառք։_');
ERROR:  character with byte sequence 0xd4 0xb2 in encoding "UTF8" has no equivalent in encoding "ISO_8859_5"
SELECT * FROM "Unicode data" WHERE i = 'arm+';
 i | t 
---+---
(0 rows)

DELETE FROM "Unicode data" WHERE t = 'Բել դղյակի ձախ ժամն օֆ ազգությանը ցպահանջ չճշտած վնաս էր եւ փառք։_';
ERROR:  character with byte sequence 0xd4 0xb2 in encoding "UTF8" has no equivalent in encoding "ISO_8859_5"
SELECT count(*) n FROM "Unicode data" WHERE i = 'arm+';
 n 
---
 0
(1 row)

INSERT INTO "Unicode data" (i, t) VALUES ('gle+', 'Chuaigh bé mhórshách le dlúthspád fíorfhinn trí hata mo dhea-phorcáin bhig._');
ERROR:  character with byte sequence 0xc3 0xa9 in encoding "UTF8" has no equivalent in encoding "ISO_8859_5"
SELECT * FROM "Unicode data" WHERE i = 'gle+';
 i | t 
---+---
(0 rows)

DELETE FROM "Unicode data" WHERE t = 'Chuaigh bé mhórshách le dlúthspád fíorfhinn trí hata mo dhea-phorcáin bhig._';
ERROR:  character with byte sequence 0xc3 0xa9 in encoding "UTF8" has no equivalent in encoding "ISO_8859_5"
SELECT count(*) n FROM "Unicode data" WHERE i = 'gle+';
 n 
---
 0
(1 row)

INSERT INTO "Unicode data" (i, t) VALUES ('epo+', 'Laŭ Ludoviko Zamenhof bongustas freŝa ĉeĥa manĝaĵo kun spicoj._');
ERROR:  character with byte sequence 0xc5 0xad in encoding "UTF8" has no equivalent in encoding "ISO_8859_5"
SELECT * FROM "Unicode data" WHERE i = 'epo+';
 i | t 
---+---
(0 rows)

DELETE FROM "Unicode data" WHERE t = 'Laŭ Ludoviko Zamenhof bongustas freŝa ĉeĥa manĝaĵo kun spicoj._';
ERROR:  character with byte sequence 0xc5 0xad in encoding "UTF8" has no equivalent in encoding "ISO_8859_5"
SELECT count(*) n FROM "Unicode data" WHERE i = 'epo+';
 n 
---
 0
(1 row)

DROP FOREIGN TABLE "Unicode data";
DROP SERVER redis_testing_server CASCADE;
NOTICE:  drop cascades to user mapping for public on server redis_testing_server
DROP EXTENSION redis_fdw;
\connect contrib_regression;
DROP DATABASE "contrib_regression_ISO_8859_5";
-- ISO_8859_6
CREATE DATABASE "contrib_regression_ISO_8859_6" ENCODING ISO_8859_6 LC_CTYPE='POSIX' LC_COLLATE='POSIX' template template0;
\connect "contrib_regression_ISO_8859_6"
CREATE EXTENSION redis_fdw;
CREATE SERVER redis_testing_server FOREIGN DATA WRAPPER redis_fdw;
CREATE FOREIGN TABLE "Unicode data"(i text, t text)
SERVER redis_testing_server
OPTIONS (database '15');
CREATE USER MAPPING FOR public SERVER redis_testing_server; 
-- EUC_JP
SELECT * FROM "Unicode data" WHERE i = 'jap';
 i | t 
---+---
(0 rows)

SELECT * FROM "Unicode data" WHERE t LIKE 'いろはにほ%';
ERROR:  character with byte sequence 0xe3 0x81 0x84 in encoding "UTF8" has no equivalent in encoding "ISO_8859_6"
INSERT INTO "Unicode data" (i, t) VALUES ('jap+', 'いろはにほへと ちりぬるを わかよたれそ つねならむ うゐのおくやま けふこえて あさきゆめみし ゑひもせす._');
ERROR:  character with byte sequence 0xe3 0x81 0x84 in encoding "UTF8" has no equivalent in encoding "ISO_8859_6"
DELETE FROM "Unicode data" WHERE t = 'いろはにほへと ちりぬるを わかよたれそ つねならむ うゐのおくやま けふこえて あさきゆめみし ゑひもせす._';
ERROR:  character with byte sequence 0xe3 0x81 0x84 in encoding "UTF8" has no equivalent in encoding "ISO_8859_6"
SELECT count(*) n FROM "Unicode data" WHERE i = 'jap+';
 n 
---
 0
(1 row)

-- 1251, ISO_8859_5
SELECT * FROM "Unicode data" WHERE i = 'bel';
 i | t 
---+---
(0 rows)

SELECT * FROM "Unicode data" WHERE i = 'bul';
 i | t 
---+---
(0 rows)

SELECT * FROM "Unicode data" WHERE i = 'rus';
 i | t 
---+---
(0 rows)

SELECT * FROM "Unicode data" WHERE i = 'ukr';
 i | t 
---+---
(0 rows)

SELECT * FROM "Unicode data" WHERE t LIKE 'У руд%';
ERROR:  character with byte sequence 0xd0 0xa3 in encoding "UTF8" has no equivalent in encoding "ISO_8859_6"
SELECT * FROM "Unicode data" WHERE t LIKE 'Ах, ч%';
ERROR:  character with byte sequence 0xd0 0x90 in encoding "UTF8" has no equivalent in encoding "ISO_8859_6"
SELECT * FROM "Unicode data" WHERE t LIKE 'Широк%';
ERROR:  character with byte sequence 0xd0 0xa8 in encoding "UTF8" has no equivalent in encoding "ISO_8859_6"
SELECT * FROM "Unicode data" WHERE t LIKE 'Гей, %';
ERROR:  character with byte sequence 0xd0 0x93 in encoding "UTF8" has no equivalent in encoding "ISO_8859_6"
INSERT INTO "Unicode data" (i, t) VALUES ('bel+', 'У рудога вераб’я ў сховішчы пад фатэлем ляжаць нейкія гаючыя зёлкі._');
ERROR:  character with byte sequence 0xd0 0xa3 in encoding "UTF8" has no equivalent in encoding "ISO_8859_6"
SELECT * FROM "Unicode data" WHERE i = 'bel+';
 i | t 
---+---
(0 rows)

DELETE FROM "Unicode data" WHERE t = 'У рудога вераб’я ў сховішчы пад фатэлем ляжаць нейкія гаючыя зёлкі._';
ERROR:  character with byte sequence 0xd0 0xa3 in encoding "UTF8" has no equivalent in encoding "ISO_8859_6"
SELECT count(*) n FROM "Unicode data" WHERE i = 'bel+';
 n 
---
 0
(1 row)

INSERT INTO "Unicode data" (i, t) VALUES ('bul+', 'Ах, чудна българска земьо, полюшвай цъфтящи жита._');
ERROR:  character with byte sequence 0xd0 0x90 in encoding "UTF8" has no equivalent in encoding "ISO_8859_6"
SELECT * FROM "Unicode data" WHERE i = 'bul+';
 i | t 
---+---
(0 rows)

DELETE FROM "Unicode data" WHERE t = 'Ах, чудна българска земьо, полюшвай цъфтящи жита._';
ERROR:  character with byte sequence 0xd0 0x90 in encoding "UTF8" has no equivalent in encoding "ISO_8859_6"
SELECT count(*) n FROM "Unicode data" WHERE i = 'bul+';
 n 
---
 0
(1 row)

INSERT INTO "Unicode data" (i, t) VALUES ('rus+', 'Широкая электрификация южных губерний даст мощный толчок подъёму сельского хозяйства._');
ERROR:  character with byte sequence 0xd0 0xa8 in encoding "UTF8" has no equivalent in encoding "ISO_8859_6"
SELECT * FROM "Unicode data" WHERE i = 'rus+';
 i | t 
---+---
(0 rows)

DELETE FROM "Unicode data" WHERE t = 'Широкая электрификация южных губерний даст мощный толчок подъёму сельского хозяйства._';
ERROR:  character with byte sequence 0xd0 0xa8 in encoding "UTF8" has no equivalent in encoding "ISO_8859_6"
SELECT count(*) n FROM "Unicode data" WHERE i = 'rus+';
 n 
---
 0
(1 row)

INSERT INTO "Unicode data" (i, t) VALUES ('ukr+', 'Гей, хлопці, не вспію — на ґанку ваша файна їжа знищується бурундучком._');
ERROR:  character with byte sequence 0xd0 0x93 in encoding "UTF8" has no equivalent in encoding "ISO_8859_6"
SELECT * FROM "Unicode data" WHERE i = 'ukr+';
 i | t 
---+---
(0 rows)

DELETE FROM "Unicode data" WHERE t = 'Гей, хлопці, не вспію — на ґанку ваша файна їжа знищується бурундучком._';
ERROR:  character with byte sequence 0xd0 0x93 in encoding "UTF8" has no equivalent in encoding "ISO_8859_6"
SELECT count(*) n FROM "Unicode data" WHERE i = 'ukr+';
 n 
---
 0
(1 row)

-- 1256, ISO_8859_6
SELECT * FROM "Unicode data" WHERE i = 'ara';
 i | t 
---+---
(0 rows)

SELECT * FROM "Unicode data" WHERE t LIKE '%ضَظَغ%';
 i | t 
---+---
(0 rows)

INSERT INTO "Unicode data" (i, t) VALUES ('ara+', 'أبجد هوَّز حُطّي كلَمُن سَعْفَص قُرِشَت ثَخَدٌ ضَظَغ_');
SELECT * FROM "Unicode data" WHERE i = 'ara+';
  i   |                  t                   
------+--------------------------------------
 ara+ | أبجد هوَّز حُطّي كلَمُن سَعْفَص قُرِشَت ثَخَدٌ ضَظَغ_
(1 row)

DELETE FROM "Unicode data" WHERE t = 'أبجد هوَّز حُطّي كلَمُن سَعْفَص قُرِشَت ثَخَدٌ ضَظَغ_';
SELECT count(*) n FROM "Unicode data" WHERE i = 'ara+';
 n 
---
 0
(1 row)

-- 1253, ISO_8859_7
SELECT * FROM "Unicode data" WHERE i = 'gre';
 i | t 
---+---
(0 rows)

SELECT * FROM "Unicode data" WHERE t LIKE 'Τάχισ%';
ERROR:  character with byte sequence 0xce 0xa4 in encoding "UTF8" has no equivalent in encoding "ISO_8859_6"
INSERT INTO "Unicode data" (i, t) VALUES ('gre+', 'Τάχιστη αλώπηξ βαφής ψημένη γη, δρασκελίζει υπέρ νωθρού κυνός_');
ERROR:  character with byte sequence 0xce 0xa4 in encoding "UTF8" has no equivalent in encoding "ISO_8859_6"
SELECT * FROM "Unicode data" WHERE i = 'gre+';
 i | t 
---+---
(0 rows)

DELETE FROM "Unicode data" WHERE t = 'Τάχιστη αλώπηξ βαφής ψημένη γη, δρασκελίζει υπέρ νωθρού κυνός_';
ERROR:  character with byte sequence 0xce 0xa4 in encoding "UTF8" has no equivalent in encoding "ISO_8859_6"
-- 1255, ISO_8859_8
SELECT * FROM "Unicode data" WHERE i = 'heb';
 i | t 
---+---
(0 rows)

SELECT * FROM "Unicode data" WHERE t LIKE '%כי ח%';
ERROR:  character with byte sequence 0xd7 0x9b in encoding "UTF8" has no equivalent in encoding "ISO_8859_6"
INSERT INTO "Unicode data" (i, t) VALUES ('heb+', 'עטלף אבק נס דרך מזגן שהתפוצץ כי חם_');
ERROR:  character with byte sequence 0xd7 0xa2 in encoding "UTF8" has no equivalent in encoding "ISO_8859_6"
SELECT * FROM "Unicode data" WHERE i = 'heb+';
 i | t 
---+---
(0 rows)

DELETE FROM "Unicode data" WHERE t = 'עטלף אבק נס דרך מזגן שהתפוצץ כי חם_';
ERROR:  character with byte sequence 0xd7 0xa2 in encoding "UTF8" has no equivalent in encoding "ISO_8859_6"
SELECT count(*) n FROM "Unicode data" WHERE i = 'heb+';
 n 
---
 0
(1 row)

-- 1252, LATIN1
SELECT * FROM "Unicode data" WHERE i = 'eus';
 i | t 
---+---
(0 rows)

SELECT * FROM "Unicode data" WHERE i = 'fra';
 i | t 
---+---
(0 rows)

SELECT * FROM "Unicode data" WHERE i = 'spa';
 i | t 
---+---
(0 rows)

SELECT * FROM "Unicode data" WHERE t LIKE 'Permi%';
ERROR:  character with byte sequence 0xb1 in encoding "ISO_8859_6" has no equivalent in encoding "UTF8"
SELECT * FROM "Unicode data" WHERE t LIKE 'Dès N%';
ERROR:  character with byte sequence 0xc3 0xa8 in encoding "UTF8" has no equivalent in encoding "ISO_8859_6"
SELECT * FROM "Unicode data" WHERE t LIKE 'Quier%';
ERROR:  character with byte sequence 0xb1 in encoding "ISO_8859_6" has no equivalent in encoding "UTF8"
INSERT INTO "Unicode data" (i, t) VALUES ('eus+', 'Permin gox dabiltzu yoskiñ._');
ERROR:  character with byte sequence 0xc3 0xb1 in encoding "UTF8" has no equivalent in encoding "ISO_8859_6"
SELECT * FROM "Unicode data" WHERE i = 'eus+';
 i | t 
---+---
(0 rows)

DELETE FROM "Unicode data" WHERE t = 'Permin gox dabiltzu yoskiñ._';
ERROR:  character with byte sequence 0xc3 0xb1 in encoding "UTF8" has no equivalent in encoding "ISO_8859_6"
SELECT count(*) n FROM "Unicode data" WHERE i = 'eus+';
 n 
---
 0
(1 row)

INSERT INTO "Unicode data" (i, t) VALUES ('fra+', 'Dès Noël où un zéphyr haï me vêt de glaçons würmiens je dîne d’exquis rôtis de bœuf au kir à l’aÿ d’âge mûr & cætera !_');
ERROR:  character with byte sequence 0xc3 0xa8 in encoding "UTF8" has no equivalent in encoding "ISO_8859_6"
SELECT * FROM "Unicode data" WHERE i = 'fra+';
 i | t 
---+---
(0 rows)

DELETE FROM "Unicode data" WHERE t = 'Dès Noël où un zéphyr haï me vêt de glaçons würmiens je dîne d’exquis rôtis de bœuf au kir à l’aÿ d’âge mûr & cætera !_';
ERROR:  character with byte sequence 0xc3 0xa8 in encoding "UTF8" has no equivalent in encoding "ISO_8859_6"
SELECT count(*) n FROM "Unicode data" WHERE i = 'fra+';
 n 
---
 0
(1 row)

INSERT INTO "Unicode data" (i, t) VALUES ('spa+', 'Quiere la boca exhausta vid, kiwi, piña y fugaz jamón._');
ERROR:  character with byte sequence 0xc3 0xb1 in encoding "UTF8" has no equivalent in encoding "ISO_8859_6"
SELECT * FROM "Unicode data" WHERE i = 'spa+';
 i | t 
---+---
(0 rows)

DELETE FROM "Unicode data" WHERE t = 'Quiere la boca exhausta vid, kiwi, piña y fugaz jamón._';
ERROR:  character with byte sequence 0xc3 0xb1 in encoding "UTF8" has no equivalent in encoding "ISO_8859_6"
SELECT count(*) n FROM "Unicode data" WHERE i = 'spa+';
 n 
---
 0
(1 row)

-- 1250, LATIN2
SELECT * FROM "Unicode data" WHERE i = 'cze';
 i | t 
---+---
(0 rows)

SELECT * FROM "Unicode data" WHERE i = 'pol';
 i | t 
---+---
(0 rows)

SELECT * FROM "Unicode data" WHERE i = 'srp';
 i | t 
---+---
(0 rows)

SELECT * FROM "Unicode data" WHERE t LIKE 'Zvláš%';
ERROR:  character with byte sequence 0xc3 0xa1 in encoding "UTF8" has no equivalent in encoding "ISO_8859_6"
SELECT * FROM "Unicode data" WHERE t LIKE 'Pchną%';
ERROR:  character with byte sequence 0xc4 0x85 in encoding "UTF8" has no equivalent in encoding "ISO_8859_6"
SELECT * FROM "Unicode data" WHERE t LIKE 'Ljuba%';
ERROR:  character with byte sequence 0xbe in encoding "ISO_8859_6" has no equivalent in encoding "UTF8"
INSERT INTO "Unicode data" (i, t) VALUES ('cze+', 'Zvlášť zákeřný učeň s ďolíčky běží podél zóny úlů._');
ERROR:  character with byte sequence 0xc3 0xa1 in encoding "UTF8" has no equivalent in encoding "ISO_8859_6"
SELECT * FROM "Unicode data" WHERE i = 'cze+';
 i | t 
---+---
(0 rows)

DELETE FROM "Unicode data" WHERE t = 'Zvlášť zákeřný učeň s ďolíčky běží podél zóny úlů._';
ERROR:  character with byte sequence 0xc3 0xa1 in encoding "UTF8" has no equivalent in encoding "ISO_8859_6"
SELECT count(*) n FROM "Unicode data" WHERE i = 'cze+';
 n 
---
 0
(1 row)

INSERT INTO "Unicode data" (i, t) VALUES ('pol+', 'Pchnąć w tę łódź jeża lub ośm skrzyń fig._');
ERROR:  character with byte sequence 0xc4 0x85 in encoding "UTF8" has no equivalent in encoding "ISO_8859_6"
SELECT * FROM "Unicode data" WHERE i = 'pol+';
 i | t 
---+---
(0 rows)

DELETE FROM "Unicode data" WHERE t = 'Pchnąć w tę łódź jeża lub ośm skrzyń fig._';
ERROR:  character with byte sequence 0xc4 0x85 in encoding "UTF8" has no equivalent in encoding "ISO_8859_6"
SELECT count(*) n FROM "Unicode data" WHERE i = 'pol+';
 n 
---
 0
(1 row)

INSERT INTO "Unicode data" (i, t) VALUES ('srp+', 'Ljubavi, Olga, hajde pođi u Fudži i čut ćeš nježnu muziku srca._');
ERROR:  character with byte sequence 0xc4 0x91 in encoding "UTF8" has no equivalent in encoding "ISO_8859_6"
SELECT * FROM "Unicode data" WHERE i = 'srp+';
 i | t 
---+---
(0 rows)

DELETE FROM "Unicode data" WHERE t = 'Ljubavi, Olga, hajde pođi u Fudži i čut ćeš nježnu muziku srca._';
ERROR:  character with byte sequence 0xc4 0x91 in encoding "UTF8" has no equivalent in encoding "ISO_8859_6"
SELECT count(*) n FROM "Unicode data" WHERE i = 'srp+';
 n 
---
 0
(1 row)

-- 1257, LATIN7
SELECT * FROM "Unicode data" WHERE i = 'lav';
 i | t 
---+---
(0 rows)

SELECT * FROM "Unicode data" WHERE t LIKE 'Ķieģeļu%';
ERROR:  character with byte sequence 0xc4 0xb6 in encoding "UTF8" has no equivalent in encoding "ISO_8859_6"
INSERT INTO "Unicode data" (i, t) VALUES ('lav+', 'Ķieģeļu cepējs Edgars Buls fraku un hūti žāvē uz čīkstošām eņģēm._');
ERROR:  character with byte sequence 0xc4 0xb6 in encoding "UTF8" has no equivalent in encoding "ISO_8859_6"
SELECT * FROM "Unicode data" WHERE i = 'lav+';
 i | t 
---+---
(0 rows)

DELETE FROM "Unicode data" WHERE t = 'Ķieģeļu cepējs Edgars Buls fraku un hūti žāvē uz čīkstošām eņģēm._';
ERROR:  character with byte sequence 0xc4 0xb6 in encoding "UTF8" has no equivalent in encoding "ISO_8859_6"
SELECT count(*) n FROM "Unicode data" WHERE i = 'lav+';
 n 
---
 0
(1 row)

-- EUC_KR
SELECT * FROM "Unicode data" WHERE i = 'kor';
 i | t 
---+---
(0 rows)

SELECT * FROM "Unicode data" WHERE t LIKE '키스의 고%';
ERROR:  character with byte sequence 0xed 0x82 0xa4 in encoding "UTF8" has no equivalent in encoding "ISO_8859_6"
INSERT INTO "Unicode data" (i, t) VALUES ('kor+', '키스의 고유조건은 입술끼리 만나야 하고 특별한 기술은 필요치 않다._');
ERROR:  character with byte sequence 0xed 0x82 0xa4 in encoding "UTF8" has no equivalent in encoding "ISO_8859_6"
SELECT * FROM "Unicode data" WHERE i = 'kor+';
 i | t 
---+---
(0 rows)

DELETE FROM "Unicode data" WHERE t = '키스의 고유조건은 입술끼리 만나야 하고 특별한 기술은 필요치 않다._';
ERROR:  character with byte sequence 0xed 0x82 0xa4 in encoding "UTF8" has no equivalent in encoding "ISO_8859_6"
SELECT count(*) n FROM "Unicode data" WHERE i = 'kor+';
 n 
---
 0
(1 row)

-- 1254, LATIN5
SELECT * FROM "Unicode data" WHERE i = 'aze';
 i | t 
---+---
(0 rows)

SELECT * FROM "Unicode data" WHERE t LIKE 'Zəfər%';
ERROR:  character with byte sequence 0xc9 0x99 in encoding "UTF8" has no equivalent in encoding "ISO_8859_6"
INSERT INTO "Unicode data" (i, t) VALUES ('aze+', 'Zəfər, jaketini də, papağını da götür, bu axşam hava çox soyuq olacaq._');
ERROR:  character with byte sequence 0xc9 0x99 in encoding "UTF8" has no equivalent in encoding "ISO_8859_6"
SELECT * FROM "Unicode data" WHERE i = 'aze+';
 i | t 
---+---
(0 rows)

DELETE FROM "Unicode data" WHERE t = 'Zəfər, jaketini də, papağını da götür, bu axşam hava çox soyuq olacaq._';
ERROR:  character with byte sequence 0xc9 0x99 in encoding "UTF8" has no equivalent in encoding "ISO_8859_6"
SELECT count(*) n FROM "Unicode data" WHERE i = 'aze+';
 n 
---
 0
(1 row)

-- etc
INSERT INTO "Unicode data" (i, t) VALUES ('arm+', 'Բել դղյակի ձախ ժամն օֆ ազգությանը ցպահանջ չճշտած վնաս էր եւ փառք։_');
ERROR:  character with byte sequence 0xd4 0xb2 in encoding "UTF8" has no equivalent in encoding "ISO_8859_6"
SELECT * FROM "Unicode data" WHERE i = 'arm+';
 i | t 
---+---
(0 rows)

DELETE FROM "Unicode data" WHERE t = 'Բել դղյակի ձախ ժամն օֆ ազգությանը ցպահանջ չճշտած վնաս էր եւ փառք։_';
ERROR:  character with byte sequence 0xd4 0xb2 in encoding "UTF8" has no equivalent in encoding "ISO_8859_6"
SELECT count(*) n FROM "Unicode data" WHERE i = 'arm+';
 n 
---
 0
(1 row)

INSERT INTO "Unicode data" (i, t) VALUES ('gle+', 'Chuaigh bé mhórshách le dlúthspád fíorfhinn trí hata mo dhea-phorcáin bhig._');
ERROR:  character with byte sequence 0xc3 0xa9 in encoding "UTF8" has no equivalent in encoding "ISO_8859_6"
SELECT * FROM "Unicode data" WHERE i = 'gle+';
 i | t 
---+---
(0 rows)

DELETE FROM "Unicode data" WHERE t = 'Chuaigh bé mhórshách le dlúthspád fíorfhinn trí hata mo dhea-phorcáin bhig._';
ERROR:  character with byte sequence 0xc3 0xa9 in encoding "UTF8" has no equivalent in encoding "ISO_8859_6"
SELECT count(*) n FROM "Unicode data" WHERE i = 'gle+';
 n 
---
 0
(1 row)

INSERT INTO "Unicode data" (i, t) VALUES ('epo+', 'Laŭ Ludoviko Zamenhof bongustas freŝa ĉeĥa manĝaĵo kun spicoj._');
ERROR:  character with byte sequence 0xc5 0xad in encoding "UTF8" has no equivalent in encoding "ISO_8859_6"
SELECT * FROM "Unicode data" WHERE i = 'epo+';
 i | t 
---+---
(0 rows)

DELETE FROM "Unicode data" WHERE t = 'Laŭ Ludoviko Zamenhof bongustas freŝa ĉeĥa manĝaĵo kun spicoj._';
ERROR:  character with byte sequence 0xc5 0xad in encoding "UTF8" has no equivalent in encoding "ISO_8859_6"
SELECT count(*) n FROM "Unicode data" WHERE i = 'epo+';
 n 
---
 0
(1 row)

DROP FOREIGN TABLE "Unicode data";
DROP SERVER redis_testing_server CASCADE;
NOTICE:  drop cascades to user mapping for public on server redis_testing_server
DROP EXTENSION redis_fdw;
\connect contrib_regression;
DROP DATABASE "contrib_regression_ISO_8859_6";
-- ISO_8859_7
CREATE DATABASE "contrib_regression_ISO_8859_7" ENCODING ISO_8859_7 LC_CTYPE='POSIX' LC_COLLATE='POSIX' template template0;
\connect "contrib_regression_ISO_8859_7"
CREATE EXTENSION redis_fdw;
CREATE SERVER redis_testing_server FOREIGN DATA WRAPPER redis_fdw;
CREATE FOREIGN TABLE "Unicode data"(i text, t text)
SERVER redis_testing_server
OPTIONS (database '15');
CREATE USER MAPPING FOR public SERVER redis_testing_server; 
-- EUC_JP
SELECT * FROM "Unicode data" WHERE i = 'jap';
 i | t 
---+---
(0 rows)

SELECT * FROM "Unicode data" WHERE t LIKE 'いろはにほ%';
ERROR:  character with byte sequence 0xe3 0x81 0x84 in encoding "UTF8" has no equivalent in encoding "ISO_8859_7"
INSERT INTO "Unicode data" (i, t) VALUES ('jap+', 'いろはにほへと ちりぬるを わかよたれそ つねならむ うゐのおくやま けふこえて あさきゆめみし ゑひもせす._');
ERROR:  character with byte sequence 0xe3 0x81 0x84 in encoding "UTF8" has no equivalent in encoding "ISO_8859_7"
DELETE FROM "Unicode data" WHERE t = 'いろはにほへと ちりぬるを わかよたれそ つねならむ うゐのおくやま けふこえて あさきゆめみし ゑひもせす._';
ERROR:  character with byte sequence 0xe3 0x81 0x84 in encoding "UTF8" has no equivalent in encoding "ISO_8859_7"
SELECT count(*) n FROM "Unicode data" WHERE i = 'jap+';
 n 
---
 0
(1 row)

-- 1251, ISO_8859_5
SELECT * FROM "Unicode data" WHERE i = 'bel';
 i | t 
---+---
(0 rows)

SELECT * FROM "Unicode data" WHERE i = 'bul';
 i | t 
---+---
(0 rows)

SELECT * FROM "Unicode data" WHERE i = 'rus';
 i | t 
---+---
(0 rows)

SELECT * FROM "Unicode data" WHERE i = 'ukr';
 i | t 
---+---
(0 rows)

SELECT * FROM "Unicode data" WHERE t LIKE 'У руд%';
ERROR:  character with byte sequence 0xd0 0xa3 in encoding "UTF8" has no equivalent in encoding "ISO_8859_7"
SELECT * FROM "Unicode data" WHERE t LIKE 'Ах, ч%';
ERROR:  character with byte sequence 0xd0 0x90 in encoding "UTF8" has no equivalent in encoding "ISO_8859_7"
SELECT * FROM "Unicode data" WHERE t LIKE 'Широк%';
ERROR:  character with byte sequence 0xd0 0xa8 in encoding "UTF8" has no equivalent in encoding "ISO_8859_7"
SELECT * FROM "Unicode data" WHERE t LIKE 'Гей, %';
ERROR:  character with byte sequence 0xd0 0x93 in encoding "UTF8" has no equivalent in encoding "ISO_8859_7"
INSERT INTO "Unicode data" (i, t) VALUES ('bel+', 'У рудога вераб’я ў сховішчы пад фатэлем ляжаць нейкія гаючыя зёлкі._');
ERROR:  character with byte sequence 0xd0 0xa3 in encoding "UTF8" has no equivalent in encoding "ISO_8859_7"
SELECT * FROM "Unicode data" WHERE i = 'bel+';
 i | t 
---+---
(0 rows)

DELETE FROM "Unicode data" WHERE t = 'У рудога вераб’я ў сховішчы пад фатэлем ляжаць нейкія гаючыя зёлкі._';
ERROR:  character with byte sequence 0xd0 0xa3 in encoding "UTF8" has no equivalent in encoding "ISO_8859_7"
SELECT count(*) n FROM "Unicode data" WHERE i = 'bel+';
 n 
---
 0
(1 row)

INSERT INTO "Unicode data" (i, t) VALUES ('bul+', 'Ах, чудна българска земьо, полюшвай цъфтящи жита._');
ERROR:  character with byte sequence 0xd0 0x90 in encoding "UTF8" has no equivalent in encoding "ISO_8859_7"
SELECT * FROM "Unicode data" WHERE i = 'bul+';
 i | t 
---+---
(0 rows)

DELETE FROM "Unicode data" WHERE t = 'Ах, чудна българска земьо, полюшвай цъфтящи жита._';
ERROR:  character with byte sequence 0xd0 0x90 in encoding "UTF8" has no equivalent in encoding "ISO_8859_7"
SELECT count(*) n FROM "Unicode data" WHERE i = 'bul+';
 n 
---
 0
(1 row)

INSERT INTO "Unicode data" (i, t) VALUES ('rus+', 'Широкая электрификация южных губерний даст мощный толчок подъёму сельского хозяйства._');
ERROR:  character with byte sequence 0xd0 0xa8 in encoding "UTF8" has no equivalent in encoding "ISO_8859_7"
SELECT * FROM "Unicode data" WHERE i = 'rus+';
 i | t 
---+---
(0 rows)

DELETE FROM "Unicode data" WHERE t = 'Широкая электрификация южных губерний даст мощный толчок подъёму сельского хозяйства._';
ERROR:  character with byte sequence 0xd0 0xa8 in encoding "UTF8" has no equivalent in encoding "ISO_8859_7"
SELECT count(*) n FROM "Unicode data" WHERE i = 'rus+';
 n 
---
 0
(1 row)

INSERT INTO "Unicode data" (i, t) VALUES ('ukr+', 'Гей, хлопці, не вспію — на ґанку ваша файна їжа знищується бурундучком._');
ERROR:  character with byte sequence 0xd0 0x93 in encoding "UTF8" has no equivalent in encoding "ISO_8859_7"
SELECT * FROM "Unicode data" WHERE i = 'ukr+';
 i | t 
---+---
(0 rows)

DELETE FROM "Unicode data" WHERE t = 'Гей, хлопці, не вспію — на ґанку ваша файна їжа знищується бурундучком._';
ERROR:  character with byte sequence 0xd0 0x93 in encoding "UTF8" has no equivalent in encoding "ISO_8859_7"
SELECT count(*) n FROM "Unicode data" WHERE i = 'ukr+';
 n 
---
 0
(1 row)

-- 1256, ISO_8859_6
SELECT * FROM "Unicode data" WHERE i = 'ara';
 i | t 
---+---
(0 rows)

SELECT * FROM "Unicode data" WHERE t LIKE '%ضَظَغ%';
ERROR:  character with byte sequence 0xd8 0xb6 in encoding "UTF8" has no equivalent in encoding "ISO_8859_7"
INSERT INTO "Unicode data" (i, t) VALUES ('ara+', 'أبجد هوَّز حُطّي كلَمُن سَعْفَص قُرِشَت ثَخَدٌ ضَظَغ_');
ERROR:  character with byte sequence 0xd8 0xa3 in encoding "UTF8" has no equivalent in encoding "ISO_8859_7"
SELECT * FROM "Unicode data" WHERE i = 'ara+';
 i | t 
---+---
(0 rows)

DELETE FROM "Unicode data" WHERE t = 'أبجد هوَّز حُطّي كلَمُن سَعْفَص قُرِشَت ثَخَدٌ ضَظَغ_';
ERROR:  character with byte sequence 0xd8 0xa3 in encoding "UTF8" has no equivalent in encoding "ISO_8859_7"
SELECT count(*) n FROM "Unicode data" WHERE i = 'ara+';
 n 
---
 0
(1 row)

-- 1253, ISO_8859_7
SELECT * FROM "Unicode data" WHERE i = 'gre';
 i | t 
---+---
(0 rows)

SELECT * FROM "Unicode data" WHERE t LIKE 'Τάχισ%';
 i | t 
---+---
(0 rows)

INSERT INTO "Unicode data" (i, t) VALUES ('gre+', 'Τάχιστη αλώπηξ βαφής ψημένη γη, δρασκελίζει υπέρ νωθρού κυνός_');
SELECT * FROM "Unicode data" WHERE i = 'gre+';
  i   |                               t                                
------+----------------------------------------------------------------
 gre+ | Τάχιστη αλώπηξ βαφής ψημένη γη, δρασκελίζει υπέρ νωθρού κυνός_
(1 row)

DELETE FROM "Unicode data" WHERE t = 'Τάχιστη αλώπηξ βαφής ψημένη γη, δρασκελίζει υπέρ νωθρού κυνός_';
-- 1255, ISO_8859_8
SELECT * FROM "Unicode data" WHERE i = 'heb';
 i | t 
---+---
(0 rows)

SELECT * FROM "Unicode data" WHERE t LIKE '%כי ח%';
ERROR:  character with byte sequence 0xd7 0x9b in encoding "UTF8" has no equivalent in encoding "ISO_8859_7"
INSERT INTO "Unicode data" (i, t) VALUES ('heb+', 'עטלף אבק נס דרך מזגן שהתפוצץ כי חם_');
ERROR:  character with byte sequence 0xd7 0xa2 in encoding "UTF8" has no equivalent in encoding "ISO_8859_7"
SELECT * FROM "Unicode data" WHERE i = 'heb+';
 i | t 
---+---
(0 rows)

DELETE FROM "Unicode data" WHERE t = 'עטלף אבק נס דרך מזגן שהתפוצץ כי חם_';
ERROR:  character with byte sequence 0xd7 0xa2 in encoding "UTF8" has no equivalent in encoding "ISO_8859_7"
SELECT count(*) n FROM "Unicode data" WHERE i = 'heb+';
 n 
---
 0
(1 row)

-- 1252, LATIN1
SELECT * FROM "Unicode data" WHERE i = 'eus';
 i | t 
---+---
(0 rows)

SELECT * FROM "Unicode data" WHERE i = 'fra';
 i | t 
---+---
(0 rows)

SELECT * FROM "Unicode data" WHERE i = 'spa';
 i | t 
---+---
(0 rows)

SELECT * FROM "Unicode data" WHERE t LIKE 'Permi%';
    i    |              t               
---------+------------------------------
 utf_eus | Permin gox dabiltzu yoskiΓ±.
(1 row)

SELECT * FROM "Unicode data" WHERE t LIKE 'Dès N%';
ERROR:  character with byte sequence 0xc3 0xa8 in encoding "UTF8" has no equivalent in encoding "ISO_8859_7"
SELECT * FROM "Unicode data" WHERE t LIKE 'Quier%';
    i    |                            t                             
---------+----------------------------------------------------------
 utf_spa | Quiere la boca exhausta vid, kiwi, piΓ±a y fugaz jamΓ³n.
(1 row)

INSERT INTO "Unicode data" (i, t) VALUES ('eus+', 'Permin gox dabiltzu yoskiñ._');
ERROR:  character with byte sequence 0xc3 0xb1 in encoding "UTF8" has no equivalent in encoding "ISO_8859_7"
SELECT * FROM "Unicode data" WHERE i = 'eus+';
 i | t 
---+---
(0 rows)

DELETE FROM "Unicode data" WHERE t = 'Permin gox dabiltzu yoskiñ._';
ERROR:  character with byte sequence 0xc3 0xb1 in encoding "UTF8" has no equivalent in encoding "ISO_8859_7"
SELECT count(*) n FROM "Unicode data" WHERE i = 'eus+';
 n 
---
 0
(1 row)

INSERT INTO "Unicode data" (i, t) VALUES ('fra+', 'Dès Noël où un zéphyr haï me vêt de glaçons würmiens je dîne d’exquis rôtis de bœuf au kir à l’aÿ d’âge mûr & cætera !_');
ERROR:  character with byte sequence 0xc3 0xa8 in encoding "UTF8" has no equivalent in encoding "ISO_8859_7"
SELECT * FROM "Unicode data" WHERE i = 'fra+';
 i | t 
---+---
(0 rows)

DELETE FROM "Unicode data" WHERE t = 'Dès Noël où un zéphyr haï me vêt de glaçons würmiens je dîne d’exquis rôtis de bœuf au kir à l’aÿ d’âge mûr & cætera !_';
ERROR:  character with byte sequence 0xc3 0xa8 in encoding "UTF8" has no equivalent in encoding "ISO_8859_7"
SELECT count(*) n FROM "Unicode data" WHERE i = 'fra+';
 n 
---
 0
(1 row)

INSERT INTO "Unicode data" (i, t) VALUES ('spa+', 'Quiere la boca exhausta vid, kiwi, piña y fugaz jamón._');
ERROR:  character with byte sequence 0xc3 0xb1 in encoding "UTF8" has no equivalent in encoding "ISO_8859_7"
SELECT * FROM "Unicode data" WHERE i = 'spa+';
 i | t 
---+---
(0 rows)

DELETE FROM "Unicode data" WHERE t = 'Quiere la boca exhausta vid, kiwi, piña y fugaz jamón._';
ERROR:  character with byte sequence 0xc3 0xb1 in encoding "UTF8" has no equivalent in encoding "ISO_8859_7"
SELECT count(*) n FROM "Unicode data" WHERE i = 'spa+';
 n 
---
 0
(1 row)

-- 1250, LATIN2
SELECT * FROM "Unicode data" WHERE i = 'cze';
 i | t 
---+---
(0 rows)

SELECT * FROM "Unicode data" WHERE i = 'pol';
 i | t 
---+---
(0 rows)

SELECT * FROM "Unicode data" WHERE i = 'srp';
 i | t 
---+---
(0 rows)

SELECT * FROM "Unicode data" WHERE t LIKE 'Zvláš%';
ERROR:  character with byte sequence 0xc3 0xa1 in encoding "UTF8" has no equivalent in encoding "ISO_8859_7"
SELECT * FROM "Unicode data" WHERE t LIKE 'Pchną%';
ERROR:  character with byte sequence 0xc4 0x85 in encoding "UTF8" has no equivalent in encoding "ISO_8859_7"
SELECT * FROM "Unicode data" WHERE t LIKE 'Ljuba%';
    i    |                                          t                                           
---------+--------------------------------------------------------------------------------------
 utf_srp | Ljubavi, Olga, hajde poΔ\u0091i u FudΕΎi i Δ\u008Dut Δ\u0087eΕ‘ njeΕΎnu muziku srca.
(1 row)

INSERT INTO "Unicode data" (i, t) VALUES ('cze+', 'Zvlášť zákeřný učeň s ďolíčky běží podél zóny úlů._');
ERROR:  character with byte sequence 0xc3 0xa1 in encoding "UTF8" has no equivalent in encoding "ISO_8859_7"
SELECT * FROM "Unicode data" WHERE i = 'cze+';
 i | t 
---+---
(0 rows)

DELETE FROM "Unicode data" WHERE t = 'Zvlášť zákeřný učeň s ďolíčky běží podél zóny úlů._';
ERROR:  character with byte sequence 0xc3 0xa1 in encoding "UTF8" has no equivalent in encoding "ISO_8859_7"
SELECT count(*) n FROM "Unicode data" WHERE i = 'cze+';
 n 
---
 0
(1 row)

INSERT INTO "Unicode data" (i, t) VALUES ('pol+', 'Pchnąć w tę łódź jeża lub ośm skrzyń fig._');
ERROR:  character with byte sequence 0xc4 0x85 in encoding "UTF8" has no equivalent in encoding "ISO_8859_7"
SELECT * FROM "Unicode data" WHERE i = 'pol+';
 i | t 
---+---
(0 rows)

DELETE FROM "Unicode data" WHERE t = 'Pchnąć w tę łódź jeża lub ośm skrzyń fig._';
ERROR:  character with byte sequence 0xc4 0x85 in encoding "UTF8" has no equivalent in encoding "ISO_8859_7"
SELECT count(*) n FROM "Unicode data" WHERE i = 'pol+';
 n 
---
 0
(1 row)

INSERT INTO "Unicode data" (i, t) VALUES ('srp+', 'Ljubavi, Olga, hajde pođi u Fudži i čut ćeš nježnu muziku srca._');
ERROR:  character with byte sequence 0xc4 0x91 in encoding "UTF8" has no equivalent in encoding "ISO_8859_7"
SELECT * FROM "Unicode data" WHERE i = 'srp+';
 i | t 
---+---
(0 rows)

DELETE FROM "Unicode data" WHERE t = 'Ljubavi, Olga, hajde pođi u Fudži i čut ćeš nježnu muziku srca._';
ERROR:  character with byte sequence 0xc4 0x91 in encoding "UTF8" has no equivalent in encoding "ISO_8859_7"
SELECT count(*) n FROM "Unicode data" WHERE i = 'srp+';
 n 
---
 0
(1 row)

-- 1257, LATIN7
SELECT * FROM "Unicode data" WHERE i = 'lav';
 i | t 
---+---
(0 rows)

SELECT * FROM "Unicode data" WHERE t LIKE 'Ķieģeļu%';
ERROR:  character with byte sequence 0xc4 0xb6 in encoding "UTF8" has no equivalent in encoding "ISO_8859_7"
INSERT INTO "Unicode data" (i, t) VALUES ('lav+', 'Ķieģeļu cepējs Edgars Buls fraku un hūti žāvē uz čīkstošām eņģēm._');
ERROR:  character with byte sequence 0xc4 0xb6 in encoding "UTF8" has no equivalent in encoding "ISO_8859_7"
SELECT * FROM "Unicode data" WHERE i = 'lav+';
 i | t 
---+---
(0 rows)

DELETE FROM "Unicode data" WHERE t = 'Ķieģeļu cepējs Edgars Buls fraku un hūti žāvē uz čīkstošām eņģēm._';
ERROR:  character with byte sequence 0xc4 0xb6 in encoding "UTF8" has no equivalent in encoding "ISO_8859_7"
SELECT count(*) n FROM "Unicode data" WHERE i = 'lav+';
 n 
---
 0
(1 row)

-- EUC_KR
SELECT * FROM "Unicode data" WHERE i = 'kor';
 i | t 
---+---
(0 rows)

SELECT * FROM "Unicode data" WHERE t LIKE '키스의 고%';
ERROR:  character with byte sequence 0xed 0x82 0xa4 in encoding "UTF8" has no equivalent in encoding "ISO_8859_7"
INSERT INTO "Unicode data" (i, t) VALUES ('kor+', '키스의 고유조건은 입술끼리 만나야 하고 특별한 기술은 필요치 않다._');
ERROR:  character with byte sequence 0xed 0x82 0xa4 in encoding "UTF8" has no equivalent in encoding "ISO_8859_7"
SELECT * FROM "Unicode data" WHERE i = 'kor+';
 i | t 
---+---
(0 rows)

DELETE FROM "Unicode data" WHERE t = '키스의 고유조건은 입술끼리 만나야 하고 특별한 기술은 필요치 않다._';
ERROR:  character with byte sequence 0xed 0x82 0xa4 in encoding "UTF8" has no equivalent in encoding "ISO_8859_7"
SELECT count(*) n FROM "Unicode data" WHERE i = 'kor+';
 n 
---
 0
(1 row)

-- 1254, LATIN5
SELECT * FROM "Unicode data" WHERE i = 'aze';
 i | t 
---+---
(0 rows)

SELECT * FROM "Unicode data" WHERE t LIKE 'Zəfər%';
ERROR:  character with byte sequence 0xc9 0x99 in encoding "UTF8" has no equivalent in encoding "ISO_8859_7"
INSERT INTO "Unicode data" (i, t) VALUES ('aze+', 'Zəfər, jaketini də, papağını da götür, bu axşam hava çox soyuq olacaq._');
ERROR:  character with byte sequence 0xc9 0x99 in encoding "UTF8" has no equivalent in encoding "ISO_8859_7"
SELECT * FROM "Unicode data" WHERE i = 'aze+';
 i | t 
---+---
(0 rows)

DELETE FROM "Unicode data" WHERE t = 'Zəfər, jaketini də, papağını da götür, bu axşam hava çox soyuq olacaq._';
ERROR:  character with byte sequence 0xc9 0x99 in encoding "UTF8" has no equivalent in encoding "ISO_8859_7"
SELECT count(*) n FROM "Unicode data" WHERE i = 'aze+';
 n 
---
 0
(1 row)

-- etc
INSERT INTO "Unicode data" (i, t) VALUES ('arm+', 'Բել դղյակի ձախ ժամն օֆ ազգությանը ցպահանջ չճշտած վնաս էր եւ փառք։_');
ERROR:  character with byte sequence 0xd4 0xb2 in encoding "UTF8" has no equivalent in encoding "ISO_8859_7"
SELECT * FROM "Unicode data" WHERE i = 'arm+';
 i | t 
---+---
(0 rows)

DELETE FROM "Unicode data" WHERE t = 'Բել դղյակի ձախ ժամն օֆ ազգությանը ցպահանջ չճշտած վնաս էր եւ փառք։_';
ERROR:  character with byte sequence 0xd4 0xb2 in encoding "UTF8" has no equivalent in encoding "ISO_8859_7"
SELECT count(*) n FROM "Unicode data" WHERE i = 'arm+';
 n 
---
 0
(1 row)

INSERT INTO "Unicode data" (i, t) VALUES ('gle+', 'Chuaigh bé mhórshách le dlúthspád fíorfhinn trí hata mo dhea-phorcáin bhig._');
ERROR:  character with byte sequence 0xc3 0xa9 in encoding "UTF8" has no equivalent in encoding "ISO_8859_7"
SELECT * FROM "Unicode data" WHERE i = 'gle+';
 i | t 
---+---
(0 rows)

DELETE FROM "Unicode data" WHERE t = 'Chuaigh bé mhórshách le dlúthspád fíorfhinn trí hata mo dhea-phorcáin bhig._';
ERROR:  character with byte sequence 0xc3 0xa9 in encoding "UTF8" has no equivalent in encoding "ISO_8859_7"
SELECT count(*) n FROM "Unicode data" WHERE i = 'gle+';
 n 
---
 0
(1 row)

INSERT INTO "Unicode data" (i, t) VALUES ('epo+', 'Laŭ Ludoviko Zamenhof bongustas freŝa ĉeĥa manĝaĵo kun spicoj._');
ERROR:  character with byte sequence 0xc5 0xad in encoding "UTF8" has no equivalent in encoding "ISO_8859_7"
SELECT * FROM "Unicode data" WHERE i = 'epo+';
 i | t 
---+---
(0 rows)

DELETE FROM "Unicode data" WHERE t = 'Laŭ Ludoviko Zamenhof bongustas freŝa ĉeĥa manĝaĵo kun spicoj._';
ERROR:  character with byte sequence 0xc5 0xad in encoding "UTF8" has no equivalent in encoding "ISO_8859_7"
SELECT count(*) n FROM "Unicode data" WHERE i = 'epo+';
 n 
---
 0
(1 row)

DROP FOREIGN TABLE "Unicode data";
DROP SERVER redis_testing_server CASCADE;
NOTICE:  drop cascades to user mapping for public on server redis_testing_server
DROP EXTENSION redis_fdw;
\connect contrib_regression;
DROP DATABASE "contrib_regression_ISO_8859_7";
-- ISO_8859_8
CREATE DATABASE "contrib_regression_ISO_8859_8" ENCODING ISO_8859_8 LC_CTYPE='POSIX' LC_COLLATE='POSIX' template template0;
\connect "contrib_regression_ISO_8859_8"
CREATE EXTENSION redis_fdw;
CREATE SERVER redis_testing_server FOREIGN DATA WRAPPER redis_fdw;
CREATE FOREIGN TABLE "Unicode data"(i text, t text)
SERVER redis_testing_server
OPTIONS (database '15');
CREATE USER MAPPING FOR public SERVER redis_testing_server; 
-- EUC_JP
SELECT * FROM "Unicode data" WHERE i = 'jap';
 i | t 
---+---
(0 rows)

SELECT * FROM "Unicode data" WHERE t LIKE 'いろはにほ%';
ERROR:  character with byte sequence 0xe3 0x81 0x84 in encoding "UTF8" has no equivalent in encoding "ISO_8859_8"
INSERT INTO "Unicode data" (i, t) VALUES ('jap+', 'いろはにほへと ちりぬるを わかよたれそ つねならむ うゐのおくやま けふこえて あさきゆめみし ゑひもせす._');
ERROR:  character with byte sequence 0xe3 0x81 0x84 in encoding "UTF8" has no equivalent in encoding "ISO_8859_8"
DELETE FROM "Unicode data" WHERE t = 'いろはにほへと ちりぬるを わかよたれそ つねならむ うゐのおくやま けふこえて あさきゆめみし ゑひもせす._';
ERROR:  character with byte sequence 0xe3 0x81 0x84 in encoding "UTF8" has no equivalent in encoding "ISO_8859_8"
SELECT count(*) n FROM "Unicode data" WHERE i = 'jap+';
 n 
---
 0
(1 row)

-- 1251, ISO_8859_5
SELECT * FROM "Unicode data" WHERE i = 'bel';
 i | t 
---+---
(0 rows)

SELECT * FROM "Unicode data" WHERE i = 'bul';
 i | t 
---+---
(0 rows)

SELECT * FROM "Unicode data" WHERE i = 'rus';
 i | t 
---+---
(0 rows)

SELECT * FROM "Unicode data" WHERE i = 'ukr';
 i | t 
---+---
(0 rows)

SELECT * FROM "Unicode data" WHERE t LIKE 'У руд%';
ERROR:  character with byte sequence 0xd0 0xa3 in encoding "UTF8" has no equivalent in encoding "ISO_8859_8"
SELECT * FROM "Unicode data" WHERE t LIKE 'Ах, ч%';
ERROR:  character with byte sequence 0xd0 0x90 in encoding "UTF8" has no equivalent in encoding "ISO_8859_8"
SELECT * FROM "Unicode data" WHERE t LIKE 'Широк%';
ERROR:  character with byte sequence 0xd0 0xa8 in encoding "UTF8" has no equivalent in encoding "ISO_8859_8"
SELECT * FROM "Unicode data" WHERE t LIKE 'Гей, %';
ERROR:  character with byte sequence 0xd0 0x93 in encoding "UTF8" has no equivalent in encoding "ISO_8859_8"
INSERT INTO "Unicode data" (i, t) VALUES ('bel+', 'У рудога вераб’я ў сховішчы пад фатэлем ляжаць нейкія гаючыя зёлкі._');
ERROR:  character with byte sequence 0xd0 0xa3 in encoding "UTF8" has no equivalent in encoding "ISO_8859_8"
SELECT * FROM "Unicode data" WHERE i = 'bel+';
 i | t 
---+---
(0 rows)

DELETE FROM "Unicode data" WHERE t = 'У рудога вераб’я ў сховішчы пад фатэлем ляжаць нейкія гаючыя зёлкі._';
ERROR:  character with byte sequence 0xd0 0xa3 in encoding "UTF8" has no equivalent in encoding "ISO_8859_8"
SELECT count(*) n FROM "Unicode data" WHERE i = 'bel+';
 n 
---
 0
(1 row)

INSERT INTO "Unicode data" (i, t) VALUES ('bul+', 'Ах, чудна българска земьо, полюшвай цъфтящи жита._');
ERROR:  character with byte sequence 0xd0 0x90 in encoding "UTF8" has no equivalent in encoding "ISO_8859_8"
SELECT * FROM "Unicode data" WHERE i = 'bul+';
 i | t 
---+---
(0 rows)

DELETE FROM "Unicode data" WHERE t = 'Ах, чудна българска земьо, полюшвай цъфтящи жита._';
ERROR:  character with byte sequence 0xd0 0x90 in encoding "UTF8" has no equivalent in encoding "ISO_8859_8"
SELECT count(*) n FROM "Unicode data" WHERE i = 'bul+';
 n 
---
 0
(1 row)

INSERT INTO "Unicode data" (i, t) VALUES ('rus+', 'Широкая электрификация южных губерний даст мощный толчок подъёму сельского хозяйства._');
ERROR:  character with byte sequence 0xd0 0xa8 in encoding "UTF8" has no equivalent in encoding "ISO_8859_8"
SELECT * FROM "Unicode data" WHERE i = 'rus+';
 i | t 
---+---
(0 rows)

DELETE FROM "Unicode data" WHERE t = 'Широкая электрификация южных губерний даст мощный толчок подъёму сельского хозяйства._';
ERROR:  character with byte sequence 0xd0 0xa8 in encoding "UTF8" has no equivalent in encoding "ISO_8859_8"
SELECT count(*) n FROM "Unicode data" WHERE i = 'rus+';
 n 
---
 0
(1 row)

INSERT INTO "Unicode data" (i, t) VALUES ('ukr+', 'Гей, хлопці, не вспію — на ґанку ваша файна їжа знищується бурундучком._');
ERROR:  character with byte sequence 0xd0 0x93 in encoding "UTF8" has no equivalent in encoding "ISO_8859_8"
SELECT * FROM "Unicode data" WHERE i = 'ukr+';
 i | t 
---+---
(0 rows)

DELETE FROM "Unicode data" WHERE t = 'Гей, хлопці, не вспію — на ґанку ваша файна їжа знищується бурундучком._';
ERROR:  character with byte sequence 0xd0 0x93 in encoding "UTF8" has no equivalent in encoding "ISO_8859_8"
SELECT count(*) n FROM "Unicode data" WHERE i = 'ukr+';
 n 
---
 0
(1 row)

-- 1256, ISO_8859_6
SELECT * FROM "Unicode data" WHERE i = 'ara';
 i | t 
---+---
(0 rows)

SELECT * FROM "Unicode data" WHERE t LIKE '%ضَظَغ%';
ERROR:  character with byte sequence 0xd8 0xb6 in encoding "UTF8" has no equivalent in encoding "ISO_8859_8"
INSERT INTO "Unicode data" (i, t) VALUES ('ara+', 'أبجد هوَّز حُطّي كلَمُن سَعْفَص قُرِشَت ثَخَدٌ ضَظَغ_');
ERROR:  character with byte sequence 0xd8 0xa3 in encoding "UTF8" has no equivalent in encoding "ISO_8859_8"
SELECT * FROM "Unicode data" WHERE i = 'ara+';
 i | t 
---+---
(0 rows)

DELETE FROM "Unicode data" WHERE t = 'أبجد هوَّز حُطّي كلَمُن سَعْفَص قُرِشَت ثَخَدٌ ضَظَغ_';
ERROR:  character with byte sequence 0xd8 0xa3 in encoding "UTF8" has no equivalent in encoding "ISO_8859_8"
SELECT count(*) n FROM "Unicode data" WHERE i = 'ara+';
 n 
---
 0
(1 row)

-- 1253, ISO_8859_7
SELECT * FROM "Unicode data" WHERE i = 'gre';
 i | t 
---+---
(0 rows)

SELECT * FROM "Unicode data" WHERE t LIKE 'Τάχισ%';
ERROR:  character with byte sequence 0xce 0xa4 in encoding "UTF8" has no equivalent in encoding "ISO_8859_8"
INSERT INTO "Unicode data" (i, t) VALUES ('gre+', 'Τάχιστη αλώπηξ βαφής ψημένη γη, δρασκελίζει υπέρ νωθρού κυνός_');
ERROR:  character with byte sequence 0xce 0xa4 in encoding "UTF8" has no equivalent in encoding "ISO_8859_8"
SELECT * FROM "Unicode data" WHERE i = 'gre+';
 i | t 
---+---
(0 rows)

DELETE FROM "Unicode data" WHERE t = 'Τάχιστη αλώπηξ βαφής ψημένη γη, δρασκελίζει υπέρ νωθρού κυνός_';
ERROR:  character with byte sequence 0xce 0xa4 in encoding "UTF8" has no equivalent in encoding "ISO_8859_8"
-- 1255, ISO_8859_8
SELECT * FROM "Unicode data" WHERE i = 'heb';
 i | t 
---+---
(0 rows)

SELECT * FROM "Unicode data" WHERE t LIKE '%כי ח%';
 i | t 
---+---
(0 rows)

INSERT INTO "Unicode data" (i, t) VALUES ('heb+', 'עטלף אבק נס דרך מזגן שהתפוצץ כי חם_');
SELECT * FROM "Unicode data" WHERE i = 'heb+';
  i   |                  t                  
------+-------------------------------------
 heb+ | עטלף אבק נס דרך מזגן שהתפוצץ כי חם_
(1 row)

DELETE FROM "Unicode data" WHERE t = 'עטלף אבק נס דרך מזגן שהתפוצץ כי חם_';
SELECT count(*) n FROM "Unicode data" WHERE i = 'heb+';
 n 
---
 0
(1 row)

-- 1252, LATIN1
SELECT * FROM "Unicode data" WHERE i = 'eus';
 i | t 
---+---
(0 rows)

SELECT * FROM "Unicode data" WHERE i = 'fra';
 i | t 
---+---
(0 rows)

SELECT * FROM "Unicode data" WHERE i = 'spa';
 i | t 
---+---
(0 rows)

SELECT * FROM "Unicode data" WHERE t LIKE 'Permi%';
ERROR:  character with byte sequence 0xc3 in encoding "ISO_8859_8" has no equivalent in encoding "UTF8"
SELECT * FROM "Unicode data" WHERE t LIKE 'Dès N%';
ERROR:  character with byte sequence 0xc3 0xa8 in encoding "UTF8" has no equivalent in encoding "ISO_8859_8"
SELECT * FROM "Unicode data" WHERE t LIKE 'Quier%';
ERROR:  character with byte sequence 0xc3 in encoding "ISO_8859_8" has no equivalent in encoding "UTF8"
INSERT INTO "Unicode data" (i, t) VALUES ('eus+', 'Permin gox dabiltzu yoskiñ._');
ERROR:  character with byte sequence 0xc3 0xb1 in encoding "UTF8" has no equivalent in encoding "ISO_8859_8"
SELECT * FROM "Unicode data" WHERE i = 'eus+';
 i | t 
---+---
(0 rows)

DELETE FROM "Unicode data" WHERE t = 'Permin gox dabiltzu yoskiñ._';
ERROR:  character with byte sequence 0xc3 0xb1 in encoding "UTF8" has no equivalent in encoding "ISO_8859_8"
SELECT count(*) n FROM "Unicode data" WHERE i = 'eus+';
 n 
---
 0
(1 row)

INSERT INTO "Unicode data" (i, t) VALUES ('fra+', 'Dès Noël où un zéphyr haï me vêt de glaçons würmiens je dîne d’exquis rôtis de bœuf au kir à l’aÿ d’âge mûr & cætera !_');
ERROR:  character with byte sequence 0xc3 0xa8 in encoding "UTF8" has no equivalent in encoding "ISO_8859_8"
SELECT * FROM "Unicode data" WHERE i = 'fra+';
 i | t 
---+---
(0 rows)

DELETE FROM "Unicode data" WHERE t = 'Dès Noël où un zéphyr haï me vêt de glaçons würmiens je dîne d’exquis rôtis de bœuf au kir à l’aÿ d’âge mûr & cætera !_';
ERROR:  character with byte sequence 0xc3 0xa8 in encoding "UTF8" has no equivalent in encoding "ISO_8859_8"
SELECT count(*) n FROM "Unicode data" WHERE i = 'fra+';
 n 
---
 0
(1 row)

INSERT INTO "Unicode data" (i, t) VALUES ('spa+', 'Quiere la boca exhausta vid, kiwi, piña y fugaz jamón._');
ERROR:  character with byte sequence 0xc3 0xb1 in encoding "UTF8" has no equivalent in encoding "ISO_8859_8"
SELECT * FROM "Unicode data" WHERE i = 'spa+';
 i | t 
---+---
(0 rows)

DELETE FROM "Unicode data" WHERE t = 'Quiere la boca exhausta vid, kiwi, piña y fugaz jamón._';
ERROR:  character with byte sequence 0xc3 0xb1 in encoding "UTF8" has no equivalent in encoding "ISO_8859_8"
SELECT count(*) n FROM "Unicode data" WHERE i = 'spa+';
 n 
---
 0
(1 row)

-- 1250, LATIN2
SELECT * FROM "Unicode data" WHERE i = 'cze';
 i | t 
---+---
(0 rows)

SELECT * FROM "Unicode data" WHERE i = 'pol';
 i | t 
---+---
(0 rows)

SELECT * FROM "Unicode data" WHERE i = 'srp';
 i | t 
---+---
(0 rows)

SELECT * FROM "Unicode data" WHERE t LIKE 'Zvláš%';
ERROR:  character with byte sequence 0xc3 0xa1 in encoding "UTF8" has no equivalent in encoding "ISO_8859_8"
SELECT * FROM "Unicode data" WHERE t LIKE 'Pchną%';
ERROR:  character with byte sequence 0xc4 0x85 in encoding "UTF8" has no equivalent in encoding "ISO_8859_8"
SELECT * FROM "Unicode data" WHERE t LIKE 'Ljuba%';
ERROR:  character with byte sequence 0xc4 in encoding "ISO_8859_8" has no equivalent in encoding "UTF8"
INSERT INTO "Unicode data" (i, t) VALUES ('cze+', 'Zvlášť zákeřný učeň s ďolíčky běží podél zóny úlů._');
ERROR:  character with byte sequence 0xc3 0xa1 in encoding "UTF8" has no equivalent in encoding "ISO_8859_8"
SELECT * FROM "Unicode data" WHERE i = 'cze+';
 i | t 
---+---
(0 rows)

DELETE FROM "Unicode data" WHERE t = 'Zvlášť zákeřný učeň s ďolíčky běží podél zóny úlů._';
ERROR:  character with byte sequence 0xc3 0xa1 in encoding "UTF8" has no equivalent in encoding "ISO_8859_8"
SELECT count(*) n FROM "Unicode data" WHERE i = 'cze+';
 n 
---
 0
(1 row)

INSERT INTO "Unicode data" (i, t) VALUES ('pol+', 'Pchnąć w tę łódź jeża lub ośm skrzyń fig._');
ERROR:  character with byte sequence 0xc4 0x85 in encoding "UTF8" has no equivalent in encoding "ISO_8859_8"
SELECT * FROM "Unicode data" WHERE i = 'pol+';
 i | t 
---+---
(0 rows)

DELETE FROM "Unicode data" WHERE t = 'Pchnąć w tę łódź jeża lub ośm skrzyń fig._';
ERROR:  character with byte sequence 0xc4 0x85 in encoding "UTF8" has no equivalent in encoding "ISO_8859_8"
SELECT count(*) n FROM "Unicode data" WHERE i = 'pol+';
 n 
---
 0
(1 row)

INSERT INTO "Unicode data" (i, t) VALUES ('srp+', 'Ljubavi, Olga, hajde pođi u Fudži i čut ćeš nježnu muziku srca._');
ERROR:  character with byte sequence 0xc4 0x91 in encoding "UTF8" has no equivalent in encoding "ISO_8859_8"
SELECT * FROM "Unicode data" WHERE i = 'srp+';
 i | t 
---+---
(0 rows)

DELETE FROM "Unicode data" WHERE t = 'Ljubavi, Olga, hajde pođi u Fudži i čut ćeš nježnu muziku srca._';
ERROR:  character with byte sequence 0xc4 0x91 in encoding "UTF8" has no equivalent in encoding "ISO_8859_8"
SELECT count(*) n FROM "Unicode data" WHERE i = 'srp+';
 n 
---
 0
(1 row)

-- 1257, LATIN7
SELECT * FROM "Unicode data" WHERE i = 'lav';
 i | t 
---+---
(0 rows)

SELECT * FROM "Unicode data" WHERE t LIKE 'Ķieģeļu%';
ERROR:  character with byte sequence 0xc4 0xb6 in encoding "UTF8" has no equivalent in encoding "ISO_8859_8"
INSERT INTO "Unicode data" (i, t) VALUES ('lav+', 'Ķieģeļu cepējs Edgars Buls fraku un hūti žāvē uz čīkstošām eņģēm._');
ERROR:  character with byte sequence 0xc4 0xb6 in encoding "UTF8" has no equivalent in encoding "ISO_8859_8"
SELECT * FROM "Unicode data" WHERE i = 'lav+';
 i | t 
---+---
(0 rows)

DELETE FROM "Unicode data" WHERE t = 'Ķieģeļu cepējs Edgars Buls fraku un hūti žāvē uz čīkstošām eņģēm._';
ERROR:  character with byte sequence 0xc4 0xb6 in encoding "UTF8" has no equivalent in encoding "ISO_8859_8"
SELECT count(*) n FROM "Unicode data" WHERE i = 'lav+';
 n 
---
 0
(1 row)

-- EUC_KR
SELECT * FROM "Unicode data" WHERE i = 'kor';
 i | t 
---+---
(0 rows)

SELECT * FROM "Unicode data" WHERE t LIKE '키스의 고%';
ERROR:  character with byte sequence 0xed 0x82 0xa4 in encoding "UTF8" has no equivalent in encoding "ISO_8859_8"
INSERT INTO "Unicode data" (i, t) VALUES ('kor+', '키스의 고유조건은 입술끼리 만나야 하고 특별한 기술은 필요치 않다._');
ERROR:  character with byte sequence 0xed 0x82 0xa4 in encoding "UTF8" has no equivalent in encoding "ISO_8859_8"
SELECT * FROM "Unicode data" WHERE i = 'kor+';
 i | t 
---+---
(0 rows)

DELETE FROM "Unicode data" WHERE t = '키스의 고유조건은 입술끼리 만나야 하고 특별한 기술은 필요치 않다._';
ERROR:  character with byte sequence 0xed 0x82 0xa4 in encoding "UTF8" has no equivalent in encoding "ISO_8859_8"
SELECT count(*) n FROM "Unicode data" WHERE i = 'kor+';
 n 
---
 0
(1 row)

-- 1254, LATIN5
SELECT * FROM "Unicode data" WHERE i = 'aze';
 i | t 
---+---
(0 rows)

SELECT * FROM "Unicode data" WHERE t LIKE 'Zəfər%';
ERROR:  character with byte sequence 0xc9 0x99 in encoding "UTF8" has no equivalent in encoding "ISO_8859_8"
INSERT INTO "Unicode data" (i, t) VALUES ('aze+', 'Zəfər, jaketini də, papağını da götür, bu axşam hava çox soyuq olacaq._');
ERROR:  character with byte sequence 0xc9 0x99 in encoding "UTF8" has no equivalent in encoding "ISO_8859_8"
SELECT * FROM "Unicode data" WHERE i = 'aze+';
 i | t 
---+---
(0 rows)

DELETE FROM "Unicode data" WHERE t = 'Zəfər, jaketini də, papağını da götür, bu axşam hava çox soyuq olacaq._';
ERROR:  character with byte sequence 0xc9 0x99 in encoding "UTF8" has no equivalent in encoding "ISO_8859_8"
SELECT count(*) n FROM "Unicode data" WHERE i = 'aze+';
 n 
---
 0
(1 row)

-- etc
INSERT INTO "Unicode data" (i, t) VALUES ('arm+', 'Բել դղյակի ձախ ժամն օֆ ազգությանը ցպահանջ չճշտած վնաս էր եւ փառք։_');
ERROR:  character with byte sequence 0xd4 0xb2 in encoding "UTF8" has no equivalent in encoding "ISO_8859_8"
SELECT * FROM "Unicode data" WHERE i = 'arm+';
 i | t 
---+---
(0 rows)

DELETE FROM "Unicode data" WHERE t = 'Բել դղյակի ձախ ժամն օֆ ազգությանը ցպահանջ չճշտած վնաս էր եւ փառք։_';
ERROR:  character with byte sequence 0xd4 0xb2 in encoding "UTF8" has no equivalent in encoding "ISO_8859_8"
SELECT count(*) n FROM "Unicode data" WHERE i = 'arm+';
 n 
---
 0
(1 row)

INSERT INTO "Unicode data" (i, t) VALUES ('gle+', 'Chuaigh bé mhórshách le dlúthspád fíorfhinn trí hata mo dhea-phorcáin bhig._');
ERROR:  character with byte sequence 0xc3 0xa9 in encoding "UTF8" has no equivalent in encoding "ISO_8859_8"
SELECT * FROM "Unicode data" WHERE i = 'gle+';
 i | t 
---+---
(0 rows)

DELETE FROM "Unicode data" WHERE t = 'Chuaigh bé mhórshách le dlúthspád fíorfhinn trí hata mo dhea-phorcáin bhig._';
ERROR:  character with byte sequence 0xc3 0xa9 in encoding "UTF8" has no equivalent in encoding "ISO_8859_8"
SELECT count(*) n FROM "Unicode data" WHERE i = 'gle+';
 n 
---
 0
(1 row)

INSERT INTO "Unicode data" (i, t) VALUES ('epo+', 'Laŭ Ludoviko Zamenhof bongustas freŝa ĉeĥa manĝaĵo kun spicoj._');
ERROR:  character with byte sequence 0xc5 0xad in encoding "UTF8" has no equivalent in encoding "ISO_8859_8"
SELECT * FROM "Unicode data" WHERE i = 'epo+';
 i | t 
---+---
(0 rows)

DELETE FROM "Unicode data" WHERE t = 'Laŭ Ludoviko Zamenhof bongustas freŝa ĉeĥa manĝaĵo kun spicoj._';
ERROR:  character with byte sequence 0xc5 0xad in encoding "UTF8" has no equivalent in encoding "ISO_8859_8"
SELECT count(*) n FROM "Unicode data" WHERE i = 'epo+';
 n 
---
 0
(1 row)

DROP FOREIGN TABLE "Unicode data";
DROP SERVER redis_testing_server CASCADE;
NOTICE:  drop cascades to user mapping for public on server redis_testing_server
DROP EXTENSION redis_fdw;
\connect contrib_regression;
DROP DATABASE "contrib_regression_ISO_8859_8";
-- ISO_8859_9
CREATE DATABASE "contrib_regression_ISO_8859_9" ENCODING ISO_8859_9 LC_CTYPE='POSIX' LC_COLLATE='POSIX' template template0;
\connect "contrib_regression_ISO_8859_9"
CREATE EXTENSION redis_fdw;
CREATE SERVER redis_testing_server FOREIGN DATA WRAPPER redis_fdw;
CREATE FOREIGN TABLE "Unicode data"(i text, t text)
SERVER redis_testing_server
OPTIONS (database '15');
CREATE USER MAPPING FOR public SERVER redis_testing_server; 
-- EUC_JP
SELECT * FROM "Unicode data" WHERE i = 'jap';
 i | t 
---+---
(0 rows)

SELECT * FROM "Unicode data" WHERE t LIKE 'いろはにほ%';
ERROR:  character with byte sequence 0xe3 0x81 0x84 in encoding "UTF8" has no equivalent in encoding "LATIN5"
INSERT INTO "Unicode data" (i, t) VALUES ('jap+', 'いろはにほへと ちりぬるを わかよたれそ つねならむ うゐのおくやま けふこえて あさきゆめみし ゑひもせす._');
ERROR:  character with byte sequence 0xe3 0x81 0x84 in encoding "UTF8" has no equivalent in encoding "LATIN5"
DELETE FROM "Unicode data" WHERE t = 'いろはにほへと ちりぬるを わかよたれそ つねならむ うゐのおくやま けふこえて あさきゆめみし ゑひもせす._';
ERROR:  character with byte sequence 0xe3 0x81 0x84 in encoding "UTF8" has no equivalent in encoding "LATIN5"
SELECT count(*) n FROM "Unicode data" WHERE i = 'jap+';
 n 
---
 0
(1 row)

-- 1251, ISO_8859_5
SELECT * FROM "Unicode data" WHERE i = 'bel';
 i | t 
---+---
(0 rows)

SELECT * FROM "Unicode data" WHERE i = 'bul';
 i | t 
---+---
(0 rows)

SELECT * FROM "Unicode data" WHERE i = 'rus';
 i | t 
---+---
(0 rows)

SELECT * FROM "Unicode data" WHERE i = 'ukr';
 i | t 
---+---
(0 rows)

SELECT * FROM "Unicode data" WHERE t LIKE 'У руд%';
ERROR:  character with byte sequence 0xd0 0xa3 in encoding "UTF8" has no equivalent in encoding "LATIN5"
SELECT * FROM "Unicode data" WHERE t LIKE 'Ах, ч%';
ERROR:  character with byte sequence 0xd0 0x90 in encoding "UTF8" has no equivalent in encoding "LATIN5"
SELECT * FROM "Unicode data" WHERE t LIKE 'Широк%';
ERROR:  character with byte sequence 0xd0 0xa8 in encoding "UTF8" has no equivalent in encoding "LATIN5"
SELECT * FROM "Unicode data" WHERE t LIKE 'Гей, %';
ERROR:  character with byte sequence 0xd0 0x93 in encoding "UTF8" has no equivalent in encoding "LATIN5"
INSERT INTO "Unicode data" (i, t) VALUES ('bel+', 'У рудога вераб’я ў сховішчы пад фатэлем ляжаць нейкія гаючыя зёлкі._');
ERROR:  character with byte sequence 0xd0 0xa3 in encoding "UTF8" has no equivalent in encoding "LATIN5"
SELECT * FROM "Unicode data" WHERE i = 'bel+';
 i | t 
---+---
(0 rows)

DELETE FROM "Unicode data" WHERE t = 'У рудога вераб’я ў сховішчы пад фатэлем ляжаць нейкія гаючыя зёлкі._';
ERROR:  character with byte sequence 0xd0 0xa3 in encoding "UTF8" has no equivalent in encoding "LATIN5"
SELECT count(*) n FROM "Unicode data" WHERE i = 'bel+';
 n 
---
 0
(1 row)

INSERT INTO "Unicode data" (i, t) VALUES ('bul+', 'Ах, чудна българска земьо, полюшвай цъфтящи жита._');
ERROR:  character with byte sequence 0xd0 0x90 in encoding "UTF8" has no equivalent in encoding "LATIN5"
SELECT * FROM "Unicode data" WHERE i = 'bul+';
 i | t 
---+---
(0 rows)

DELETE FROM "Unicode data" WHERE t = 'Ах, чудна българска земьо, полюшвай цъфтящи жита._';
ERROR:  character with byte sequence 0xd0 0x90 in encoding "UTF8" has no equivalent in encoding "LATIN5"
SELECT count(*) n FROM "Unicode data" WHERE i = 'bul+';
 n 
---
 0
(1 row)

INSERT INTO "Unicode data" (i, t) VALUES ('rus+', 'Широкая электрификация южных губерний даст мощный толчок подъёму сельского хозяйства._');
ERROR:  character with byte sequence 0xd0 0xa8 in encoding "UTF8" has no equivalent in encoding "LATIN5"
SELECT * FROM "Unicode data" WHERE i = 'rus+';
 i | t 
---+---
(0 rows)

DELETE FROM "Unicode data" WHERE t = 'Широкая электрификация южных губерний даст мощный толчок подъёму сельского хозяйства._';
ERROR:  character with byte sequence 0xd0 0xa8 in encoding "UTF8" has no equivalent in encoding "LATIN5"
SELECT count(*) n FROM "Unicode data" WHERE i = 'rus+';
 n 
---
 0
(1 row)

INSERT INTO "Unicode data" (i, t) VALUES ('ukr+', 'Гей, хлопці, не вспію — на ґанку ваша файна їжа знищується бурундучком._');
ERROR:  character with byte sequence 0xd0 0x93 in encoding "UTF8" has no equivalent in encoding "LATIN5"
SELECT * FROM "Unicode data" WHERE i = 'ukr+';
 i | t 
---+---
(0 rows)

DELETE FROM "Unicode data" WHERE t = 'Гей, хлопці, не вспію — на ґанку ваша файна їжа знищується бурундучком._';
ERROR:  character with byte sequence 0xd0 0x93 in encoding "UTF8" has no equivalent in encoding "LATIN5"
SELECT count(*) n FROM "Unicode data" WHERE i = 'ukr+';
 n 
---
 0
(1 row)

-- 1256, ISO_8859_6
SELECT * FROM "Unicode data" WHERE i = 'ara';
 i | t 
---+---
(0 rows)

SELECT * FROM "Unicode data" WHERE t LIKE '%ضَظَغ%';
ERROR:  character with byte sequence 0xd8 0xb6 in encoding "UTF8" has no equivalent in encoding "LATIN5"
INSERT INTO "Unicode data" (i, t) VALUES ('ara+', 'أبجد هوَّز حُطّي كلَمُن سَعْفَص قُرِشَت ثَخَدٌ ضَظَغ_');
ERROR:  character with byte sequence 0xd8 0xa3 in encoding "UTF8" has no equivalent in encoding "LATIN5"
SELECT * FROM "Unicode data" WHERE i = 'ara+';
 i | t 
---+---
(0 rows)

DELETE FROM "Unicode data" WHERE t = 'أبجد هوَّز حُطّي كلَمُن سَعْفَص قُرِشَت ثَخَدٌ ضَظَغ_';
ERROR:  character with byte sequence 0xd8 0xa3 in encoding "UTF8" has no equivalent in encoding "LATIN5"
SELECT count(*) n FROM "Unicode data" WHERE i = 'ara+';
 n 
---
 0
(1 row)

-- 1253, ISO_8859_7
SELECT * FROM "Unicode data" WHERE i = 'gre';
 i | t 
---+---
(0 rows)

SELECT * FROM "Unicode data" WHERE t LIKE 'Τάχισ%';
ERROR:  character with byte sequence 0xce 0xa4 in encoding "UTF8" has no equivalent in encoding "LATIN5"
INSERT INTO "Unicode data" (i, t) VALUES ('gre+', 'Τάχιστη αλώπηξ βαφής ψημένη γη, δρασκελίζει υπέρ νωθρού κυνός_');
ERROR:  character with byte sequence 0xce 0xa4 in encoding "UTF8" has no equivalent in encoding "LATIN5"
SELECT * FROM "Unicode data" WHERE i = 'gre+';
 i | t 
---+---
(0 rows)

DELETE FROM "Unicode data" WHERE t = 'Τάχιστη αλώπηξ βαφής ψημένη γη, δρασκελίζει υπέρ νωθρού κυνός_';
ERROR:  character with byte sequence 0xce 0xa4 in encoding "UTF8" has no equivalent in encoding "LATIN5"
-- 1255, ISO_8859_8
SELECT * FROM "Unicode data" WHERE i = 'heb';
 i | t 
---+---
(0 rows)

SELECT * FROM "Unicode data" WHERE t LIKE '%כי ח%';
ERROR:  character with byte sequence 0xd7 0x9b in encoding "UTF8" has no equivalent in encoding "LATIN5"
INSERT INTO "Unicode data" (i, t) VALUES ('heb+', 'עטלף אבק נס דרך מזגן שהתפוצץ כי חם_');
ERROR:  character with byte sequence 0xd7 0xa2 in encoding "UTF8" has no equivalent in encoding "LATIN5"
SELECT * FROM "Unicode data" WHERE i = 'heb+';
 i | t 
---+---
(0 rows)

DELETE FROM "Unicode data" WHERE t = 'עטלף אבק נס דרך מזגן שהתפוצץ כי חם_';
ERROR:  character with byte sequence 0xd7 0xa2 in encoding "UTF8" has no equivalent in encoding "LATIN5"
SELECT count(*) n FROM "Unicode data" WHERE i = 'heb+';
 n 
---
 0
(1 row)

-- 1252, LATIN1
SELECT * FROM "Unicode data" WHERE i = 'eus';
 i | t 
---+---
(0 rows)

SELECT * FROM "Unicode data" WHERE i = 'fra';
 i | t 
---+---
(0 rows)

SELECT * FROM "Unicode data" WHERE i = 'spa';
 i | t 
---+---
(0 rows)

SELECT * FROM "Unicode data" WHERE t LIKE 'Permi%';
    i    |              t               
---------+------------------------------
 utf_eus | Permin gox dabiltzu yoskiÃ±.
(1 row)

SELECT * FROM "Unicode data" WHERE t LIKE 'Dès N%';
 i | t 
---+---
(0 rows)

SELECT * FROM "Unicode data" WHERE t LIKE 'Quier%';
    i    |                            t                             
---------+----------------------------------------------------------
 utf_spa | Quiere la boca exhausta vid, kiwi, piÃ±a y fugaz jamÃ³n.
(1 row)

INSERT INTO "Unicode data" (i, t) VALUES ('eus+', 'Permin gox dabiltzu yoskiñ._');
SELECT * FROM "Unicode data" WHERE i = 'eus+';
  i   |              t               
------+------------------------------
 eus+ | Permin gox dabiltzu yoskiñ._
(1 row)

DELETE FROM "Unicode data" WHERE t = 'Permin gox dabiltzu yoskiñ._';
SELECT count(*) n FROM "Unicode data" WHERE i = 'eus+';
 n 
---
 0
(1 row)

INSERT INTO "Unicode data" (i, t) VALUES ('fra+', 'Dès Noël où un zéphyr haï me vêt de glaçons würmiens je dîne d’exquis rôtis de bœuf au kir à l’aÿ d’âge mûr & cætera !_');
ERROR:  character with byte sequence 0xe2 0x80 0x99 in encoding "UTF8" has no equivalent in encoding "LATIN5"
SELECT * FROM "Unicode data" WHERE i = 'fra+';
 i | t 
---+---
(0 rows)

DELETE FROM "Unicode data" WHERE t = 'Dès Noël où un zéphyr haï me vêt de glaçons würmiens je dîne d’exquis rôtis de bœuf au kir à l’aÿ d’âge mûr & cætera !_';
ERROR:  character with byte sequence 0xe2 0x80 0x99 in encoding "UTF8" has no equivalent in encoding "LATIN5"
SELECT count(*) n FROM "Unicode data" WHERE i = 'fra+';
 n 
---
 0
(1 row)

INSERT INTO "Unicode data" (i, t) VALUES ('spa+', 'Quiere la boca exhausta vid, kiwi, piña y fugaz jamón._');
SELECT * FROM "Unicode data" WHERE i = 'spa+';
  i   |                            t                            
------+---------------------------------------------------------
 spa+ | Quiere la boca exhausta vid, kiwi, piña y fugaz jamón._
(1 row)

DELETE FROM "Unicode data" WHERE t = 'Quiere la boca exhausta vid, kiwi, piña y fugaz jamón._';
SELECT count(*) n FROM "Unicode data" WHERE i = 'spa+';
 n 
---
 0
(1 row)

-- 1250, LATIN2
SELECT * FROM "Unicode data" WHERE i = 'cze';
 i | t 
---+---
(0 rows)

SELECT * FROM "Unicode data" WHERE i = 'pol';
 i | t 
---+---
(0 rows)

SELECT * FROM "Unicode data" WHERE i = 'srp';
 i | t 
---+---
(0 rows)

SELECT * FROM "Unicode data" WHERE t LIKE 'Zvláš%';
ERROR:  character with byte sequence 0xc5 0xa1 in encoding "UTF8" has no equivalent in encoding "LATIN5"
SELECT * FROM "Unicode data" WHERE t LIKE 'Pchną%';
ERROR:  character with byte sequence 0xc4 0x85 in encoding "UTF8" has no equivalent in encoding "LATIN5"
SELECT * FROM "Unicode data" WHERE t LIKE 'Ljuba%';
    i    |                                          t                                           
---------+--------------------------------------------------------------------------------------
 utf_srp | Ljubavi, Olga, hajde poÄ\u0091i u FudÅ¾i i Ä\u008Dut Ä\u0087eÅ¡ njeÅ¾nu muziku srca.
(1 row)

INSERT INTO "Unicode data" (i, t) VALUES ('cze+', 'Zvlášť zákeřný učeň s ďolíčky běží podél zóny úlů._');
ERROR:  character with byte sequence 0xc5 0xa1 in encoding "UTF8" has no equivalent in encoding "LATIN5"
SELECT * FROM "Unicode data" WHERE i = 'cze+';
 i | t 
---+---
(0 rows)

DELETE FROM "Unicode data" WHERE t = 'Zvlášť zákeřný učeň s ďolíčky běží podél zóny úlů._';
ERROR:  character with byte sequence 0xc5 0xa1 in encoding "UTF8" has no equivalent in encoding "LATIN5"
SELECT count(*) n FROM "Unicode data" WHERE i = 'cze+';
 n 
---
 0
(1 row)

INSERT INTO "Unicode data" (i, t) VALUES ('pol+', 'Pchnąć w tę łódź jeża lub ośm skrzyń fig._');
ERROR:  character with byte sequence 0xc4 0x85 in encoding "UTF8" has no equivalent in encoding "LATIN5"
SELECT * FROM "Unicode data" WHERE i = 'pol+';
 i | t 
---+---
(0 rows)

DELETE FROM "Unicode data" WHERE t = 'Pchnąć w tę łódź jeża lub ośm skrzyń fig._';
ERROR:  character with byte sequence 0xc4 0x85 in encoding "UTF8" has no equivalent in encoding "LATIN5"
SELECT count(*) n FROM "Unicode data" WHERE i = 'pol+';
 n 
---
 0
(1 row)

INSERT INTO "Unicode data" (i, t) VALUES ('srp+', 'Ljubavi, Olga, hajde pođi u Fudži i čut ćeš nježnu muziku srca._');
ERROR:  character with byte sequence 0xc4 0x91 in encoding "UTF8" has no equivalent in encoding "LATIN5"
SELECT * FROM "Unicode data" WHERE i = 'srp+';
 i | t 
---+---
(0 rows)

DELETE FROM "Unicode data" WHERE t = 'Ljubavi, Olga, hajde pođi u Fudži i čut ćeš nježnu muziku srca._';
ERROR:  character with byte sequence 0xc4 0x91 in encoding "UTF8" has no equivalent in encoding "LATIN5"
SELECT count(*) n FROM "Unicode data" WHERE i = 'srp+';
 n 
---
 0
(1 row)

-- 1257, LATIN7
SELECT * FROM "Unicode data" WHERE i = 'lav';
 i | t 
---+---
(0 rows)

SELECT * FROM "Unicode data" WHERE t LIKE 'Ķieģeļu%';
ERROR:  character with byte sequence 0xc4 0xb6 in encoding "UTF8" has no equivalent in encoding "LATIN5"
INSERT INTO "Unicode data" (i, t) VALUES ('lav+', 'Ķieģeļu cepējs Edgars Buls fraku un hūti žāvē uz čīkstošām eņģēm._');
ERROR:  character with byte sequence 0xc4 0xb6 in encoding "UTF8" has no equivalent in encoding "LATIN5"
SELECT * FROM "Unicode data" WHERE i = 'lav+';
 i | t 
---+---
(0 rows)

DELETE FROM "Unicode data" WHERE t = 'Ķieģeļu cepējs Edgars Buls fraku un hūti žāvē uz čīkstošām eņģēm._';
ERROR:  character with byte sequence 0xc4 0xb6 in encoding "UTF8" has no equivalent in encoding "LATIN5"
SELECT count(*) n FROM "Unicode data" WHERE i = 'lav+';
 n 
---
 0
(1 row)

-- EUC_KR
SELECT * FROM "Unicode data" WHERE i = 'kor';
 i | t 
---+---
(0 rows)

SELECT * FROM "Unicode data" WHERE t LIKE '키스의 고%';
ERROR:  character with byte sequence 0xed 0x82 0xa4 in encoding "UTF8" has no equivalent in encoding "LATIN5"
INSERT INTO "Unicode data" (i, t) VALUES ('kor+', '키스의 고유조건은 입술끼리 만나야 하고 특별한 기술은 필요치 않다._');
ERROR:  character with byte sequence 0xed 0x82 0xa4 in encoding "UTF8" has no equivalent in encoding "LATIN5"
SELECT * FROM "Unicode data" WHERE i = 'kor+';
 i | t 
---+---
(0 rows)

DELETE FROM "Unicode data" WHERE t = '키스의 고유조건은 입술끼리 만나야 하고 특별한 기술은 필요치 않다._';
ERROR:  character with byte sequence 0xed 0x82 0xa4 in encoding "UTF8" has no equivalent in encoding "LATIN5"
SELECT count(*) n FROM "Unicode data" WHERE i = 'kor+';
 n 
---
 0
(1 row)

-- 1254, LATIN5
SELECT * FROM "Unicode data" WHERE i = 'aze';
 i | t 
---+---
(0 rows)

SELECT * FROM "Unicode data" WHERE t LIKE 'Zəfər%';
ERROR:  character with byte sequence 0xc9 0x99 in encoding "UTF8" has no equivalent in encoding "LATIN5"
INSERT INTO "Unicode data" (i, t) VALUES ('aze+', 'Zəfər, jaketini də, papağını da götür, bu axşam hava çox soyuq olacaq._');
ERROR:  character with byte sequence 0xc9 0x99 in encoding "UTF8" has no equivalent in encoding "LATIN5"
SELECT * FROM "Unicode data" WHERE i = 'aze+';
 i | t 
---+---
(0 rows)

DELETE FROM "Unicode data" WHERE t = 'Zəfər, jaketini də, papağını da götür, bu axşam hava çox soyuq olacaq._';
ERROR:  character with byte sequence 0xc9 0x99 in encoding "UTF8" has no equivalent in encoding "LATIN5"
SELECT count(*) n FROM "Unicode data" WHERE i = 'aze+';
 n 
---
 0
(1 row)

-- etc
INSERT INTO "Unicode data" (i, t) VALUES ('arm+', 'Բել դղյակի ձախ ժամն օֆ ազգությանը ցպահանջ չճշտած վնաս էր եւ փառք։_');
ERROR:  character with byte sequence 0xd4 0xb2 in encoding "UTF8" has no equivalent in encoding "LATIN5"
SELECT * FROM "Unicode data" WHERE i = 'arm+';
 i | t 
---+---
(0 rows)

DELETE FROM "Unicode data" WHERE t = 'Բել դղյակի ձախ ժամն օֆ ազգությանը ցպահանջ չճշտած վնաս էր եւ փառք։_';
ERROR:  character with byte sequence 0xd4 0xb2 in encoding "UTF8" has no equivalent in encoding "LATIN5"
SELECT count(*) n FROM "Unicode data" WHERE i = 'arm+';
 n 
---
 0
(1 row)

INSERT INTO "Unicode data" (i, t) VALUES ('gle+', 'Chuaigh bé mhórshách le dlúthspád fíorfhinn trí hata mo dhea-phorcáin bhig._');
SELECT * FROM "Unicode data" WHERE i = 'gle+';
  i   |                                      t                                       
------+------------------------------------------------------------------------------
 gle+ | Chuaigh bé mhórshách le dlúthspád fíorfhinn trí hata mo dhea-phorcáin bhig._
(1 row)

DELETE FROM "Unicode data" WHERE t = 'Chuaigh bé mhórshách le dlúthspád fíorfhinn trí hata mo dhea-phorcáin bhig._';
SELECT count(*) n FROM "Unicode data" WHERE i = 'gle+';
 n 
---
 0
(1 row)

INSERT INTO "Unicode data" (i, t) VALUES ('epo+', 'Laŭ Ludoviko Zamenhof bongustas freŝa ĉeĥa manĝaĵo kun spicoj._');
ERROR:  character with byte sequence 0xc5 0xad in encoding "UTF8" has no equivalent in encoding "LATIN5"
SELECT * FROM "Unicode data" WHERE i = 'epo+';
 i | t 
---+---
(0 rows)

DELETE FROM "Unicode data" WHERE t = 'Laŭ Ludoviko Zamenhof bongustas freŝa ĉeĥa manĝaĵo kun spicoj._';
ERROR:  character with byte sequence 0xc5 0xad in encoding "UTF8" has no equivalent in encoding "LATIN5"
SELECT count(*) n FROM "Unicode data" WHERE i = 'epo+';
 n 
---
 0
(1 row)

DROP FOREIGN TABLE "Unicode data";
DROP SERVER redis_testing_server CASCADE;
NOTICE:  drop cascades to user mapping for public on server redis_testing_server
DROP EXTENSION redis_fdw;
\connect contrib_regression;
DROP DATABASE "contrib_regression_ISO_8859_9";
-- LATIN1
CREATE DATABASE "contrib_regression_LATIN1" ENCODING LATIN1 LC_CTYPE='POSIX' LC_COLLATE='POSIX' template template0;
\connect "contrib_regression_LATIN1"
CREATE EXTENSION redis_fdw;
CREATE SERVER redis_testing_server FOREIGN DATA WRAPPER redis_fdw;
CREATE FOREIGN TABLE "Unicode data"(i text, t text)
SERVER redis_testing_server
OPTIONS (database '15');
CREATE USER MAPPING FOR public SERVER redis_testing_server; 
-- EUC_JP
SELECT * FROM "Unicode data" WHERE i = 'jap';
 i | t 
---+---
(0 rows)

SELECT * FROM "Unicode data" WHERE t LIKE 'いろはにほ%';
ERROR:  character with byte sequence 0xe3 0x81 0x84 in encoding "UTF8" has no equivalent in encoding "LATIN1"
INSERT INTO "Unicode data" (i, t) VALUES ('jap+', 'いろはにほへと ちりぬるを わかよたれそ つねならむ うゐのおくやま けふこえて あさきゆめみし ゑひもせす._');
ERROR:  character with byte sequence 0xe3 0x81 0x84 in encoding "UTF8" has no equivalent in encoding "LATIN1"
DELETE FROM "Unicode data" WHERE t = 'いろはにほへと ちりぬるを わかよたれそ つねならむ うゐのおくやま けふこえて あさきゆめみし ゑひもせす._';
ERROR:  character with byte sequence 0xe3 0x81 0x84 in encoding "UTF8" has no equivalent in encoding "LATIN1"
SELECT count(*) n FROM "Unicode data" WHERE i = 'jap+';
 n 
---
 0
(1 row)

-- 1251, ISO_8859_5
SELECT * FROM "Unicode data" WHERE i = 'bel';
 i | t 
---+---
(0 rows)

SELECT * FROM "Unicode data" WHERE i = 'bul';
 i | t 
---+---
(0 rows)

SELECT * FROM "Unicode data" WHERE i = 'rus';
 i | t 
---+---
(0 rows)

SELECT * FROM "Unicode data" WHERE i = 'ukr';
 i | t 
---+---
(0 rows)

SELECT * FROM "Unicode data" WHERE t LIKE 'У руд%';
ERROR:  character with byte sequence 0xd0 0xa3 in encoding "UTF8" has no equivalent in encoding "LATIN1"
SELECT * FROM "Unicode data" WHERE t LIKE 'Ах, ч%';
ERROR:  character with byte sequence 0xd0 0x90 in encoding "UTF8" has no equivalent in encoding "LATIN1"
SELECT * FROM "Unicode data" WHERE t LIKE 'Широк%';
ERROR:  character with byte sequence 0xd0 0xa8 in encoding "UTF8" has no equivalent in encoding "LATIN1"
SELECT * FROM "Unicode data" WHERE t LIKE 'Гей, %';
ERROR:  character with byte sequence 0xd0 0x93 in encoding "UTF8" has no equivalent in encoding "LATIN1"
INSERT INTO "Unicode data" (i, t) VALUES ('bel+', 'У рудога вераб’я ў сховішчы пад фатэлем ляжаць нейкія гаючыя зёлкі._');
ERROR:  character with byte sequence 0xd0 0xa3 in encoding "UTF8" has no equivalent in encoding "LATIN1"
SELECT * FROM "Unicode data" WHERE i = 'bel+';
 i | t 
---+---
(0 rows)

DELETE FROM "Unicode data" WHERE t = 'У рудога вераб’я ў сховішчы пад фатэлем ляжаць нейкія гаючыя зёлкі._';
ERROR:  character with byte sequence 0xd0 0xa3 in encoding "UTF8" has no equivalent in encoding "LATIN1"
SELECT count(*) n FROM "Unicode data" WHERE i = 'bel+';
 n 
---
 0
(1 row)

INSERT INTO "Unicode data" (i, t) VALUES ('bul+', 'Ах, чудна българска земьо, полюшвай цъфтящи жита._');
ERROR:  character with byte sequence 0xd0 0x90 in encoding "UTF8" has no equivalent in encoding "LATIN1"
SELECT * FROM "Unicode data" WHERE i = 'bul+';
 i | t 
---+---
(0 rows)

DELETE FROM "Unicode data" WHERE t = 'Ах, чудна българска земьо, полюшвай цъфтящи жита._';
ERROR:  character with byte sequence 0xd0 0x90 in encoding "UTF8" has no equivalent in encoding "LATIN1"
SELECT count(*) n FROM "Unicode data" WHERE i = 'bul+';
 n 
---
 0
(1 row)

INSERT INTO "Unicode data" (i, t) VALUES ('rus+', 'Широкая электрификация южных губерний даст мощный толчок подъёму сельского хозяйства._');
ERROR:  character with byte sequence 0xd0 0xa8 in encoding "UTF8" has no equivalent in encoding "LATIN1"
SELECT * FROM "Unicode data" WHERE i = 'rus+';
 i | t 
---+---
(0 rows)

DELETE FROM "Unicode data" WHERE t = 'Широкая электрификация южных губерний даст мощный толчок подъёму сельского хозяйства._';
ERROR:  character with byte sequence 0xd0 0xa8 in encoding "UTF8" has no equivalent in encoding "LATIN1"
SELECT count(*) n FROM "Unicode data" WHERE i = 'rus+';
 n 
---
 0
(1 row)

INSERT INTO "Unicode data" (i, t) VALUES ('ukr+', 'Гей, хлопці, не вспію — на ґанку ваша файна їжа знищується бурундучком._');
ERROR:  character with byte sequence 0xd0 0x93 in encoding "UTF8" has no equivalent in encoding "LATIN1"
SELECT * FROM "Unicode data" WHERE i = 'ukr+';
 i | t 
---+---
(0 rows)

DELETE FROM "Unicode data" WHERE t = 'Гей, хлопці, не вспію — на ґанку ваша файна їжа знищується бурундучком._';
ERROR:  character with byte sequence 0xd0 0x93 in encoding "UTF8" has no equivalent in encoding "LATIN1"
SELECT count(*) n FROM "Unicode data" WHERE i = 'ukr+';
 n 
---
 0
(1 row)

-- 1256, ISO_8859_6
SELECT * FROM "Unicode data" WHERE i = 'ara';
 i | t 
---+---
(0 rows)

SELECT * FROM "Unicode data" WHERE t LIKE '%ضَظَغ%';
ERROR:  character with byte sequence 0xd8 0xb6 in encoding "UTF8" has no equivalent in encoding "LATIN1"
INSERT INTO "Unicode data" (i, t) VALUES ('ara+', 'أبجد هوَّز حُطّي كلَمُن سَعْفَص قُرِشَت ثَخَدٌ ضَظَغ_');
ERROR:  character with byte sequence 0xd8 0xa3 in encoding "UTF8" has no equivalent in encoding "LATIN1"
SELECT * FROM "Unicode data" WHERE i = 'ara+';
 i | t 
---+---
(0 rows)

DELETE FROM "Unicode data" WHERE t = 'أبجد هوَّز حُطّي كلَمُن سَعْفَص قُرِشَت ثَخَدٌ ضَظَغ_';
ERROR:  character with byte sequence 0xd8 0xa3 in encoding "UTF8" has no equivalent in encoding "LATIN1"
SELECT count(*) n FROM "Unicode data" WHERE i = 'ara+';
 n 
---
 0
(1 row)

-- 1253, ISO_8859_7
SELECT * FROM "Unicode data" WHERE i = 'gre';
 i | t 
---+---
(0 rows)

SELECT * FROM "Unicode data" WHERE t LIKE 'Τάχισ%';
ERROR:  character with byte sequence 0xce 0xa4 in encoding "UTF8" has no equivalent in encoding "LATIN1"
INSERT INTO "Unicode data" (i, t) VALUES ('gre+', 'Τάχιστη αλώπηξ βαφής ψημένη γη, δρασκελίζει υπέρ νωθρού κυνός_');
ERROR:  character with byte sequence 0xce 0xa4 in encoding "UTF8" has no equivalent in encoding "LATIN1"
SELECT * FROM "Unicode data" WHERE i = 'gre+';
 i | t 
---+---
(0 rows)

DELETE FROM "Unicode data" WHERE t = 'Τάχιστη αλώπηξ βαφής ψημένη γη, δρασκελίζει υπέρ νωθρού κυνός_';
ERROR:  character with byte sequence 0xce 0xa4 in encoding "UTF8" has no equivalent in encoding "LATIN1"
-- 1255, ISO_8859_8
SELECT * FROM "Unicode data" WHERE i = 'heb';
 i | t 
---+---
(0 rows)

SELECT * FROM "Unicode data" WHERE t LIKE '%כי ח%';
ERROR:  character with byte sequence 0xd7 0x9b in encoding "UTF8" has no equivalent in encoding "LATIN1"
INSERT INTO "Unicode data" (i, t) VALUES ('heb+', 'עטלף אבק נס דרך מזגן שהתפוצץ כי חם_');
ERROR:  character with byte sequence 0xd7 0xa2 in encoding "UTF8" has no equivalent in encoding "LATIN1"
SELECT * FROM "Unicode data" WHERE i = 'heb+';
 i | t 
---+---
(0 rows)

DELETE FROM "Unicode data" WHERE t = 'עטלף אבק נס דרך מזגן שהתפוצץ כי חם_';
ERROR:  character with byte sequence 0xd7 0xa2 in encoding "UTF8" has no equivalent in encoding "LATIN1"
SELECT count(*) n FROM "Unicode data" WHERE i = 'heb+';
 n 
---
 0
(1 row)

-- 1252, LATIN1
SELECT * FROM "Unicode data" WHERE i = 'eus';
 i | t 
---+---
(0 rows)

SELECT * FROM "Unicode data" WHERE i = 'fra';
 i | t 
---+---
(0 rows)

SELECT * FROM "Unicode data" WHERE i = 'spa';
 i | t 
---+---
(0 rows)

SELECT * FROM "Unicode data" WHERE t LIKE 'Permi%';
    i    |              t               
---------+------------------------------
 utf_eus | Permin gox dabiltzu yoskiÃ±.
(1 row)

SELECT * FROM "Unicode data" WHERE t LIKE 'Dès N%';
 i | t 
---+---
(0 rows)

SELECT * FROM "Unicode data" WHERE t LIKE 'Quier%';
    i    |                            t                             
---------+----------------------------------------------------------
 utf_spa | Quiere la boca exhausta vid, kiwi, piÃ±a y fugaz jamÃ³n.
(1 row)

INSERT INTO "Unicode data" (i, t) VALUES ('eus+', 'Permin gox dabiltzu yoskiñ._');
SELECT * FROM "Unicode data" WHERE i = 'eus+';
  i   |              t               
------+------------------------------
 eus+ | Permin gox dabiltzu yoskiñ._
(1 row)

DELETE FROM "Unicode data" WHERE t = 'Permin gox dabiltzu yoskiñ._';
SELECT count(*) n FROM "Unicode data" WHERE i = 'eus+';
 n 
---
 0
(1 row)

INSERT INTO "Unicode data" (i, t) VALUES ('fra+', 'Dès Noël où un zéphyr haï me vêt de glaçons würmiens je dîne d’exquis rôtis de bœuf au kir à l’aÿ d’âge mûr & cætera !_');
ERROR:  character with byte sequence 0xe2 0x80 0x99 in encoding "UTF8" has no equivalent in encoding "LATIN1"
SELECT * FROM "Unicode data" WHERE i = 'fra+';
 i | t 
---+---
(0 rows)

DELETE FROM "Unicode data" WHERE t = 'Dès Noël où un zéphyr haï me vêt de glaçons würmiens je dîne d’exquis rôtis de bœuf au kir à l’aÿ d’âge mûr & cætera !_';
ERROR:  character with byte sequence 0xe2 0x80 0x99 in encoding "UTF8" has no equivalent in encoding "LATIN1"
SELECT count(*) n FROM "Unicode data" WHERE i = 'fra+';
 n 
---
 0
(1 row)

INSERT INTO "Unicode data" (i, t) VALUES ('spa+', 'Quiere la boca exhausta vid, kiwi, piña y fugaz jamón._');
SELECT * FROM "Unicode data" WHERE i = 'spa+';
  i   |                            t                            
------+---------------------------------------------------------
 spa+ | Quiere la boca exhausta vid, kiwi, piña y fugaz jamón._
(1 row)

DELETE FROM "Unicode data" WHERE t = 'Quiere la boca exhausta vid, kiwi, piña y fugaz jamón._';
SELECT count(*) n FROM "Unicode data" WHERE i = 'spa+';
 n 
---
 0
(1 row)

-- 1250, LATIN2
SELECT * FROM "Unicode data" WHERE i = 'cze';
 i | t 
---+---
(0 rows)

SELECT * FROM "Unicode data" WHERE i = 'pol';
 i | t 
---+---
(0 rows)

SELECT * FROM "Unicode data" WHERE i = 'srp';
 i | t 
---+---
(0 rows)

SELECT * FROM "Unicode data" WHERE t LIKE 'Zvláš%';
ERROR:  character with byte sequence 0xc5 0xa1 in encoding "UTF8" has no equivalent in encoding "LATIN1"
SELECT * FROM "Unicode data" WHERE t LIKE 'Pchną%';
ERROR:  character with byte sequence 0xc4 0x85 in encoding "UTF8" has no equivalent in encoding "LATIN1"
SELECT * FROM "Unicode data" WHERE t LIKE 'Ljuba%';
    i    |                                          t                                           
---------+--------------------------------------------------------------------------------------
 utf_srp | Ljubavi, Olga, hajde poÄ\u0091i u FudÅ¾i i Ä\u008Dut Ä\u0087eÅ¡ njeÅ¾nu muziku srca.
(1 row)

INSERT INTO "Unicode data" (i, t) VALUES ('cze+', 'Zvlášť zákeřný učeň s ďolíčky běží podél zóny úlů._');
ERROR:  character with byte sequence 0xc5 0xa1 in encoding "UTF8" has no equivalent in encoding "LATIN1"
SELECT * FROM "Unicode data" WHERE i = 'cze+';
 i | t 
---+---
(0 rows)

DELETE FROM "Unicode data" WHERE t = 'Zvlášť zákeřný učeň s ďolíčky běží podél zóny úlů._';
ERROR:  character with byte sequence 0xc5 0xa1 in encoding "UTF8" has no equivalent in encoding "LATIN1"
SELECT count(*) n FROM "Unicode data" WHERE i = 'cze+';
 n 
---
 0
(1 row)

INSERT INTO "Unicode data" (i, t) VALUES ('pol+', 'Pchnąć w tę łódź jeża lub ośm skrzyń fig._');
ERROR:  character with byte sequence 0xc4 0x85 in encoding "UTF8" has no equivalent in encoding "LATIN1"
SELECT * FROM "Unicode data" WHERE i = 'pol+';
 i | t 
---+---
(0 rows)

DELETE FROM "Unicode data" WHERE t = 'Pchnąć w tę łódź jeża lub ośm skrzyń fig._';
ERROR:  character with byte sequence 0xc4 0x85 in encoding "UTF8" has no equivalent in encoding "LATIN1"
SELECT count(*) n FROM "Unicode data" WHERE i = 'pol+';
 n 
---
 0
(1 row)

INSERT INTO "Unicode data" (i, t) VALUES ('srp+', 'Ljubavi, Olga, hajde pođi u Fudži i čut ćeš nježnu muziku srca._');
ERROR:  character with byte sequence 0xc4 0x91 in encoding "UTF8" has no equivalent in encoding "LATIN1"
SELECT * FROM "Unicode data" WHERE i = 'srp+';
 i | t 
---+---
(0 rows)

DELETE FROM "Unicode data" WHERE t = 'Ljubavi, Olga, hajde pođi u Fudži i čut ćeš nježnu muziku srca._';
ERROR:  character with byte sequence 0xc4 0x91 in encoding "UTF8" has no equivalent in encoding "LATIN1"
SELECT count(*) n FROM "Unicode data" WHERE i = 'srp+';
 n 
---
 0
(1 row)

-- 1257, LATIN7
SELECT * FROM "Unicode data" WHERE i = 'lav';
 i | t 
---+---
(0 rows)

SELECT * FROM "Unicode data" WHERE t LIKE 'Ķieģeļu%';
ERROR:  character with byte sequence 0xc4 0xb6 in encoding "UTF8" has no equivalent in encoding "LATIN1"
INSERT INTO "Unicode data" (i, t) VALUES ('lav+', 'Ķieģeļu cepējs Edgars Buls fraku un hūti žāvē uz čīkstošām eņģēm._');
ERROR:  character with byte sequence 0xc4 0xb6 in encoding "UTF8" has no equivalent in encoding "LATIN1"
SELECT * FROM "Unicode data" WHERE i = 'lav+';
 i | t 
---+---
(0 rows)

DELETE FROM "Unicode data" WHERE t = 'Ķieģeļu cepējs Edgars Buls fraku un hūti žāvē uz čīkstošām eņģēm._';
ERROR:  character with byte sequence 0xc4 0xb6 in encoding "UTF8" has no equivalent in encoding "LATIN1"
SELECT count(*) n FROM "Unicode data" WHERE i = 'lav+';
 n 
---
 0
(1 row)

-- EUC_KR
SELECT * FROM "Unicode data" WHERE i = 'kor';
 i | t 
---+---
(0 rows)

SELECT * FROM "Unicode data" WHERE t LIKE '키스의 고%';
ERROR:  character with byte sequence 0xed 0x82 0xa4 in encoding "UTF8" has no equivalent in encoding "LATIN1"
INSERT INTO "Unicode data" (i, t) VALUES ('kor+', '키스의 고유조건은 입술끼리 만나야 하고 특별한 기술은 필요치 않다._');
ERROR:  character with byte sequence 0xed 0x82 0xa4 in encoding "UTF8" has no equivalent in encoding "LATIN1"
SELECT * FROM "Unicode data" WHERE i = 'kor+';
 i | t 
---+---
(0 rows)

DELETE FROM "Unicode data" WHERE t = '키스의 고유조건은 입술끼리 만나야 하고 특별한 기술은 필요치 않다._';
ERROR:  character with byte sequence 0xed 0x82 0xa4 in encoding "UTF8" has no equivalent in encoding "LATIN1"
SELECT count(*) n FROM "Unicode data" WHERE i = 'kor+';
 n 
---
 0
(1 row)

-- 1254, LATIN5
SELECT * FROM "Unicode data" WHERE i = 'aze';
 i | t 
---+---
(0 rows)

SELECT * FROM "Unicode data" WHERE t LIKE 'Zəfər%';
ERROR:  character with byte sequence 0xc9 0x99 in encoding "UTF8" has no equivalent in encoding "LATIN1"
INSERT INTO "Unicode data" (i, t) VALUES ('aze+', 'Zəfər, jaketini də, papağını da götür, bu axşam hava çox soyuq olacaq._');
ERROR:  character with byte sequence 0xc9 0x99 in encoding "UTF8" has no equivalent in encoding "LATIN1"
SELECT * FROM "Unicode data" WHERE i = 'aze+';
 i | t 
---+---
(0 rows)

DELETE FROM "Unicode data" WHERE t = 'Zəfər, jaketini də, papağını da götür, bu axşam hava çox soyuq olacaq._';
ERROR:  character with byte sequence 0xc9 0x99 in encoding "UTF8" has no equivalent in encoding "LATIN1"
SELECT count(*) n FROM "Unicode data" WHERE i = 'aze+';
 n 
---
 0
(1 row)

-- etc
INSERT INTO "Unicode data" (i, t) VALUES ('arm+', 'Բել դղյակի ձախ ժամն օֆ ազգությանը ցպահանջ չճշտած վնաս էր եւ փառք։_');
ERROR:  character with byte sequence 0xd4 0xb2 in encoding "UTF8" has no equivalent in encoding "LATIN1"
SELECT * FROM "Unicode data" WHERE i = 'arm+';
 i | t 
---+---
(0 rows)

DELETE FROM "Unicode data" WHERE t = 'Բել դղյակի ձախ ժամն օֆ ազգությանը ցպահանջ չճշտած վնաս էր եւ փառք։_';
ERROR:  character with byte sequence 0xd4 0xb2 in encoding "UTF8" has no equivalent in encoding "LATIN1"
SELECT count(*) n FROM "Unicode data" WHERE i = 'arm+';
 n 
---
 0
(1 row)

INSERT INTO "Unicode data" (i, t) VALUES ('gle+', 'Chuaigh bé mhórshách le dlúthspád fíorfhinn trí hata mo dhea-phorcáin bhig._');
SELECT * FROM "Unicode data" WHERE i = 'gle+';
  i   |                                      t                                       
------+------------------------------------------------------------------------------
 gle+ | Chuaigh bé mhórshách le dlúthspád fíorfhinn trí hata mo dhea-phorcáin bhig._
(1 row)

DELETE FROM "Unicode data" WHERE t = 'Chuaigh bé mhórshách le dlúthspád fíorfhinn trí hata mo dhea-phorcáin bhig._';
SELECT count(*) n FROM "Unicode data" WHERE i = 'gle+';
 n 
---
 0
(1 row)

INSERT INTO "Unicode data" (i, t) VALUES ('epo+', 'Laŭ Ludoviko Zamenhof bongustas freŝa ĉeĥa manĝaĵo kun spicoj._');
ERROR:  character with byte sequence 0xc5 0xad in encoding "UTF8" has no equivalent in encoding "LATIN1"
SELECT * FROM "Unicode data" WHERE i = 'epo+';
 i | t 
---+---
(0 rows)

DELETE FROM "Unicode data" WHERE t = 'Laŭ Ludoviko Zamenhof bongustas freŝa ĉeĥa manĝaĵo kun spicoj._';
ERROR:  character with byte sequence 0xc5 0xad in encoding "UTF8" has no equivalent in encoding "LATIN1"
SELECT count(*) n FROM "Unicode data" WHERE i = 'epo+';
 n 
---
 0
(1 row)

DROP FOREIGN TABLE "Unicode data";
DROP SERVER redis_testing_server CASCADE;
NOTICE:  drop cascades to user mapping for public on server redis_testing_server
DROP EXTENSION redis_fdw;
\connect contrib_regression;
DROP DATABASE "contrib_regression_LATIN1";
-- LATIN2
CREATE DATABASE "contrib_regression_LATIN2" ENCODING LATIN2 LC_CTYPE='POSIX' LC_COLLATE='POSIX' template template0;
\connect "contrib_regression_LATIN2"
CREATE EXTENSION redis_fdw;
CREATE SERVER redis_testing_server FOREIGN DATA WRAPPER redis_fdw;
CREATE FOREIGN TABLE "Unicode data"(i text, t text)
SERVER redis_testing_server
OPTIONS (database '15');
CREATE USER MAPPING FOR public SERVER redis_testing_server; 
-- EUC_JP
SELECT * FROM "Unicode data" WHERE i = 'jap';
 i | t 
---+---
(0 rows)

SELECT * FROM "Unicode data" WHERE t LIKE 'いろはにほ%';
ERROR:  character with byte sequence 0xe3 0x81 0x84 in encoding "UTF8" has no equivalent in encoding "LATIN2"
INSERT INTO "Unicode data" (i, t) VALUES ('jap+', 'いろはにほへと ちりぬるを わかよたれそ つねならむ うゐのおくやま けふこえて あさきゆめみし ゑひもせす._');
ERROR:  character with byte sequence 0xe3 0x81 0x84 in encoding "UTF8" has no equivalent in encoding "LATIN2"
DELETE FROM "Unicode data" WHERE t = 'いろはにほへと ちりぬるを わかよたれそ つねならむ うゐのおくやま けふこえて あさきゆめみし ゑひもせす._';
ERROR:  character with byte sequence 0xe3 0x81 0x84 in encoding "UTF8" has no equivalent in encoding "LATIN2"
SELECT count(*) n FROM "Unicode data" WHERE i = 'jap+';
 n 
---
 0
(1 row)

-- 1251, ISO_8859_5
SELECT * FROM "Unicode data" WHERE i = 'bel';
 i | t 
---+---
(0 rows)

SELECT * FROM "Unicode data" WHERE i = 'bul';
 i | t 
---+---
(0 rows)

SELECT * FROM "Unicode data" WHERE i = 'rus';
 i | t 
---+---
(0 rows)

SELECT * FROM "Unicode data" WHERE i = 'ukr';
 i | t 
---+---
(0 rows)

SELECT * FROM "Unicode data" WHERE t LIKE 'У руд%';
ERROR:  character with byte sequence 0xd0 0xa3 in encoding "UTF8" has no equivalent in encoding "LATIN2"
SELECT * FROM "Unicode data" WHERE t LIKE 'Ах, ч%';
ERROR:  character with byte sequence 0xd0 0x90 in encoding "UTF8" has no equivalent in encoding "LATIN2"
SELECT * FROM "Unicode data" WHERE t LIKE 'Широк%';
ERROR:  character with byte sequence 0xd0 0xa8 in encoding "UTF8" has no equivalent in encoding "LATIN2"
SELECT * FROM "Unicode data" WHERE t LIKE 'Гей, %';
ERROR:  character with byte sequence 0xd0 0x93 in encoding "UTF8" has no equivalent in encoding "LATIN2"
INSERT INTO "Unicode data" (i, t) VALUES ('bel+', 'У рудога вераб’я ў сховішчы пад фатэлем ляжаць нейкія гаючыя зёлкі._');
ERROR:  character with byte sequence 0xd0 0xa3 in encoding "UTF8" has no equivalent in encoding "LATIN2"
SELECT * FROM "Unicode data" WHERE i = 'bel+';
 i | t 
---+---
(0 rows)

DELETE FROM "Unicode data" WHERE t = 'У рудога вераб’я ў сховішчы пад фатэлем ляжаць нейкія гаючыя зёлкі._';
ERROR:  character with byte sequence 0xd0 0xa3 in encoding "UTF8" has no equivalent in encoding "LATIN2"
SELECT count(*) n FROM "Unicode data" WHERE i = 'bel+';
 n 
---
 0
(1 row)

INSERT INTO "Unicode data" (i, t) VALUES ('bul+', 'Ах, чудна българска земьо, полюшвай цъфтящи жита._');
ERROR:  character with byte sequence 0xd0 0x90 in encoding "UTF8" has no equivalent in encoding "LATIN2"
SELECT * FROM "Unicode data" WHERE i = 'bul+';
 i | t 
---+---
(0 rows)

DELETE FROM "Unicode data" WHERE t = 'Ах, чудна българска земьо, полюшвай цъфтящи жита._';
ERROR:  character with byte sequence 0xd0 0x90 in encoding "UTF8" has no equivalent in encoding "LATIN2"
SELECT count(*) n FROM "Unicode data" WHERE i = 'bul+';
 n 
---
 0
(1 row)

INSERT INTO "Unicode data" (i, t) VALUES ('rus+', 'Широкая электрификация южных губерний даст мощный толчок подъёму сельского хозяйства._');
ERROR:  character with byte sequence 0xd0 0xa8 in encoding "UTF8" has no equivalent in encoding "LATIN2"
SELECT * FROM "Unicode data" WHERE i = 'rus+';
 i | t 
---+---
(0 rows)

DELETE FROM "Unicode data" WHERE t = 'Широкая электрификация южных губерний даст мощный толчок подъёму сельского хозяйства._';
ERROR:  character with byte sequence 0xd0 0xa8 in encoding "UTF8" has no equivalent in encoding "LATIN2"
SELECT count(*) n FROM "Unicode data" WHERE i = 'rus+';
 n 
---
 0
(1 row)

INSERT INTO "Unicode data" (i, t) VALUES ('ukr+', 'Гей, хлопці, не вспію — на ґанку ваша файна їжа знищується бурундучком._');
ERROR:  character with byte sequence 0xd0 0x93 in encoding "UTF8" has no equivalent in encoding "LATIN2"
SELECT * FROM "Unicode data" WHERE i = 'ukr+';
 i | t 
---+---
(0 rows)

DELETE FROM "Unicode data" WHERE t = 'Гей, хлопці, не вспію — на ґанку ваша файна їжа знищується бурундучком._';
ERROR:  character with byte sequence 0xd0 0x93 in encoding "UTF8" has no equivalent in encoding "LATIN2"
SELECT count(*) n FROM "Unicode data" WHERE i = 'ukr+';
 n 
---
 0
(1 row)

-- 1256, ISO_8859_6
SELECT * FROM "Unicode data" WHERE i = 'ara';
 i | t 
---+---
(0 rows)

SELECT * FROM "Unicode data" WHERE t LIKE '%ضَظَغ%';
ERROR:  character with byte sequence 0xd8 0xb6 in encoding "UTF8" has no equivalent in encoding "LATIN2"
INSERT INTO "Unicode data" (i, t) VALUES ('ara+', 'أبجد هوَّز حُطّي كلَمُن سَعْفَص قُرِشَت ثَخَدٌ ضَظَغ_');
ERROR:  character with byte sequence 0xd8 0xa3 in encoding "UTF8" has no equivalent in encoding "LATIN2"
SELECT * FROM "Unicode data" WHERE i = 'ara+';
 i | t 
---+---
(0 rows)

DELETE FROM "Unicode data" WHERE t = 'أبجد هوَّز حُطّي كلَمُن سَعْفَص قُرِشَت ثَخَدٌ ضَظَغ_';
ERROR:  character with byte sequence 0xd8 0xa3 in encoding "UTF8" has no equivalent in encoding "LATIN2"
SELECT count(*) n FROM "Unicode data" WHERE i = 'ara+';
 n 
---
 0
(1 row)

-- 1253, ISO_8859_7
SELECT * FROM "Unicode data" WHERE i = 'gre';
 i | t 
---+---
(0 rows)

SELECT * FROM "Unicode data" WHERE t LIKE 'Τάχισ%';
ERROR:  character with byte sequence 0xce 0xa4 in encoding "UTF8" has no equivalent in encoding "LATIN2"
INSERT INTO "Unicode data" (i, t) VALUES ('gre+', 'Τάχιστη αλώπηξ βαφής ψημένη γη, δρασκελίζει υπέρ νωθρού κυνός_');
ERROR:  character with byte sequence 0xce 0xa4 in encoding "UTF8" has no equivalent in encoding "LATIN2"
SELECT * FROM "Unicode data" WHERE i = 'gre+';
 i | t 
---+---
(0 rows)

DELETE FROM "Unicode data" WHERE t = 'Τάχιστη αλώπηξ βαφής ψημένη γη, δρασκελίζει υπέρ νωθρού κυνός_';
ERROR:  character with byte sequence 0xce 0xa4 in encoding "UTF8" has no equivalent in encoding "LATIN2"
-- 1255, ISO_8859_8
SELECT * FROM "Unicode data" WHERE i = 'heb';
 i | t 
---+---
(0 rows)

SELECT * FROM "Unicode data" WHERE t LIKE '%כי ח%';
ERROR:  character with byte sequence 0xd7 0x9b in encoding "UTF8" has no equivalent in encoding "LATIN2"
INSERT INTO "Unicode data" (i, t) VALUES ('heb+', 'עטלף אבק נס דרך מזגן שהתפוצץ כי חם_');
ERROR:  character with byte sequence 0xd7 0xa2 in encoding "UTF8" has no equivalent in encoding "LATIN2"
SELECT * FROM "Unicode data" WHERE i = 'heb+';
 i | t 
---+---
(0 rows)

DELETE FROM "Unicode data" WHERE t = 'עטלף אבק נס דרך מזגן שהתפוצץ כי חם_';
ERROR:  character with byte sequence 0xd7 0xa2 in encoding "UTF8" has no equivalent in encoding "LATIN2"
SELECT count(*) n FROM "Unicode data" WHERE i = 'heb+';
 n 
---
 0
(1 row)

-- 1252, LATIN1
SELECT * FROM "Unicode data" WHERE i = 'eus';
 i | t 
---+---
(0 rows)

SELECT * FROM "Unicode data" WHERE i = 'fra';
 i | t 
---+---
(0 rows)

SELECT * FROM "Unicode data" WHERE i = 'spa';
 i | t 
---+---
(0 rows)

SELECT * FROM "Unicode data" WHERE t LIKE 'Permi%';
    i    |              t               
---------+------------------------------
 utf_eus | Permin gox dabiltzu yoskiĂą.
(1 row)

SELECT * FROM "Unicode data" WHERE t LIKE 'Dès N%';
ERROR:  character with byte sequence 0xc3 0xa8 in encoding "UTF8" has no equivalent in encoding "LATIN2"
SELECT * FROM "Unicode data" WHERE t LIKE 'Quier%';
    i    |                            t                             
---------+----------------------------------------------------------
 utf_spa | Quiere la boca exhausta vid, kiwi, piĂąa y fugaz jamĂłn.
(1 row)

INSERT INTO "Unicode data" (i, t) VALUES ('eus+', 'Permin gox dabiltzu yoskiñ._');
ERROR:  character with byte sequence 0xc3 0xb1 in encoding "UTF8" has no equivalent in encoding "LATIN2"
SELECT * FROM "Unicode data" WHERE i = 'eus+';
 i | t 
---+---
(0 rows)

DELETE FROM "Unicode data" WHERE t = 'Permin gox dabiltzu yoskiñ._';
ERROR:  character with byte sequence 0xc3 0xb1 in encoding "UTF8" has no equivalent in encoding "LATIN2"
SELECT count(*) n FROM "Unicode data" WHERE i = 'eus+';
 n 
---
 0
(1 row)

INSERT INTO "Unicode data" (i, t) VALUES ('fra+', 'Dès Noël où un zéphyr haï me vêt de glaçons würmiens je dîne d’exquis rôtis de bœuf au kir à l’aÿ d’âge mûr & cætera !_');
ERROR:  character with byte sequence 0xc3 0xa8 in encoding "UTF8" has no equivalent in encoding "LATIN2"
SELECT * FROM "Unicode data" WHERE i = 'fra+';
 i | t 
---+---
(0 rows)

DELETE FROM "Unicode data" WHERE t = 'Dès Noël où un zéphyr haï me vêt de glaçons würmiens je dîne d’exquis rôtis de bœuf au kir à l’aÿ d’âge mûr & cætera !_';
ERROR:  character with byte sequence 0xc3 0xa8 in encoding "UTF8" has no equivalent in encoding "LATIN2"
SELECT count(*) n FROM "Unicode data" WHERE i = 'fra+';
 n 
---
 0
(1 row)

INSERT INTO "Unicode data" (i, t) VALUES ('spa+', 'Quiere la boca exhausta vid, kiwi, piña y fugaz jamón._');
ERROR:  character with byte sequence 0xc3 0xb1 in encoding "UTF8" has no equivalent in encoding "LATIN2"
SELECT * FROM "Unicode data" WHERE i = 'spa+';
 i | t 
---+---
(0 rows)

DELETE FROM "Unicode data" WHERE t = 'Quiere la boca exhausta vid, kiwi, piña y fugaz jamón._';
ERROR:  character with byte sequence 0xc3 0xb1 in encoding "UTF8" has no equivalent in encoding "LATIN2"
SELECT count(*) n FROM "Unicode data" WHERE i = 'spa+';
 n 
---
 0
(1 row)

-- 1250, LATIN2
SELECT * FROM "Unicode data" WHERE i = 'cze';
 i | t 
---+---
(0 rows)

SELECT * FROM "Unicode data" WHERE i = 'pol';
 i | t 
---+---
(0 rows)

SELECT * FROM "Unicode data" WHERE i = 'srp';
 i | t 
---+---
(0 rows)

SELECT * FROM "Unicode data" WHERE t LIKE 'Zvláš%';
 i | t 
---+---
(0 rows)

SELECT * FROM "Unicode data" WHERE t LIKE 'Pchną%';
 i | t 
---+---
(0 rows)

SELECT * FROM "Unicode data" WHERE t LIKE 'Ljuba%';
    i    |                                          t                                           
---------+--------------------------------------------------------------------------------------
 utf_srp | Ljubavi, Olga, hajde poÄ\u0091i u FudĹži i Ä\u008Dut Ä\u0087eĹĄ njeĹžnu muziku srca.
(1 row)

INSERT INTO "Unicode data" (i, t) VALUES ('cze+', 'Zvlášť zákeřný učeň s ďolíčky běží podél zóny úlů._');
SELECT * FROM "Unicode data" WHERE i = 'cze+';
  i   |                          t                          
------+-----------------------------------------------------
 cze+ | Zvlášť zákeřný učeň s ďolíčky běží podél zóny úlů._
(1 row)

DELETE FROM "Unicode data" WHERE t = 'Zvlášť zákeřný učeň s ďolíčky běží podél zóny úlů._';
SELECT count(*) n FROM "Unicode data" WHERE i = 'cze+';
 n 
---
 0
(1 row)

INSERT INTO "Unicode data" (i, t) VALUES ('pol+', 'Pchnąć w tę łódź jeża lub ośm skrzyń fig._');
SELECT * FROM "Unicode data" WHERE i = 'pol+';
  i   |                     t                      
------+--------------------------------------------
 pol+ | Pchnąć w tę łódź jeża lub ośm skrzyń fig._
(1 row)

DELETE FROM "Unicode data" WHERE t = 'Pchnąć w tę łódź jeża lub ośm skrzyń fig._';
SELECT count(*) n FROM "Unicode data" WHERE i = 'pol+';
 n 
---
 0
(1 row)

INSERT INTO "Unicode data" (i, t) VALUES ('srp+', 'Ljubavi, Olga, hajde pođi u Fudži i čut ćeš nježnu muziku srca._');
SELECT * FROM "Unicode data" WHERE i = 'srp+';
  i   |                                t                                 
------+------------------------------------------------------------------
 srp+ | Ljubavi, Olga, hajde pođi u Fudži i čut ćeš nježnu muziku srca._
(1 row)

DELETE FROM "Unicode data" WHERE t = 'Ljubavi, Olga, hajde pođi u Fudži i čut ćeš nježnu muziku srca._';
SELECT count(*) n FROM "Unicode data" WHERE i = 'srp+';
 n 
---
 0
(1 row)

-- 1257, LATIN7
SELECT * FROM "Unicode data" WHERE i = 'lav';
 i | t 
---+---
(0 rows)

SELECT * FROM "Unicode data" WHERE t LIKE 'Ķieģeļu%';
ERROR:  character with byte sequence 0xc4 0xb6 in encoding "UTF8" has no equivalent in encoding "LATIN2"
INSERT INTO "Unicode data" (i, t) VALUES ('lav+', 'Ķieģeļu cepējs Edgars Buls fraku un hūti žāvē uz čīkstošām eņģēm._');
ERROR:  character with byte sequence 0xc4 0xb6 in encoding "UTF8" has no equivalent in encoding "LATIN2"
SELECT * FROM "Unicode data" WHERE i = 'lav+';
 i | t 
---+---
(0 rows)

DELETE FROM "Unicode data" WHERE t = 'Ķieģeļu cepējs Edgars Buls fraku un hūti žāvē uz čīkstošām eņģēm._';
ERROR:  character with byte sequence 0xc4 0xb6 in encoding "UTF8" has no equivalent in encoding "LATIN2"
SELECT count(*) n FROM "Unicode data" WHERE i = 'lav+';
 n 
---
 0
(1 row)

-- EUC_KR
SELECT * FROM "Unicode data" WHERE i = 'kor';
 i | t 
---+---
(0 rows)

SELECT * FROM "Unicode data" WHERE t LIKE '키스의 고%';
ERROR:  character with byte sequence 0xed 0x82 0xa4 in encoding "UTF8" has no equivalent in encoding "LATIN2"
INSERT INTO "Unicode data" (i, t) VALUES ('kor+', '키스의 고유조건은 입술끼리 만나야 하고 특별한 기술은 필요치 않다._');
ERROR:  character with byte sequence 0xed 0x82 0xa4 in encoding "UTF8" has no equivalent in encoding "LATIN2"
SELECT * FROM "Unicode data" WHERE i = 'kor+';
 i | t 
---+---
(0 rows)

DELETE FROM "Unicode data" WHERE t = '키스의 고유조건은 입술끼리 만나야 하고 특별한 기술은 필요치 않다._';
ERROR:  character with byte sequence 0xed 0x82 0xa4 in encoding "UTF8" has no equivalent in encoding "LATIN2"
SELECT count(*) n FROM "Unicode data" WHERE i = 'kor+';
 n 
---
 0
(1 row)

-- 1254, LATIN5
SELECT * FROM "Unicode data" WHERE i = 'aze';
 i | t 
---+---
(0 rows)

SELECT * FROM "Unicode data" WHERE t LIKE 'Zəfər%';
ERROR:  character with byte sequence 0xc9 0x99 in encoding "UTF8" has no equivalent in encoding "LATIN2"
INSERT INTO "Unicode data" (i, t) VALUES ('aze+', 'Zəfər, jaketini də, papağını da götür, bu axşam hava çox soyuq olacaq._');
ERROR:  character with byte sequence 0xc9 0x99 in encoding "UTF8" has no equivalent in encoding "LATIN2"
SELECT * FROM "Unicode data" WHERE i = 'aze+';
 i | t 
---+---
(0 rows)

DELETE FROM "Unicode data" WHERE t = 'Zəfər, jaketini də, papağını da götür, bu axşam hava çox soyuq olacaq._';
ERROR:  character with byte sequence 0xc9 0x99 in encoding "UTF8" has no equivalent in encoding "LATIN2"
SELECT count(*) n FROM "Unicode data" WHERE i = 'aze+';
 n 
---
 0
(1 row)

-- etc
INSERT INTO "Unicode data" (i, t) VALUES ('arm+', 'Բել դղյակի ձախ ժամն օֆ ազգությանը ցպահանջ չճշտած վնաս էր եւ փառք։_');
ERROR:  character with byte sequence 0xd4 0xb2 in encoding "UTF8" has no equivalent in encoding "LATIN2"
SELECT * FROM "Unicode data" WHERE i = 'arm+';
 i | t 
---+---
(0 rows)

DELETE FROM "Unicode data" WHERE t = 'Բել դղյակի ձախ ժամն օֆ ազգությանը ցպահանջ չճշտած վնաս էր եւ փառք։_';
ERROR:  character with byte sequence 0xd4 0xb2 in encoding "UTF8" has no equivalent in encoding "LATIN2"
SELECT count(*) n FROM "Unicode data" WHERE i = 'arm+';
 n 
---
 0
(1 row)

INSERT INTO "Unicode data" (i, t) VALUES ('gle+', 'Chuaigh bé mhórshách le dlúthspád fíorfhinn trí hata mo dhea-phorcáin bhig._');
SELECT * FROM "Unicode data" WHERE i = 'gle+';
  i   |                                      t                                       
------+------------------------------------------------------------------------------
 gle+ | Chuaigh bé mhórshách le dlúthspád fíorfhinn trí hata mo dhea-phorcáin bhig._
(1 row)

DELETE FROM "Unicode data" WHERE t = 'Chuaigh bé mhórshách le dlúthspád fíorfhinn trí hata mo dhea-phorcáin bhig._';
SELECT count(*) n FROM "Unicode data" WHERE i = 'gle+';
 n 
---
 0
(1 row)

INSERT INTO "Unicode data" (i, t) VALUES ('epo+', 'Laŭ Ludoviko Zamenhof bongustas freŝa ĉeĥa manĝaĵo kun spicoj._');
ERROR:  character with byte sequence 0xc5 0xad in encoding "UTF8" has no equivalent in encoding "LATIN2"
SELECT * FROM "Unicode data" WHERE i = 'epo+';
 i | t 
---+---
(0 rows)

DELETE FROM "Unicode data" WHERE t = 'Laŭ Ludoviko Zamenhof bongustas freŝa ĉeĥa manĝaĵo kun spicoj._';
ERROR:  character with byte sequence 0xc5 0xad in encoding "UTF8" has no equivalent in encoding "LATIN2"
SELECT count(*) n FROM "Unicode data" WHERE i = 'epo+';
 n 
---
 0
(1 row)

DROP FOREIGN TABLE "Unicode data";
DROP SERVER redis_testing_server CASCADE;
NOTICE:  drop cascades to user mapping for public on server redis_testing_server
DROP EXTENSION redis_fdw;
\connect contrib_regression;
DROP DATABASE "contrib_regression_LATIN2";
-- LATIN3
CREATE DATABASE "contrib_regression_LATIN3" ENCODING LATIN3 LC_CTYPE='POSIX' LC_COLLATE='POSIX' template template0;
\connect "contrib_regression_LATIN3"
CREATE EXTENSION redis_fdw;
CREATE SERVER redis_testing_server FOREIGN DATA WRAPPER redis_fdw;
CREATE FOREIGN TABLE "Unicode data"(i text, t text)
SERVER redis_testing_server
OPTIONS (database '15');
CREATE USER MAPPING FOR public SERVER redis_testing_server; 
-- EUC_JP
SELECT * FROM "Unicode data" WHERE i = 'jap';
 i | t 
---+---
(0 rows)

SELECT * FROM "Unicode data" WHERE t LIKE 'いろはにほ%';
ERROR:  character with byte sequence 0xe3 0x81 0x84 in encoding "UTF8" has no equivalent in encoding "LATIN3"
INSERT INTO "Unicode data" (i, t) VALUES ('jap+', 'いろはにほへと ちりぬるを わかよたれそ つねならむ うゐのおくやま けふこえて あさきゆめみし ゑひもせす._');
ERROR:  character with byte sequence 0xe3 0x81 0x84 in encoding "UTF8" has no equivalent in encoding "LATIN3"
DELETE FROM "Unicode data" WHERE t = 'いろはにほへと ちりぬるを わかよたれそ つねならむ うゐのおくやま けふこえて あさきゆめみし ゑひもせす._';
ERROR:  character with byte sequence 0xe3 0x81 0x84 in encoding "UTF8" has no equivalent in encoding "LATIN3"
SELECT count(*) n FROM "Unicode data" WHERE i = 'jap+';
 n 
---
 0
(1 row)

-- 1251, ISO_8859_5
SELECT * FROM "Unicode data" WHERE i = 'bel';
 i | t 
---+---
(0 rows)

SELECT * FROM "Unicode data" WHERE i = 'bul';
 i | t 
---+---
(0 rows)

SELECT * FROM "Unicode data" WHERE i = 'rus';
 i | t 
---+---
(0 rows)

SELECT * FROM "Unicode data" WHERE i = 'ukr';
 i | t 
---+---
(0 rows)

SELECT * FROM "Unicode data" WHERE t LIKE 'У руд%';
ERROR:  character with byte sequence 0xd0 0xa3 in encoding "UTF8" has no equivalent in encoding "LATIN3"
SELECT * FROM "Unicode data" WHERE t LIKE 'Ах, ч%';
ERROR:  character with byte sequence 0xd0 0x90 in encoding "UTF8" has no equivalent in encoding "LATIN3"
SELECT * FROM "Unicode data" WHERE t LIKE 'Широк%';
ERROR:  character with byte sequence 0xd0 0xa8 in encoding "UTF8" has no equivalent in encoding "LATIN3"
SELECT * FROM "Unicode data" WHERE t LIKE 'Гей, %';
ERROR:  character with byte sequence 0xd0 0x93 in encoding "UTF8" has no equivalent in encoding "LATIN3"
INSERT INTO "Unicode data" (i, t) VALUES ('bel+', 'У рудога вераб’я ў сховішчы пад фатэлем ляжаць нейкія гаючыя зёлкі._');
ERROR:  character with byte sequence 0xd0 0xa3 in encoding "UTF8" has no equivalent in encoding "LATIN3"
SELECT * FROM "Unicode data" WHERE i = 'bel+';
 i | t 
---+---
(0 rows)

DELETE FROM "Unicode data" WHERE t = 'У рудога вераб’я ў сховішчы пад фатэлем ляжаць нейкія гаючыя зёлкі._';
ERROR:  character with byte sequence 0xd0 0xa3 in encoding "UTF8" has no equivalent in encoding "LATIN3"
SELECT count(*) n FROM "Unicode data" WHERE i = 'bel+';
 n 
---
 0
(1 row)

INSERT INTO "Unicode data" (i, t) VALUES ('bul+', 'Ах, чудна българска земьо, полюшвай цъфтящи жита._');
ERROR:  character with byte sequence 0xd0 0x90 in encoding "UTF8" has no equivalent in encoding "LATIN3"
SELECT * FROM "Unicode data" WHERE i = 'bul+';
 i | t 
---+---
(0 rows)

DELETE FROM "Unicode data" WHERE t = 'Ах, чудна българска земьо, полюшвай цъфтящи жита._';
ERROR:  character with byte sequence 0xd0 0x90 in encoding "UTF8" has no equivalent in encoding "LATIN3"
SELECT count(*) n FROM "Unicode data" WHERE i = 'bul+';
 n 
---
 0
(1 row)

INSERT INTO "Unicode data" (i, t) VALUES ('rus+', 'Широкая электрификация южных губерний даст мощный толчок подъёму сельского хозяйства._');
ERROR:  character with byte sequence 0xd0 0xa8 in encoding "UTF8" has no equivalent in encoding "LATIN3"
SELECT * FROM "Unicode data" WHERE i = 'rus+';
 i | t 
---+---
(0 rows)

DELETE FROM "Unicode data" WHERE t = 'Широкая электрификация южных губерний даст мощный толчок подъёму сельского хозяйства._';
ERROR:  character with byte sequence 0xd0 0xa8 in encoding "UTF8" has no equivalent in encoding "LATIN3"
SELECT count(*) n FROM "Unicode data" WHERE i = 'rus+';
 n 
---
 0
(1 row)

INSERT INTO "Unicode data" (i, t) VALUES ('ukr+', 'Гей, хлопці, не вспію — на ґанку ваша файна їжа знищується бурундучком._');
ERROR:  character with byte sequence 0xd0 0x93 in encoding "UTF8" has no equivalent in encoding "LATIN3"
SELECT * FROM "Unicode data" WHERE i = 'ukr+';
 i | t 
---+---
(0 rows)

DELETE FROM "Unicode data" WHERE t = 'Гей, хлопці, не вспію — на ґанку ваша файна їжа знищується бурундучком._';
ERROR:  character with byte sequence 0xd0 0x93 in encoding "UTF8" has no equivalent in encoding "LATIN3"
SELECT count(*) n FROM "Unicode data" WHERE i = 'ukr+';
 n 
---
 0
(1 row)

-- 1256, ISO_8859_6
SELECT * FROM "Unicode data" WHERE i = 'ara';
 i | t 
---+---
(0 rows)

SELECT * FROM "Unicode data" WHERE t LIKE '%ضَظَغ%';
ERROR:  character with byte sequence 0xd8 0xb6 in encoding "UTF8" has no equivalent in encoding "LATIN3"
INSERT INTO "Unicode data" (i, t) VALUES ('ara+', 'أبجد هوَّز حُطّي كلَمُن سَعْفَص قُرِشَت ثَخَدٌ ضَظَغ_');
ERROR:  character with byte sequence 0xd8 0xa3 in encoding "UTF8" has no equivalent in encoding "LATIN3"
SELECT * FROM "Unicode data" WHERE i = 'ara+';
 i | t 
---+---
(0 rows)

DELETE FROM "Unicode data" WHERE t = 'أبجد هوَّز حُطّي كلَمُن سَعْفَص قُرِشَت ثَخَدٌ ضَظَغ_';
ERROR:  character with byte sequence 0xd8 0xa3 in encoding "UTF8" has no equivalent in encoding "LATIN3"
SELECT count(*) n FROM "Unicode data" WHERE i = 'ara+';
 n 
---
 0
(1 row)

-- 1253, ISO_8859_7
SELECT * FROM "Unicode data" WHERE i = 'gre';
 i | t 
---+---
(0 rows)

SELECT * FROM "Unicode data" WHERE t LIKE 'Τάχισ%';
ERROR:  character with byte sequence 0xce 0xa4 in encoding "UTF8" has no equivalent in encoding "LATIN3"
INSERT INTO "Unicode data" (i, t) VALUES ('gre+', 'Τάχιστη αλώπηξ βαφής ψημένη γη, δρασκελίζει υπέρ νωθρού κυνός_');
ERROR:  character with byte sequence 0xce 0xa4 in encoding "UTF8" has no equivalent in encoding "LATIN3"
SELECT * FROM "Unicode data" WHERE i = 'gre+';
 i | t 
---+---
(0 rows)

DELETE FROM "Unicode data" WHERE t = 'Τάχιστη αλώπηξ βαφής ψημένη γη, δρασκελίζει υπέρ νωθρού κυνός_';
ERROR:  character with byte sequence 0xce 0xa4 in encoding "UTF8" has no equivalent in encoding "LATIN3"
-- 1255, ISO_8859_8
SELECT * FROM "Unicode data" WHERE i = 'heb';
 i | t 
---+---
(0 rows)

SELECT * FROM "Unicode data" WHERE t LIKE '%כי ח%';
ERROR:  character with byte sequence 0xd7 0x9b in encoding "UTF8" has no equivalent in encoding "LATIN3"
INSERT INTO "Unicode data" (i, t) VALUES ('heb+', 'עטלף אבק נס דרך מזגן שהתפוצץ כי חם_');
ERROR:  character with byte sequence 0xd7 0xa2 in encoding "UTF8" has no equivalent in encoding "LATIN3"
SELECT * FROM "Unicode data" WHERE i = 'heb+';
 i | t 
---+---
(0 rows)

DELETE FROM "Unicode data" WHERE t = 'עטלף אבק נס דרך מזגן שהתפוצץ כי חם_';
ERROR:  character with byte sequence 0xd7 0xa2 in encoding "UTF8" has no equivalent in encoding "LATIN3"
SELECT count(*) n FROM "Unicode data" WHERE i = 'heb+';
 n 
---
 0
(1 row)

-- 1252, LATIN1
SELECT * FROM "Unicode data" WHERE i = 'eus';
 i | t 
---+---
(0 rows)

SELECT * FROM "Unicode data" WHERE i = 'fra';
 i | t 
---+---
(0 rows)

SELECT * FROM "Unicode data" WHERE i = 'spa';
 i | t 
---+---
(0 rows)

SELECT * FROM "Unicode data" WHERE t LIKE 'Permi%';
ERROR:  character with byte sequence 0xc3 in encoding "LATIN3" has no equivalent in encoding "UTF8"
SELECT * FROM "Unicode data" WHERE t LIKE 'Dès N%';
 i | t 
---+---
(0 rows)

SELECT * FROM "Unicode data" WHERE t LIKE 'Quier%';
ERROR:  character with byte sequence 0xc3 in encoding "LATIN3" has no equivalent in encoding "UTF8"
INSERT INTO "Unicode data" (i, t) VALUES ('eus+', 'Permin gox dabiltzu yoskiñ._');
SELECT * FROM "Unicode data" WHERE i = 'eus+';
  i   |              t               
------+------------------------------
 eus+ | Permin gox dabiltzu yoskiñ._
(1 row)

DELETE FROM "Unicode data" WHERE t = 'Permin gox dabiltzu yoskiñ._';
SELECT count(*) n FROM "Unicode data" WHERE i = 'eus+';
 n 
---
 0
(1 row)

INSERT INTO "Unicode data" (i, t) VALUES ('fra+', 'Dès Noël où un zéphyr haï me vêt de glaçons würmiens je dîne d’exquis rôtis de bœuf au kir à l’aÿ d’âge mûr & cætera !_');
ERROR:  character with byte sequence 0xe2 0x80 0x99 in encoding "UTF8" has no equivalent in encoding "LATIN3"
SELECT * FROM "Unicode data" WHERE i = 'fra+';
 i | t 
---+---
(0 rows)

DELETE FROM "Unicode data" WHERE t = 'Dès Noël où un zéphyr haï me vêt de glaçons würmiens je dîne d’exquis rôtis de bœuf au kir à l’aÿ d’âge mûr & cætera !_';
ERROR:  character with byte sequence 0xe2 0x80 0x99 in encoding "UTF8" has no equivalent in encoding "LATIN3"
SELECT count(*) n FROM "Unicode data" WHERE i = 'fra+';
 n 
---
 0
(1 row)

INSERT INTO "Unicode data" (i, t) VALUES ('spa+', 'Quiere la boca exhausta vid, kiwi, piña y fugaz jamón._');
SELECT * FROM "Unicode data" WHERE i = 'spa+';
  i   |                            t                            
------+---------------------------------------------------------
 spa+ | Quiere la boca exhausta vid, kiwi, piña y fugaz jamón._
(1 row)

DELETE FROM "Unicode data" WHERE t = 'Quiere la boca exhausta vid, kiwi, piña y fugaz jamón._';
SELECT count(*) n FROM "Unicode data" WHERE i = 'spa+';
 n 
---
 0
(1 row)

-- 1250, LATIN2
SELECT * FROM "Unicode data" WHERE i = 'cze';
 i | t 
---+---
(0 rows)

SELECT * FROM "Unicode data" WHERE i = 'pol';
 i | t 
---+---
(0 rows)

SELECT * FROM "Unicode data" WHERE i = 'srp';
 i | t 
---+---
(0 rows)

SELECT * FROM "Unicode data" WHERE t LIKE 'Zvláš%';
ERROR:  character with byte sequence 0xc5 0xa1 in encoding "UTF8" has no equivalent in encoding "LATIN3"
SELECT * FROM "Unicode data" WHERE t LIKE 'Pchną%';
ERROR:  character with byte sequence 0xc4 0x85 in encoding "UTF8" has no equivalent in encoding "LATIN3"
SELECT * FROM "Unicode data" WHERE t LIKE 'Ljuba%';
ERROR:  character with byte sequence 0xbe in encoding "LATIN3" has no equivalent in encoding "UTF8"
INSERT INTO "Unicode data" (i, t) VALUES ('cze+', 'Zvlášť zákeřný učeň s ďolíčky běží podél zóny úlů._');
ERROR:  character with byte sequence 0xc5 0xa1 in encoding "UTF8" has no equivalent in encoding "LATIN3"
SELECT * FROM "Unicode data" WHERE i = 'cze+';
 i | t 
---+---
(0 rows)

DELETE FROM "Unicode data" WHERE t = 'Zvlášť zákeřný učeň s ďolíčky běží podél zóny úlů._';
ERROR:  character with byte sequence 0xc5 0xa1 in encoding "UTF8" has no equivalent in encoding "LATIN3"
SELECT count(*) n FROM "Unicode data" WHERE i = 'cze+';
 n 
---
 0
(1 row)

INSERT INTO "Unicode data" (i, t) VALUES ('pol+', 'Pchnąć w tę łódź jeża lub ośm skrzyń fig._');
ERROR:  character with byte sequence 0xc4 0x85 in encoding "UTF8" has no equivalent in encoding "LATIN3"
SELECT * FROM "Unicode data" WHERE i = 'pol+';
 i | t 
---+---
(0 rows)

DELETE FROM "Unicode data" WHERE t = 'Pchnąć w tę łódź jeża lub ośm skrzyń fig._';
ERROR:  character with byte sequence 0xc4 0x85 in encoding "UTF8" has no equivalent in encoding "LATIN3"
SELECT count(*) n FROM "Unicode data" WHERE i = 'pol+';
 n 
---
 0
(1 row)

INSERT INTO "Unicode data" (i, t) VALUES ('srp+', 'Ljubavi, Olga, hajde pođi u Fudži i čut ćeš nježnu muziku srca._');
ERROR:  character with byte sequence 0xc4 0x91 in encoding "UTF8" has no equivalent in encoding "LATIN3"
SELECT * FROM "Unicode data" WHERE i = 'srp+';
 i | t 
---+---
(0 rows)

DELETE FROM "Unicode data" WHERE t = 'Ljubavi, Olga, hajde pođi u Fudži i čut ćeš nježnu muziku srca._';
ERROR:  character with byte sequence 0xc4 0x91 in encoding "UTF8" has no equivalent in encoding "LATIN3"
SELECT count(*) n FROM "Unicode data" WHERE i = 'srp+';
 n 
---
 0
(1 row)

-- 1257, LATIN7
SELECT * FROM "Unicode data" WHERE i = 'lav';
 i | t 
---+---
(0 rows)

SELECT * FROM "Unicode data" WHERE t LIKE 'Ķieģeļu%';
ERROR:  character with byte sequence 0xc4 0xb6 in encoding "UTF8" has no equivalent in encoding "LATIN3"
INSERT INTO "Unicode data" (i, t) VALUES ('lav+', 'Ķieģeļu cepējs Edgars Buls fraku un hūti žāvē uz čīkstošām eņģēm._');
ERROR:  character with byte sequence 0xc4 0xb6 in encoding "UTF8" has no equivalent in encoding "LATIN3"
SELECT * FROM "Unicode data" WHERE i = 'lav+';
 i | t 
---+---
(0 rows)

DELETE FROM "Unicode data" WHERE t = 'Ķieģeļu cepējs Edgars Buls fraku un hūti žāvē uz čīkstošām eņģēm._';
ERROR:  character with byte sequence 0xc4 0xb6 in encoding "UTF8" has no equivalent in encoding "LATIN3"
SELECT count(*) n FROM "Unicode data" WHERE i = 'lav+';
 n 
---
 0
(1 row)

-- EUC_KR
SELECT * FROM "Unicode data" WHERE i = 'kor';
 i | t 
---+---
(0 rows)

SELECT * FROM "Unicode data" WHERE t LIKE '키스의 고%';
ERROR:  character with byte sequence 0xed 0x82 0xa4 in encoding "UTF8" has no equivalent in encoding "LATIN3"
INSERT INTO "Unicode data" (i, t) VALUES ('kor+', '키스의 고유조건은 입술끼리 만나야 하고 특별한 기술은 필요치 않다._');
ERROR:  character with byte sequence 0xed 0x82 0xa4 in encoding "UTF8" has no equivalent in encoding "LATIN3"
SELECT * FROM "Unicode data" WHERE i = 'kor+';
 i | t 
---+---
(0 rows)

DELETE FROM "Unicode data" WHERE t = '키스의 고유조건은 입술끼리 만나야 하고 특별한 기술은 필요치 않다._';
ERROR:  character with byte sequence 0xed 0x82 0xa4 in encoding "UTF8" has no equivalent in encoding "LATIN3"
SELECT count(*) n FROM "Unicode data" WHERE i = 'kor+';
 n 
---
 0
(1 row)

-- 1254, LATIN5
SELECT * FROM "Unicode data" WHERE i = 'aze';
 i | t 
---+---
(0 rows)

SELECT * FROM "Unicode data" WHERE t LIKE 'Zəfər%';
ERROR:  character with byte sequence 0xc9 0x99 in encoding "UTF8" has no equivalent in encoding "LATIN3"
INSERT INTO "Unicode data" (i, t) VALUES ('aze+', 'Zəfər, jaketini də, papağını da götür, bu axşam hava çox soyuq olacaq._');
ERROR:  character with byte sequence 0xc9 0x99 in encoding "UTF8" has no equivalent in encoding "LATIN3"
SELECT * FROM "Unicode data" WHERE i = 'aze+';
 i | t 
---+---
(0 rows)

DELETE FROM "Unicode data" WHERE t = 'Zəfər, jaketini də, papağını da götür, bu axşam hava çox soyuq olacaq._';
ERROR:  character with byte sequence 0xc9 0x99 in encoding "UTF8" has no equivalent in encoding "LATIN3"
SELECT count(*) n FROM "Unicode data" WHERE i = 'aze+';
 n 
---
 0
(1 row)

-- etc
INSERT INTO "Unicode data" (i, t) VALUES ('arm+', 'Բել դղյակի ձախ ժամն օֆ ազգությանը ցպահանջ չճշտած վնաս էր եւ փառք։_');
ERROR:  character with byte sequence 0xd4 0xb2 in encoding "UTF8" has no equivalent in encoding "LATIN3"
SELECT * FROM "Unicode data" WHERE i = 'arm+';
 i | t 
---+---
(0 rows)

DELETE FROM "Unicode data" WHERE t = 'Բել դղյակի ձախ ժամն օֆ ազգությանը ցպահանջ չճշտած վնաս էր եւ փառք։_';
ERROR:  character with byte sequence 0xd4 0xb2 in encoding "UTF8" has no equivalent in encoding "LATIN3"
SELECT count(*) n FROM "Unicode data" WHERE i = 'arm+';
 n 
---
 0
(1 row)

INSERT INTO "Unicode data" (i, t) VALUES ('gle+', 'Chuaigh bé mhórshách le dlúthspád fíorfhinn trí hata mo dhea-phorcáin bhig._');
SELECT * FROM "Unicode data" WHERE i = 'gle+';
  i   |                                      t                                       
------+------------------------------------------------------------------------------
 gle+ | Chuaigh bé mhórshách le dlúthspád fíorfhinn trí hata mo dhea-phorcáin bhig._
(1 row)

DELETE FROM "Unicode data" WHERE t = 'Chuaigh bé mhórshách le dlúthspád fíorfhinn trí hata mo dhea-phorcáin bhig._';
SELECT count(*) n FROM "Unicode data" WHERE i = 'gle+';
 n 
---
 0
(1 row)

INSERT INTO "Unicode data" (i, t) VALUES ('epo+', 'Laŭ Ludoviko Zamenhof bongustas freŝa ĉeĥa manĝaĵo kun spicoj._');
SELECT * FROM "Unicode data" WHERE i = 'epo+';
  i   |                                t                                
------+-----------------------------------------------------------------
 epo+ | Laŭ Ludoviko Zamenhof bongustas freŝa ĉeĥa manĝaĵo kun spicoj._
(1 row)

DELETE FROM "Unicode data" WHERE t = 'Laŭ Ludoviko Zamenhof bongustas freŝa ĉeĥa manĝaĵo kun spicoj._';
SELECT count(*) n FROM "Unicode data" WHERE i = 'epo+';
 n 
---
 0
(1 row)

DROP FOREIGN TABLE "Unicode data";
DROP SERVER redis_testing_server CASCADE;
NOTICE:  drop cascades to user mapping for public on server redis_testing_server
DROP EXTENSION redis_fdw;
\connect contrib_regression;
DROP DATABASE "contrib_regression_LATIN3";
-- LATIN4
CREATE DATABASE "contrib_regression_LATIN4" ENCODING LATIN4 LC_CTYPE='POSIX' LC_COLLATE='POSIX' template template0;
\connect "contrib_regression_LATIN4"
CREATE EXTENSION redis_fdw;
CREATE SERVER redis_testing_server FOREIGN DATA WRAPPER redis_fdw;
CREATE FOREIGN TABLE "Unicode data"(i text, t text)
SERVER redis_testing_server
OPTIONS (database '15');
CREATE USER MAPPING FOR public SERVER redis_testing_server; 
-- EUC_JP
SELECT * FROM "Unicode data" WHERE i = 'jap';
 i | t 
---+---
(0 rows)

SELECT * FROM "Unicode data" WHERE t LIKE 'いろはにほ%';
ERROR:  character with byte sequence 0xe3 0x81 0x84 in encoding "UTF8" has no equivalent in encoding "LATIN4"
INSERT INTO "Unicode data" (i, t) VALUES ('jap+', 'いろはにほへと ちりぬるを わかよたれそ つねならむ うゐのおくやま けふこえて あさきゆめみし ゑひもせす._');
ERROR:  character with byte sequence 0xe3 0x81 0x84 in encoding "UTF8" has no equivalent in encoding "LATIN4"
DELETE FROM "Unicode data" WHERE t = 'いろはにほへと ちりぬるを わかよたれそ つねならむ うゐのおくやま けふこえて あさきゆめみし ゑひもせす._';
ERROR:  character with byte sequence 0xe3 0x81 0x84 in encoding "UTF8" has no equivalent in encoding "LATIN4"
SELECT count(*) n FROM "Unicode data" WHERE i = 'jap+';
 n 
---
 0
(1 row)

-- 1251, ISO_8859_5
SELECT * FROM "Unicode data" WHERE i = 'bel';
 i | t 
---+---
(0 rows)

SELECT * FROM "Unicode data" WHERE i = 'bul';
 i | t 
---+---
(0 rows)

SELECT * FROM "Unicode data" WHERE i = 'rus';
 i | t 
---+---
(0 rows)

SELECT * FROM "Unicode data" WHERE i = 'ukr';
 i | t 
---+---
(0 rows)

SELECT * FROM "Unicode data" WHERE t LIKE 'У руд%';
ERROR:  character with byte sequence 0xd0 0xa3 in encoding "UTF8" has no equivalent in encoding "LATIN4"
SELECT * FROM "Unicode data" WHERE t LIKE 'Ах, ч%';
ERROR:  character with byte sequence 0xd0 0x90 in encoding "UTF8" has no equivalent in encoding "LATIN4"
SELECT * FROM "Unicode data" WHERE t LIKE 'Широк%';
ERROR:  character with byte sequence 0xd0 0xa8 in encoding "UTF8" has no equivalent in encoding "LATIN4"
SELECT * FROM "Unicode data" WHERE t LIKE 'Гей, %';
ERROR:  character with byte sequence 0xd0 0x93 in encoding "UTF8" has no equivalent in encoding "LATIN4"
INSERT INTO "Unicode data" (i, t) VALUES ('bel+', 'У рудога вераб’я ў сховішчы пад фатэлем ляжаць нейкія гаючыя зёлкі._');
ERROR:  character with byte sequence 0xd0 0xa3 in encoding "UTF8" has no equivalent in encoding "LATIN4"
SELECT * FROM "Unicode data" WHERE i = 'bel+';
 i | t 
---+---
(0 rows)

DELETE FROM "Unicode data" WHERE t = 'У рудога вераб’я ў сховішчы пад фатэлем ляжаць нейкія гаючыя зёлкі._';
ERROR:  character with byte sequence 0xd0 0xa3 in encoding "UTF8" has no equivalent in encoding "LATIN4"
SELECT count(*) n FROM "Unicode data" WHERE i = 'bel+';
 n 
---
 0
(1 row)

INSERT INTO "Unicode data" (i, t) VALUES ('bul+', 'Ах, чудна българска земьо, полюшвай цъфтящи жита._');
ERROR:  character with byte sequence 0xd0 0x90 in encoding "UTF8" has no equivalent in encoding "LATIN4"
SELECT * FROM "Unicode data" WHERE i = 'bul+';
 i | t 
---+---
(0 rows)

DELETE FROM "Unicode data" WHERE t = 'Ах, чудна българска земьо, полюшвай цъфтящи жита._';
ERROR:  character with byte sequence 0xd0 0x90 in encoding "UTF8" has no equivalent in encoding "LATIN4"
SELECT count(*) n FROM "Unicode data" WHERE i = 'bul+';
 n 
---
 0
(1 row)

INSERT INTO "Unicode data" (i, t) VALUES ('rus+', 'Широкая электрификация южных губерний даст мощный толчок подъёму сельского хозяйства._');
ERROR:  character with byte sequence 0xd0 0xa8 in encoding "UTF8" has no equivalent in encoding "LATIN4"
SELECT * FROM "Unicode data" WHERE i = 'rus+';
 i | t 
---+---
(0 rows)

DELETE FROM "Unicode data" WHERE t = 'Широкая электрификация южных губерний даст мощный толчок подъёму сельского хозяйства._';
ERROR:  character with byte sequence 0xd0 0xa8 in encoding "UTF8" has no equivalent in encoding "LATIN4"
SELECT count(*) n FROM "Unicode data" WHERE i = 'rus+';
 n 
---
 0
(1 row)

INSERT INTO "Unicode data" (i, t) VALUES ('ukr+', 'Гей, хлопці, не вспію — на ґанку ваша файна їжа знищується бурундучком._');
ERROR:  character with byte sequence 0xd0 0x93 in encoding "UTF8" has no equivalent in encoding "LATIN4"
SELECT * FROM "Unicode data" WHERE i = 'ukr+';
 i | t 
---+---
(0 rows)

DELETE FROM "Unicode data" WHERE t = 'Гей, хлопці, не вспію — на ґанку ваша файна їжа знищується бурундучком._';
ERROR:  character with byte sequence 0xd0 0x93 in encoding "UTF8" has no equivalent in encoding "LATIN4"
SELECT count(*) n FROM "Unicode data" WHERE i = 'ukr+';
 n 
---
 0
(1 row)

-- 1256, ISO_8859_6
SELECT * FROM "Unicode data" WHERE i = 'ara';
 i | t 
---+---
(0 rows)

SELECT * FROM "Unicode data" WHERE t LIKE '%ضَظَغ%';
ERROR:  character with byte sequence 0xd8 0xb6 in encoding "UTF8" has no equivalent in encoding "LATIN4"
INSERT INTO "Unicode data" (i, t) VALUES ('ara+', 'أبجد هوَّز حُطّي كلَمُن سَعْفَص قُرِشَت ثَخَدٌ ضَظَغ_');
ERROR:  character with byte sequence 0xd8 0xa3 in encoding "UTF8" has no equivalent in encoding "LATIN4"
SELECT * FROM "Unicode data" WHERE i = 'ara+';
 i | t 
---+---
(0 rows)

DELETE FROM "Unicode data" WHERE t = 'أبجد هوَّز حُطّي كلَمُن سَعْفَص قُرِشَت ثَخَدٌ ضَظَغ_';
ERROR:  character with byte sequence 0xd8 0xa3 in encoding "UTF8" has no equivalent in encoding "LATIN4"
SELECT count(*) n FROM "Unicode data" WHERE i = 'ara+';
 n 
---
 0
(1 row)

-- 1253, ISO_8859_7
SELECT * FROM "Unicode data" WHERE i = 'gre';
 i | t 
---+---
(0 rows)

SELECT * FROM "Unicode data" WHERE t LIKE 'Τάχισ%';
ERROR:  character with byte sequence 0xce 0xa4 in encoding "UTF8" has no equivalent in encoding "LATIN4"
INSERT INTO "Unicode data" (i, t) VALUES ('gre+', 'Τάχιστη αλώπηξ βαφής ψημένη γη, δρασκελίζει υπέρ νωθρού κυνός_');
ERROR:  character with byte sequence 0xce 0xa4 in encoding "UTF8" has no equivalent in encoding "LATIN4"
SELECT * FROM "Unicode data" WHERE i = 'gre+';
 i | t 
---+---
(0 rows)

DELETE FROM "Unicode data" WHERE t = 'Τάχιστη αλώπηξ βαφής ψημένη γη, δρασκελίζει υπέρ νωθρού κυνός_';
ERROR:  character with byte sequence 0xce 0xa4 in encoding "UTF8" has no equivalent in encoding "LATIN4"
-- 1255, ISO_8859_8
SELECT * FROM "Unicode data" WHERE i = 'heb';
 i | t 
---+---
(0 rows)

SELECT * FROM "Unicode data" WHERE t LIKE '%כי ח%';
ERROR:  character with byte sequence 0xd7 0x9b in encoding "UTF8" has no equivalent in encoding "LATIN4"
INSERT INTO "Unicode data" (i, t) VALUES ('heb+', 'עטלף אבק נס דרך מזגן שהתפוצץ כי חם_');
ERROR:  character with byte sequence 0xd7 0xa2 in encoding "UTF8" has no equivalent in encoding "LATIN4"
SELECT * FROM "Unicode data" WHERE i = 'heb+';
 i | t 
---+---
(0 rows)

DELETE FROM "Unicode data" WHERE t = 'עטלף אבק נס דרך מזגן שהתפוצץ כי חם_';
ERROR:  character with byte sequence 0xd7 0xa2 in encoding "UTF8" has no equivalent in encoding "LATIN4"
SELECT count(*) n FROM "Unicode data" WHERE i = 'heb+';
 n 
---
 0
(1 row)

-- 1252, LATIN1
SELECT * FROM "Unicode data" WHERE i = 'eus';
 i | t 
---+---
(0 rows)

SELECT * FROM "Unicode data" WHERE i = 'fra';
 i | t 
---+---
(0 rows)

SELECT * FROM "Unicode data" WHERE i = 'spa';
 i | t 
---+---
(0 rows)

SELECT * FROM "Unicode data" WHERE t LIKE 'Permi%';
    i    |              t               
---------+------------------------------
 utf_eus | Permin gox dabiltzu yoskiÃą.
(1 row)

SELECT * FROM "Unicode data" WHERE t LIKE 'Dès N%';
ERROR:  character with byte sequence 0xc3 0xa8 in encoding "UTF8" has no equivalent in encoding "LATIN4"
SELECT * FROM "Unicode data" WHERE t LIKE 'Quier%';
    i    |                            t                             
---------+----------------------------------------------------------
 utf_spa | Quiere la boca exhausta vid, kiwi, piÃąa y fugaz jamÃŗn.
(1 row)

INSERT INTO "Unicode data" (i, t) VALUES ('eus+', 'Permin gox dabiltzu yoskiñ._');
ERROR:  character with byte sequence 0xc3 0xb1 in encoding "UTF8" has no equivalent in encoding "LATIN4"
SELECT * FROM "Unicode data" WHERE i = 'eus+';
 i | t 
---+---
(0 rows)

DELETE FROM "Unicode data" WHERE t = 'Permin gox dabiltzu yoskiñ._';
ERROR:  character with byte sequence 0xc3 0xb1 in encoding "UTF8" has no equivalent in encoding "LATIN4"
SELECT count(*) n FROM "Unicode data" WHERE i = 'eus+';
 n 
---
 0
(1 row)

INSERT INTO "Unicode data" (i, t) VALUES ('fra+', 'Dès Noël où un zéphyr haï me vêt de glaçons würmiens je dîne d’exquis rôtis de bœuf au kir à l’aÿ d’âge mûr & cætera !_');
ERROR:  character with byte sequence 0xc3 0xa8 in encoding "UTF8" has no equivalent in encoding "LATIN4"
SELECT * FROM "Unicode data" WHERE i = 'fra+';
 i | t 
---+---
(0 rows)

DELETE FROM "Unicode data" WHERE t = 'Dès Noël où un zéphyr haï me vêt de glaçons würmiens je dîne d’exquis rôtis de bœuf au kir à l’aÿ d’âge mûr & cætera !_';
ERROR:  character with byte sequence 0xc3 0xa8 in encoding "UTF8" has no equivalent in encoding "LATIN4"
SELECT count(*) n FROM "Unicode data" WHERE i = 'fra+';
 n 
---
 0
(1 row)

INSERT INTO "Unicode data" (i, t) VALUES ('spa+', 'Quiere la boca exhausta vid, kiwi, piña y fugaz jamón._');
ERROR:  character with byte sequence 0xc3 0xb1 in encoding "UTF8" has no equivalent in encoding "LATIN4"
SELECT * FROM "Unicode data" WHERE i = 'spa+';
 i | t 
---+---
(0 rows)

DELETE FROM "Unicode data" WHERE t = 'Quiere la boca exhausta vid, kiwi, piña y fugaz jamón._';
ERROR:  character with byte sequence 0xc3 0xb1 in encoding "UTF8" has no equivalent in encoding "LATIN4"
SELECT count(*) n FROM "Unicode data" WHERE i = 'spa+';
 n 
---
 0
(1 row)

-- 1250, LATIN2
SELECT * FROM "Unicode data" WHERE i = 'cze';
 i | t 
---+---
(0 rows)

SELECT * FROM "Unicode data" WHERE i = 'pol';
 i | t 
---+---
(0 rows)

SELECT * FROM "Unicode data" WHERE i = 'srp';
 i | t 
---+---
(0 rows)

SELECT * FROM "Unicode data" WHERE t LIKE 'Zvláš%';
 i | t 
---+---
(0 rows)

SELECT * FROM "Unicode data" WHERE t LIKE 'Pchną%';
 i | t 
---+---
(0 rows)

SELECT * FROM "Unicode data" WHERE t LIKE 'Ljuba%';
    i    |                                          t                                           
---------+--------------------------------------------------------------------------------------
 utf_srp | Ljubavi, Olga, hajde poÄ\u0091i u FudÅži i Ä\u008Dut Ä\u0087eÅĄ njeÅžnu muziku srca.
(1 row)

INSERT INTO "Unicode data" (i, t) VALUES ('cze+', 'Zvlášť zákeřný učeň s ďolíčky běží podél zóny úlů._');
ERROR:  character with byte sequence 0xc5 0xa5 in encoding "UTF8" has no equivalent in encoding "LATIN4"
SELECT * FROM "Unicode data" WHERE i = 'cze+';
 i | t 
---+---
(0 rows)

DELETE FROM "Unicode data" WHERE t = 'Zvlášť zákeřný učeň s ďolíčky běží podél zóny úlů._';
ERROR:  character with byte sequence 0xc5 0xa5 in encoding "UTF8" has no equivalent in encoding "LATIN4"
SELECT count(*) n FROM "Unicode data" WHERE i = 'cze+';
 n 
---
 0
(1 row)

INSERT INTO "Unicode data" (i, t) VALUES ('pol+', 'Pchnąć w tę łódź jeża lub ośm skrzyń fig._');
ERROR:  character with byte sequence 0xc4 0x87 in encoding "UTF8" has no equivalent in encoding "LATIN4"
SELECT * FROM "Unicode data" WHERE i = 'pol+';
 i | t 
---+---
(0 rows)

DELETE FROM "Unicode data" WHERE t = 'Pchnąć w tę łódź jeża lub ośm skrzyń fig._';
ERROR:  character with byte sequence 0xc4 0x87 in encoding "UTF8" has no equivalent in encoding "LATIN4"
SELECT count(*) n FROM "Unicode data" WHERE i = 'pol+';
 n 
---
 0
(1 row)

INSERT INTO "Unicode data" (i, t) VALUES ('srp+', 'Ljubavi, Olga, hajde pođi u Fudži i čut ćeš nježnu muziku srca._');
ERROR:  character with byte sequence 0xc4 0x87 in encoding "UTF8" has no equivalent in encoding "LATIN4"
SELECT * FROM "Unicode data" WHERE i = 'srp+';
 i | t 
---+---
(0 rows)

DELETE FROM "Unicode data" WHERE t = 'Ljubavi, Olga, hajde pođi u Fudži i čut ćeš nježnu muziku srca._';
ERROR:  character with byte sequence 0xc4 0x87 in encoding "UTF8" has no equivalent in encoding "LATIN4"
SELECT count(*) n FROM "Unicode data" WHERE i = 'srp+';
 n 
---
 0
(1 row)

-- 1257, LATIN7
SELECT * FROM "Unicode data" WHERE i = 'lav';
 i | t 
---+---
(0 rows)

SELECT * FROM "Unicode data" WHERE t LIKE 'Ķieģeļu%';
 i | t 
---+---
(0 rows)

INSERT INTO "Unicode data" (i, t) VALUES ('lav+', 'Ķieģeļu cepējs Edgars Buls fraku un hūti žāvē uz čīkstošām eņģēm._');
SELECT * FROM "Unicode data" WHERE i = 'lav+';
  i   |                                 t                                  
------+--------------------------------------------------------------------
 lav+ | Ķieģeļu cepējs Edgars Buls fraku un hūti žāvē uz čīkstošām eņģēm._
(1 row)

DELETE FROM "Unicode data" WHERE t = 'Ķieģeļu cepējs Edgars Buls fraku un hūti žāvē uz čīkstošām eņģēm._';
SELECT count(*) n FROM "Unicode data" WHERE i = 'lav+';
 n 
---
 0
(1 row)

-- EUC_KR
SELECT * FROM "Unicode data" WHERE i = 'kor';
 i | t 
---+---
(0 rows)

SELECT * FROM "Unicode data" WHERE t LIKE '키스의 고%';
ERROR:  character with byte sequence 0xed 0x82 0xa4 in encoding "UTF8" has no equivalent in encoding "LATIN4"
INSERT INTO "Unicode data" (i, t) VALUES ('kor+', '키스의 고유조건은 입술끼리 만나야 하고 특별한 기술은 필요치 않다._');
ERROR:  character with byte sequence 0xed 0x82 0xa4 in encoding "UTF8" has no equivalent in encoding "LATIN4"
SELECT * FROM "Unicode data" WHERE i = 'kor+';
 i | t 
---+---
(0 rows)

DELETE FROM "Unicode data" WHERE t = '키스의 고유조건은 입술끼리 만나야 하고 특별한 기술은 필요치 않다._';
ERROR:  character with byte sequence 0xed 0x82 0xa4 in encoding "UTF8" has no equivalent in encoding "LATIN4"
SELECT count(*) n FROM "Unicode data" WHERE i = 'kor+';
 n 
---
 0
(1 row)

-- 1254, LATIN5
SELECT * FROM "Unicode data" WHERE i = 'aze';
 i | t 
---+---
(0 rows)

SELECT * FROM "Unicode data" WHERE t LIKE 'Zəfər%';
ERROR:  character with byte sequence 0xc9 0x99 in encoding "UTF8" has no equivalent in encoding "LATIN4"
INSERT INTO "Unicode data" (i, t) VALUES ('aze+', 'Zəfər, jaketini də, papağını da götür, bu axşam hava çox soyuq olacaq._');
ERROR:  character with byte sequence 0xc9 0x99 in encoding "UTF8" has no equivalent in encoding "LATIN4"
SELECT * FROM "Unicode data" WHERE i = 'aze+';
 i | t 
---+---
(0 rows)

DELETE FROM "Unicode data" WHERE t = 'Zəfər, jaketini də, papağını da götür, bu axşam hava çox soyuq olacaq._';
ERROR:  character with byte sequence 0xc9 0x99 in encoding "UTF8" has no equivalent in encoding "LATIN4"
SELECT count(*) n FROM "Unicode data" WHERE i = 'aze+';
 n 
---
 0
(1 row)

-- etc
INSERT INTO "Unicode data" (i, t) VALUES ('arm+', 'Բել դղյակի ձախ ժամն օֆ ազգությանը ցպահանջ չճշտած վնաս էր եւ փառք։_');
ERROR:  character with byte sequence 0xd4 0xb2 in encoding "UTF8" has no equivalent in encoding "LATIN4"
SELECT * FROM "Unicode data" WHERE i = 'arm+';
 i | t 
---+---
(0 rows)

DELETE FROM "Unicode data" WHERE t = 'Բել դղյակի ձախ ժամն օֆ ազգությանը ցպահանջ չճշտած վնաս էր եւ փառք։_';
ERROR:  character with byte sequence 0xd4 0xb2 in encoding "UTF8" has no equivalent in encoding "LATIN4"
SELECT count(*) n FROM "Unicode data" WHERE i = 'arm+';
 n 
---
 0
(1 row)

INSERT INTO "Unicode data" (i, t) VALUES ('gle+', 'Chuaigh bé mhórshách le dlúthspád fíorfhinn trí hata mo dhea-phorcáin bhig._');
ERROR:  character with byte sequence 0xc3 0xb3 in encoding "UTF8" has no equivalent in encoding "LATIN4"
SELECT * FROM "Unicode data" WHERE i = 'gle+';
 i | t 
---+---
(0 rows)

DELETE FROM "Unicode data" WHERE t = 'Chuaigh bé mhórshách le dlúthspád fíorfhinn trí hata mo dhea-phorcáin bhig._';
ERROR:  character with byte sequence 0xc3 0xb3 in encoding "UTF8" has no equivalent in encoding "LATIN4"
SELECT count(*) n FROM "Unicode data" WHERE i = 'gle+';
 n 
---
 0
(1 row)

INSERT INTO "Unicode data" (i, t) VALUES ('epo+', 'Laŭ Ludoviko Zamenhof bongustas freŝa ĉeĥa manĝaĵo kun spicoj._');
ERROR:  character with byte sequence 0xc5 0xad in encoding "UTF8" has no equivalent in encoding "LATIN4"
SELECT * FROM "Unicode data" WHERE i = 'epo+';
 i | t 
---+---
(0 rows)

DELETE FROM "Unicode data" WHERE t = 'Laŭ Ludoviko Zamenhof bongustas freŝa ĉeĥa manĝaĵo kun spicoj._';
ERROR:  character with byte sequence 0xc5 0xad in encoding "UTF8" has no equivalent in encoding "LATIN4"
SELECT count(*) n FROM "Unicode data" WHERE i = 'epo+';
 n 
---
 0
(1 row)

DROP FOREIGN TABLE "Unicode data";
DROP SERVER redis_testing_server CASCADE;
NOTICE:  drop cascades to user mapping for public on server redis_testing_server
DROP EXTENSION redis_fdw;
\connect contrib_regression;
DROP DATABASE "contrib_regression_LATIN4";
-- LATIN5
CREATE DATABASE "contrib_regression_LATIN5" ENCODING LATIN5 LC_CTYPE='POSIX' LC_COLLATE='POSIX' template template0;
\connect "contrib_regression_LATIN5"
CREATE EXTENSION redis_fdw;
CREATE SERVER redis_testing_server FOREIGN DATA WRAPPER redis_fdw;
CREATE FOREIGN TABLE "Unicode data"(i text, t text)
SERVER redis_testing_server
OPTIONS (database '15');
CREATE USER MAPPING FOR public SERVER redis_testing_server; 
-- EUC_JP
SELECT * FROM "Unicode data" WHERE i = 'jap';
 i | t 
---+---
(0 rows)

SELECT * FROM "Unicode data" WHERE t LIKE 'いろはにほ%';
ERROR:  character with byte sequence 0xe3 0x81 0x84 in encoding "UTF8" has no equivalent in encoding "LATIN5"
INSERT INTO "Unicode data" (i, t) VALUES ('jap+', 'いろはにほへと ちりぬるを わかよたれそ つねならむ うゐのおくやま けふこえて あさきゆめみし ゑひもせす._');
ERROR:  character with byte sequence 0xe3 0x81 0x84 in encoding "UTF8" has no equivalent in encoding "LATIN5"
DELETE FROM "Unicode data" WHERE t = 'いろはにほへと ちりぬるを わかよたれそ つねならむ うゐのおくやま けふこえて あさきゆめみし ゑひもせす._';
ERROR:  character with byte sequence 0xe3 0x81 0x84 in encoding "UTF8" has no equivalent in encoding "LATIN5"
SELECT count(*) n FROM "Unicode data" WHERE i = 'jap+';
 n 
---
 0
(1 row)

-- 1251, ISO_8859_5
SELECT * FROM "Unicode data" WHERE i = 'bel';
 i | t 
---+---
(0 rows)

SELECT * FROM "Unicode data" WHERE i = 'bul';
 i | t 
---+---
(0 rows)

SELECT * FROM "Unicode data" WHERE i = 'rus';
 i | t 
---+---
(0 rows)

SELECT * FROM "Unicode data" WHERE i = 'ukr';
 i | t 
---+---
(0 rows)

SELECT * FROM "Unicode data" WHERE t LIKE 'У руд%';
ERROR:  character with byte sequence 0xd0 0xa3 in encoding "UTF8" has no equivalent in encoding "LATIN5"
SELECT * FROM "Unicode data" WHERE t LIKE 'Ах, ч%';
ERROR:  character with byte sequence 0xd0 0x90 in encoding "UTF8" has no equivalent in encoding "LATIN5"
SELECT * FROM "Unicode data" WHERE t LIKE 'Широк%';
ERROR:  character with byte sequence 0xd0 0xa8 in encoding "UTF8" has no equivalent in encoding "LATIN5"
SELECT * FROM "Unicode data" WHERE t LIKE 'Гей, %';
ERROR:  character with byte sequence 0xd0 0x93 in encoding "UTF8" has no equivalent in encoding "LATIN5"
INSERT INTO "Unicode data" (i, t) VALUES ('bel+', 'У рудога вераб’я ў сховішчы пад фатэлем ляжаць нейкія гаючыя зёлкі._');
ERROR:  character with byte sequence 0xd0 0xa3 in encoding "UTF8" has no equivalent in encoding "LATIN5"
SELECT * FROM "Unicode data" WHERE i = 'bel+';
 i | t 
---+---
(0 rows)

DELETE FROM "Unicode data" WHERE t = 'У рудога вераб’я ў сховішчы пад фатэлем ляжаць нейкія гаючыя зёлкі._';
ERROR:  character with byte sequence 0xd0 0xa3 in encoding "UTF8" has no equivalent in encoding "LATIN5"
SELECT count(*) n FROM "Unicode data" WHERE i = 'bel+';
 n 
---
 0
(1 row)

INSERT INTO "Unicode data" (i, t) VALUES ('bul+', 'Ах, чудна българска земьо, полюшвай цъфтящи жита._');
ERROR:  character with byte sequence 0xd0 0x90 in encoding "UTF8" has no equivalent in encoding "LATIN5"
SELECT * FROM "Unicode data" WHERE i = 'bul+';
 i | t 
---+---
(0 rows)

DELETE FROM "Unicode data" WHERE t = 'Ах, чудна българска земьо, полюшвай цъфтящи жита._';
ERROR:  character with byte sequence 0xd0 0x90 in encoding "UTF8" has no equivalent in encoding "LATIN5"
SELECT count(*) n FROM "Unicode data" WHERE i = 'bul+';
 n 
---
 0
(1 row)

INSERT INTO "Unicode data" (i, t) VALUES ('rus+', 'Широкая электрификация южных губерний даст мощный толчок подъёму сельского хозяйства._');
ERROR:  character with byte sequence 0xd0 0xa8 in encoding "UTF8" has no equivalent in encoding "LATIN5"
SELECT * FROM "Unicode data" WHERE i = 'rus+';
 i | t 
---+---
(0 rows)

DELETE FROM "Unicode data" WHERE t = 'Широкая электрификация южных губерний даст мощный толчок подъёму сельского хозяйства._';
ERROR:  character with byte sequence 0xd0 0xa8 in encoding "UTF8" has no equivalent in encoding "LATIN5"
SELECT count(*) n FROM "Unicode data" WHERE i = 'rus+';
 n 
---
 0
(1 row)

INSERT INTO "Unicode data" (i, t) VALUES ('ukr+', 'Гей, хлопці, не вспію — на ґанку ваша файна їжа знищується бурундучком._');
ERROR:  character with byte sequence 0xd0 0x93 in encoding "UTF8" has no equivalent in encoding "LATIN5"
SELECT * FROM "Unicode data" WHERE i = 'ukr+';
 i | t 
---+---
(0 rows)

DELETE FROM "Unicode data" WHERE t = 'Гей, хлопці, не вспію — на ґанку ваша файна їжа знищується бурундучком._';
ERROR:  character with byte sequence 0xd0 0x93 in encoding "UTF8" has no equivalent in encoding "LATIN5"
SELECT count(*) n FROM "Unicode data" WHERE i = 'ukr+';
 n 
---
 0
(1 row)

-- 1256, ISO_8859_6
SELECT * FROM "Unicode data" WHERE i = 'ara';
 i | t 
---+---
(0 rows)

SELECT * FROM "Unicode data" WHERE t LIKE '%ضَظَغ%';
ERROR:  character with byte sequence 0xd8 0xb6 in encoding "UTF8" has no equivalent in encoding "LATIN5"
INSERT INTO "Unicode data" (i, t) VALUES ('ara+', 'أبجد هوَّز حُطّي كلَمُن سَعْفَص قُرِشَت ثَخَدٌ ضَظَغ_');
ERROR:  character with byte sequence 0xd8 0xa3 in encoding "UTF8" has no equivalent in encoding "LATIN5"
SELECT * FROM "Unicode data" WHERE i = 'ara+';
 i | t 
---+---
(0 rows)

DELETE FROM "Unicode data" WHERE t = 'أبجد هوَّز حُطّي كلَمُن سَعْفَص قُرِشَت ثَخَدٌ ضَظَغ_';
ERROR:  character with byte sequence 0xd8 0xa3 in encoding "UTF8" has no equivalent in encoding "LATIN5"
SELECT count(*) n FROM "Unicode data" WHERE i = 'ara+';
 n 
---
 0
(1 row)

-- 1253, ISO_8859_7
SELECT * FROM "Unicode data" WHERE i = 'gre';
 i | t 
---+---
(0 rows)

SELECT * FROM "Unicode data" WHERE t LIKE 'Τάχισ%';
ERROR:  character with byte sequence 0xce 0xa4 in encoding "UTF8" has no equivalent in encoding "LATIN5"
INSERT INTO "Unicode data" (i, t) VALUES ('gre+', 'Τάχιστη αλώπηξ βαφής ψημένη γη, δρασκελίζει υπέρ νωθρού κυνός_');
ERROR:  character with byte sequence 0xce 0xa4 in encoding "UTF8" has no equivalent in encoding "LATIN5"
SELECT * FROM "Unicode data" WHERE i = 'gre+';
 i | t 
---+---
(0 rows)

DELETE FROM "Unicode data" WHERE t = 'Τάχιστη αλώπηξ βαφής ψημένη γη, δρασκελίζει υπέρ νωθρού κυνός_';
ERROR:  character with byte sequence 0xce 0xa4 in encoding "UTF8" has no equivalent in encoding "LATIN5"
-- 1255, ISO_8859_8
SELECT * FROM "Unicode data" WHERE i = 'heb';
 i | t 
---+---
(0 rows)

SELECT * FROM "Unicode data" WHERE t LIKE '%כי ח%';
ERROR:  character with byte sequence 0xd7 0x9b in encoding "UTF8" has no equivalent in encoding "LATIN5"
INSERT INTO "Unicode data" (i, t) VALUES ('heb+', 'עטלף אבק נס דרך מזגן שהתפוצץ כי חם_');
ERROR:  character with byte sequence 0xd7 0xa2 in encoding "UTF8" has no equivalent in encoding "LATIN5"
SELECT * FROM "Unicode data" WHERE i = 'heb+';
 i | t 
---+---
(0 rows)

DELETE FROM "Unicode data" WHERE t = 'עטלף אבק נס דרך מזגן שהתפוצץ כי חם_';
ERROR:  character with byte sequence 0xd7 0xa2 in encoding "UTF8" has no equivalent in encoding "LATIN5"
SELECT count(*) n FROM "Unicode data" WHERE i = 'heb+';
 n 
---
 0
(1 row)

-- 1252, LATIN1
SELECT * FROM "Unicode data" WHERE i = 'eus';
 i | t 
---+---
(0 rows)

SELECT * FROM "Unicode data" WHERE i = 'fra';
 i | t 
---+---
(0 rows)

SELECT * FROM "Unicode data" WHERE i = 'spa';
 i | t 
---+---
(0 rows)

SELECT * FROM "Unicode data" WHERE t LIKE 'Permi%';
    i    |              t               
---------+------------------------------
 utf_eus | Permin gox dabiltzu yoskiÃ±.
(1 row)

SELECT * FROM "Unicode data" WHERE t LIKE 'Dès N%';
 i | t 
---+---
(0 rows)

SELECT * FROM "Unicode data" WHERE t LIKE 'Quier%';
    i    |                            t                             
---------+----------------------------------------------------------
 utf_spa | Quiere la boca exhausta vid, kiwi, piÃ±a y fugaz jamÃ³n.
(1 row)

INSERT INTO "Unicode data" (i, t) VALUES ('eus+', 'Permin gox dabiltzu yoskiñ._');
SELECT * FROM "Unicode data" WHERE i = 'eus+';
  i   |              t               
------+------------------------------
 eus+ | Permin gox dabiltzu yoskiñ._
(1 row)

DELETE FROM "Unicode data" WHERE t = 'Permin gox dabiltzu yoskiñ._';
SELECT count(*) n FROM "Unicode data" WHERE i = 'eus+';
 n 
---
 0
(1 row)

INSERT INTO "Unicode data" (i, t) VALUES ('fra+', 'Dès Noël où un zéphyr haï me vêt de glaçons würmiens je dîne d’exquis rôtis de bœuf au kir à l’aÿ d’âge mûr & cætera !_');
ERROR:  character with byte sequence 0xe2 0x80 0x99 in encoding "UTF8" has no equivalent in encoding "LATIN5"
SELECT * FROM "Unicode data" WHERE i = 'fra+';
 i | t 
---+---
(0 rows)

DELETE FROM "Unicode data" WHERE t = 'Dès Noël où un zéphyr haï me vêt de glaçons würmiens je dîne d’exquis rôtis de bœuf au kir à l’aÿ d’âge mûr & cætera !_';
ERROR:  character with byte sequence 0xe2 0x80 0x99 in encoding "UTF8" has no equivalent in encoding "LATIN5"
SELECT count(*) n FROM "Unicode data" WHERE i = 'fra+';
 n 
---
 0
(1 row)

INSERT INTO "Unicode data" (i, t) VALUES ('spa+', 'Quiere la boca exhausta vid, kiwi, piña y fugaz jamón._');
SELECT * FROM "Unicode data" WHERE i = 'spa+';
  i   |                            t                            
------+---------------------------------------------------------
 spa+ | Quiere la boca exhausta vid, kiwi, piña y fugaz jamón._
(1 row)

DELETE FROM "Unicode data" WHERE t = 'Quiere la boca exhausta vid, kiwi, piña y fugaz jamón._';
SELECT count(*) n FROM "Unicode data" WHERE i = 'spa+';
 n 
---
 0
(1 row)

-- 1250, LATIN2
SELECT * FROM "Unicode data" WHERE i = 'cze';
 i | t 
---+---
(0 rows)

SELECT * FROM "Unicode data" WHERE i = 'pol';
 i | t 
---+---
(0 rows)

SELECT * FROM "Unicode data" WHERE i = 'srp';
 i | t 
---+---
(0 rows)

SELECT * FROM "Unicode data" WHERE t LIKE 'Zvláš%';
ERROR:  character with byte sequence 0xc5 0xa1 in encoding "UTF8" has no equivalent in encoding "LATIN5"
SELECT * FROM "Unicode data" WHERE t LIKE 'Pchną%';
ERROR:  character with byte sequence 0xc4 0x85 in encoding "UTF8" has no equivalent in encoding "LATIN5"
SELECT * FROM "Unicode data" WHERE t LIKE 'Ljuba%';
    i    |                                          t                                           
---------+--------------------------------------------------------------------------------------
 utf_srp | Ljubavi, Olga, hajde poÄ\u0091i u FudÅ¾i i Ä\u008Dut Ä\u0087eÅ¡ njeÅ¾nu muziku srca.
(1 row)

INSERT INTO "Unicode data" (i, t) VALUES ('cze+', 'Zvlášť zákeřný učeň s ďolíčky běží podél zóny úlů._');
ERROR:  character with byte sequence 0xc5 0xa1 in encoding "UTF8" has no equivalent in encoding "LATIN5"
SELECT * FROM "Unicode data" WHERE i = 'cze+';
 i | t 
---+---
(0 rows)

DELETE FROM "Unicode data" WHERE t = 'Zvlášť zákeřný učeň s ďolíčky běží podél zóny úlů._';
ERROR:  character with byte sequence 0xc5 0xa1 in encoding "UTF8" has no equivalent in encoding "LATIN5"
SELECT count(*) n FROM "Unicode data" WHERE i = 'cze+';
 n 
---
 0
(1 row)

INSERT INTO "Unicode data" (i, t) VALUES ('pol+', 'Pchnąć w tę łódź jeża lub ośm skrzyń fig._');
ERROR:  character with byte sequence 0xc4 0x85 in encoding "UTF8" has no equivalent in encoding "LATIN5"
SELECT * FROM "Unicode data" WHERE i = 'pol+';
 i | t 
---+---
(0 rows)

DELETE FROM "Unicode data" WHERE t = 'Pchnąć w tę łódź jeża lub ośm skrzyń fig._';
ERROR:  character with byte sequence 0xc4 0x85 in encoding "UTF8" has no equivalent in encoding "LATIN5"
SELECT count(*) n FROM "Unicode data" WHERE i = 'pol+';
 n 
---
 0
(1 row)

INSERT INTO "Unicode data" (i, t) VALUES ('srp+', 'Ljubavi, Olga, hajde pođi u Fudži i čut ćeš nježnu muziku srca._');
ERROR:  character with byte sequence 0xc4 0x91 in encoding "UTF8" has no equivalent in encoding "LATIN5"
SELECT * FROM "Unicode data" WHERE i = 'srp+';
 i | t 
---+---
(0 rows)

DELETE FROM "Unicode data" WHERE t = 'Ljubavi, Olga, hajde pođi u Fudži i čut ćeš nježnu muziku srca._';
ERROR:  character with byte sequence 0xc4 0x91 in encoding "UTF8" has no equivalent in encoding "LATIN5"
SELECT count(*) n FROM "Unicode data" WHERE i = 'srp+';
 n 
---
 0
(1 row)

-- 1257, LATIN7
SELECT * FROM "Unicode data" WHERE i = 'lav';
 i | t 
---+---
(0 rows)

SELECT * FROM "Unicode data" WHERE t LIKE 'Ķieģeļu%';
ERROR:  character with byte sequence 0xc4 0xb6 in encoding "UTF8" has no equivalent in encoding "LATIN5"
INSERT INTO "Unicode data" (i, t) VALUES ('lav+', 'Ķieģeļu cepējs Edgars Buls fraku un hūti žāvē uz čīkstošām eņģēm._');
ERROR:  character with byte sequence 0xc4 0xb6 in encoding "UTF8" has no equivalent in encoding "LATIN5"
SELECT * FROM "Unicode data" WHERE i = 'lav+';
 i | t 
---+---
(0 rows)

DELETE FROM "Unicode data" WHERE t = 'Ķieģeļu cepējs Edgars Buls fraku un hūti žāvē uz čīkstošām eņģēm._';
ERROR:  character with byte sequence 0xc4 0xb6 in encoding "UTF8" has no equivalent in encoding "LATIN5"
SELECT count(*) n FROM "Unicode data" WHERE i = 'lav+';
 n 
---
 0
(1 row)

-- EUC_KR
SELECT * FROM "Unicode data" WHERE i = 'kor';
 i | t 
---+---
(0 rows)

SELECT * FROM "Unicode data" WHERE t LIKE '키스의 고%';
ERROR:  character with byte sequence 0xed 0x82 0xa4 in encoding "UTF8" has no equivalent in encoding "LATIN5"
INSERT INTO "Unicode data" (i, t) VALUES ('kor+', '키스의 고유조건은 입술끼리 만나야 하고 특별한 기술은 필요치 않다._');
ERROR:  character with byte sequence 0xed 0x82 0xa4 in encoding "UTF8" has no equivalent in encoding "LATIN5"
SELECT * FROM "Unicode data" WHERE i = 'kor+';
 i | t 
---+---
(0 rows)

DELETE FROM "Unicode data" WHERE t = '키스의 고유조건은 입술끼리 만나야 하고 특별한 기술은 필요치 않다._';
ERROR:  character with byte sequence 0xed 0x82 0xa4 in encoding "UTF8" has no equivalent in encoding "LATIN5"
SELECT count(*) n FROM "Unicode data" WHERE i = 'kor+';
 n 
---
 0
(1 row)

-- 1254, LATIN5
SELECT * FROM "Unicode data" WHERE i = 'aze';
 i | t 
---+---
(0 rows)

SELECT * FROM "Unicode data" WHERE t LIKE 'Zəfər%';
ERROR:  character with byte sequence 0xc9 0x99 in encoding "UTF8" has no equivalent in encoding "LATIN5"
INSERT INTO "Unicode data" (i, t) VALUES ('aze+', 'Zəfər, jaketini də, papağını da götür, bu axşam hava çox soyuq olacaq._');
ERROR:  character with byte sequence 0xc9 0x99 in encoding "UTF8" has no equivalent in encoding "LATIN5"
SELECT * FROM "Unicode data" WHERE i = 'aze+';
 i | t 
---+---
(0 rows)

DELETE FROM "Unicode data" WHERE t = 'Zəfər, jaketini də, papağını da götür, bu axşam hava çox soyuq olacaq._';
ERROR:  character with byte sequence 0xc9 0x99 in encoding "UTF8" has no equivalent in encoding "LATIN5"
SELECT count(*) n FROM "Unicode data" WHERE i = 'aze+';
 n 
---
 0
(1 row)

-- etc
INSERT INTO "Unicode data" (i, t) VALUES ('arm+', 'Բել դղյակի ձախ ժամն օֆ ազգությանը ցպահանջ չճշտած վնաս էր եւ փառք։_');
ERROR:  character with byte sequence 0xd4 0xb2 in encoding "UTF8" has no equivalent in encoding "LATIN5"
SELECT * FROM "Unicode data" WHERE i = 'arm+';
 i | t 
---+---
(0 rows)

DELETE FROM "Unicode data" WHERE t = 'Բել դղյակի ձախ ժամն օֆ ազգությանը ցպահանջ չճշտած վնաս էր եւ փառք։_';
ERROR:  character with byte sequence 0xd4 0xb2 in encoding "UTF8" has no equivalent in encoding "LATIN5"
SELECT count(*) n FROM "Unicode data" WHERE i = 'arm+';
 n 
---
 0
(1 row)

INSERT INTO "Unicode data" (i, t) VALUES ('gle+', 'Chuaigh bé mhórshách le dlúthspád fíorfhinn trí hata mo dhea-phorcáin bhig._');
SELECT * FROM "Unicode data" WHERE i = 'gle+';
  i   |                                      t                                       
------+------------------------------------------------------------------------------
 gle+ | Chuaigh bé mhórshách le dlúthspád fíorfhinn trí hata mo dhea-phorcáin bhig._
(1 row)

DELETE FROM "Unicode data" WHERE t = 'Chuaigh bé mhórshách le dlúthspád fíorfhinn trí hata mo dhea-phorcáin bhig._';
SELECT count(*) n FROM "Unicode data" WHERE i = 'gle+';
 n 
---
 0
(1 row)

INSERT INTO "Unicode data" (i, t) VALUES ('epo+', 'Laŭ Ludoviko Zamenhof bongustas freŝa ĉeĥa manĝaĵo kun spicoj._');
ERROR:  character with byte sequence 0xc5 0xad in encoding "UTF8" has no equivalent in encoding "LATIN5"
SELECT * FROM "Unicode data" WHERE i = 'epo+';
 i | t 
---+---
(0 rows)

DELETE FROM "Unicode data" WHERE t = 'Laŭ Ludoviko Zamenhof bongustas freŝa ĉeĥa manĝaĵo kun spicoj._';
ERROR:  character with byte sequence 0xc5 0xad in encoding "UTF8" has no equivalent in encoding "LATIN5"
SELECT count(*) n FROM "Unicode data" WHERE i = 'epo+';
 n 
---
 0
(1 row)

DROP FOREIGN TABLE "Unicode data";
DROP SERVER redis_testing_server CASCADE;
NOTICE:  drop cascades to user mapping for public on server redis_testing_server
DROP EXTENSION redis_fdw;
\connect contrib_regression;
DROP DATABASE "contrib_regression_LATIN5";
-- LATIN6
CREATE DATABASE "contrib_regression_LATIN6" ENCODING LATIN6 LC_CTYPE='POSIX' LC_COLLATE='POSIX' template template0;
\connect "contrib_regression_LATIN6"
CREATE EXTENSION redis_fdw;
CREATE SERVER redis_testing_server FOREIGN DATA WRAPPER redis_fdw;
CREATE FOREIGN TABLE "Unicode data"(i text, t text)
SERVER redis_testing_server
OPTIONS (database '15');
CREATE USER MAPPING FOR public SERVER redis_testing_server; 
-- EUC_JP
SELECT * FROM "Unicode data" WHERE i = 'jap';
 i | t 
---+---
(0 rows)

SELECT * FROM "Unicode data" WHERE t LIKE 'いろはにほ%';
ERROR:  character with byte sequence 0xe3 0x81 0x84 in encoding "UTF8" has no equivalent in encoding "LATIN6"
INSERT INTO "Unicode data" (i, t) VALUES ('jap+', 'いろはにほへと ちりぬるを わかよたれそ つねならむ うゐのおくやま けふこえて あさきゆめみし ゑひもせす._');
ERROR:  character with byte sequence 0xe3 0x81 0x84 in encoding "UTF8" has no equivalent in encoding "LATIN6"
DELETE FROM "Unicode data" WHERE t = 'いろはにほへと ちりぬるを わかよたれそ つねならむ うゐのおくやま けふこえて あさきゆめみし ゑひもせす._';
ERROR:  character with byte sequence 0xe3 0x81 0x84 in encoding "UTF8" has no equivalent in encoding "LATIN6"
SELECT count(*) n FROM "Unicode data" WHERE i = 'jap+';
 n 
---
 0
(1 row)

-- 1251, ISO_8859_5
SELECT * FROM "Unicode data" WHERE i = 'bel';
 i | t 
---+---
(0 rows)

SELECT * FROM "Unicode data" WHERE i = 'bul';
 i | t 
---+---
(0 rows)

SELECT * FROM "Unicode data" WHERE i = 'rus';
 i | t 
---+---
(0 rows)

SELECT * FROM "Unicode data" WHERE i = 'ukr';
 i | t 
---+---
(0 rows)

SELECT * FROM "Unicode data" WHERE t LIKE 'У руд%';
ERROR:  character with byte sequence 0xd0 0xa3 in encoding "UTF8" has no equivalent in encoding "LATIN6"
SELECT * FROM "Unicode data" WHERE t LIKE 'Ах, ч%';
ERROR:  character with byte sequence 0xd0 0x90 in encoding "UTF8" has no equivalent in encoding "LATIN6"
SELECT * FROM "Unicode data" WHERE t LIKE 'Широк%';
ERROR:  character with byte sequence 0xd0 0xa8 in encoding "UTF8" has no equivalent in encoding "LATIN6"
SELECT * FROM "Unicode data" WHERE t LIKE 'Гей, %';
ERROR:  character with byte sequence 0xd0 0x93 in encoding "UTF8" has no equivalent in encoding "LATIN6"
INSERT INTO "Unicode data" (i, t) VALUES ('bel+', 'У рудога вераб’я ў сховішчы пад фатэлем ляжаць нейкія гаючыя зёлкі._');
ERROR:  character with byte sequence 0xd0 0xa3 in encoding "UTF8" has no equivalent in encoding "LATIN6"
SELECT * FROM "Unicode data" WHERE i = 'bel+';
 i | t 
---+---
(0 rows)

DELETE FROM "Unicode data" WHERE t = 'У рудога вераб’я ў сховішчы пад фатэлем ляжаць нейкія гаючыя зёлкі._';
ERROR:  character with byte sequence 0xd0 0xa3 in encoding "UTF8" has no equivalent in encoding "LATIN6"
SELECT count(*) n FROM "Unicode data" WHERE i = 'bel+';
 n 
---
 0
(1 row)

INSERT INTO "Unicode data" (i, t) VALUES ('bul+', 'Ах, чудна българска земьо, полюшвай цъфтящи жита._');
ERROR:  character with byte sequence 0xd0 0x90 in encoding "UTF8" has no equivalent in encoding "LATIN6"
SELECT * FROM "Unicode data" WHERE i = 'bul+';
 i | t 
---+---
(0 rows)

DELETE FROM "Unicode data" WHERE t = 'Ах, чудна българска земьо, полюшвай цъфтящи жита._';
ERROR:  character with byte sequence 0xd0 0x90 in encoding "UTF8" has no equivalent in encoding "LATIN6"
SELECT count(*) n FROM "Unicode data" WHERE i = 'bul+';
 n 
---
 0
(1 row)

INSERT INTO "Unicode data" (i, t) VALUES ('rus+', 'Широкая электрификация южных губерний даст мощный толчок подъёму сельского хозяйства._');
ERROR:  character with byte sequence 0xd0 0xa8 in encoding "UTF8" has no equivalent in encoding "LATIN6"
SELECT * FROM "Unicode data" WHERE i = 'rus+';
 i | t 
---+---
(0 rows)

DELETE FROM "Unicode data" WHERE t = 'Широкая электрификация южных губерний даст мощный толчок подъёму сельского хозяйства._';
ERROR:  character with byte sequence 0xd0 0xa8 in encoding "UTF8" has no equivalent in encoding "LATIN6"
SELECT count(*) n FROM "Unicode data" WHERE i = 'rus+';
 n 
---
 0
(1 row)

INSERT INTO "Unicode data" (i, t) VALUES ('ukr+', 'Гей, хлопці, не вспію — на ґанку ваша файна їжа знищується бурундучком._');
ERROR:  character with byte sequence 0xd0 0x93 in encoding "UTF8" has no equivalent in encoding "LATIN6"
SELECT * FROM "Unicode data" WHERE i = 'ukr+';
 i | t 
---+---
(0 rows)

DELETE FROM "Unicode data" WHERE t = 'Гей, хлопці, не вспію — на ґанку ваша файна їжа знищується бурундучком._';
ERROR:  character with byte sequence 0xd0 0x93 in encoding "UTF8" has no equivalent in encoding "LATIN6"
SELECT count(*) n FROM "Unicode data" WHERE i = 'ukr+';
 n 
---
 0
(1 row)

-- 1256, ISO_8859_6
SELECT * FROM "Unicode data" WHERE i = 'ara';
 i | t 
---+---
(0 rows)

SELECT * FROM "Unicode data" WHERE t LIKE '%ضَظَغ%';
ERROR:  character with byte sequence 0xd8 0xb6 in encoding "UTF8" has no equivalent in encoding "LATIN6"
INSERT INTO "Unicode data" (i, t) VALUES ('ara+', 'أبجد هوَّز حُطّي كلَمُن سَعْفَص قُرِشَت ثَخَدٌ ضَظَغ_');
ERROR:  character with byte sequence 0xd8 0xa3 in encoding "UTF8" has no equivalent in encoding "LATIN6"
SELECT * FROM "Unicode data" WHERE i = 'ara+';
 i | t 
---+---
(0 rows)

DELETE FROM "Unicode data" WHERE t = 'أبجد هوَّز حُطّي كلَمُن سَعْفَص قُرِشَت ثَخَدٌ ضَظَغ_';
ERROR:  character with byte sequence 0xd8 0xa3 in encoding "UTF8" has no equivalent in encoding "LATIN6"
SELECT count(*) n FROM "Unicode data" WHERE i = 'ara+';
 n 
---
 0
(1 row)

-- 1253, ISO_8859_7
SELECT * FROM "Unicode data" WHERE i = 'gre';
 i | t 
---+---
(0 rows)

SELECT * FROM "Unicode data" WHERE t LIKE 'Τάχισ%';
ERROR:  character with byte sequence 0xce 0xa4 in encoding "UTF8" has no equivalent in encoding "LATIN6"
INSERT INTO "Unicode data" (i, t) VALUES ('gre+', 'Τάχιστη αλώπηξ βαφής ψημένη γη, δρασκελίζει υπέρ νωθρού κυνός_');
ERROR:  character with byte sequence 0xce 0xa4 in encoding "UTF8" has no equivalent in encoding "LATIN6"
SELECT * FROM "Unicode data" WHERE i = 'gre+';
 i | t 
---+---
(0 rows)

DELETE FROM "Unicode data" WHERE t = 'Τάχιστη αλώπηξ βαφής ψημένη γη, δρασκελίζει υπέρ νωθρού κυνός_';
ERROR:  character with byte sequence 0xce 0xa4 in encoding "UTF8" has no equivalent in encoding "LATIN6"
-- 1255, ISO_8859_8
SELECT * FROM "Unicode data" WHERE i = 'heb';
 i | t 
---+---
(0 rows)

SELECT * FROM "Unicode data" WHERE t LIKE '%כי ח%';
ERROR:  character with byte sequence 0xd7 0x9b in encoding "UTF8" has no equivalent in encoding "LATIN6"
INSERT INTO "Unicode data" (i, t) VALUES ('heb+', 'עטלף אבק נס דרך מזגן שהתפוצץ כי חם_');
ERROR:  character with byte sequence 0xd7 0xa2 in encoding "UTF8" has no equivalent in encoding "LATIN6"
SELECT * FROM "Unicode data" WHERE i = 'heb+';
 i | t 
---+---
(0 rows)

DELETE FROM "Unicode data" WHERE t = 'עטלף אבק נס דרך מזגן שהתפוצץ כי חם_';
ERROR:  character with byte sequence 0xd7 0xa2 in encoding "UTF8" has no equivalent in encoding "LATIN6"
SELECT count(*) n FROM "Unicode data" WHERE i = 'heb+';
 n 
---
 0
(1 row)

-- 1252, LATIN1
SELECT * FROM "Unicode data" WHERE i = 'eus';
 i | t 
---+---
(0 rows)

SELECT * FROM "Unicode data" WHERE i = 'fra';
 i | t 
---+---
(0 rows)

SELECT * FROM "Unicode data" WHERE i = 'spa';
 i | t 
---+---
(0 rows)

SELECT * FROM "Unicode data" WHERE t LIKE 'Permi%';
    i    |              t               
---------+------------------------------
 utf_eus | Permin gox dabiltzu yoskiÃą.
(1 row)

SELECT * FROM "Unicode data" WHERE t LIKE 'Dès N%';
ERROR:  character with byte sequence 0xc3 0xa8 in encoding "UTF8" has no equivalent in encoding "LATIN6"
SELECT * FROM "Unicode data" WHERE t LIKE 'Quier%';
    i    |                            t                             
---------+----------------------------------------------------------
 utf_spa | Quiere la boca exhausta vid, kiwi, piÃąa y fugaz jamÃģn.
(1 row)

INSERT INTO "Unicode data" (i, t) VALUES ('eus+', 'Permin gox dabiltzu yoskiñ._');
ERROR:  character with byte sequence 0xc3 0xb1 in encoding "UTF8" has no equivalent in encoding "LATIN6"
SELECT * FROM "Unicode data" WHERE i = 'eus+';
 i | t 
---+---
(0 rows)

DELETE FROM "Unicode data" WHERE t = 'Permin gox dabiltzu yoskiñ._';
ERROR:  character with byte sequence 0xc3 0xb1 in encoding "UTF8" has no equivalent in encoding "LATIN6"
SELECT count(*) n FROM "Unicode data" WHERE i = 'eus+';
 n 
---
 0
(1 row)

INSERT INTO "Unicode data" (i, t) VALUES ('fra+', 'Dès Noël où un zéphyr haï me vêt de glaçons würmiens je dîne d’exquis rôtis de bœuf au kir à l’aÿ d’âge mûr & cætera !_');
ERROR:  character with byte sequence 0xc3 0xa8 in encoding "UTF8" has no equivalent in encoding "LATIN6"
SELECT * FROM "Unicode data" WHERE i = 'fra+';
 i | t 
---+---
(0 rows)

DELETE FROM "Unicode data" WHERE t = 'Dès Noël où un zéphyr haï me vêt de glaçons würmiens je dîne d’exquis rôtis de bœuf au kir à l’aÿ d’âge mûr & cætera !_';
ERROR:  character with byte sequence 0xc3 0xa8 in encoding "UTF8" has no equivalent in encoding "LATIN6"
SELECT count(*) n FROM "Unicode data" WHERE i = 'fra+';
 n 
---
 0
(1 row)

INSERT INTO "Unicode data" (i, t) VALUES ('spa+', 'Quiere la boca exhausta vid, kiwi, piña y fugaz jamón._');
ERROR:  character with byte sequence 0xc3 0xb1 in encoding "UTF8" has no equivalent in encoding "LATIN6"
SELECT * FROM "Unicode data" WHERE i = 'spa+';
 i | t 
---+---
(0 rows)

DELETE FROM "Unicode data" WHERE t = 'Quiere la boca exhausta vid, kiwi, piña y fugaz jamón._';
ERROR:  character with byte sequence 0xc3 0xb1 in encoding "UTF8" has no equivalent in encoding "LATIN6"
SELECT count(*) n FROM "Unicode data" WHERE i = 'spa+';
 n 
---
 0
(1 row)

-- 1250, LATIN2
SELECT * FROM "Unicode data" WHERE i = 'cze';
 i | t 
---+---
(0 rows)

SELECT * FROM "Unicode data" WHERE i = 'pol';
 i | t 
---+---
(0 rows)

SELECT * FROM "Unicode data" WHERE i = 'srp';
 i | t 
---+---
(0 rows)

SELECT * FROM "Unicode data" WHERE t LIKE 'Zvláš%';
 i | t 
---+---
(0 rows)

SELECT * FROM "Unicode data" WHERE t LIKE 'Pchną%';
 i | t 
---+---
(0 rows)

SELECT * FROM "Unicode data" WHERE t LIKE 'Ljuba%';
    i    |                                          t                                           
---------+--------------------------------------------------------------------------------------
 utf_srp | Ljubavi, Olga, hajde poÄ\u0091i u FudÅūi i Ä\u008Dut Ä\u0087eÅĄ njeÅūnu muziku srca.
(1 row)

INSERT INTO "Unicode data" (i, t) VALUES ('cze+', 'Zvlášť zákeřný učeň s ďolíčky běží podél zóny úlů._');
ERROR:  character with byte sequence 0xc5 0xa5 in encoding "UTF8" has no equivalent in encoding "LATIN6"
SELECT * FROM "Unicode data" WHERE i = 'cze+';
 i | t 
---+---
(0 rows)

DELETE FROM "Unicode data" WHERE t = 'Zvlášť zákeřný učeň s ďolíčky běží podél zóny úlů._';
ERROR:  character with byte sequence 0xc5 0xa5 in encoding "UTF8" has no equivalent in encoding "LATIN6"
SELECT count(*) n FROM "Unicode data" WHERE i = 'cze+';
 n 
---
 0
(1 row)

INSERT INTO "Unicode data" (i, t) VALUES ('pol+', 'Pchnąć w tę łódź jeża lub ośm skrzyń fig._');
ERROR:  character with byte sequence 0xc4 0x87 in encoding "UTF8" has no equivalent in encoding "LATIN6"
SELECT * FROM "Unicode data" WHERE i = 'pol+';
 i | t 
---+---
(0 rows)

DELETE FROM "Unicode data" WHERE t = 'Pchnąć w tę łódź jeża lub ośm skrzyń fig._';
ERROR:  character with byte sequence 0xc4 0x87 in encoding "UTF8" has no equivalent in encoding "LATIN6"
SELECT count(*) n FROM "Unicode data" WHERE i = 'pol+';
 n 
---
 0
(1 row)

INSERT INTO "Unicode data" (i, t) VALUES ('srp+', 'Ljubavi, Olga, hajde pođi u Fudži i čut ćeš nježnu muziku srca._');
ERROR:  character with byte sequence 0xc4 0x87 in encoding "UTF8" has no equivalent in encoding "LATIN6"
SELECT * FROM "Unicode data" WHERE i = 'srp+';
 i | t 
---+---
(0 rows)

DELETE FROM "Unicode data" WHERE t = 'Ljubavi, Olga, hajde pođi u Fudži i čut ćeš nježnu muziku srca._';
ERROR:  character with byte sequence 0xc4 0x87 in encoding "UTF8" has no equivalent in encoding "LATIN6"
SELECT count(*) n FROM "Unicode data" WHERE i = 'srp+';
 n 
---
 0
(1 row)

-- 1257, LATIN7
SELECT * FROM "Unicode data" WHERE i = 'lav';
 i | t 
---+---
(0 rows)

SELECT * FROM "Unicode data" WHERE t LIKE 'Ķieģeļu%';
 i | t 
---+---
(0 rows)

INSERT INTO "Unicode data" (i, t) VALUES ('lav+', 'Ķieģeļu cepējs Edgars Buls fraku un hūti žāvē uz čīkstošām eņģēm._');
SELECT * FROM "Unicode data" WHERE i = 'lav+';
  i   |                                 t                                  
------+--------------------------------------------------------------------
 lav+ | Ķieģeļu cepējs Edgars Buls fraku un hūti žāvē uz čīkstošām eņģēm._
(1 row)

DELETE FROM "Unicode data" WHERE t = 'Ķieģeļu cepējs Edgars Buls fraku un hūti žāvē uz čīkstošām eņģēm._';
SELECT count(*) n FROM "Unicode data" WHERE i = 'lav+';
 n 
---
 0
(1 row)

-- EUC_KR
SELECT * FROM "Unicode data" WHERE i = 'kor';
 i | t 
---+---
(0 rows)

SELECT * FROM "Unicode data" WHERE t LIKE '키스의 고%';
ERROR:  character with byte sequence 0xed 0x82 0xa4 in encoding "UTF8" has no equivalent in encoding "LATIN6"
INSERT INTO "Unicode data" (i, t) VALUES ('kor+', '키스의 고유조건은 입술끼리 만나야 하고 특별한 기술은 필요치 않다._');
ERROR:  character with byte sequence 0xed 0x82 0xa4 in encoding "UTF8" has no equivalent in encoding "LATIN6"
SELECT * FROM "Unicode data" WHERE i = 'kor+';
 i | t 
---+---
(0 rows)

DELETE FROM "Unicode data" WHERE t = '키스의 고유조건은 입술끼리 만나야 하고 특별한 기술은 필요치 않다._';
ERROR:  character with byte sequence 0xed 0x82 0xa4 in encoding "UTF8" has no equivalent in encoding "LATIN6"
SELECT count(*) n FROM "Unicode data" WHERE i = 'kor+';
 n 
---
 0
(1 row)

-- 1254, LATIN5
SELECT * FROM "Unicode data" WHERE i = 'aze';
 i | t 
---+---
(0 rows)

SELECT * FROM "Unicode data" WHERE t LIKE 'Zəfər%';
ERROR:  character with byte sequence 0xc9 0x99 in encoding "UTF8" has no equivalent in encoding "LATIN6"
INSERT INTO "Unicode data" (i, t) VALUES ('aze+', 'Zəfər, jaketini də, papağını da götür, bu axşam hava çox soyuq olacaq._');
ERROR:  character with byte sequence 0xc9 0x99 in encoding "UTF8" has no equivalent in encoding "LATIN6"
SELECT * FROM "Unicode data" WHERE i = 'aze+';
 i | t 
---+---
(0 rows)

DELETE FROM "Unicode data" WHERE t = 'Zəfər, jaketini də, papağını da götür, bu axşam hava çox soyuq olacaq._';
ERROR:  character with byte sequence 0xc9 0x99 in encoding "UTF8" has no equivalent in encoding "LATIN6"
SELECT count(*) n FROM "Unicode data" WHERE i = 'aze+';
 n 
---
 0
(1 row)

-- etc
INSERT INTO "Unicode data" (i, t) VALUES ('arm+', 'Բել դղյակի ձախ ժամն օֆ ազգությանը ցպահանջ չճշտած վնաս էր եւ փառք։_');
ERROR:  character with byte sequence 0xd4 0xb2 in encoding "UTF8" has no equivalent in encoding "LATIN6"
SELECT * FROM "Unicode data" WHERE i = 'arm+';
 i | t 
---+---
(0 rows)

DELETE FROM "Unicode data" WHERE t = 'Բել դղյակի ձախ ժամն օֆ ազգությանը ցպահանջ չճշտած վնաս էր եւ փառք։_';
ERROR:  character with byte sequence 0xd4 0xb2 in encoding "UTF8" has no equivalent in encoding "LATIN6"
SELECT count(*) n FROM "Unicode data" WHERE i = 'arm+';
 n 
---
 0
(1 row)

INSERT INTO "Unicode data" (i, t) VALUES ('gle+', 'Chuaigh bé mhórshách le dlúthspád fíorfhinn trí hata mo dhea-phorcáin bhig._');
SELECT * FROM "Unicode data" WHERE i = 'gle+';
  i   |                                      t                                       
------+------------------------------------------------------------------------------
 gle+ | Chuaigh bé mhórshách le dlúthspád fíorfhinn trí hata mo dhea-phorcáin bhig._
(1 row)

DELETE FROM "Unicode data" WHERE t = 'Chuaigh bé mhórshách le dlúthspád fíorfhinn trí hata mo dhea-phorcáin bhig._';
SELECT count(*) n FROM "Unicode data" WHERE i = 'gle+';
 n 
---
 0
(1 row)

INSERT INTO "Unicode data" (i, t) VALUES ('epo+', 'Laŭ Ludoviko Zamenhof bongustas freŝa ĉeĥa manĝaĵo kun spicoj._');
ERROR:  character with byte sequence 0xc5 0xad in encoding "UTF8" has no equivalent in encoding "LATIN6"
SELECT * FROM "Unicode data" WHERE i = 'epo+';
 i | t 
---+---
(0 rows)

DELETE FROM "Unicode data" WHERE t = 'Laŭ Ludoviko Zamenhof bongustas freŝa ĉeĥa manĝaĵo kun spicoj._';
ERROR:  character with byte sequence 0xc5 0xad in encoding "UTF8" has no equivalent in encoding "LATIN6"
SELECT count(*) n FROM "Unicode data" WHERE i = 'epo+';
 n 
---
 0
(1 row)

DROP FOREIGN TABLE "Unicode data";
DROP SERVER redis_testing_server CASCADE;
NOTICE:  drop cascades to user mapping for public on server redis_testing_server
DROP EXTENSION redis_fdw;
\connect contrib_regression;
DROP DATABASE "contrib_regression_LATIN6";
-- LATIN7
CREATE DATABASE "contrib_regression_LATIN7" ENCODING LATIN7 LC_CTYPE='POSIX' LC_COLLATE='POSIX' template template0;
\connect "contrib_regression_LATIN7"
CREATE EXTENSION redis_fdw;
CREATE SERVER redis_testing_server FOREIGN DATA WRAPPER redis_fdw;
CREATE FOREIGN TABLE "Unicode data"(i text, t text)
SERVER redis_testing_server
OPTIONS (database '15');
CREATE USER MAPPING FOR public SERVER redis_testing_server; 
-- EUC_JP
SELECT * FROM "Unicode data" WHERE i = 'jap';
 i | t 
---+---
(0 rows)

SELECT * FROM "Unicode data" WHERE t LIKE 'いろはにほ%';
ERROR:  character with byte sequence 0xe3 0x81 0x84 in encoding "UTF8" has no equivalent in encoding "LATIN7"
INSERT INTO "Unicode data" (i, t) VALUES ('jap+', 'いろはにほへと ちりぬるを わかよたれそ つねならむ うゐのおくやま けふこえて あさきゆめみし ゑひもせす._');
ERROR:  character with byte sequence 0xe3 0x81 0x84 in encoding "UTF8" has no equivalent in encoding "LATIN7"
DELETE FROM "Unicode data" WHERE t = 'いろはにほへと ちりぬるを わかよたれそ つねならむ うゐのおくやま けふこえて あさきゆめみし ゑひもせす._';
ERROR:  character with byte sequence 0xe3 0x81 0x84 in encoding "UTF8" has no equivalent in encoding "LATIN7"
SELECT count(*) n FROM "Unicode data" WHERE i = 'jap+';
 n 
---
 0
(1 row)

-- 1251, ISO_8859_5
SELECT * FROM "Unicode data" WHERE i = 'bel';
 i | t 
---+---
(0 rows)

SELECT * FROM "Unicode data" WHERE i = 'bul';
 i | t 
---+---
(0 rows)

SELECT * FROM "Unicode data" WHERE i = 'rus';
 i | t 
---+---
(0 rows)

SELECT * FROM "Unicode data" WHERE i = 'ukr';
 i | t 
---+---
(0 rows)

SELECT * FROM "Unicode data" WHERE t LIKE 'У руд%';
ERROR:  character with byte sequence 0xd0 0xa3 in encoding "UTF8" has no equivalent in encoding "LATIN7"
SELECT * FROM "Unicode data" WHERE t LIKE 'Ах, ч%';
ERROR:  character with byte sequence 0xd0 0x90 in encoding "UTF8" has no equivalent in encoding "LATIN7"
SELECT * FROM "Unicode data" WHERE t LIKE 'Широк%';
ERROR:  character with byte sequence 0xd0 0xa8 in encoding "UTF8" has no equivalent in encoding "LATIN7"
SELECT * FROM "Unicode data" WHERE t LIKE 'Гей, %';
ERROR:  character with byte sequence 0xd0 0x93 in encoding "UTF8" has no equivalent in encoding "LATIN7"
INSERT INTO "Unicode data" (i, t) VALUES ('bel+', 'У рудога вераб’я ў сховішчы пад фатэлем ляжаць нейкія гаючыя зёлкі._');
ERROR:  character with byte sequence 0xd0 0xa3 in encoding "UTF8" has no equivalent in encoding "LATIN7"
SELECT * FROM "Unicode data" WHERE i = 'bel+';
 i | t 
---+---
(0 rows)

DELETE FROM "Unicode data" WHERE t = 'У рудога вераб’я ў сховішчы пад фатэлем ляжаць нейкія гаючыя зёлкі._';
ERROR:  character with byte sequence 0xd0 0xa3 in encoding "UTF8" has no equivalent in encoding "LATIN7"
SELECT count(*) n FROM "Unicode data" WHERE i = 'bel+';
 n 
---
 0
(1 row)

INSERT INTO "Unicode data" (i, t) VALUES ('bul+', 'Ах, чудна българска земьо, полюшвай цъфтящи жита._');
ERROR:  character with byte sequence 0xd0 0x90 in encoding "UTF8" has no equivalent in encoding "LATIN7"
SELECT * FROM "Unicode data" WHERE i = 'bul+';
 i | t 
---+---
(0 rows)

DELETE FROM "Unicode data" WHERE t = 'Ах, чудна българска земьо, полюшвай цъфтящи жита._';
ERROR:  character with byte sequence 0xd0 0x90 in encoding "UTF8" has no equivalent in encoding "LATIN7"
SELECT count(*) n FROM "Unicode data" WHERE i = 'bul+';
 n 
---
 0
(1 row)

INSERT INTO "Unicode data" (i, t) VALUES ('rus+', 'Широкая электрификация южных губерний даст мощный толчок подъёму сельского хозяйства._');
ERROR:  character with byte sequence 0xd0 0xa8 in encoding "UTF8" has no equivalent in encoding "LATIN7"
SELECT * FROM "Unicode data" WHERE i = 'rus+';
 i | t 
---+---
(0 rows)

DELETE FROM "Unicode data" WHERE t = 'Широкая электрификация южных губерний даст мощный толчок подъёму сельского хозяйства._';
ERROR:  character with byte sequence 0xd0 0xa8 in encoding "UTF8" has no equivalent in encoding "LATIN7"
SELECT count(*) n FROM "Unicode data" WHERE i = 'rus+';
 n 
---
 0
(1 row)

INSERT INTO "Unicode data" (i, t) VALUES ('ukr+', 'Гей, хлопці, не вспію — на ґанку ваша файна їжа знищується бурундучком._');
ERROR:  character with byte sequence 0xd0 0x93 in encoding "UTF8" has no equivalent in encoding "LATIN7"
SELECT * FROM "Unicode data" WHERE i = 'ukr+';
 i | t 
---+---
(0 rows)

DELETE FROM "Unicode data" WHERE t = 'Гей, хлопці, не вспію — на ґанку ваша файна їжа знищується бурундучком._';
ERROR:  character with byte sequence 0xd0 0x93 in encoding "UTF8" has no equivalent in encoding "LATIN7"
SELECT count(*) n FROM "Unicode data" WHERE i = 'ukr+';
 n 
---
 0
(1 row)

-- 1256, ISO_8859_6
SELECT * FROM "Unicode data" WHERE i = 'ara';
 i | t 
---+---
(0 rows)

SELECT * FROM "Unicode data" WHERE t LIKE '%ضَظَغ%';
ERROR:  character with byte sequence 0xd8 0xb6 in encoding "UTF8" has no equivalent in encoding "LATIN7"
INSERT INTO "Unicode data" (i, t) VALUES ('ara+', 'أبجد هوَّز حُطّي كلَمُن سَعْفَص قُرِشَت ثَخَدٌ ضَظَغ_');
ERROR:  character with byte sequence 0xd8 0xa3 in encoding "UTF8" has no equivalent in encoding "LATIN7"
SELECT * FROM "Unicode data" WHERE i = 'ara+';
 i | t 
---+---
(0 rows)

DELETE FROM "Unicode data" WHERE t = 'أبجد هوَّز حُطّي كلَمُن سَعْفَص قُرِشَت ثَخَدٌ ضَظَغ_';
ERROR:  character with byte sequence 0xd8 0xa3 in encoding "UTF8" has no equivalent in encoding "LATIN7"
SELECT count(*) n FROM "Unicode data" WHERE i = 'ara+';
 n 
---
 0
(1 row)

-- 1253, ISO_8859_7
SELECT * FROM "Unicode data" WHERE i = 'gre';
 i | t 
---+---
(0 rows)

SELECT * FROM "Unicode data" WHERE t LIKE 'Τάχισ%';
ERROR:  character with byte sequence 0xce 0xa4 in encoding "UTF8" has no equivalent in encoding "LATIN7"
INSERT INTO "Unicode data" (i, t) VALUES ('gre+', 'Τάχιστη αλώπηξ βαφής ψημένη γη, δρασκελίζει υπέρ νωθρού κυνός_');
ERROR:  character with byte sequence 0xce 0xa4 in encoding "UTF8" has no equivalent in encoding "LATIN7"
SELECT * FROM "Unicode data" WHERE i = 'gre+';
 i | t 
---+---
(0 rows)

DELETE FROM "Unicode data" WHERE t = 'Τάχιστη αλώπηξ βαφής ψημένη γη, δρασκελίζει υπέρ νωθρού κυνός_';
ERROR:  character with byte sequence 0xce 0xa4 in encoding "UTF8" has no equivalent in encoding "LATIN7"
-- 1255, ISO_8859_8
SELECT * FROM "Unicode data" WHERE i = 'heb';
 i | t 
---+---
(0 rows)

SELECT * FROM "Unicode data" WHERE t LIKE '%כי ח%';
ERROR:  character with byte sequence 0xd7 0x9b in encoding "UTF8" has no equivalent in encoding "LATIN7"
INSERT INTO "Unicode data" (i, t) VALUES ('heb+', 'עטלף אבק נס דרך מזגן שהתפוצץ כי חם_');
ERROR:  character with byte sequence 0xd7 0xa2 in encoding "UTF8" has no equivalent in encoding "LATIN7"
SELECT * FROM "Unicode data" WHERE i = 'heb+';
 i | t 
---+---
(0 rows)

DELETE FROM "Unicode data" WHERE t = 'עטלף אבק נס דרך מזגן שהתפוצץ כי חם_';
ERROR:  character with byte sequence 0xd7 0xa2 in encoding "UTF8" has no equivalent in encoding "LATIN7"
SELECT count(*) n FROM "Unicode data" WHERE i = 'heb+';
 n 
---
 0
(1 row)

-- 1252, LATIN1
SELECT * FROM "Unicode data" WHERE i = 'eus';
 i | t 
---+---
(0 rows)

SELECT * FROM "Unicode data" WHERE i = 'fra';
 i | t 
---+---
(0 rows)

SELECT * FROM "Unicode data" WHERE i = 'spa';
 i | t 
---+---
(0 rows)

SELECT * FROM "Unicode data" WHERE t LIKE 'Permi%';
    i    |              t               
---------+------------------------------
 utf_eus | Permin gox dabiltzu yoskiĆ±.
(1 row)

SELECT * FROM "Unicode data" WHERE t LIKE 'Dès N%';
ERROR:  character with byte sequence 0xc3 0xa8 in encoding "UTF8" has no equivalent in encoding "LATIN7"
SELECT * FROM "Unicode data" WHERE t LIKE 'Quier%';
    i    |                            t                             
---------+----------------------------------------------------------
 utf_spa | Quiere la boca exhausta vid, kiwi, piĆ±a y fugaz jamĆ³n.
(1 row)

INSERT INTO "Unicode data" (i, t) VALUES ('eus+', 'Permin gox dabiltzu yoskiñ._');
ERROR:  character with byte sequence 0xc3 0xb1 in encoding "UTF8" has no equivalent in encoding "LATIN7"
SELECT * FROM "Unicode data" WHERE i = 'eus+';
 i | t 
---+---
(0 rows)

DELETE FROM "Unicode data" WHERE t = 'Permin gox dabiltzu yoskiñ._';
ERROR:  character with byte sequence 0xc3 0xb1 in encoding "UTF8" has no equivalent in encoding "LATIN7"
SELECT count(*) n FROM "Unicode data" WHERE i = 'eus+';
 n 
---
 0
(1 row)

INSERT INTO "Unicode data" (i, t) VALUES ('fra+', 'Dès Noël où un zéphyr haï me vêt de glaçons würmiens je dîne d’exquis rôtis de bœuf au kir à l’aÿ d’âge mûr & cætera !_');
ERROR:  character with byte sequence 0xc3 0xa8 in encoding "UTF8" has no equivalent in encoding "LATIN7"
SELECT * FROM "Unicode data" WHERE i = 'fra+';
 i | t 
---+---
(0 rows)

DELETE FROM "Unicode data" WHERE t = 'Dès Noël où un zéphyr haï me vêt de glaçons würmiens je dîne d’exquis rôtis de bœuf au kir à l’aÿ d’âge mûr & cætera !_';
ERROR:  character with byte sequence 0xc3 0xa8 in encoding "UTF8" has no equivalent in encoding "LATIN7"
SELECT count(*) n FROM "Unicode data" WHERE i = 'fra+';
 n 
---
 0
(1 row)

INSERT INTO "Unicode data" (i, t) VALUES ('spa+', 'Quiere la boca exhausta vid, kiwi, piña y fugaz jamón._');
ERROR:  character with byte sequence 0xc3 0xb1 in encoding "UTF8" has no equivalent in encoding "LATIN7"
SELECT * FROM "Unicode data" WHERE i = 'spa+';
 i | t 
---+---
(0 rows)

DELETE FROM "Unicode data" WHERE t = 'Quiere la boca exhausta vid, kiwi, piña y fugaz jamón._';
ERROR:  character with byte sequence 0xc3 0xb1 in encoding "UTF8" has no equivalent in encoding "LATIN7"
SELECT count(*) n FROM "Unicode data" WHERE i = 'spa+';
 n 
---
 0
(1 row)

-- 1250, LATIN2
SELECT * FROM "Unicode data" WHERE i = 'cze';
 i | t 
---+---
(0 rows)

SELECT * FROM "Unicode data" WHERE i = 'pol';
 i | t 
---+---
(0 rows)

SELECT * FROM "Unicode data" WHERE i = 'srp';
 i | t 
---+---
(0 rows)

SELECT * FROM "Unicode data" WHERE t LIKE 'Zvláš%';
ERROR:  character with byte sequence 0xc3 0xa1 in encoding "UTF8" has no equivalent in encoding "LATIN7"
SELECT * FROM "Unicode data" WHERE t LIKE 'Pchną%';
 i | t 
---+---
(0 rows)

SELECT * FROM "Unicode data" WHERE t LIKE 'Ljuba%';
    i    |                                          t                                           
---------+--------------------------------------------------------------------------------------
 utf_srp | Ljubavi, Olga, hajde poÄ\u0091i u FudÅ¾i i Ä\u008Dut Ä\u0087eÅ” njeÅ¾nu muziku srca.
(1 row)

INSERT INTO "Unicode data" (i, t) VALUES ('cze+', 'Zvlášť zákeřný učeň s ďolíčky běží podél zóny úlů._');
ERROR:  character with byte sequence 0xc3 0xa1 in encoding "UTF8" has no equivalent in encoding "LATIN7"
SELECT * FROM "Unicode data" WHERE i = 'cze+';
 i | t 
---+---
(0 rows)

DELETE FROM "Unicode data" WHERE t = 'Zvlášť zákeřný učeň s ďolíčky běží podél zóny úlů._';
ERROR:  character with byte sequence 0xc3 0xa1 in encoding "UTF8" has no equivalent in encoding "LATIN7"
SELECT count(*) n FROM "Unicode data" WHERE i = 'cze+';
 n 
---
 0
(1 row)

INSERT INTO "Unicode data" (i, t) VALUES ('pol+', 'Pchnąć w tę łódź jeża lub ośm skrzyń fig._');
SELECT * FROM "Unicode data" WHERE i = 'pol+';
  i   |                     t                      
------+--------------------------------------------
 pol+ | Pchnąć w tę łódź jeża lub ośm skrzyń fig._
(1 row)

DELETE FROM "Unicode data" WHERE t = 'Pchnąć w tę łódź jeża lub ośm skrzyń fig._';
SELECT count(*) n FROM "Unicode data" WHERE i = 'pol+';
 n 
---
 0
(1 row)

INSERT INTO "Unicode data" (i, t) VALUES ('srp+', 'Ljubavi, Olga, hajde pođi u Fudži i čut ćeš nježnu muziku srca._');
ERROR:  character with byte sequence 0xc4 0x91 in encoding "UTF8" has no equivalent in encoding "LATIN7"
SELECT * FROM "Unicode data" WHERE i = 'srp+';
 i | t 
---+---
(0 rows)

DELETE FROM "Unicode data" WHERE t = 'Ljubavi, Olga, hajde pođi u Fudži i čut ćeš nježnu muziku srca._';
ERROR:  character with byte sequence 0xc4 0x91 in encoding "UTF8" has no equivalent in encoding "LATIN7"
SELECT count(*) n FROM "Unicode data" WHERE i = 'srp+';
 n 
---
 0
(1 row)

-- 1257, LATIN7
SELECT * FROM "Unicode data" WHERE i = 'lav';
 i | t 
---+---
(0 rows)

SELECT * FROM "Unicode data" WHERE t LIKE 'Ķieģeļu%';
 i | t 
---+---
(0 rows)

INSERT INTO "Unicode data" (i, t) VALUES ('lav+', 'Ķieģeļu cepējs Edgars Buls fraku un hūti žāvē uz čīkstošām eņģēm._');
SELECT * FROM "Unicode data" WHERE i = 'lav+';
  i   |                                 t                                  
------+--------------------------------------------------------------------
 lav+ | Ķieģeļu cepējs Edgars Buls fraku un hūti žāvē uz čīkstošām eņģēm._
(1 row)

DELETE FROM "Unicode data" WHERE t = 'Ķieģeļu cepējs Edgars Buls fraku un hūti žāvē uz čīkstošām eņģēm._';
SELECT count(*) n FROM "Unicode data" WHERE i = 'lav+';
 n 
---
 0
(1 row)

-- EUC_KR
SELECT * FROM "Unicode data" WHERE i = 'kor';
 i | t 
---+---
(0 rows)

SELECT * FROM "Unicode data" WHERE t LIKE '키스의 고%';
ERROR:  character with byte sequence 0xed 0x82 0xa4 in encoding "UTF8" has no equivalent in encoding "LATIN7"
INSERT INTO "Unicode data" (i, t) VALUES ('kor+', '키스의 고유조건은 입술끼리 만나야 하고 특별한 기술은 필요치 않다._');
ERROR:  character with byte sequence 0xed 0x82 0xa4 in encoding "UTF8" has no equivalent in encoding "LATIN7"
SELECT * FROM "Unicode data" WHERE i = 'kor+';
 i | t 
---+---
(0 rows)

DELETE FROM "Unicode data" WHERE t = '키스의 고유조건은 입술끼리 만나야 하고 특별한 기술은 필요치 않다._';
ERROR:  character with byte sequence 0xed 0x82 0xa4 in encoding "UTF8" has no equivalent in encoding "LATIN7"
SELECT count(*) n FROM "Unicode data" WHERE i = 'kor+';
 n 
---
 0
(1 row)

-- 1254, LATIN5
SELECT * FROM "Unicode data" WHERE i = 'aze';
 i | t 
---+---
(0 rows)

SELECT * FROM "Unicode data" WHERE t LIKE 'Zəfər%';
ERROR:  character with byte sequence 0xc9 0x99 in encoding "UTF8" has no equivalent in encoding "LATIN7"
INSERT INTO "Unicode data" (i, t) VALUES ('aze+', 'Zəfər, jaketini də, papağını da götür, bu axşam hava çox soyuq olacaq._');
ERROR:  character with byte sequence 0xc9 0x99 in encoding "UTF8" has no equivalent in encoding "LATIN7"
SELECT * FROM "Unicode data" WHERE i = 'aze+';
 i | t 
---+---
(0 rows)

DELETE FROM "Unicode data" WHERE t = 'Zəfər, jaketini də, papağını da götür, bu axşam hava çox soyuq olacaq._';
ERROR:  character with byte sequence 0xc9 0x99 in encoding "UTF8" has no equivalent in encoding "LATIN7"
SELECT count(*) n FROM "Unicode data" WHERE i = 'aze+';
 n 
---
 0
(1 row)

-- etc
INSERT INTO "Unicode data" (i, t) VALUES ('arm+', 'Բել դղյակի ձախ ժամն օֆ ազգությանը ցպահանջ չճշտած վնաս էր եւ փառք։_');
ERROR:  character with byte sequence 0xd4 0xb2 in encoding "UTF8" has no equivalent in encoding "LATIN7"
SELECT * FROM "Unicode data" WHERE i = 'arm+';
 i | t 
---+---
(0 rows)

DELETE FROM "Unicode data" WHERE t = 'Բել դղյակի ձախ ժամն օֆ ազգությանը ցպահանջ չճշտած վնաս էր եւ փառք։_';
ERROR:  character with byte sequence 0xd4 0xb2 in encoding "UTF8" has no equivalent in encoding "LATIN7"
SELECT count(*) n FROM "Unicode data" WHERE i = 'arm+';
 n 
---
 0
(1 row)

INSERT INTO "Unicode data" (i, t) VALUES ('gle+', 'Chuaigh bé mhórshách le dlúthspád fíorfhinn trí hata mo dhea-phorcáin bhig._');
ERROR:  character with byte sequence 0xc3 0xa1 in encoding "UTF8" has no equivalent in encoding "LATIN7"
SELECT * FROM "Unicode data" WHERE i = 'gle+';
 i | t 
---+---
(0 rows)

DELETE FROM "Unicode data" WHERE t = 'Chuaigh bé mhórshách le dlúthspád fíorfhinn trí hata mo dhea-phorcáin bhig._';
ERROR:  character with byte sequence 0xc3 0xa1 in encoding "UTF8" has no equivalent in encoding "LATIN7"
SELECT count(*) n FROM "Unicode data" WHERE i = 'gle+';
 n 
---
 0
(1 row)

INSERT INTO "Unicode data" (i, t) VALUES ('epo+', 'Laŭ Ludoviko Zamenhof bongustas freŝa ĉeĥa manĝaĵo kun spicoj._');
ERROR:  character with byte sequence 0xc5 0xad in encoding "UTF8" has no equivalent in encoding "LATIN7"
SELECT * FROM "Unicode data" WHERE i = 'epo+';
 i | t 
---+---
(0 rows)

DELETE FROM "Unicode data" WHERE t = 'Laŭ Ludoviko Zamenhof bongustas freŝa ĉeĥa manĝaĵo kun spicoj._';
ERROR:  character with byte sequence 0xc5 0xad in encoding "UTF8" has no equivalent in encoding "LATIN7"
SELECT count(*) n FROM "Unicode data" WHERE i = 'epo+';
 n 
---
 0
(1 row)

DROP FOREIGN TABLE "Unicode data";
DROP SERVER redis_testing_server CASCADE;
NOTICE:  drop cascades to user mapping for public on server redis_testing_server
DROP EXTENSION redis_fdw;
\connect contrib_regression;
DROP DATABASE "contrib_regression_LATIN7";
-- LATIN8
CREATE DATABASE "contrib_regression_LATIN8" ENCODING LATIN8 LC_CTYPE='POSIX' LC_COLLATE='POSIX' template template0;
\connect "contrib_regression_LATIN8"
CREATE EXTENSION redis_fdw;
CREATE SERVER redis_testing_server FOREIGN DATA WRAPPER redis_fdw;
CREATE FOREIGN TABLE "Unicode data"(i text, t text)
SERVER redis_testing_server
OPTIONS (database '15');
CREATE USER MAPPING FOR public SERVER redis_testing_server; 
-- EUC_JP
SELECT * FROM "Unicode data" WHERE i = 'jap';
 i | t 
---+---
(0 rows)

SELECT * FROM "Unicode data" WHERE t LIKE 'いろはにほ%';
ERROR:  character with byte sequence 0xe3 0x81 0x84 in encoding "UTF8" has no equivalent in encoding "LATIN8"
INSERT INTO "Unicode data" (i, t) VALUES ('jap+', 'いろはにほへと ちりぬるを わかよたれそ つねならむ うゐのおくやま けふこえて あさきゆめみし ゑひもせす._');
ERROR:  character with byte sequence 0xe3 0x81 0x84 in encoding "UTF8" has no equivalent in encoding "LATIN8"
DELETE FROM "Unicode data" WHERE t = 'いろはにほへと ちりぬるを わかよたれそ つねならむ うゐのおくやま けふこえて あさきゆめみし ゑひもせす._';
ERROR:  character with byte sequence 0xe3 0x81 0x84 in encoding "UTF8" has no equivalent in encoding "LATIN8"
SELECT count(*) n FROM "Unicode data" WHERE i = 'jap+';
 n 
---
 0
(1 row)

-- 1251, ISO_8859_5
SELECT * FROM "Unicode data" WHERE i = 'bel';
 i | t 
---+---
(0 rows)

SELECT * FROM "Unicode data" WHERE i = 'bul';
 i | t 
---+---
(0 rows)

SELECT * FROM "Unicode data" WHERE i = 'rus';
 i | t 
---+---
(0 rows)

SELECT * FROM "Unicode data" WHERE i = 'ukr';
 i | t 
---+---
(0 rows)

SELECT * FROM "Unicode data" WHERE t LIKE 'У руд%';
ERROR:  character with byte sequence 0xd0 0xa3 in encoding "UTF8" has no equivalent in encoding "LATIN8"
SELECT * FROM "Unicode data" WHERE t LIKE 'Ах, ч%';
ERROR:  character with byte sequence 0xd0 0x90 in encoding "UTF8" has no equivalent in encoding "LATIN8"
SELECT * FROM "Unicode data" WHERE t LIKE 'Широк%';
ERROR:  character with byte sequence 0xd0 0xa8 in encoding "UTF8" has no equivalent in encoding "LATIN8"
SELECT * FROM "Unicode data" WHERE t LIKE 'Гей, %';
ERROR:  character with byte sequence 0xd0 0x93 in encoding "UTF8" has no equivalent in encoding "LATIN8"
INSERT INTO "Unicode data" (i, t) VALUES ('bel+', 'У рудога вераб’я ў сховішчы пад фатэлем ляжаць нейкія гаючыя зёлкі._');
ERROR:  character with byte sequence 0xd0 0xa3 in encoding "UTF8" has no equivalent in encoding "LATIN8"
SELECT * FROM "Unicode data" WHERE i = 'bel+';
 i | t 
---+---
(0 rows)

DELETE FROM "Unicode data" WHERE t = 'У рудога вераб’я ў сховішчы пад фатэлем ляжаць нейкія гаючыя зёлкі._';
ERROR:  character with byte sequence 0xd0 0xa3 in encoding "UTF8" has no equivalent in encoding "LATIN8"
SELECT count(*) n FROM "Unicode data" WHERE i = 'bel+';
 n 
---
 0
(1 row)

INSERT INTO "Unicode data" (i, t) VALUES ('bul+', 'Ах, чудна българска земьо, полюшвай цъфтящи жита._');
ERROR:  character with byte sequence 0xd0 0x90 in encoding "UTF8" has no equivalent in encoding "LATIN8"
SELECT * FROM "Unicode data" WHERE i = 'bul+';
 i | t 
---+---
(0 rows)

DELETE FROM "Unicode data" WHERE t = 'Ах, чудна българска земьо, полюшвай цъфтящи жита._';
ERROR:  character with byte sequence 0xd0 0x90 in encoding "UTF8" has no equivalent in encoding "LATIN8"
SELECT count(*) n FROM "Unicode data" WHERE i = 'bul+';
 n 
---
 0
(1 row)

INSERT INTO "Unicode data" (i, t) VALUES ('rus+', 'Широкая электрификация южных губерний даст мощный толчок подъёму сельского хозяйства._');
ERROR:  character with byte sequence 0xd0 0xa8 in encoding "UTF8" has no equivalent in encoding "LATIN8"
SELECT * FROM "Unicode data" WHERE i = 'rus+';
 i | t 
---+---
(0 rows)

DELETE FROM "Unicode data" WHERE t = 'Широкая электрификация южных губерний даст мощный толчок подъёму сельского хозяйства._';
ERROR:  character with byte sequence 0xd0 0xa8 in encoding "UTF8" has no equivalent in encoding "LATIN8"
SELECT count(*) n FROM "Unicode data" WHERE i = 'rus+';
 n 
---
 0
(1 row)

INSERT INTO "Unicode data" (i, t) VALUES ('ukr+', 'Гей, хлопці, не вспію — на ґанку ваша файна їжа знищується бурундучком._');
ERROR:  character with byte sequence 0xd0 0x93 in encoding "UTF8" has no equivalent in encoding "LATIN8"
SELECT * FROM "Unicode data" WHERE i = 'ukr+';
 i | t 
---+---
(0 rows)

DELETE FROM "Unicode data" WHERE t = 'Гей, хлопці, не вспію — на ґанку ваша файна їжа знищується бурундучком._';
ERROR:  character with byte sequence 0xd0 0x93 in encoding "UTF8" has no equivalent in encoding "LATIN8"
SELECT count(*) n FROM "Unicode data" WHERE i = 'ukr+';
 n 
---
 0
(1 row)

-- 1256, ISO_8859_6
SELECT * FROM "Unicode data" WHERE i = 'ara';
 i | t 
---+---
(0 rows)

SELECT * FROM "Unicode data" WHERE t LIKE '%ضَظَغ%';
ERROR:  character with byte sequence 0xd8 0xb6 in encoding "UTF8" has no equivalent in encoding "LATIN8"
INSERT INTO "Unicode data" (i, t) VALUES ('ara+', 'أبجد هوَّز حُطّي كلَمُن سَعْفَص قُرِشَت ثَخَدٌ ضَظَغ_');
ERROR:  character with byte sequence 0xd8 0xa3 in encoding "UTF8" has no equivalent in encoding "LATIN8"
SELECT * FROM "Unicode data" WHERE i = 'ara+';
 i | t 
---+---
(0 rows)

DELETE FROM "Unicode data" WHERE t = 'أبجد هوَّز حُطّي كلَمُن سَعْفَص قُرِشَت ثَخَدٌ ضَظَغ_';
ERROR:  character with byte sequence 0xd8 0xa3 in encoding "UTF8" has no equivalent in encoding "LATIN8"
SELECT count(*) n FROM "Unicode data" WHERE i = 'ara+';
 n 
---
 0
(1 row)

-- 1253, ISO_8859_7
SELECT * FROM "Unicode data" WHERE i = 'gre';
 i | t 
---+---
(0 rows)

SELECT * FROM "Unicode data" WHERE t LIKE 'Τάχισ%';
ERROR:  character with byte sequence 0xce 0xa4 in encoding "UTF8" has no equivalent in encoding "LATIN8"
INSERT INTO "Unicode data" (i, t) VALUES ('gre+', 'Τάχιστη αλώπηξ βαφής ψημένη γη, δρασκελίζει υπέρ νωθρού κυνός_');
ERROR:  character with byte sequence 0xce 0xa4 in encoding "UTF8" has no equivalent in encoding "LATIN8"
SELECT * FROM "Unicode data" WHERE i = 'gre+';
 i | t 
---+---
(0 rows)

DELETE FROM "Unicode data" WHERE t = 'Τάχιστη αλώπηξ βαφής ψημένη γη, δρασκελίζει υπέρ νωθρού κυνός_';
ERROR:  character with byte sequence 0xce 0xa4 in encoding "UTF8" has no equivalent in encoding "LATIN8"
-- 1255, ISO_8859_8
SELECT * FROM "Unicode data" WHERE i = 'heb';
 i | t 
---+---
(0 rows)

SELECT * FROM "Unicode data" WHERE t LIKE '%כי ח%';
ERROR:  character with byte sequence 0xd7 0x9b in encoding "UTF8" has no equivalent in encoding "LATIN8"
INSERT INTO "Unicode data" (i, t) VALUES ('heb+', 'עטלף אבק נס דרך מזגן שהתפוצץ כי חם_');
ERROR:  character with byte sequence 0xd7 0xa2 in encoding "UTF8" has no equivalent in encoding "LATIN8"
SELECT * FROM "Unicode data" WHERE i = 'heb+';
 i | t 
---+---
(0 rows)

DELETE FROM "Unicode data" WHERE t = 'עטלף אבק נס דרך מזגן שהתפוצץ כי חם_';
ERROR:  character with byte sequence 0xd7 0xa2 in encoding "UTF8" has no equivalent in encoding "LATIN8"
SELECT count(*) n FROM "Unicode data" WHERE i = 'heb+';
 n 
---
 0
(1 row)

-- 1252, LATIN1
SELECT * FROM "Unicode data" WHERE i = 'eus';
 i | t 
---+---
(0 rows)

SELECT * FROM "Unicode data" WHERE i = 'fra';
 i | t 
---+---
(0 rows)

SELECT * FROM "Unicode data" WHERE i = 'spa';
 i | t 
---+---
(0 rows)

SELECT * FROM "Unicode data" WHERE t LIKE 'Permi%';
    i    |              t               
---------+------------------------------
 utf_eus | Permin gox dabiltzu yoskiÃḟ.
(1 row)

SELECT * FROM "Unicode data" WHERE t LIKE 'Dès N%';
 i | t 
---+---
(0 rows)

SELECT * FROM "Unicode data" WHERE t LIKE 'Quier%';
    i    |                            t                             
---------+----------------------------------------------------------
 utf_spa | Quiere la boca exhausta vid, kiwi, piÃḟa y fugaz jamÃġn.
(1 row)

INSERT INTO "Unicode data" (i, t) VALUES ('eus+', 'Permin gox dabiltzu yoskiñ._');
SELECT * FROM "Unicode data" WHERE i = 'eus+';
  i   |              t               
------+------------------------------
 eus+ | Permin gox dabiltzu yoskiñ._
(1 row)

DELETE FROM "Unicode data" WHERE t = 'Permin gox dabiltzu yoskiñ._';
SELECT count(*) n FROM "Unicode data" WHERE i = 'eus+';
 n 
---
 0
(1 row)

INSERT INTO "Unicode data" (i, t) VALUES ('fra+', 'Dès Noël où un zéphyr haï me vêt de glaçons würmiens je dîne d’exquis rôtis de bœuf au kir à l’aÿ d’âge mûr & cætera !_');
ERROR:  character with byte sequence 0xe2 0x80 0x99 in encoding "UTF8" has no equivalent in encoding "LATIN8"
SELECT * FROM "Unicode data" WHERE i = 'fra+';
 i | t 
---+---
(0 rows)

DELETE FROM "Unicode data" WHERE t = 'Dès Noël où un zéphyr haï me vêt de glaçons würmiens je dîne d’exquis rôtis de bœuf au kir à l’aÿ d’âge mûr & cætera !_';
ERROR:  character with byte sequence 0xe2 0x80 0x99 in encoding "UTF8" has no equivalent in encoding "LATIN8"
SELECT count(*) n FROM "Unicode data" WHERE i = 'fra+';
 n 
---
 0
(1 row)

INSERT INTO "Unicode data" (i, t) VALUES ('spa+', 'Quiere la boca exhausta vid, kiwi, piña y fugaz jamón._');
SELECT * FROM "Unicode data" WHERE i = 'spa+';
  i   |                            t                            
------+---------------------------------------------------------
 spa+ | Quiere la boca exhausta vid, kiwi, piña y fugaz jamón._
(1 row)

DELETE FROM "Unicode data" WHERE t = 'Quiere la boca exhausta vid, kiwi, piña y fugaz jamón._';
SELECT count(*) n FROM "Unicode data" WHERE i = 'spa+';
 n 
---
 0
(1 row)

-- 1250, LATIN2
SELECT * FROM "Unicode data" WHERE i = 'cze';
 i | t 
---+---
(0 rows)

SELECT * FROM "Unicode data" WHERE i = 'pol';
 i | t 
---+---
(0 rows)

SELECT * FROM "Unicode data" WHERE i = 'srp';
 i | t 
---+---
(0 rows)

SELECT * FROM "Unicode data" WHERE t LIKE 'Zvláš%';
ERROR:  character with byte sequence 0xc5 0xa1 in encoding "UTF8" has no equivalent in encoding "LATIN8"
SELECT * FROM "Unicode data" WHERE t LIKE 'Pchną%';
ERROR:  character with byte sequence 0xc4 0x85 in encoding "UTF8" has no equivalent in encoding "LATIN8"
SELECT * FROM "Unicode data" WHERE t LIKE 'Ljuba%';
    i    |                                          t                                           
---------+--------------------------------------------------------------------------------------
 utf_srp | Ljubavi, Olga, hajde poÄ\u0091i u FudÅẅi i Ä\u008Dut Ä\u0087eÅḂ njeÅẅnu muziku srca.
(1 row)

INSERT INTO "Unicode data" (i, t) VALUES ('cze+', 'Zvlášť zákeřný učeň s ďolíčky běží podél zóny úlů._');
ERROR:  character with byte sequence 0xc5 0xa1 in encoding "UTF8" has no equivalent in encoding "LATIN8"
SELECT * FROM "Unicode data" WHERE i = 'cze+';
 i | t 
---+---
(0 rows)

DELETE FROM "Unicode data" WHERE t = 'Zvlášť zákeřný učeň s ďolíčky běží podél zóny úlů._';
ERROR:  character with byte sequence 0xc5 0xa1 in encoding "UTF8" has no equivalent in encoding "LATIN8"
SELECT count(*) n FROM "Unicode data" WHERE i = 'cze+';
 n 
---
 0
(1 row)

INSERT INTO "Unicode data" (i, t) VALUES ('pol+', 'Pchnąć w tę łódź jeża lub ośm skrzyń fig._');
ERROR:  character with byte sequence 0xc4 0x85 in encoding "UTF8" has no equivalent in encoding "LATIN8"
SELECT * FROM "Unicode data" WHERE i = 'pol+';
 i | t 
---+---
(0 rows)

DELETE FROM "Unicode data" WHERE t = 'Pchnąć w tę łódź jeża lub ośm skrzyń fig._';
ERROR:  character with byte sequence 0xc4 0x85 in encoding "UTF8" has no equivalent in encoding "LATIN8"
SELECT count(*) n FROM "Unicode data" WHERE i = 'pol+';
 n 
---
 0
(1 row)

INSERT INTO "Unicode data" (i, t) VALUES ('srp+', 'Ljubavi, Olga, hajde pođi u Fudži i čut ćeš nježnu muziku srca._');
ERROR:  character with byte sequence 0xc4 0x91 in encoding "UTF8" has no equivalent in encoding "LATIN8"
SELECT * FROM "Unicode data" WHERE i = 'srp+';
 i | t 
---+---
(0 rows)

DELETE FROM "Unicode data" WHERE t = 'Ljubavi, Olga, hajde pođi u Fudži i čut ćeš nježnu muziku srca._';
ERROR:  character with byte sequence 0xc4 0x91 in encoding "UTF8" has no equivalent in encoding "LATIN8"
SELECT count(*) n FROM "Unicode data" WHERE i = 'srp+';
 n 
---
 0
(1 row)

-- 1257, LATIN7
SELECT * FROM "Unicode data" WHERE i = 'lav';
 i | t 
---+---
(0 rows)

SELECT * FROM "Unicode data" WHERE t LIKE 'Ķieģeļu%';
ERROR:  character with byte sequence 0xc4 0xb6 in encoding "UTF8" has no equivalent in encoding "LATIN8"
INSERT INTO "Unicode data" (i, t) VALUES ('lav+', 'Ķieģeļu cepējs Edgars Buls fraku un hūti žāvē uz čīkstošām eņģēm._');
ERROR:  character with byte sequence 0xc4 0xb6 in encoding "UTF8" has no equivalent in encoding "LATIN8"
SELECT * FROM "Unicode data" WHERE i = 'lav+';
 i | t 
---+---
(0 rows)

DELETE FROM "Unicode data" WHERE t = 'Ķieģeļu cepējs Edgars Buls fraku un hūti žāvē uz čīkstošām eņģēm._';
ERROR:  character with byte sequence 0xc4 0xb6 in encoding "UTF8" has no equivalent in encoding "LATIN8"
SELECT count(*) n FROM "Unicode data" WHERE i = 'lav+';
 n 
---
 0
(1 row)

-- EUC_KR
SELECT * FROM "Unicode data" WHERE i = 'kor';
 i | t 
---+---
(0 rows)

SELECT * FROM "Unicode data" WHERE t LIKE '키스의 고%';
ERROR:  character with byte sequence 0xed 0x82 0xa4 in encoding "UTF8" has no equivalent in encoding "LATIN8"
INSERT INTO "Unicode data" (i, t) VALUES ('kor+', '키스의 고유조건은 입술끼리 만나야 하고 특별한 기술은 필요치 않다._');
ERROR:  character with byte sequence 0xed 0x82 0xa4 in encoding "UTF8" has no equivalent in encoding "LATIN8"
SELECT * FROM "Unicode data" WHERE i = 'kor+';
 i | t 
---+---
(0 rows)

DELETE FROM "Unicode data" WHERE t = '키스의 고유조건은 입술끼리 만나야 하고 특별한 기술은 필요치 않다._';
ERROR:  character with byte sequence 0xed 0x82 0xa4 in encoding "UTF8" has no equivalent in encoding "LATIN8"
SELECT count(*) n FROM "Unicode data" WHERE i = 'kor+';
 n 
---
 0
(1 row)

-- 1254, LATIN5
SELECT * FROM "Unicode data" WHERE i = 'aze';
 i | t 
---+---
(0 rows)

SELECT * FROM "Unicode data" WHERE t LIKE 'Zəfər%';
ERROR:  character with byte sequence 0xc9 0x99 in encoding "UTF8" has no equivalent in encoding "LATIN8"
INSERT INTO "Unicode data" (i, t) VALUES ('aze+', 'Zəfər, jaketini də, papağını da götür, bu axşam hava çox soyuq olacaq._');
ERROR:  character with byte sequence 0xc9 0x99 in encoding "UTF8" has no equivalent in encoding "LATIN8"
SELECT * FROM "Unicode data" WHERE i = 'aze+';
 i | t 
---+---
(0 rows)

DELETE FROM "Unicode data" WHERE t = 'Zəfər, jaketini də, papağını da götür, bu axşam hava çox soyuq olacaq._';
ERROR:  character with byte sequence 0xc9 0x99 in encoding "UTF8" has no equivalent in encoding "LATIN8"
SELECT count(*) n FROM "Unicode data" WHERE i = 'aze+';
 n 
---
 0
(1 row)

-- etc
INSERT INTO "Unicode data" (i, t) VALUES ('arm+', 'Բել դղյակի ձախ ժամն օֆ ազգությանը ցպահանջ չճշտած վնաս էր եւ փառք։_');
ERROR:  character with byte sequence 0xd4 0xb2 in encoding "UTF8" has no equivalent in encoding "LATIN8"
SELECT * FROM "Unicode data" WHERE i = 'arm+';
 i | t 
---+---
(0 rows)

DELETE FROM "Unicode data" WHERE t = 'Բել դղյակի ձախ ժամն օֆ ազգությանը ցպահանջ չճշտած վնաս էր եւ փառք։_';
ERROR:  character with byte sequence 0xd4 0xb2 in encoding "UTF8" has no equivalent in encoding "LATIN8"
SELECT count(*) n FROM "Unicode data" WHERE i = 'arm+';
 n 
---
 0
(1 row)

INSERT INTO "Unicode data" (i, t) VALUES ('gle+', 'Chuaigh bé mhórshách le dlúthspád fíorfhinn trí hata mo dhea-phorcáin bhig._');
SELECT * FROM "Unicode data" WHERE i = 'gle+';
  i   |                                      t                                       
------+------------------------------------------------------------------------------
 gle+ | Chuaigh bé mhórshách le dlúthspád fíorfhinn trí hata mo dhea-phorcáin bhig._
(1 row)

DELETE FROM "Unicode data" WHERE t = 'Chuaigh bé mhórshách le dlúthspád fíorfhinn trí hata mo dhea-phorcáin bhig._';
SELECT count(*) n FROM "Unicode data" WHERE i = 'gle+';
 n 
---
 0
(1 row)

INSERT INTO "Unicode data" (i, t) VALUES ('epo+', 'Laŭ Ludoviko Zamenhof bongustas freŝa ĉeĥa manĝaĵo kun spicoj._');
ERROR:  character with byte sequence 0xc5 0xad in encoding "UTF8" has no equivalent in encoding "LATIN8"
SELECT * FROM "Unicode data" WHERE i = 'epo+';
 i | t 
---+---
(0 rows)

DELETE FROM "Unicode data" WHERE t = 'Laŭ Ludoviko Zamenhof bongustas freŝa ĉeĥa manĝaĵo kun spicoj._';
ERROR:  character with byte sequence 0xc5 0xad in encoding "UTF8" has no equivalent in encoding "LATIN8"
SELECT count(*) n FROM "Unicode data" WHERE i = 'epo+';
 n 
---
 0
(1 row)

DROP FOREIGN TABLE "Unicode data";
DROP SERVER redis_testing_server CASCADE;
NOTICE:  drop cascades to user mapping for public on server redis_testing_server
DROP EXTENSION redis_fdw;
\connect contrib_regression;
DROP DATABASE "contrib_regression_LATIN8";
-- LATIN9
CREATE DATABASE "contrib_regression_LATIN9" ENCODING LATIN9 LC_CTYPE='POSIX' LC_COLLATE='POSIX' template template0;
\connect "contrib_regression_LATIN9"
CREATE EXTENSION redis_fdw;
CREATE SERVER redis_testing_server FOREIGN DATA WRAPPER redis_fdw;
CREATE FOREIGN TABLE "Unicode data"(i text, t text)
SERVER redis_testing_server
OPTIONS (database '15');
CREATE USER MAPPING FOR public SERVER redis_testing_server; 
-- EUC_JP
SELECT * FROM "Unicode data" WHERE i = 'jap';
 i | t 
---+---
(0 rows)

SELECT * FROM "Unicode data" WHERE t LIKE 'いろはにほ%';
ERROR:  character with byte sequence 0xe3 0x81 0x84 in encoding "UTF8" has no equivalent in encoding "LATIN9"
INSERT INTO "Unicode data" (i, t) VALUES ('jap+', 'いろはにほへと ちりぬるを わかよたれそ つねならむ うゐのおくやま けふこえて あさきゆめみし ゑひもせす._');
ERROR:  character with byte sequence 0xe3 0x81 0x84 in encoding "UTF8" has no equivalent in encoding "LATIN9"
DELETE FROM "Unicode data" WHERE t = 'いろはにほへと ちりぬるを わかよたれそ つねならむ うゐのおくやま けふこえて あさきゆめみし ゑひもせす._';
ERROR:  character with byte sequence 0xe3 0x81 0x84 in encoding "UTF8" has no equivalent in encoding "LATIN9"
SELECT count(*) n FROM "Unicode data" WHERE i = 'jap+';
 n 
---
 0
(1 row)

-- 1251, ISO_8859_5
SELECT * FROM "Unicode data" WHERE i = 'bel';
 i | t 
---+---
(0 rows)

SELECT * FROM "Unicode data" WHERE i = 'bul';
 i | t 
---+---
(0 rows)

SELECT * FROM "Unicode data" WHERE i = 'rus';
 i | t 
---+---
(0 rows)

SELECT * FROM "Unicode data" WHERE i = 'ukr';
 i | t 
---+---
(0 rows)

SELECT * FROM "Unicode data" WHERE t LIKE 'У руд%';
ERROR:  character with byte sequence 0xd0 0xa3 in encoding "UTF8" has no equivalent in encoding "LATIN9"
SELECT * FROM "Unicode data" WHERE t LIKE 'Ах, ч%';
ERROR:  character with byte sequence 0xd0 0x90 in encoding "UTF8" has no equivalent in encoding "LATIN9"
SELECT * FROM "Unicode data" WHERE t LIKE 'Широк%';
ERROR:  character with byte sequence 0xd0 0xa8 in encoding "UTF8" has no equivalent in encoding "LATIN9"
SELECT * FROM "Unicode data" WHERE t LIKE 'Гей, %';
ERROR:  character with byte sequence 0xd0 0x93 in encoding "UTF8" has no equivalent in encoding "LATIN9"
INSERT INTO "Unicode data" (i, t) VALUES ('bel+', 'У рудога вераб’я ў сховішчы пад фатэлем ляжаць нейкія гаючыя зёлкі._');
ERROR:  character with byte sequence 0xd0 0xa3 in encoding "UTF8" has no equivalent in encoding "LATIN9"
SELECT * FROM "Unicode data" WHERE i = 'bel+';
 i | t 
---+---
(0 rows)

DELETE FROM "Unicode data" WHERE t = 'У рудога вераб’я ў сховішчы пад фатэлем ляжаць нейкія гаючыя зёлкі._';
ERROR:  character with byte sequence 0xd0 0xa3 in encoding "UTF8" has no equivalent in encoding "LATIN9"
SELECT count(*) n FROM "Unicode data" WHERE i = 'bel+';
 n 
---
 0
(1 row)

INSERT INTO "Unicode data" (i, t) VALUES ('bul+', 'Ах, чудна българска земьо, полюшвай цъфтящи жита._');
ERROR:  character with byte sequence 0xd0 0x90 in encoding "UTF8" has no equivalent in encoding "LATIN9"
SELECT * FROM "Unicode data" WHERE i = 'bul+';
 i | t 
---+---
(0 rows)

DELETE FROM "Unicode data" WHERE t = 'Ах, чудна българска земьо, полюшвай цъфтящи жита._';
ERROR:  character with byte sequence 0xd0 0x90 in encoding "UTF8" has no equivalent in encoding "LATIN9"
SELECT count(*) n FROM "Unicode data" WHERE i = 'bul+';
 n 
---
 0
(1 row)

INSERT INTO "Unicode data" (i, t) VALUES ('rus+', 'Широкая электрификация южных губерний даст мощный толчок подъёму сельского хозяйства._');
ERROR:  character with byte sequence 0xd0 0xa8 in encoding "UTF8" has no equivalent in encoding "LATIN9"
SELECT * FROM "Unicode data" WHERE i = 'rus+';
 i | t 
---+---
(0 rows)

DELETE FROM "Unicode data" WHERE t = 'Широкая электрификация южных губерний даст мощный толчок подъёму сельского хозяйства._';
ERROR:  character with byte sequence 0xd0 0xa8 in encoding "UTF8" has no equivalent in encoding "LATIN9"
SELECT count(*) n FROM "Unicode data" WHERE i = 'rus+';
 n 
---
 0
(1 row)

INSERT INTO "Unicode data" (i, t) VALUES ('ukr+', 'Гей, хлопці, не вспію — на ґанку ваша файна їжа знищується бурундучком._');
ERROR:  character with byte sequence 0xd0 0x93 in encoding "UTF8" has no equivalent in encoding "LATIN9"
SELECT * FROM "Unicode data" WHERE i = 'ukr+';
 i | t 
---+---
(0 rows)

DELETE FROM "Unicode data" WHERE t = 'Гей, хлопці, не вспію — на ґанку ваша файна їжа знищується бурундучком._';
ERROR:  character with byte sequence 0xd0 0x93 in encoding "UTF8" has no equivalent in encoding "LATIN9"
SELECT count(*) n FROM "Unicode data" WHERE i = 'ukr+';
 n 
---
 0
(1 row)

-- 1256, ISO_8859_6
SELECT * FROM "Unicode data" WHERE i = 'ara';
 i | t 
---+---
(0 rows)

SELECT * FROM "Unicode data" WHERE t LIKE '%ضَظَغ%';
ERROR:  character with byte sequence 0xd8 0xb6 in encoding "UTF8" has no equivalent in encoding "LATIN9"
INSERT INTO "Unicode data" (i, t) VALUES ('ara+', 'أبجد هوَّز حُطّي كلَمُن سَعْفَص قُرِشَت ثَخَدٌ ضَظَغ_');
ERROR:  character with byte sequence 0xd8 0xa3 in encoding "UTF8" has no equivalent in encoding "LATIN9"
SELECT * FROM "Unicode data" WHERE i = 'ara+';
 i | t 
---+---
(0 rows)

DELETE FROM "Unicode data" WHERE t = 'أبجد هوَّز حُطّي كلَمُن سَعْفَص قُرِشَت ثَخَدٌ ضَظَغ_';
ERROR:  character with byte sequence 0xd8 0xa3 in encoding "UTF8" has no equivalent in encoding "LATIN9"
SELECT count(*) n FROM "Unicode data" WHERE i = 'ara+';
 n 
---
 0
(1 row)

-- 1253, ISO_8859_7
SELECT * FROM "Unicode data" WHERE i = 'gre';
 i | t 
---+---
(0 rows)

SELECT * FROM "Unicode data" WHERE t LIKE 'Τάχισ%';
ERROR:  character with byte sequence 0xce 0xa4 in encoding "UTF8" has no equivalent in encoding "LATIN9"
INSERT INTO "Unicode data" (i, t) VALUES ('gre+', 'Τάχιστη αλώπηξ βαφής ψημένη γη, δρασκελίζει υπέρ νωθρού κυνός_');
ERROR:  character with byte sequence 0xce 0xa4 in encoding "UTF8" has no equivalent in encoding "LATIN9"
SELECT * FROM "Unicode data" WHERE i = 'gre+';
 i | t 
---+---
(0 rows)

DELETE FROM "Unicode data" WHERE t = 'Τάχιστη αλώπηξ βαφής ψημένη γη, δρασκελίζει υπέρ νωθρού κυνός_';
ERROR:  character with byte sequence 0xce 0xa4 in encoding "UTF8" has no equivalent in encoding "LATIN9"
-- 1255, ISO_8859_8
SELECT * FROM "Unicode data" WHERE i = 'heb';
 i | t 
---+---
(0 rows)

SELECT * FROM "Unicode data" WHERE t LIKE '%כי ח%';
ERROR:  character with byte sequence 0xd7 0x9b in encoding "UTF8" has no equivalent in encoding "LATIN9"
INSERT INTO "Unicode data" (i, t) VALUES ('heb+', 'עטלף אבק נס דרך מזגן שהתפוצץ כי חם_');
ERROR:  character with byte sequence 0xd7 0xa2 in encoding "UTF8" has no equivalent in encoding "LATIN9"
SELECT * FROM "Unicode data" WHERE i = 'heb+';
 i | t 
---+---
(0 rows)

DELETE FROM "Unicode data" WHERE t = 'עטלף אבק נס דרך מזגן שהתפוצץ כי חם_';
ERROR:  character with byte sequence 0xd7 0xa2 in encoding "UTF8" has no equivalent in encoding "LATIN9"
SELECT count(*) n FROM "Unicode data" WHERE i = 'heb+';
 n 
---
 0
(1 row)

-- 1252, LATIN1
SELECT * FROM "Unicode data" WHERE i = 'eus';
 i | t 
---+---
(0 rows)

SELECT * FROM "Unicode data" WHERE i = 'fra';
 i | t 
---+---
(0 rows)

SELECT * FROM "Unicode data" WHERE i = 'spa';
 i | t 
---+---
(0 rows)

SELECT * FROM "Unicode data" WHERE t LIKE 'Permi%';
    i    |              t               
---------+------------------------------
 utf_eus | Permin gox dabiltzu yoskiÃ±.
(1 row)

SELECT * FROM "Unicode data" WHERE t LIKE 'Dès N%';
 i | t 
---+---
(0 rows)

SELECT * FROM "Unicode data" WHERE t LIKE 'Quier%';
    i    |                            t                             
---------+----------------------------------------------------------
 utf_spa | Quiere la boca exhausta vid, kiwi, piÃ±a y fugaz jamÃ³n.
(1 row)

INSERT INTO "Unicode data" (i, t) VALUES ('eus+', 'Permin gox dabiltzu yoskiñ._');
SELECT * FROM "Unicode data" WHERE i = 'eus+';
  i   |              t               
------+------------------------------
 eus+ | Permin gox dabiltzu yoskiñ._
(1 row)

DELETE FROM "Unicode data" WHERE t = 'Permin gox dabiltzu yoskiñ._';
SELECT count(*) n FROM "Unicode data" WHERE i = 'eus+';
 n 
---
 0
(1 row)

INSERT INTO "Unicode data" (i, t) VALUES ('fra+', 'Dès Noël où un zéphyr haï me vêt de glaçons würmiens je dîne d’exquis rôtis de bœuf au kir à l’aÿ d’âge mûr & cætera !_');
ERROR:  character with byte sequence 0xe2 0x80 0x99 in encoding "UTF8" has no equivalent in encoding "LATIN9"
SELECT * FROM "Unicode data" WHERE i = 'fra+';
 i | t 
---+---
(0 rows)

DELETE FROM "Unicode data" WHERE t = 'Dès Noël où un zéphyr haï me vêt de glaçons würmiens je dîne d’exquis rôtis de bœuf au kir à l’aÿ d’âge mûr & cætera !_';
ERROR:  character with byte sequence 0xe2 0x80 0x99 in encoding "UTF8" has no equivalent in encoding "LATIN9"
SELECT count(*) n FROM "Unicode data" WHERE i = 'fra+';
 n 
---
 0
(1 row)

INSERT INTO "Unicode data" (i, t) VALUES ('spa+', 'Quiere la boca exhausta vid, kiwi, piña y fugaz jamón._');
SELECT * FROM "Unicode data" WHERE i = 'spa+';
  i   |                            t                            
------+---------------------------------------------------------
 spa+ | Quiere la boca exhausta vid, kiwi, piña y fugaz jamón._
(1 row)

DELETE FROM "Unicode data" WHERE t = 'Quiere la boca exhausta vid, kiwi, piña y fugaz jamón._';
SELECT count(*) n FROM "Unicode data" WHERE i = 'spa+';
 n 
---
 0
(1 row)

-- 1250, LATIN2
SELECT * FROM "Unicode data" WHERE i = 'cze';
 i | t 
---+---
(0 rows)

SELECT * FROM "Unicode data" WHERE i = 'pol';
 i | t 
---+---
(0 rows)

SELECT * FROM "Unicode data" WHERE i = 'srp';
 i | t 
---+---
(0 rows)

SELECT * FROM "Unicode data" WHERE t LIKE 'Zvláš%';
 i | t 
---+---
(0 rows)

SELECT * FROM "Unicode data" WHERE t LIKE 'Pchną%';
ERROR:  character with byte sequence 0xc4 0x85 in encoding "UTF8" has no equivalent in encoding "LATIN9"
SELECT * FROM "Unicode data" WHERE t LIKE 'Ljuba%';
    i    |                                          t                                           
---------+--------------------------------------------------------------------------------------
 utf_srp | Ljubavi, Olga, hajde poÄ\u0091i u FudÅŸi i Ä\u008Dut Ä\u0087eÅ¡ njeÅŸnu muziku srca.
(1 row)

INSERT INTO "Unicode data" (i, t) VALUES ('cze+', 'Zvlášť zákeřný učeň s ďolíčky běží podél zóny úlů._');
ERROR:  character with byte sequence 0xc5 0xa5 in encoding "UTF8" has no equivalent in encoding "LATIN9"
SELECT * FROM "Unicode data" WHERE i = 'cze+';
 i | t 
---+---
(0 rows)

DELETE FROM "Unicode data" WHERE t = 'Zvlášť zákeřný učeň s ďolíčky běží podél zóny úlů._';
ERROR:  character with byte sequence 0xc5 0xa5 in encoding "UTF8" has no equivalent in encoding "LATIN9"
SELECT count(*) n FROM "Unicode data" WHERE i = 'cze+';
 n 
---
 0
(1 row)

INSERT INTO "Unicode data" (i, t) VALUES ('pol+', 'Pchnąć w tę łódź jeża lub ośm skrzyń fig._');
ERROR:  character with byte sequence 0xc4 0x85 in encoding "UTF8" has no equivalent in encoding "LATIN9"
SELECT * FROM "Unicode data" WHERE i = 'pol+';
 i | t 
---+---
(0 rows)

DELETE FROM "Unicode data" WHERE t = 'Pchnąć w tę łódź jeża lub ośm skrzyń fig._';
ERROR:  character with byte sequence 0xc4 0x85 in encoding "UTF8" has no equivalent in encoding "LATIN9"
SELECT count(*) n FROM "Unicode data" WHERE i = 'pol+';
 n 
---
 0
(1 row)

INSERT INTO "Unicode data" (i, t) VALUES ('srp+', 'Ljubavi, Olga, hajde pođi u Fudži i čut ćeš nježnu muziku srca._');
ERROR:  character with byte sequence 0xc4 0x91 in encoding "UTF8" has no equivalent in encoding "LATIN9"
SELECT * FROM "Unicode data" WHERE i = 'srp+';
 i | t 
---+---
(0 rows)

DELETE FROM "Unicode data" WHERE t = 'Ljubavi, Olga, hajde pođi u Fudži i čut ćeš nježnu muziku srca._';
ERROR:  character with byte sequence 0xc4 0x91 in encoding "UTF8" has no equivalent in encoding "LATIN9"
SELECT count(*) n FROM "Unicode data" WHERE i = 'srp+';
 n 
---
 0
(1 row)

-- 1257, LATIN7
SELECT * FROM "Unicode data" WHERE i = 'lav';
 i | t 
---+---
(0 rows)

SELECT * FROM "Unicode data" WHERE t LIKE 'Ķieģeļu%';
ERROR:  character with byte sequence 0xc4 0xb6 in encoding "UTF8" has no equivalent in encoding "LATIN9"
INSERT INTO "Unicode data" (i, t) VALUES ('lav+', 'Ķieģeļu cepējs Edgars Buls fraku un hūti žāvē uz čīkstošām eņģēm._');
ERROR:  character with byte sequence 0xc4 0xb6 in encoding "UTF8" has no equivalent in encoding "LATIN9"
SELECT * FROM "Unicode data" WHERE i = 'lav+';
 i | t 
---+---
(0 rows)

DELETE FROM "Unicode data" WHERE t = 'Ķieģeļu cepējs Edgars Buls fraku un hūti žāvē uz čīkstošām eņģēm._';
ERROR:  character with byte sequence 0xc4 0xb6 in encoding "UTF8" has no equivalent in encoding "LATIN9"
SELECT count(*) n FROM "Unicode data" WHERE i = 'lav+';
 n 
---
 0
(1 row)

-- EUC_KR
SELECT * FROM "Unicode data" WHERE i = 'kor';
 i | t 
---+---
(0 rows)

SELECT * FROM "Unicode data" WHERE t LIKE '키스의 고%';
ERROR:  character with byte sequence 0xed 0x82 0xa4 in encoding "UTF8" has no equivalent in encoding "LATIN9"
INSERT INTO "Unicode data" (i, t) VALUES ('kor+', '키스의 고유조건은 입술끼리 만나야 하고 특별한 기술은 필요치 않다._');
ERROR:  character with byte sequence 0xed 0x82 0xa4 in encoding "UTF8" has no equivalent in encoding "LATIN9"
SELECT * FROM "Unicode data" WHERE i = 'kor+';
 i | t 
---+---
(0 rows)

DELETE FROM "Unicode data" WHERE t = '키스의 고유조건은 입술끼리 만나야 하고 특별한 기술은 필요치 않다._';
ERROR:  character with byte sequence 0xed 0x82 0xa4 in encoding "UTF8" has no equivalent in encoding "LATIN9"
SELECT count(*) n FROM "Unicode data" WHERE i = 'kor+';
 n 
---
 0
(1 row)

-- 1254, LATIN5
SELECT * FROM "Unicode data" WHERE i = 'aze';
 i | t 
---+---
(0 rows)

SELECT * FROM "Unicode data" WHERE t LIKE 'Zəfər%';
ERROR:  character with byte sequence 0xc9 0x99 in encoding "UTF8" has no equivalent in encoding "LATIN9"
INSERT INTO "Unicode data" (i, t) VALUES ('aze+', 'Zəfər, jaketini də, papağını da götür, bu axşam hava çox soyuq olacaq._');
ERROR:  character with byte sequence 0xc9 0x99 in encoding "UTF8" has no equivalent in encoding "LATIN9"
SELECT * FROM "Unicode data" WHERE i = 'aze+';
 i | t 
---+---
(0 rows)

DELETE FROM "Unicode data" WHERE t = 'Zəfər, jaketini də, papağını da götür, bu axşam hava çox soyuq olacaq._';
ERROR:  character with byte sequence 0xc9 0x99 in encoding "UTF8" has no equivalent in encoding "LATIN9"
SELECT count(*) n FROM "Unicode data" WHERE i = 'aze+';
 n 
---
 0
(1 row)

-- etc
INSERT INTO "Unicode data" (i, t) VALUES ('arm+', 'Բել դղյակի ձախ ժամն օֆ ազգությանը ցպահանջ չճշտած վնաս էր եւ փառք։_');
ERROR:  character with byte sequence 0xd4 0xb2 in encoding "UTF8" has no equivalent in encoding "LATIN9"
SELECT * FROM "Unicode data" WHERE i = 'arm+';
 i | t 
---+---
(0 rows)

DELETE FROM "Unicode data" WHERE t = 'Բել դղյակի ձախ ժամն օֆ ազգությանը ցպահանջ չճշտած վնաս էր եւ փառք։_';
ERROR:  character with byte sequence 0xd4 0xb2 in encoding "UTF8" has no equivalent in encoding "LATIN9"
SELECT count(*) n FROM "Unicode data" WHERE i = 'arm+';
 n 
---
 0
(1 row)

INSERT INTO "Unicode data" (i, t) VALUES ('gle+', 'Chuaigh bé mhórshách le dlúthspád fíorfhinn trí hata mo dhea-phorcáin bhig._');
SELECT * FROM "Unicode data" WHERE i = 'gle+';
  i   |                                      t                                       
------+------------------------------------------------------------------------------
 gle+ | Chuaigh bé mhórshách le dlúthspád fíorfhinn trí hata mo dhea-phorcáin bhig._
(1 row)

DELETE FROM "Unicode data" WHERE t = 'Chuaigh bé mhórshách le dlúthspád fíorfhinn trí hata mo dhea-phorcáin bhig._';
SELECT count(*) n FROM "Unicode data" WHERE i = 'gle+';
 n 
---
 0
(1 row)

INSERT INTO "Unicode data" (i, t) VALUES ('epo+', 'Laŭ Ludoviko Zamenhof bongustas freŝa ĉeĥa manĝaĵo kun spicoj._');
ERROR:  character with byte sequence 0xc5 0xad in encoding "UTF8" has no equivalent in encoding "LATIN9"
SELECT * FROM "Unicode data" WHERE i = 'epo+';
 i | t 
---+---
(0 rows)

DELETE FROM "Unicode data" WHERE t = 'Laŭ Ludoviko Zamenhof bongustas freŝa ĉeĥa manĝaĵo kun spicoj._';
ERROR:  character with byte sequence 0xc5 0xad in encoding "UTF8" has no equivalent in encoding "LATIN9"
SELECT count(*) n FROM "Unicode data" WHERE i = 'epo+';
 n 
---
 0
(1 row)

DROP FOREIGN TABLE "Unicode data";
DROP SERVER redis_testing_server CASCADE;
NOTICE:  drop cascades to user mapping for public on server redis_testing_server
DROP EXTENSION redis_fdw;
\connect contrib_regression;
DROP DATABASE "contrib_regression_LATIN9";
-- LATIN10
CREATE DATABASE "contrib_regression_LATIN10" ENCODING LATIN10 LC_CTYPE='POSIX' LC_COLLATE='POSIX' template template0;
\connect "contrib_regression_LATIN10"
CREATE EXTENSION redis_fdw;
CREATE SERVER redis_testing_server FOREIGN DATA WRAPPER redis_fdw;
CREATE FOREIGN TABLE "Unicode data"(i text, t text)
SERVER redis_testing_server
OPTIONS (database '15');
CREATE USER MAPPING FOR public SERVER redis_testing_server; 
-- EUC_JP
SELECT * FROM "Unicode data" WHERE i = 'jap';
 i | t 
---+---
(0 rows)

SELECT * FROM "Unicode data" WHERE t LIKE 'いろはにほ%';
ERROR:  character with byte sequence 0xe3 0x81 0x84 in encoding "UTF8" has no equivalent in encoding "LATIN10"
INSERT INTO "Unicode data" (i, t) VALUES ('jap+', 'いろはにほへと ちりぬるを わかよたれそ つねならむ うゐのおくやま けふこえて あさきゆめみし ゑひもせす._');
ERROR:  character with byte sequence 0xe3 0x81 0x84 in encoding "UTF8" has no equivalent in encoding "LATIN10"
DELETE FROM "Unicode data" WHERE t = 'いろはにほへと ちりぬるを わかよたれそ つねならむ うゐのおくやま けふこえて あさきゆめみし ゑひもせす._';
ERROR:  character with byte sequence 0xe3 0x81 0x84 in encoding "UTF8" has no equivalent in encoding "LATIN10"
SELECT count(*) n FROM "Unicode data" WHERE i = 'jap+';
 n 
---
 0
(1 row)

-- 1251, ISO_8859_5
SELECT * FROM "Unicode data" WHERE i = 'bel';
 i | t 
---+---
(0 rows)

SELECT * FROM "Unicode data" WHERE i = 'bul';
 i | t 
---+---
(0 rows)

SELECT * FROM "Unicode data" WHERE i = 'rus';
 i | t 
---+---
(0 rows)

SELECT * FROM "Unicode data" WHERE i = 'ukr';
 i | t 
---+---
(0 rows)

SELECT * FROM "Unicode data" WHERE t LIKE 'У руд%';
ERROR:  character with byte sequence 0xd0 0xa3 in encoding "UTF8" has no equivalent in encoding "LATIN10"
SELECT * FROM "Unicode data" WHERE t LIKE 'Ах, ч%';
ERROR:  character with byte sequence 0xd0 0x90 in encoding "UTF8" has no equivalent in encoding "LATIN10"
SELECT * FROM "Unicode data" WHERE t LIKE 'Широк%';
ERROR:  character with byte sequence 0xd0 0xa8 in encoding "UTF8" has no equivalent in encoding "LATIN10"
SELECT * FROM "Unicode data" WHERE t LIKE 'Гей, %';
ERROR:  character with byte sequence 0xd0 0x93 in encoding "UTF8" has no equivalent in encoding "LATIN10"
INSERT INTO "Unicode data" (i, t) VALUES ('bel+', 'У рудога вераб’я ў сховішчы пад фатэлем ляжаць нейкія гаючыя зёлкі._');
ERROR:  character with byte sequence 0xd0 0xa3 in encoding "UTF8" has no equivalent in encoding "LATIN10"
SELECT * FROM "Unicode data" WHERE i = 'bel+';
 i | t 
---+---
(0 rows)

DELETE FROM "Unicode data" WHERE t = 'У рудога вераб’я ў сховішчы пад фатэлем ляжаць нейкія гаючыя зёлкі._';
ERROR:  character with byte sequence 0xd0 0xa3 in encoding "UTF8" has no equivalent in encoding "LATIN10"
SELECT count(*) n FROM "Unicode data" WHERE i = 'bel+';
 n 
---
 0
(1 row)

INSERT INTO "Unicode data" (i, t) VALUES ('bul+', 'Ах, чудна българска земьо, полюшвай цъфтящи жита._');
ERROR:  character with byte sequence 0xd0 0x90 in encoding "UTF8" has no equivalent in encoding "LATIN10"
SELECT * FROM "Unicode data" WHERE i = 'bul+';
 i | t 
---+---
(0 rows)

DELETE FROM "Unicode data" WHERE t = 'Ах, чудна българска земьо, полюшвай цъфтящи жита._';
ERROR:  character with byte sequence 0xd0 0x90 in encoding "UTF8" has no equivalent in encoding "LATIN10"
SELECT count(*) n FROM "Unicode data" WHERE i = 'bul+';
 n 
---
 0
(1 row)

INSERT INTO "Unicode data" (i, t) VALUES ('rus+', 'Широкая электрификация южных губерний даст мощный толчок подъёму сельского хозяйства._');
ERROR:  character with byte sequence 0xd0 0xa8 in encoding "UTF8" has no equivalent in encoding "LATIN10"
SELECT * FROM "Unicode data" WHERE i = 'rus+';
 i | t 
---+---
(0 rows)

DELETE FROM "Unicode data" WHERE t = 'Широкая электрификация южных губерний даст мощный толчок подъёму сельского хозяйства._';
ERROR:  character with byte sequence 0xd0 0xa8 in encoding "UTF8" has no equivalent in encoding "LATIN10"
SELECT count(*) n FROM "Unicode data" WHERE i = 'rus+';
 n 
---
 0
(1 row)

INSERT INTO "Unicode data" (i, t) VALUES ('ukr+', 'Гей, хлопці, не вспію — на ґанку ваша файна їжа знищується бурундучком._');
ERROR:  character with byte sequence 0xd0 0x93 in encoding "UTF8" has no equivalent in encoding "LATIN10"
SELECT * FROM "Unicode data" WHERE i = 'ukr+';
 i | t 
---+---
(0 rows)

DELETE FROM "Unicode data" WHERE t = 'Гей, хлопці, не вспію — на ґанку ваша файна їжа знищується бурундучком._';
ERROR:  character with byte sequence 0xd0 0x93 in encoding "UTF8" has no equivalent in encoding "LATIN10"
SELECT count(*) n FROM "Unicode data" WHERE i = 'ukr+';
 n 
---
 0
(1 row)

-- 1256, ISO_8859_6
SELECT * FROM "Unicode data" WHERE i = 'ara';
 i | t 
---+---
(0 rows)

SELECT * FROM "Unicode data" WHERE t LIKE '%ضَظَغ%';
ERROR:  character with byte sequence 0xd8 0xb6 in encoding "UTF8" has no equivalent in encoding "LATIN10"
INSERT INTO "Unicode data" (i, t) VALUES ('ara+', 'أبجد هوَّز حُطّي كلَمُن سَعْفَص قُرِشَت ثَخَدٌ ضَظَغ_');
ERROR:  character with byte sequence 0xd8 0xa3 in encoding "UTF8" has no equivalent in encoding "LATIN10"
SELECT * FROM "Unicode data" WHERE i = 'ara+';
 i | t 
---+---
(0 rows)

DELETE FROM "Unicode data" WHERE t = 'أبجد هوَّز حُطّي كلَمُن سَعْفَص قُرِشَت ثَخَدٌ ضَظَغ_';
ERROR:  character with byte sequence 0xd8 0xa3 in encoding "UTF8" has no equivalent in encoding "LATIN10"
SELECT count(*) n FROM "Unicode data" WHERE i = 'ara+';
 n 
---
 0
(1 row)

-- 1253, ISO_8859_7
SELECT * FROM "Unicode data" WHERE i = 'gre';
 i | t 
---+---
(0 rows)

SELECT * FROM "Unicode data" WHERE t LIKE 'Τάχισ%';
ERROR:  character with byte sequence 0xce 0xa4 in encoding "UTF8" has no equivalent in encoding "LATIN10"
INSERT INTO "Unicode data" (i, t) VALUES ('gre+', 'Τάχιστη αλώπηξ βαφής ψημένη γη, δρασκελίζει υπέρ νωθρού κυνός_');
ERROR:  character with byte sequence 0xce 0xa4 in encoding "UTF8" has no equivalent in encoding "LATIN10"
SELECT * FROM "Unicode data" WHERE i = 'gre+';
 i | t 
---+---
(0 rows)

DELETE FROM "Unicode data" WHERE t = 'Τάχιστη αλώπηξ βαφής ψημένη γη, δρασκελίζει υπέρ νωθρού κυνός_';
ERROR:  character with byte sequence 0xce 0xa4 in encoding "UTF8" has no equivalent in encoding "LATIN10"
-- 1255, ISO_8859_8
SELECT * FROM "Unicode data" WHERE i = 'heb';
 i | t 
---+---
(0 rows)

SELECT * FROM "Unicode data" WHERE t LIKE '%כי ח%';
ERROR:  character with byte sequence 0xd7 0x9b in encoding "UTF8" has no equivalent in encoding "LATIN10"
INSERT INTO "Unicode data" (i, t) VALUES ('heb+', 'עטלף אבק נס דרך מזגן שהתפוצץ כי חם_');
ERROR:  character with byte sequence 0xd7 0xa2 in encoding "UTF8" has no equivalent in encoding "LATIN10"
SELECT * FROM "Unicode data" WHERE i = 'heb+';
 i | t 
---+---
(0 rows)

DELETE FROM "Unicode data" WHERE t = 'עטלף אבק נס דרך מזגן שהתפוצץ כי חם_';
ERROR:  character with byte sequence 0xd7 0xa2 in encoding "UTF8" has no equivalent in encoding "LATIN10"
SELECT count(*) n FROM "Unicode data" WHERE i = 'heb+';
 n 
---
 0
(1 row)

-- 1252, LATIN1
SELECT * FROM "Unicode data" WHERE i = 'eus';
 i | t 
---+---
(0 rows)

SELECT * FROM "Unicode data" WHERE i = 'fra';
 i | t 
---+---
(0 rows)

SELECT * FROM "Unicode data" WHERE i = 'spa';
 i | t 
---+---
(0 rows)

SELECT * FROM "Unicode data" WHERE t LIKE 'Permi%';
    i    |              t               
---------+------------------------------
 utf_eus | Permin gox dabiltzu yoskiĂ±.
(1 row)

SELECT * FROM "Unicode data" WHERE t LIKE 'Dès N%';
 i | t 
---+---
(0 rows)

SELECT * FROM "Unicode data" WHERE t LIKE 'Quier%';
    i    |                            t                             
---------+----------------------------------------------------------
 utf_spa | Quiere la boca exhausta vid, kiwi, piĂ±a y fugaz jamĂłn.
(1 row)

INSERT INTO "Unicode data" (i, t) VALUES ('eus+', 'Permin gox dabiltzu yoskiñ._');
ERROR:  character with byte sequence 0xc3 0xb1 in encoding "UTF8" has no equivalent in encoding "LATIN10"
SELECT * FROM "Unicode data" WHERE i = 'eus+';
 i | t 
---+---
(0 rows)

DELETE FROM "Unicode data" WHERE t = 'Permin gox dabiltzu yoskiñ._';
ERROR:  character with byte sequence 0xc3 0xb1 in encoding "UTF8" has no equivalent in encoding "LATIN10"
SELECT count(*) n FROM "Unicode data" WHERE i = 'eus+';
 n 
---
 0
(1 row)

INSERT INTO "Unicode data" (i, t) VALUES ('fra+', 'Dès Noël où un zéphyr haï me vêt de glaçons würmiens je dîne d’exquis rôtis de bœuf au kir à l’aÿ d’âge mûr & cætera !_');
ERROR:  character with byte sequence 0xe2 0x80 0x99 in encoding "UTF8" has no equivalent in encoding "LATIN10"
SELECT * FROM "Unicode data" WHERE i = 'fra+';
 i | t 
---+---
(0 rows)

DELETE FROM "Unicode data" WHERE t = 'Dès Noël où un zéphyr haï me vêt de glaçons würmiens je dîne d’exquis rôtis de bœuf au kir à l’aÿ d’âge mûr & cætera !_';
ERROR:  character with byte sequence 0xe2 0x80 0x99 in encoding "UTF8" has no equivalent in encoding "LATIN10"
SELECT count(*) n FROM "Unicode data" WHERE i = 'fra+';
 n 
---
 0
(1 row)

INSERT INTO "Unicode data" (i, t) VALUES ('spa+', 'Quiere la boca exhausta vid, kiwi, piña y fugaz jamón._');
ERROR:  character with byte sequence 0xc3 0xb1 in encoding "UTF8" has no equivalent in encoding "LATIN10"
SELECT * FROM "Unicode data" WHERE i = 'spa+';
 i | t 
---+---
(0 rows)

DELETE FROM "Unicode data" WHERE t = 'Quiere la boca exhausta vid, kiwi, piña y fugaz jamón._';
ERROR:  character with byte sequence 0xc3 0xb1 in encoding "UTF8" has no equivalent in encoding "LATIN10"
SELECT count(*) n FROM "Unicode data" WHERE i = 'spa+';
 n 
---
 0
(1 row)

-- 1250, LATIN2
SELECT * FROM "Unicode data" WHERE i = 'cze';
 i | t 
---+---
(0 rows)

SELECT * FROM "Unicode data" WHERE i = 'pol';
 i | t 
---+---
(0 rows)

SELECT * FROM "Unicode data" WHERE i = 'srp';
 i | t 
---+---
(0 rows)

SELECT * FROM "Unicode data" WHERE t LIKE 'Zvláš%';
 i | t 
---+---
(0 rows)

SELECT * FROM "Unicode data" WHERE t LIKE 'Pchną%';
 i | t 
---+---
(0 rows)

SELECT * FROM "Unicode data" WHERE t LIKE 'Ljuba%';
    i    |                                          t                                           
---------+--------------------------------------------------------------------------------------
 utf_srp | Ljubavi, Olga, hajde poÄ\u0091i u FudĆŸi i Ä\u008Dut Ä\u0087eĆĄ njeĆŸnu muziku srca.
(1 row)

INSERT INTO "Unicode data" (i, t) VALUES ('cze+', 'Zvlášť zákeřný učeň s ďolíčky běží podél zóny úlů._');
ERROR:  character with byte sequence 0xc5 0xa5 in encoding "UTF8" has no equivalent in encoding "LATIN10"
SELECT * FROM "Unicode data" WHERE i = 'cze+';
 i | t 
---+---
(0 rows)

DELETE FROM "Unicode data" WHERE t = 'Zvlášť zákeřný učeň s ďolíčky běží podél zóny úlů._';
ERROR:  character with byte sequence 0xc5 0xa5 in encoding "UTF8" has no equivalent in encoding "LATIN10"
SELECT count(*) n FROM "Unicode data" WHERE i = 'cze+';
 n 
---
 0
(1 row)

INSERT INTO "Unicode data" (i, t) VALUES ('pol+', 'Pchnąć w tę łódź jeża lub ośm skrzyń fig._');
SELECT * FROM "Unicode data" WHERE i = 'pol+';
  i   |                     t                      
------+--------------------------------------------
 pol+ | Pchnąć w tę łódź jeża lub ośm skrzyń fig._
(1 row)

DELETE FROM "Unicode data" WHERE t = 'Pchnąć w tę łódź jeża lub ośm skrzyń fig._';
SELECT count(*) n FROM "Unicode data" WHERE i = 'pol+';
 n 
---
 0
(1 row)

INSERT INTO "Unicode data" (i, t) VALUES ('srp+', 'Ljubavi, Olga, hajde pođi u Fudži i čut ćeš nježnu muziku srca._');
SELECT * FROM "Unicode data" WHERE i = 'srp+';
  i   |                                t                                 
------+------------------------------------------------------------------
 srp+ | Ljubavi, Olga, hajde pođi u Fudži i čut ćeš nježnu muziku srca._
(1 row)

DELETE FROM "Unicode data" WHERE t = 'Ljubavi, Olga, hajde pođi u Fudži i čut ćeš nježnu muziku srca._';
SELECT count(*) n FROM "Unicode data" WHERE i = 'srp+';
 n 
---
 0
(1 row)

-- 1257, LATIN7
SELECT * FROM "Unicode data" WHERE i = 'lav';
 i | t 
---+---
(0 rows)

SELECT * FROM "Unicode data" WHERE t LIKE 'Ķieģeļu%';
ERROR:  character with byte sequence 0xc4 0xb6 in encoding "UTF8" has no equivalent in encoding "LATIN10"
INSERT INTO "Unicode data" (i, t) VALUES ('lav+', 'Ķieģeļu cepējs Edgars Buls fraku un hūti žāvē uz čīkstošām eņģēm._');
ERROR:  character with byte sequence 0xc4 0xb6 in encoding "UTF8" has no equivalent in encoding "LATIN10"
SELECT * FROM "Unicode data" WHERE i = 'lav+';
 i | t 
---+---
(0 rows)

DELETE FROM "Unicode data" WHERE t = 'Ķieģeļu cepējs Edgars Buls fraku un hūti žāvē uz čīkstošām eņģēm._';
ERROR:  character with byte sequence 0xc4 0xb6 in encoding "UTF8" has no equivalent in encoding "LATIN10"
SELECT count(*) n FROM "Unicode data" WHERE i = 'lav+';
 n 
---
 0
(1 row)

-- EUC_KR
SELECT * FROM "Unicode data" WHERE i = 'kor';
 i | t 
---+---
(0 rows)

SELECT * FROM "Unicode data" WHERE t LIKE '키스의 고%';
ERROR:  character with byte sequence 0xed 0x82 0xa4 in encoding "UTF8" has no equivalent in encoding "LATIN10"
INSERT INTO "Unicode data" (i, t) VALUES ('kor+', '키스의 고유조건은 입술끼리 만나야 하고 특별한 기술은 필요치 않다._');
ERROR:  character with byte sequence 0xed 0x82 0xa4 in encoding "UTF8" has no equivalent in encoding "LATIN10"
SELECT * FROM "Unicode data" WHERE i = 'kor+';
 i | t 
---+---
(0 rows)

DELETE FROM "Unicode data" WHERE t = '키스의 고유조건은 입술끼리 만나야 하고 특별한 기술은 필요치 않다._';
ERROR:  character with byte sequence 0xed 0x82 0xa4 in encoding "UTF8" has no equivalent in encoding "LATIN10"
SELECT count(*) n FROM "Unicode data" WHERE i = 'kor+';
 n 
---
 0
(1 row)

-- 1254, LATIN5
SELECT * FROM "Unicode data" WHERE i = 'aze';
 i | t 
---+---
(0 rows)

SELECT * FROM "Unicode data" WHERE t LIKE 'Zəfər%';
ERROR:  character with byte sequence 0xc9 0x99 in encoding "UTF8" has no equivalent in encoding "LATIN10"
INSERT INTO "Unicode data" (i, t) VALUES ('aze+', 'Zəfər, jaketini də, papağını da götür, bu axşam hava çox soyuq olacaq._');
ERROR:  character with byte sequence 0xc9 0x99 in encoding "UTF8" has no equivalent in encoding "LATIN10"
SELECT * FROM "Unicode data" WHERE i = 'aze+';
 i | t 
---+---
(0 rows)

DELETE FROM "Unicode data" WHERE t = 'Zəfər, jaketini də, papağını da götür, bu axşam hava çox soyuq olacaq._';
ERROR:  character with byte sequence 0xc9 0x99 in encoding "UTF8" has no equivalent in encoding "LATIN10"
SELECT count(*) n FROM "Unicode data" WHERE i = 'aze+';
 n 
---
 0
(1 row)

-- etc
INSERT INTO "Unicode data" (i, t) VALUES ('arm+', 'Բել դղյակի ձախ ժամն օֆ ազգությանը ցպահանջ չճշտած վնաս էր եւ փառք։_');
ERROR:  character with byte sequence 0xd4 0xb2 in encoding "UTF8" has no equivalent in encoding "LATIN10"
SELECT * FROM "Unicode data" WHERE i = 'arm+';
 i | t 
---+---
(0 rows)

DELETE FROM "Unicode data" WHERE t = 'Բել դղյակի ձախ ժամն օֆ ազգությանը ցպահանջ չճշտած վնաս էր եւ փառք։_';
ERROR:  character with byte sequence 0xd4 0xb2 in encoding "UTF8" has no equivalent in encoding "LATIN10"
SELECT count(*) n FROM "Unicode data" WHERE i = 'arm+';
 n 
---
 0
(1 row)

INSERT INTO "Unicode data" (i, t) VALUES ('gle+', 'Chuaigh bé mhórshách le dlúthspád fíorfhinn trí hata mo dhea-phorcáin bhig._');
SELECT * FROM "Unicode data" WHERE i = 'gle+';
  i   |                                      t                                       
------+------------------------------------------------------------------------------
 gle+ | Chuaigh bé mhórshách le dlúthspád fíorfhinn trí hata mo dhea-phorcáin bhig._
(1 row)

DELETE FROM "Unicode data" WHERE t = 'Chuaigh bé mhórshách le dlúthspád fíorfhinn trí hata mo dhea-phorcáin bhig._';
SELECT count(*) n FROM "Unicode data" WHERE i = 'gle+';
 n 
---
 0
(1 row)

INSERT INTO "Unicode data" (i, t) VALUES ('epo+', 'Laŭ Ludoviko Zamenhof bongustas freŝa ĉeĥa manĝaĵo kun spicoj._');
ERROR:  character with byte sequence 0xc5 0xad in encoding "UTF8" has no equivalent in encoding "LATIN10"
SELECT * FROM "Unicode data" WHERE i = 'epo+';
 i | t 
---+---
(0 rows)

DELETE FROM "Unicode data" WHERE t = 'Laŭ Ludoviko Zamenhof bongustas freŝa ĉeĥa manĝaĵo kun spicoj._';
ERROR:  character with byte sequence 0xc5 0xad in encoding "UTF8" has no equivalent in encoding "LATIN10"
SELECT count(*) n FROM "Unicode data" WHERE i = 'epo+';
 n 
---
 0
(1 row)

DROP FOREIGN TABLE "Unicode data";
DROP SERVER redis_testing_server CASCADE;
NOTICE:  drop cascades to user mapping for public on server redis_testing_server
DROP EXTENSION redis_fdw;
\connect contrib_regression;
DROP DATABASE "contrib_regression_LATIN10";
-- cp1250
CREATE DATABASE "contrib_regression_WIN1250" ENCODING WIN1250 LC_CTYPE='POSIX' LC_COLLATE='POSIX' template template0;
\connect "contrib_regression_WIN1250"
CREATE EXTENSION redis_fdw;
CREATE SERVER redis_testing_server FOREIGN DATA WRAPPER redis_fdw;
CREATE FOREIGN TABLE "Unicode data"(i text, t text)
SERVER redis_testing_server
OPTIONS (database '15');
CREATE USER MAPPING FOR public SERVER redis_testing_server; 
-- EUC_JP
SELECT * FROM "Unicode data" WHERE i = 'jap';
 i | t 
---+---
(0 rows)

SELECT * FROM "Unicode data" WHERE t LIKE 'いろはにほ%';
ERROR:  character with byte sequence 0xe3 0x81 0x84 in encoding "UTF8" has no equivalent in encoding "WIN1250"
INSERT INTO "Unicode data" (i, t) VALUES ('jap+', 'いろはにほへと ちりぬるを わかよたれそ つねならむ うゐのおくやま けふこえて あさきゆめみし ゑひもせす._');
ERROR:  character with byte sequence 0xe3 0x81 0x84 in encoding "UTF8" has no equivalent in encoding "WIN1250"
DELETE FROM "Unicode data" WHERE t = 'いろはにほへと ちりぬるを わかよたれそ つねならむ うゐのおくやま けふこえて あさきゆめみし ゑひもせす._';
ERROR:  character with byte sequence 0xe3 0x81 0x84 in encoding "UTF8" has no equivalent in encoding "WIN1250"
SELECT count(*) n FROM "Unicode data" WHERE i = 'jap+';
 n 
---
 0
(1 row)

-- 1251, ISO_8859_5
SELECT * FROM "Unicode data" WHERE i = 'bel';
 i | t 
---+---
(0 rows)

SELECT * FROM "Unicode data" WHERE i = 'bul';
 i | t 
---+---
(0 rows)

SELECT * FROM "Unicode data" WHERE i = 'rus';
 i | t 
---+---
(0 rows)

SELECT * FROM "Unicode data" WHERE i = 'ukr';
 i | t 
---+---
(0 rows)

SELECT * FROM "Unicode data" WHERE t LIKE 'У руд%';
ERROR:  character with byte sequence 0xd0 0xa3 in encoding "UTF8" has no equivalent in encoding "WIN1250"
SELECT * FROM "Unicode data" WHERE t LIKE 'Ах, ч%';
ERROR:  character with byte sequence 0xd0 0x90 in encoding "UTF8" has no equivalent in encoding "WIN1250"
SELECT * FROM "Unicode data" WHERE t LIKE 'Широк%';
ERROR:  character with byte sequence 0xd0 0xa8 in encoding "UTF8" has no equivalent in encoding "WIN1250"
SELECT * FROM "Unicode data" WHERE t LIKE 'Гей, %';
ERROR:  character with byte sequence 0xd0 0x93 in encoding "UTF8" has no equivalent in encoding "WIN1250"
INSERT INTO "Unicode data" (i, t) VALUES ('bel+', 'У рудога вераб’я ў сховішчы пад фатэлем ляжаць нейкія гаючыя зёлкі._');
ERROR:  character with byte sequence 0xd0 0xa3 in encoding "UTF8" has no equivalent in encoding "WIN1250"
SELECT * FROM "Unicode data" WHERE i = 'bel+';
 i | t 
---+---
(0 rows)

DELETE FROM "Unicode data" WHERE t = 'У рудога вераб’я ў сховішчы пад фатэлем ляжаць нейкія гаючыя зёлкі._';
ERROR:  character with byte sequence 0xd0 0xa3 in encoding "UTF8" has no equivalent in encoding "WIN1250"
SELECT count(*) n FROM "Unicode data" WHERE i = 'bel+';
 n 
---
 0
(1 row)

INSERT INTO "Unicode data" (i, t) VALUES ('bul+', 'Ах, чудна българска земьо, полюшвай цъфтящи жита._');
ERROR:  character with byte sequence 0xd0 0x90 in encoding "UTF8" has no equivalent in encoding "WIN1250"
SELECT * FROM "Unicode data" WHERE i = 'bul+';
 i | t 
---+---
(0 rows)

DELETE FROM "Unicode data" WHERE t = 'Ах, чудна българска земьо, полюшвай цъфтящи жита._';
ERROR:  character with byte sequence 0xd0 0x90 in encoding "UTF8" has no equivalent in encoding "WIN1250"
SELECT count(*) n FROM "Unicode data" WHERE i = 'bul+';
 n 
---
 0
(1 row)

INSERT INTO "Unicode data" (i, t) VALUES ('rus+', 'Широкая электрификация южных губерний даст мощный толчок подъёму сельского хозяйства._');
ERROR:  character with byte sequence 0xd0 0xa8 in encoding "UTF8" has no equivalent in encoding "WIN1250"
SELECT * FROM "Unicode data" WHERE i = 'rus+';
 i | t 
---+---
(0 rows)

DELETE FROM "Unicode data" WHERE t = 'Широкая электрификация южных губерний даст мощный толчок подъёму сельского хозяйства._';
ERROR:  character with byte sequence 0xd0 0xa8 in encoding "UTF8" has no equivalent in encoding "WIN1250"
SELECT count(*) n FROM "Unicode data" WHERE i = 'rus+';
 n 
---
 0
(1 row)

INSERT INTO "Unicode data" (i, t) VALUES ('ukr+', 'Гей, хлопці, не вспію — на ґанку ваша файна їжа знищується бурундучком._');
ERROR:  character with byte sequence 0xd0 0x93 in encoding "UTF8" has no equivalent in encoding "WIN1250"
SELECT * FROM "Unicode data" WHERE i = 'ukr+';
 i | t 
---+---
(0 rows)

DELETE FROM "Unicode data" WHERE t = 'Гей, хлопці, не вспію — на ґанку ваша файна їжа знищується бурундучком._';
ERROR:  character with byte sequence 0xd0 0x93 in encoding "UTF8" has no equivalent in encoding "WIN1250"
SELECT count(*) n FROM "Unicode data" WHERE i = 'ukr+';
 n 
---
 0
(1 row)

-- 1256, ISO_8859_6
SELECT * FROM "Unicode data" WHERE i = 'ara';
 i | t 
---+---
(0 rows)

SELECT * FROM "Unicode data" WHERE t LIKE '%ضَظَغ%';
ERROR:  character with byte sequence 0xd8 0xb6 in encoding "UTF8" has no equivalent in encoding "WIN1250"
INSERT INTO "Unicode data" (i, t) VALUES ('ara+', 'أبجد هوَّز حُطّي كلَمُن سَعْفَص قُرِشَت ثَخَدٌ ضَظَغ_');
ERROR:  character with byte sequence 0xd8 0xa3 in encoding "UTF8" has no equivalent in encoding "WIN1250"
SELECT * FROM "Unicode data" WHERE i = 'ara+';
 i | t 
---+---
(0 rows)

DELETE FROM "Unicode data" WHERE t = 'أبجد هوَّز حُطّي كلَمُن سَعْفَص قُرِشَت ثَخَدٌ ضَظَغ_';
ERROR:  character with byte sequence 0xd8 0xa3 in encoding "UTF8" has no equivalent in encoding "WIN1250"
SELECT count(*) n FROM "Unicode data" WHERE i = 'ara+';
 n 
---
 0
(1 row)

-- 1253, ISO_8859_7
SELECT * FROM "Unicode data" WHERE i = 'gre';
 i | t 
---+---
(0 rows)

SELECT * FROM "Unicode data" WHERE t LIKE 'Τάχισ%';
ERROR:  character with byte sequence 0xce 0xa4 in encoding "UTF8" has no equivalent in encoding "WIN1250"
INSERT INTO "Unicode data" (i, t) VALUES ('gre+', 'Τάχιστη αλώπηξ βαφής ψημένη γη, δρασκελίζει υπέρ νωθρού κυνός_');
ERROR:  character with byte sequence 0xce 0xa4 in encoding "UTF8" has no equivalent in encoding "WIN1250"
SELECT * FROM "Unicode data" WHERE i = 'gre+';
 i | t 
---+---
(0 rows)

DELETE FROM "Unicode data" WHERE t = 'Τάχιστη αλώπηξ βαφής ψημένη γη, δρασκελίζει υπέρ νωθρού κυνός_';
ERROR:  character with byte sequence 0xce 0xa4 in encoding "UTF8" has no equivalent in encoding "WIN1250"
-- 1255, ISO_8859_8
SELECT * FROM "Unicode data" WHERE i = 'heb';
 i | t 
---+---
(0 rows)

SELECT * FROM "Unicode data" WHERE t LIKE '%כי ח%';
ERROR:  character with byte sequence 0xd7 0x9b in encoding "UTF8" has no equivalent in encoding "WIN1250"
INSERT INTO "Unicode data" (i, t) VALUES ('heb+', 'עטלף אבק נס דרך מזגן שהתפוצץ כי חם_');
ERROR:  character with byte sequence 0xd7 0xa2 in encoding "UTF8" has no equivalent in encoding "WIN1250"
SELECT * FROM "Unicode data" WHERE i = 'heb+';
 i | t 
---+---
(0 rows)

DELETE FROM "Unicode data" WHERE t = 'עטלף אבק נס דרך מזגן שהתפוצץ כי חם_';
ERROR:  character with byte sequence 0xd7 0xa2 in encoding "UTF8" has no equivalent in encoding "WIN1250"
SELECT count(*) n FROM "Unicode data" WHERE i = 'heb+';
 n 
---
 0
(1 row)

-- 1252, LATIN1
SELECT * FROM "Unicode data" WHERE i = 'eus';
 i | t 
---+---
(0 rows)

SELECT * FROM "Unicode data" WHERE i = 'fra';
 i | t 
---+---
(0 rows)

SELECT * FROM "Unicode data" WHERE i = 'spa';
 i | t 
---+---
(0 rows)

SELECT * FROM "Unicode data" WHERE t LIKE 'Permi%';
    i    |              t               
---------+------------------------------
 utf_eus | Permin gox dabiltzu yoskiĂ±.
(1 row)

SELECT * FROM "Unicode data" WHERE t LIKE 'Dès N%';
ERROR:  character with byte sequence 0xc3 0xa8 in encoding "UTF8" has no equivalent in encoding "WIN1250"
SELECT * FROM "Unicode data" WHERE t LIKE 'Quier%';
    i    |                            t                             
---------+----------------------------------------------------------
 utf_spa | Quiere la boca exhausta vid, kiwi, piĂ±a y fugaz jamĂłn.
(1 row)

INSERT INTO "Unicode data" (i, t) VALUES ('eus+', 'Permin gox dabiltzu yoskiñ._');
ERROR:  character with byte sequence 0xc3 0xb1 in encoding "UTF8" has no equivalent in encoding "WIN1250"
SELECT * FROM "Unicode data" WHERE i = 'eus+';
 i | t 
---+---
(0 rows)

DELETE FROM "Unicode data" WHERE t = 'Permin gox dabiltzu yoskiñ._';
ERROR:  character with byte sequence 0xc3 0xb1 in encoding "UTF8" has no equivalent in encoding "WIN1250"
SELECT count(*) n FROM "Unicode data" WHERE i = 'eus+';
 n 
---
 0
(1 row)

INSERT INTO "Unicode data" (i, t) VALUES ('fra+', 'Dès Noël où un zéphyr haï me vêt de glaçons würmiens je dîne d’exquis rôtis de bœuf au kir à l’aÿ d’âge mûr & cætera !_');
ERROR:  character with byte sequence 0xc3 0xa8 in encoding "UTF8" has no equivalent in encoding "WIN1250"
SELECT * FROM "Unicode data" WHERE i = 'fra+';
 i | t 
---+---
(0 rows)

DELETE FROM "Unicode data" WHERE t = 'Dès Noël où un zéphyr haï me vêt de glaçons würmiens je dîne d’exquis rôtis de bœuf au kir à l’aÿ d’âge mûr & cætera !_';
ERROR:  character with byte sequence 0xc3 0xa8 in encoding "UTF8" has no equivalent in encoding "WIN1250"
SELECT count(*) n FROM "Unicode data" WHERE i = 'fra+';
 n 
---
 0
(1 row)

INSERT INTO "Unicode data" (i, t) VALUES ('spa+', 'Quiere la boca exhausta vid, kiwi, piña y fugaz jamón._');
ERROR:  character with byte sequence 0xc3 0xb1 in encoding "UTF8" has no equivalent in encoding "WIN1250"
SELECT * FROM "Unicode data" WHERE i = 'spa+';
 i | t 
---+---
(0 rows)

DELETE FROM "Unicode data" WHERE t = 'Quiere la boca exhausta vid, kiwi, piña y fugaz jamón._';
ERROR:  character with byte sequence 0xc3 0xb1 in encoding "UTF8" has no equivalent in encoding "WIN1250"
SELECT count(*) n FROM "Unicode data" WHERE i = 'spa+';
 n 
---
 0
(1 row)

-- 1250, LATIN2
SELECT * FROM "Unicode data" WHERE i = 'cze';
 i | t 
---+---
(0 rows)

SELECT * FROM "Unicode data" WHERE i = 'pol';
 i | t 
---+---
(0 rows)

SELECT * FROM "Unicode data" WHERE i = 'srp';
 i | t 
---+---
(0 rows)

SELECT * FROM "Unicode data" WHERE t LIKE 'Zvláš%';
 i | t 
---+---
(0 rows)

SELECT * FROM "Unicode data" WHERE t LIKE 'Pchną%';
 i | t 
---+---
(0 rows)

SELECT * FROM "Unicode data" WHERE t LIKE 'Ljuba%';
    i    |                                   t                                   
---------+-----------------------------------------------------------------------
 utf_srp | Ljubavi, Olga, hajde poÄ‘i u FudĹľi i ÄŤut Ä‡eĹˇ njeĹľnu muziku srca.
(1 row)

INSERT INTO "Unicode data" (i, t) VALUES ('cze+', 'Zvlášť zákeřný učeň s ďolíčky běží podél zóny úlů._');
SELECT * FROM "Unicode data" WHERE i = 'cze+';
  i   |                          t                          
------+-----------------------------------------------------
 cze+ | Zvlášť zákeřný učeň s ďolíčky běží podél zóny úlů._
(1 row)

DELETE FROM "Unicode data" WHERE t = 'Zvlášť zákeřný učeň s ďolíčky běží podél zóny úlů._';
SELECT count(*) n FROM "Unicode data" WHERE i = 'cze+';
 n 
---
 0
(1 row)

INSERT INTO "Unicode data" (i, t) VALUES ('pol+', 'Pchnąć w tę łódź jeża lub ośm skrzyń fig._');
SELECT * FROM "Unicode data" WHERE i = 'pol+';
  i   |                     t                      
------+--------------------------------------------
 pol+ | Pchnąć w tę łódź jeża lub ośm skrzyń fig._
(1 row)

DELETE FROM "Unicode data" WHERE t = 'Pchnąć w tę łódź jeża lub ośm skrzyń fig._';
SELECT count(*) n FROM "Unicode data" WHERE i = 'pol+';
 n 
---
 0
(1 row)

INSERT INTO "Unicode data" (i, t) VALUES ('srp+', 'Ljubavi, Olga, hajde pođi u Fudži i čut ćeš nježnu muziku srca._');
SELECT * FROM "Unicode data" WHERE i = 'srp+';
  i   |                                t                                 
------+------------------------------------------------------------------
 srp+ | Ljubavi, Olga, hajde pođi u Fudži i čut ćeš nježnu muziku srca._
(1 row)

DELETE FROM "Unicode data" WHERE t = 'Ljubavi, Olga, hajde pođi u Fudži i čut ćeš nježnu muziku srca._';
SELECT count(*) n FROM "Unicode data" WHERE i = 'srp+';
 n 
---
 0
(1 row)

-- 1257, LATIN7
SELECT * FROM "Unicode data" WHERE i = 'lav';
 i | t 
---+---
(0 rows)

SELECT * FROM "Unicode data" WHERE t LIKE 'Ķieģeļu%';
ERROR:  character with byte sequence 0xc4 0xb6 in encoding "UTF8" has no equivalent in encoding "WIN1250"
INSERT INTO "Unicode data" (i, t) VALUES ('lav+', 'Ķieģeļu cepējs Edgars Buls fraku un hūti žāvē uz čīkstošām eņģēm._');
ERROR:  character with byte sequence 0xc4 0xb6 in encoding "UTF8" has no equivalent in encoding "WIN1250"
SELECT * FROM "Unicode data" WHERE i = 'lav+';
 i | t 
---+---
(0 rows)

DELETE FROM "Unicode data" WHERE t = 'Ķieģeļu cepējs Edgars Buls fraku un hūti žāvē uz čīkstošām eņģēm._';
ERROR:  character with byte sequence 0xc4 0xb6 in encoding "UTF8" has no equivalent in encoding "WIN1250"
SELECT count(*) n FROM "Unicode data" WHERE i = 'lav+';
 n 
---
 0
(1 row)

-- EUC_KR
SELECT * FROM "Unicode data" WHERE i = 'kor';
 i | t 
---+---
(0 rows)

SELECT * FROM "Unicode data" WHERE t LIKE '키스의 고%';
ERROR:  character with byte sequence 0xed 0x82 0xa4 in encoding "UTF8" has no equivalent in encoding "WIN1250"
INSERT INTO "Unicode data" (i, t) VALUES ('kor+', '키스의 고유조건은 입술끼리 만나야 하고 특별한 기술은 필요치 않다._');
ERROR:  character with byte sequence 0xed 0x82 0xa4 in encoding "UTF8" has no equivalent in encoding "WIN1250"
SELECT * FROM "Unicode data" WHERE i = 'kor+';
 i | t 
---+---
(0 rows)

DELETE FROM "Unicode data" WHERE t = '키스의 고유조건은 입술끼리 만나야 하고 특별한 기술은 필요치 않다._';
ERROR:  character with byte sequence 0xed 0x82 0xa4 in encoding "UTF8" has no equivalent in encoding "WIN1250"
SELECT count(*) n FROM "Unicode data" WHERE i = 'kor+';
 n 
---
 0
(1 row)

-- 1254, LATIN5
SELECT * FROM "Unicode data" WHERE i = 'aze';
 i | t 
---+---
(0 rows)

SELECT * FROM "Unicode data" WHERE t LIKE 'Zəfər%';
ERROR:  character with byte sequence 0xc9 0x99 in encoding "UTF8" has no equivalent in encoding "WIN1250"
INSERT INTO "Unicode data" (i, t) VALUES ('aze+', 'Zəfər, jaketini də, papağını da götür, bu axşam hava çox soyuq olacaq._');
ERROR:  character with byte sequence 0xc9 0x99 in encoding "UTF8" has no equivalent in encoding "WIN1250"
SELECT * FROM "Unicode data" WHERE i = 'aze+';
 i | t 
---+---
(0 rows)

DELETE FROM "Unicode data" WHERE t = 'Zəfər, jaketini də, papağını da götür, bu axşam hava çox soyuq olacaq._';
ERROR:  character with byte sequence 0xc9 0x99 in encoding "UTF8" has no equivalent in encoding "WIN1250"
SELECT count(*) n FROM "Unicode data" WHERE i = 'aze+';
 n 
---
 0
(1 row)

-- etc
INSERT INTO "Unicode data" (i, t) VALUES ('arm+', 'Բել դղյակի ձախ ժամն օֆ ազգությանը ցպահանջ չճշտած վնաս էր եւ փառք։_');
ERROR:  character with byte sequence 0xd4 0xb2 in encoding "UTF8" has no equivalent in encoding "WIN1250"
SELECT * FROM "Unicode data" WHERE i = 'arm+';
 i | t 
---+---
(0 rows)

DELETE FROM "Unicode data" WHERE t = 'Բել դղյակի ձախ ժամն օֆ ազգությանը ցպահանջ չճշտած վնաս էր եւ փառք։_';
ERROR:  character with byte sequence 0xd4 0xb2 in encoding "UTF8" has no equivalent in encoding "WIN1250"
SELECT count(*) n FROM "Unicode data" WHERE i = 'arm+';
 n 
---
 0
(1 row)

INSERT INTO "Unicode data" (i, t) VALUES ('gle+', 'Chuaigh bé mhórshách le dlúthspád fíorfhinn trí hata mo dhea-phorcáin bhig._');
SELECT * FROM "Unicode data" WHERE i = 'gle+';
  i   |                                      t                                       
------+------------------------------------------------------------------------------
 gle+ | Chuaigh bé mhórshách le dlúthspád fíorfhinn trí hata mo dhea-phorcáin bhig._
(1 row)

DELETE FROM "Unicode data" WHERE t = 'Chuaigh bé mhórshách le dlúthspád fíorfhinn trí hata mo dhea-phorcáin bhig._';
SELECT count(*) n FROM "Unicode data" WHERE i = 'gle+';
 n 
---
 0
(1 row)

INSERT INTO "Unicode data" (i, t) VALUES ('epo+', 'Laŭ Ludoviko Zamenhof bongustas freŝa ĉeĥa manĝaĵo kun spicoj._');
ERROR:  character with byte sequence 0xc5 0xad in encoding "UTF8" has no equivalent in encoding "WIN1250"
SELECT * FROM "Unicode data" WHERE i = 'epo+';
 i | t 
---+---
(0 rows)

DELETE FROM "Unicode data" WHERE t = 'Laŭ Ludoviko Zamenhof bongustas freŝa ĉeĥa manĝaĵo kun spicoj._';
ERROR:  character with byte sequence 0xc5 0xad in encoding "UTF8" has no equivalent in encoding "WIN1250"
SELECT count(*) n FROM "Unicode data" WHERE i = 'epo+';
 n 
---
 0
(1 row)

DROP FOREIGN TABLE "Unicode data";
DROP SERVER redis_testing_server CASCADE;
NOTICE:  drop cascades to user mapping for public on server redis_testing_server
DROP EXTENSION redis_fdw;
\connect contrib_regression;
DROP DATABASE "contrib_regression_WIN1250";
-- cp1251
CREATE DATABASE "contrib_regression_WIN1251" ENCODING WIN1251 LC_CTYPE='bg_BG' LC_COLLATE='bg_BG' template template0;
\connect "contrib_regression_WIN1251"
CREATE EXTENSION redis_fdw;
CREATE SERVER redis_testing_server FOREIGN DATA WRAPPER redis_fdw;
CREATE FOREIGN TABLE "Unicode data"(i text, t text)
SERVER redis_testing_server
OPTIONS (database '15');
CREATE USER MAPPING FOR public SERVER redis_testing_server; 
-- EUC_JP
SELECT * FROM "Unicode data" WHERE i = 'jap';
 i | t 
---+---
(0 rows)

SELECT * FROM "Unicode data" WHERE t LIKE 'いろはにほ%';
ERROR:  character with byte sequence 0xe3 0x81 0x84 in encoding "UTF8" has no equivalent in encoding "WIN1251"
INSERT INTO "Unicode data" (i, t) VALUES ('jap+', 'いろはにほへと ちりぬるを わかよたれそ つねならむ うゐのおくやま けふこえて あさきゆめみし ゑひもせす._');
ERROR:  character with byte sequence 0xe3 0x81 0x84 in encoding "UTF8" has no equivalent in encoding "WIN1251"
DELETE FROM "Unicode data" WHERE t = 'いろはにほへと ちりぬるを わかよたれそ つねならむ うゐのおくやま けふこえて あさきゆめみし ゑひもせす._';
ERROR:  character with byte sequence 0xe3 0x81 0x84 in encoding "UTF8" has no equivalent in encoding "WIN1251"
SELECT count(*) n FROM "Unicode data" WHERE i = 'jap+';
 n 
---
 0
(1 row)

-- 1251, ISO_8859_5
SELECT * FROM "Unicode data" WHERE i = 'bel';
 i | t 
---+---
(0 rows)

SELECT * FROM "Unicode data" WHERE i = 'bul';
 i | t 
---+---
(0 rows)

SELECT * FROM "Unicode data" WHERE i = 'rus';
 i | t 
---+---
(0 rows)

SELECT * FROM "Unicode data" WHERE i = 'ukr';
 i | t 
---+---
(0 rows)

SELECT * FROM "Unicode data" WHERE t LIKE 'У руд%';
 i | t 
---+---
(0 rows)

SELECT * FROM "Unicode data" WHERE t LIKE 'Ах, ч%';
 i | t 
---+---
(0 rows)

SELECT * FROM "Unicode data" WHERE t LIKE 'Широк%';
 i | t 
---+---
(0 rows)

SELECT * FROM "Unicode data" WHERE t LIKE 'Гей, %';
 i | t 
---+---
(0 rows)

INSERT INTO "Unicode data" (i, t) VALUES ('bel+', 'У рудога вераб’я ў сховішчы пад фатэлем ляжаць нейкія гаючыя зёлкі._');
SELECT * FROM "Unicode data" WHERE i = 'bel+';
  i   |                                  t                                   
------+----------------------------------------------------------------------
 bel+ | У рудога вераб’я ў сховішчы пад фатэлем ляжаць нейкія гаючыя зёлкі._
(1 row)

DELETE FROM "Unicode data" WHERE t = 'У рудога вераб’я ў сховішчы пад фатэлем ляжаць нейкія гаючыя зёлкі._';
SELECT count(*) n FROM "Unicode data" WHERE i = 'bel+';
 n 
---
 0
(1 row)

INSERT INTO "Unicode data" (i, t) VALUES ('bul+', 'Ах, чудна българска земьо, полюшвай цъфтящи жита._');
SELECT * FROM "Unicode data" WHERE i = 'bul+';
  i   |                         t                          
------+----------------------------------------------------
 bul+ | Ах, чудна българска земьо, полюшвай цъфтящи жита._
(1 row)

DELETE FROM "Unicode data" WHERE t = 'Ах, чудна българска земьо, полюшвай цъфтящи жита._';
SELECT count(*) n FROM "Unicode data" WHERE i = 'bul+';
 n 
---
 0
(1 row)

INSERT INTO "Unicode data" (i, t) VALUES ('rus+', 'Широкая электрификация южных губерний даст мощный толчок подъёму сельского хозяйства._');
SELECT * FROM "Unicode data" WHERE i = 'rus+';
  i   |                                           t                                            
------+----------------------------------------------------------------------------------------
 rus+ | Широкая электрификация южных губерний даст мощный толчок подъёму сельского хозяйства._
(1 row)

DELETE FROM "Unicode data" WHERE t = 'Широкая электрификация южных губерний даст мощный толчок подъёму сельского хозяйства._';
SELECT count(*) n FROM "Unicode data" WHERE i = 'rus+';
 n 
---
 0
(1 row)

INSERT INTO "Unicode data" (i, t) VALUES ('ukr+', 'Гей, хлопці, не вспію — на ґанку ваша файна їжа знищується бурундучком._');
SELECT * FROM "Unicode data" WHERE i = 'ukr+';
  i   |                                    t                                     
------+--------------------------------------------------------------------------
 ukr+ | Гей, хлопці, не вспію — на ґанку ваша файна їжа знищується бурундучком._
(1 row)

DELETE FROM "Unicode data" WHERE t = 'Гей, хлопці, не вспію — на ґанку ваша файна їжа знищується бурундучком._';
SELECT count(*) n FROM "Unicode data" WHERE i = 'ukr+';
 n 
---
 0
(1 row)

-- 1256, ISO_8859_6
SELECT * FROM "Unicode data" WHERE i = 'ara';
 i | t 
---+---
(0 rows)

SELECT * FROM "Unicode data" WHERE t LIKE '%ضَظَغ%';
ERROR:  character with byte sequence 0xd8 0xb6 in encoding "UTF8" has no equivalent in encoding "WIN1251"
INSERT INTO "Unicode data" (i, t) VALUES ('ara+', 'أبجد هوَّز حُطّي كلَمُن سَعْفَص قُرِشَت ثَخَدٌ ضَظَغ_');
ERROR:  character with byte sequence 0xd8 0xa3 in encoding "UTF8" has no equivalent in encoding "WIN1251"
SELECT * FROM "Unicode data" WHERE i = 'ara+';
 i | t 
---+---
(0 rows)

DELETE FROM "Unicode data" WHERE t = 'أبجد هوَّز حُطّي كلَمُن سَعْفَص قُرِشَت ثَخَدٌ ضَظَغ_';
ERROR:  character with byte sequence 0xd8 0xa3 in encoding "UTF8" has no equivalent in encoding "WIN1251"
SELECT count(*) n FROM "Unicode data" WHERE i = 'ara+';
 n 
---
 0
(1 row)

-- 1253, ISO_8859_7
SELECT * FROM "Unicode data" WHERE i = 'gre';
 i | t 
---+---
(0 rows)

SELECT * FROM "Unicode data" WHERE t LIKE 'Τάχισ%';
ERROR:  character with byte sequence 0xce 0xa4 in encoding "UTF8" has no equivalent in encoding "WIN1251"
INSERT INTO "Unicode data" (i, t) VALUES ('gre+', 'Τάχιστη αλώπηξ βαφής ψημένη γη, δρασκελίζει υπέρ νωθρού κυνός_');
ERROR:  character with byte sequence 0xce 0xa4 in encoding "UTF8" has no equivalent in encoding "WIN1251"
SELECT * FROM "Unicode data" WHERE i = 'gre+';
 i | t 
---+---
(0 rows)

DELETE FROM "Unicode data" WHERE t = 'Τάχιστη αλώπηξ βαφής ψημένη γη, δρασκελίζει υπέρ νωθρού κυνός_';
ERROR:  character with byte sequence 0xce 0xa4 in encoding "UTF8" has no equivalent in encoding "WIN1251"
-- 1255, ISO_8859_8
SELECT * FROM "Unicode data" WHERE i = 'heb';
 i | t 
---+---
(0 rows)

SELECT * FROM "Unicode data" WHERE t LIKE '%כי ח%';
ERROR:  character with byte sequence 0xd7 0x9b in encoding "UTF8" has no equivalent in encoding "WIN1251"
INSERT INTO "Unicode data" (i, t) VALUES ('heb+', 'עטלף אבק נס דרך מזגן שהתפוצץ כי חם_');
ERROR:  character with byte sequence 0xd7 0xa2 in encoding "UTF8" has no equivalent in encoding "WIN1251"
SELECT * FROM "Unicode data" WHERE i = 'heb+';
 i | t 
---+---
(0 rows)

DELETE FROM "Unicode data" WHERE t = 'עטלף אבק נס דרך מזגן שהתפוצץ כי חם_';
ERROR:  character with byte sequence 0xd7 0xa2 in encoding "UTF8" has no equivalent in encoding "WIN1251"
SELECT count(*) n FROM "Unicode data" WHERE i = 'heb+';
 n 
---
 0
(1 row)

-- 1252, LATIN1
SELECT * FROM "Unicode data" WHERE i = 'eus';
 i | t 
---+---
(0 rows)

SELECT * FROM "Unicode data" WHERE i = 'fra';
 i | t 
---+---
(0 rows)

SELECT * FROM "Unicode data" WHERE i = 'spa';
 i | t 
---+---
(0 rows)

SELECT * FROM "Unicode data" WHERE t LIKE 'Permi%';
    i    |              t               
---------+------------------------------
 utf_eus | Permin gox dabiltzu yoskiГ±.
(1 row)

SELECT * FROM "Unicode data" WHERE t LIKE 'Dès N%';
ERROR:  character with byte sequence 0xc3 0xa8 in encoding "UTF8" has no equivalent in encoding "WIN1251"
SELECT * FROM "Unicode data" WHERE t LIKE 'Quier%';
    i    |                            t                             
---------+----------------------------------------------------------
 utf_spa | Quiere la boca exhausta vid, kiwi, piГ±a y fugaz jamГіn.
(1 row)

INSERT INTO "Unicode data" (i, t) VALUES ('eus+', 'Permin gox dabiltzu yoskiñ._');
ERROR:  character with byte sequence 0xc3 0xb1 in encoding "UTF8" has no equivalent in encoding "WIN1251"
SELECT * FROM "Unicode data" WHERE i = 'eus+';
 i | t 
---+---
(0 rows)

DELETE FROM "Unicode data" WHERE t = 'Permin gox dabiltzu yoskiñ._';
ERROR:  character with byte sequence 0xc3 0xb1 in encoding "UTF8" has no equivalent in encoding "WIN1251"
SELECT count(*) n FROM "Unicode data" WHERE i = 'eus+';
 n 
---
 0
(1 row)

INSERT INTO "Unicode data" (i, t) VALUES ('fra+', 'Dès Noël où un zéphyr haï me vêt de glaçons würmiens je dîne d’exquis rôtis de bœuf au kir à l’aÿ d’âge mûr & cætera !_');
ERROR:  character with byte sequence 0xc3 0xa8 in encoding "UTF8" has no equivalent in encoding "WIN1251"
SELECT * FROM "Unicode data" WHERE i = 'fra+';
 i | t 
---+---
(0 rows)

DELETE FROM "Unicode data" WHERE t = 'Dès Noël où un zéphyr haï me vêt de glaçons würmiens je dîne d’exquis rôtis de bœuf au kir à l’aÿ d’âge mûr & cætera !_';
ERROR:  character with byte sequence 0xc3 0xa8 in encoding "UTF8" has no equivalent in encoding "WIN1251"
SELECT count(*) n FROM "Unicode data" WHERE i = 'fra+';
 n 
---
 0
(1 row)

INSERT INTO "Unicode data" (i, t) VALUES ('spa+', 'Quiere la boca exhausta vid, kiwi, piña y fugaz jamón._');
ERROR:  character with byte sequence 0xc3 0xb1 in encoding "UTF8" has no equivalent in encoding "WIN1251"
SELECT * FROM "Unicode data" WHERE i = 'spa+';
 i | t 
---+---
(0 rows)

DELETE FROM "Unicode data" WHERE t = 'Quiere la boca exhausta vid, kiwi, piña y fugaz jamón._';
ERROR:  character with byte sequence 0xc3 0xb1 in encoding "UTF8" has no equivalent in encoding "WIN1251"
SELECT count(*) n FROM "Unicode data" WHERE i = 'spa+';
 n 
---
 0
(1 row)

-- 1250, LATIN2
SELECT * FROM "Unicode data" WHERE i = 'cze';
 i | t 
---+---
(0 rows)

SELECT * FROM "Unicode data" WHERE i = 'pol';
 i | t 
---+---
(0 rows)

SELECT * FROM "Unicode data" WHERE i = 'srp';
 i | t 
---+---
(0 rows)

SELECT * FROM "Unicode data" WHERE t LIKE 'Zvláš%';
ERROR:  character with byte sequence 0xc3 0xa1 in encoding "UTF8" has no equivalent in encoding "WIN1251"
SELECT * FROM "Unicode data" WHERE t LIKE 'Pchną%';
ERROR:  character with byte sequence 0xc4 0x85 in encoding "UTF8" has no equivalent in encoding "WIN1251"
SELECT * FROM "Unicode data" WHERE t LIKE 'Ljuba%';
    i    |                                   t                                   
---------+-----------------------------------------------------------------------
 utf_srp | Ljubavi, Olga, hajde poД‘i u FudЕѕi i ДЌut Д‡eЕЎ njeЕѕnu muziku srca.
(1 row)

INSERT INTO "Unicode data" (i, t) VALUES ('cze+', 'Zvlášť zákeřný učeň s ďolíčky běží podél zóny úlů._');
ERROR:  character with byte sequence 0xc3 0xa1 in encoding "UTF8" has no equivalent in encoding "WIN1251"
SELECT * FROM "Unicode data" WHERE i = 'cze+';
 i | t 
---+---
(0 rows)

DELETE FROM "Unicode data" WHERE t = 'Zvlášť zákeřný učeň s ďolíčky běží podél zóny úlů._';
ERROR:  character with byte sequence 0xc3 0xa1 in encoding "UTF8" has no equivalent in encoding "WIN1251"
SELECT count(*) n FROM "Unicode data" WHERE i = 'cze+';
 n 
---
 0
(1 row)

INSERT INTO "Unicode data" (i, t) VALUES ('pol+', 'Pchnąć w tę łódź jeża lub ośm skrzyń fig._');
ERROR:  character with byte sequence 0xc4 0x85 in encoding "UTF8" has no equivalent in encoding "WIN1251"
SELECT * FROM "Unicode data" WHERE i = 'pol+';
 i | t 
---+---
(0 rows)

DELETE FROM "Unicode data" WHERE t = 'Pchnąć w tę łódź jeża lub ośm skrzyń fig._';
ERROR:  character with byte sequence 0xc4 0x85 in encoding "UTF8" has no equivalent in encoding "WIN1251"
SELECT count(*) n FROM "Unicode data" WHERE i = 'pol+';
 n 
---
 0
(1 row)

INSERT INTO "Unicode data" (i, t) VALUES ('srp+', 'Ljubavi, Olga, hajde pođi u Fudži i čut ćeš nježnu muziku srca._');
ERROR:  character with byte sequence 0xc4 0x91 in encoding "UTF8" has no equivalent in encoding "WIN1251"
SELECT * FROM "Unicode data" WHERE i = 'srp+';
 i | t 
---+---
(0 rows)

DELETE FROM "Unicode data" WHERE t = 'Ljubavi, Olga, hajde pođi u Fudži i čut ćeš nježnu muziku srca._';
ERROR:  character with byte sequence 0xc4 0x91 in encoding "UTF8" has no equivalent in encoding "WIN1251"
SELECT count(*) n FROM "Unicode data" WHERE i = 'srp+';
 n 
---
 0
(1 row)

-- 1257, LATIN7
SELECT * FROM "Unicode data" WHERE i = 'lav';
 i | t 
---+---
(0 rows)

SELECT * FROM "Unicode data" WHERE t LIKE 'Ķieģeļu%';
ERROR:  character with byte sequence 0xc4 0xb6 in encoding "UTF8" has no equivalent in encoding "WIN1251"
INSERT INTO "Unicode data" (i, t) VALUES ('lav+', 'Ķieģeļu cepējs Edgars Buls fraku un hūti žāvē uz čīkstošām eņģēm._');
ERROR:  character with byte sequence 0xc4 0xb6 in encoding "UTF8" has no equivalent in encoding "WIN1251"
SELECT * FROM "Unicode data" WHERE i = 'lav+';
 i | t 
---+---
(0 rows)

DELETE FROM "Unicode data" WHERE t = 'Ķieģeļu cepējs Edgars Buls fraku un hūti žāvē uz čīkstošām eņģēm._';
ERROR:  character with byte sequence 0xc4 0xb6 in encoding "UTF8" has no equivalent in encoding "WIN1251"
SELECT count(*) n FROM "Unicode data" WHERE i = 'lav+';
 n 
---
 0
(1 row)

-- EUC_KR
SELECT * FROM "Unicode data" WHERE i = 'kor';
 i | t 
---+---
(0 rows)

SELECT * FROM "Unicode data" WHERE t LIKE '키스의 고%';
ERROR:  character with byte sequence 0xed 0x82 0xa4 in encoding "UTF8" has no equivalent in encoding "WIN1251"
INSERT INTO "Unicode data" (i, t) VALUES ('kor+', '키스의 고유조건은 입술끼리 만나야 하고 특별한 기술은 필요치 않다._');
ERROR:  character with byte sequence 0xed 0x82 0xa4 in encoding "UTF8" has no equivalent in encoding "WIN1251"
SELECT * FROM "Unicode data" WHERE i = 'kor+';
 i | t 
---+---
(0 rows)

DELETE FROM "Unicode data" WHERE t = '키스의 고유조건은 입술끼리 만나야 하고 특별한 기술은 필요치 않다._';
ERROR:  character with byte sequence 0xed 0x82 0xa4 in encoding "UTF8" has no equivalent in encoding "WIN1251"
SELECT count(*) n FROM "Unicode data" WHERE i = 'kor+';
 n 
---
 0
(1 row)

-- 1254, LATIN5
SELECT * FROM "Unicode data" WHERE i = 'aze';
 i | t 
---+---
(0 rows)

SELECT * FROM "Unicode data" WHERE t LIKE 'Zəfər%';
ERROR:  character with byte sequence 0xc9 0x99 in encoding "UTF8" has no equivalent in encoding "WIN1251"
INSERT INTO "Unicode data" (i, t) VALUES ('aze+', 'Zəfər, jaketini də, papağını da götür, bu axşam hava çox soyuq olacaq._');
ERROR:  character with byte sequence 0xc9 0x99 in encoding "UTF8" has no equivalent in encoding "WIN1251"
SELECT * FROM "Unicode data" WHERE i = 'aze+';
 i | t 
---+---
(0 rows)

DELETE FROM "Unicode data" WHERE t = 'Zəfər, jaketini də, papağını da götür, bu axşam hava çox soyuq olacaq._';
ERROR:  character with byte sequence 0xc9 0x99 in encoding "UTF8" has no equivalent in encoding "WIN1251"
SELECT count(*) n FROM "Unicode data" WHERE i = 'aze+';
 n 
---
 0
(1 row)

-- etc
INSERT INTO "Unicode data" (i, t) VALUES ('arm+', 'Բել դղյակի ձախ ժամն օֆ ազգությանը ցպահանջ չճշտած վնաս էր եւ փառք։_');
ERROR:  character with byte sequence 0xd4 0xb2 in encoding "UTF8" has no equivalent in encoding "WIN1251"
SELECT * FROM "Unicode data" WHERE i = 'arm+';
 i | t 
---+---
(0 rows)

DELETE FROM "Unicode data" WHERE t = 'Բել դղյակի ձախ ժամն օֆ ազգությանը ցպահանջ չճշտած վնաս էր եւ փառք։_';
ERROR:  character with byte sequence 0xd4 0xb2 in encoding "UTF8" has no equivalent in encoding "WIN1251"
SELECT count(*) n FROM "Unicode data" WHERE i = 'arm+';
 n 
---
 0
(1 row)

INSERT INTO "Unicode data" (i, t) VALUES ('gle+', 'Chuaigh bé mhórshách le dlúthspád fíorfhinn trí hata mo dhea-phorcáin bhig._');
ERROR:  character with byte sequence 0xc3 0xa9 in encoding "UTF8" has no equivalent in encoding "WIN1251"
SELECT * FROM "Unicode data" WHERE i = 'gle+';
 i | t 
---+---
(0 rows)

DELETE FROM "Unicode data" WHERE t = 'Chuaigh bé mhórshách le dlúthspád fíorfhinn trí hata mo dhea-phorcáin bhig._';
ERROR:  character with byte sequence 0xc3 0xa9 in encoding "UTF8" has no equivalent in encoding "WIN1251"
SELECT count(*) n FROM "Unicode data" WHERE i = 'gle+';
 n 
---
 0
(1 row)

INSERT INTO "Unicode data" (i, t) VALUES ('epo+', 'Laŭ Ludoviko Zamenhof bongustas freŝa ĉeĥa manĝaĵo kun spicoj._');
ERROR:  character with byte sequence 0xc5 0xad in encoding "UTF8" has no equivalent in encoding "WIN1251"
SELECT * FROM "Unicode data" WHERE i = 'epo+';
 i | t 
---+---
(0 rows)

DELETE FROM "Unicode data" WHERE t = 'Laŭ Ludoviko Zamenhof bongustas freŝa ĉeĥa manĝaĵo kun spicoj._';
ERROR:  character with byte sequence 0xc5 0xad in encoding "UTF8" has no equivalent in encoding "WIN1251"
SELECT count(*) n FROM "Unicode data" WHERE i = 'epo+';
 n 
---
 0
(1 row)

DROP FOREIGN TABLE "Unicode data";
DROP SERVER redis_testing_server CASCADE;
NOTICE:  drop cascades to user mapping for public on server redis_testing_server
DROP EXTENSION redis_fdw;
\connect contrib_regression;
DROP DATABASE "contrib_regression_WIN1251";
-- cp1252
CREATE DATABASE "contrib_regression_WIN1252" ENCODING WIN1252 LC_CTYPE='POSIX' LC_COLLATE='POSIX' template template0;
\connect "contrib_regression_WIN1252"
CREATE EXTENSION redis_fdw;
CREATE SERVER redis_testing_server FOREIGN DATA WRAPPER redis_fdw;
CREATE FOREIGN TABLE "Unicode data"(i text, t text)
SERVER redis_testing_server
OPTIONS (database '15');
CREATE USER MAPPING FOR public SERVER redis_testing_server; 
-- EUC_JP
SELECT * FROM "Unicode data" WHERE i = 'jap';
 i | t 
---+---
(0 rows)

SELECT * FROM "Unicode data" WHERE t LIKE 'いろはにほ%';
ERROR:  character with byte sequence 0xe3 0x81 0x84 in encoding "UTF8" has no equivalent in encoding "WIN1252"
INSERT INTO "Unicode data" (i, t) VALUES ('jap+', 'いろはにほへと ちりぬるを わかよたれそ つねならむ うゐのおくやま けふこえて あさきゆめみし ゑひもせす._');
ERROR:  character with byte sequence 0xe3 0x81 0x84 in encoding "UTF8" has no equivalent in encoding "WIN1252"
DELETE FROM "Unicode data" WHERE t = 'いろはにほへと ちりぬるを わかよたれそ つねならむ うゐのおくやま けふこえて あさきゆめみし ゑひもせす._';
ERROR:  character with byte sequence 0xe3 0x81 0x84 in encoding "UTF8" has no equivalent in encoding "WIN1252"
SELECT count(*) n FROM "Unicode data" WHERE i = 'jap+';
 n 
---
 0
(1 row)

-- 1251, ISO_8859_5
SELECT * FROM "Unicode data" WHERE i = 'bel';
 i | t 
---+---
(0 rows)

SELECT * FROM "Unicode data" WHERE i = 'bul';
 i | t 
---+---
(0 rows)

SELECT * FROM "Unicode data" WHERE i = 'rus';
 i | t 
---+---
(0 rows)

SELECT * FROM "Unicode data" WHERE i = 'ukr';
 i | t 
---+---
(0 rows)

SELECT * FROM "Unicode data" WHERE t LIKE 'У руд%';
ERROR:  character with byte sequence 0xd0 0xa3 in encoding "UTF8" has no equivalent in encoding "WIN1252"
SELECT * FROM "Unicode data" WHERE t LIKE 'Ах, ч%';
ERROR:  character with byte sequence 0xd0 0x90 in encoding "UTF8" has no equivalent in encoding "WIN1252"
SELECT * FROM "Unicode data" WHERE t LIKE 'Широк%';
ERROR:  character with byte sequence 0xd0 0xa8 in encoding "UTF8" has no equivalent in encoding "WIN1252"
SELECT * FROM "Unicode data" WHERE t LIKE 'Гей, %';
ERROR:  character with byte sequence 0xd0 0x93 in encoding "UTF8" has no equivalent in encoding "WIN1252"
INSERT INTO "Unicode data" (i, t) VALUES ('bel+', 'У рудога вераб’я ў сховішчы пад фатэлем ляжаць нейкія гаючыя зёлкі._');
ERROR:  character with byte sequence 0xd0 0xa3 in encoding "UTF8" has no equivalent in encoding "WIN1252"
SELECT * FROM "Unicode data" WHERE i = 'bel+';
 i | t 
---+---
(0 rows)

DELETE FROM "Unicode data" WHERE t = 'У рудога вераб’я ў сховішчы пад фатэлем ляжаць нейкія гаючыя зёлкі._';
ERROR:  character with byte sequence 0xd0 0xa3 in encoding "UTF8" has no equivalent in encoding "WIN1252"
SELECT count(*) n FROM "Unicode data" WHERE i = 'bel+';
 n 
---
 0
(1 row)

INSERT INTO "Unicode data" (i, t) VALUES ('bul+', 'Ах, чудна българска земьо, полюшвай цъфтящи жита._');
ERROR:  character with byte sequence 0xd0 0x90 in encoding "UTF8" has no equivalent in encoding "WIN1252"
SELECT * FROM "Unicode data" WHERE i = 'bul+';
 i | t 
---+---
(0 rows)

DELETE FROM "Unicode data" WHERE t = 'Ах, чудна българска земьо, полюшвай цъфтящи жита._';
ERROR:  character with byte sequence 0xd0 0x90 in encoding "UTF8" has no equivalent in encoding "WIN1252"
SELECT count(*) n FROM "Unicode data" WHERE i = 'bul+';
 n 
---
 0
(1 row)

INSERT INTO "Unicode data" (i, t) VALUES ('rus+', 'Широкая электрификация южных губерний даст мощный толчок подъёму сельского хозяйства._');
ERROR:  character with byte sequence 0xd0 0xa8 in encoding "UTF8" has no equivalent in encoding "WIN1252"
SELECT * FROM "Unicode data" WHERE i = 'rus+';
 i | t 
---+---
(0 rows)

DELETE FROM "Unicode data" WHERE t = 'Широкая электрификация южных губерний даст мощный толчок подъёму сельского хозяйства._';
ERROR:  character with byte sequence 0xd0 0xa8 in encoding "UTF8" has no equivalent in encoding "WIN1252"
SELECT count(*) n FROM "Unicode data" WHERE i = 'rus+';
 n 
---
 0
(1 row)

INSERT INTO "Unicode data" (i, t) VALUES ('ukr+', 'Гей, хлопці, не вспію — на ґанку ваша файна їжа знищується бурундучком._');
ERROR:  character with byte sequence 0xd0 0x93 in encoding "UTF8" has no equivalent in encoding "WIN1252"
SELECT * FROM "Unicode data" WHERE i = 'ukr+';
 i | t 
---+---
(0 rows)

DELETE FROM "Unicode data" WHERE t = 'Гей, хлопці, не вспію — на ґанку ваша файна їжа знищується бурундучком._';
ERROR:  character with byte sequence 0xd0 0x93 in encoding "UTF8" has no equivalent in encoding "WIN1252"
SELECT count(*) n FROM "Unicode data" WHERE i = 'ukr+';
 n 
---
 0
(1 row)

-- 1256, ISO_8859_6
SELECT * FROM "Unicode data" WHERE i = 'ara';
 i | t 
---+---
(0 rows)

SELECT * FROM "Unicode data" WHERE t LIKE '%ضَظَغ%';
ERROR:  character with byte sequence 0xd8 0xb6 in encoding "UTF8" has no equivalent in encoding "WIN1252"
INSERT INTO "Unicode data" (i, t) VALUES ('ara+', 'أبجد هوَّز حُطّي كلَمُن سَعْفَص قُرِشَت ثَخَدٌ ضَظَغ_');
ERROR:  character with byte sequence 0xd8 0xa3 in encoding "UTF8" has no equivalent in encoding "WIN1252"
SELECT * FROM "Unicode data" WHERE i = 'ara+';
 i | t 
---+---
(0 rows)

DELETE FROM "Unicode data" WHERE t = 'أبجد هوَّز حُطّي كلَمُن سَعْفَص قُرِشَت ثَخَدٌ ضَظَغ_';
ERROR:  character with byte sequence 0xd8 0xa3 in encoding "UTF8" has no equivalent in encoding "WIN1252"
SELECT count(*) n FROM "Unicode data" WHERE i = 'ara+';
 n 
---
 0
(1 row)

-- 1253, ISO_8859_7
SELECT * FROM "Unicode data" WHERE i = 'gre';
 i | t 
---+---
(0 rows)

SELECT * FROM "Unicode data" WHERE t LIKE 'Τάχισ%';
ERROR:  character with byte sequence 0xce 0xa4 in encoding "UTF8" has no equivalent in encoding "WIN1252"
INSERT INTO "Unicode data" (i, t) VALUES ('gre+', 'Τάχιστη αλώπηξ βαφής ψημένη γη, δρασκελίζει υπέρ νωθρού κυνός_');
ERROR:  character with byte sequence 0xce 0xa4 in encoding "UTF8" has no equivalent in encoding "WIN1252"
SELECT * FROM "Unicode data" WHERE i = 'gre+';
 i | t 
---+---
(0 rows)

DELETE FROM "Unicode data" WHERE t = 'Τάχιστη αλώπηξ βαφής ψημένη γη, δρασκελίζει υπέρ νωθρού κυνός_';
ERROR:  character with byte sequence 0xce 0xa4 in encoding "UTF8" has no equivalent in encoding "WIN1252"
-- 1255, ISO_8859_8
SELECT * FROM "Unicode data" WHERE i = 'heb';
 i | t 
---+---
(0 rows)

SELECT * FROM "Unicode data" WHERE t LIKE '%כי ח%';
ERROR:  character with byte sequence 0xd7 0x9b in encoding "UTF8" has no equivalent in encoding "WIN1252"
INSERT INTO "Unicode data" (i, t) VALUES ('heb+', 'עטלף אבק נס דרך מזגן שהתפוצץ כי חם_');
ERROR:  character with byte sequence 0xd7 0xa2 in encoding "UTF8" has no equivalent in encoding "WIN1252"
SELECT * FROM "Unicode data" WHERE i = 'heb+';
 i | t 
---+---
(0 rows)

DELETE FROM "Unicode data" WHERE t = 'עטלף אבק נס דרך מזגן שהתפוצץ כי חם_';
ERROR:  character with byte sequence 0xd7 0xa2 in encoding "UTF8" has no equivalent in encoding "WIN1252"
SELECT count(*) n FROM "Unicode data" WHERE i = 'heb+';
 n 
---
 0
(1 row)

-- 1252, LATIN1
SELECT * FROM "Unicode data" WHERE i = 'eus';
 i | t 
---+---
(0 rows)

SELECT * FROM "Unicode data" WHERE i = 'fra';
 i | t 
---+---
(0 rows)

SELECT * FROM "Unicode data" WHERE i = 'spa';
 i | t 
---+---
(0 rows)

SELECT * FROM "Unicode data" WHERE t LIKE 'Permi%';
    i    |              t               
---------+------------------------------
 utf_eus | Permin gox dabiltzu yoskiÃ±.
(1 row)

SELECT * FROM "Unicode data" WHERE t LIKE 'Dès N%';
 i | t 
---+---
(0 rows)

SELECT * FROM "Unicode data" WHERE t LIKE 'Quier%';
    i    |                            t                             
---------+----------------------------------------------------------
 utf_spa | Quiere la boca exhausta vid, kiwi, piÃ±a y fugaz jamÃ³n.
(1 row)

INSERT INTO "Unicode data" (i, t) VALUES ('eus+', 'Permin gox dabiltzu yoskiñ._');
SELECT * FROM "Unicode data" WHERE i = 'eus+';
  i   |              t               
------+------------------------------
 eus+ | Permin gox dabiltzu yoskiñ._
(1 row)

DELETE FROM "Unicode data" WHERE t = 'Permin gox dabiltzu yoskiñ._';
SELECT count(*) n FROM "Unicode data" WHERE i = 'eus+';
 n 
---
 0
(1 row)

INSERT INTO "Unicode data" (i, t) VALUES ('fra+', 'Dès Noël où un zéphyr haï me vêt de glaçons würmiens je dîne d’exquis rôtis de bœuf au kir à l’aÿ d’âge mûr & cætera !_');
SELECT * FROM "Unicode data" WHERE i = 'fra+';
  i   |                                                            t                                                            
------+-------------------------------------------------------------------------------------------------------------------------
 fra+ | Dès Noël où un zéphyr haï me vêt de glaçons würmiens je dîne d’exquis rôtis de bœuf au kir à l’aÿ d’âge mûr & cætera !_
(1 row)

DELETE FROM "Unicode data" WHERE t = 'Dès Noël où un zéphyr haï me vêt de glaçons würmiens je dîne d’exquis rôtis de bœuf au kir à l’aÿ d’âge mûr & cætera !_';
SELECT count(*) n FROM "Unicode data" WHERE i = 'fra+';
 n 
---
 0
(1 row)

INSERT INTO "Unicode data" (i, t) VALUES ('spa+', 'Quiere la boca exhausta vid, kiwi, piña y fugaz jamón._');
SELECT * FROM "Unicode data" WHERE i = 'spa+';
  i   |                            t                            
------+---------------------------------------------------------
 spa+ | Quiere la boca exhausta vid, kiwi, piña y fugaz jamón._
(1 row)

DELETE FROM "Unicode data" WHERE t = 'Quiere la boca exhausta vid, kiwi, piña y fugaz jamón._';
SELECT count(*) n FROM "Unicode data" WHERE i = 'spa+';
 n 
---
 0
(1 row)

-- 1250, LATIN2
SELECT * FROM "Unicode data" WHERE i = 'cze';
 i | t 
---+---
(0 rows)

SELECT * FROM "Unicode data" WHERE i = 'pol';
 i | t 
---+---
(0 rows)

SELECT * FROM "Unicode data" WHERE i = 'srp';
 i | t 
---+---
(0 rows)

SELECT * FROM "Unicode data" WHERE t LIKE 'Zvláš%';
 i | t 
---+---
(0 rows)

SELECT * FROM "Unicode data" WHERE t LIKE 'Pchną%';
ERROR:  character with byte sequence 0xc4 0x85 in encoding "UTF8" has no equivalent in encoding "WIN1252"
SELECT * FROM "Unicode data" WHERE t LIKE 'Ljuba%';
ERROR:  character with byte sequence 0x8d in encoding "WIN1252" has no equivalent in encoding "UTF8"
INSERT INTO "Unicode data" (i, t) VALUES ('cze+', 'Zvlášť zákeřný učeň s ďolíčky běží podél zóny úlů._');
ERROR:  character with byte sequence 0xc5 0xa5 in encoding "UTF8" has no equivalent in encoding "WIN1252"
SELECT * FROM "Unicode data" WHERE i = 'cze+';
 i | t 
---+---
(0 rows)

DELETE FROM "Unicode data" WHERE t = 'Zvlášť zákeřný učeň s ďolíčky běží podél zóny úlů._';
ERROR:  character with byte sequence 0xc5 0xa5 in encoding "UTF8" has no equivalent in encoding "WIN1252"
SELECT count(*) n FROM "Unicode data" WHERE i = 'cze+';
 n 
---
 0
(1 row)

INSERT INTO "Unicode data" (i, t) VALUES ('pol+', 'Pchnąć w tę łódź jeża lub ośm skrzyń fig._');
ERROR:  character with byte sequence 0xc4 0x85 in encoding "UTF8" has no equivalent in encoding "WIN1252"
SELECT * FROM "Unicode data" WHERE i = 'pol+';
 i | t 
---+---
(0 rows)

DELETE FROM "Unicode data" WHERE t = 'Pchnąć w tę łódź jeża lub ośm skrzyń fig._';
ERROR:  character with byte sequence 0xc4 0x85 in encoding "UTF8" has no equivalent in encoding "WIN1252"
SELECT count(*) n FROM "Unicode data" WHERE i = 'pol+';
 n 
---
 0
(1 row)

INSERT INTO "Unicode data" (i, t) VALUES ('srp+', 'Ljubavi, Olga, hajde pođi u Fudži i čut ćeš nježnu muziku srca._');
ERROR:  character with byte sequence 0xc4 0x91 in encoding "UTF8" has no equivalent in encoding "WIN1252"
SELECT * FROM "Unicode data" WHERE i = 'srp+';
 i | t 
---+---
(0 rows)

DELETE FROM "Unicode data" WHERE t = 'Ljubavi, Olga, hajde pođi u Fudži i čut ćeš nježnu muziku srca._';
ERROR:  character with byte sequence 0xc4 0x91 in encoding "UTF8" has no equivalent in encoding "WIN1252"
SELECT count(*) n FROM "Unicode data" WHERE i = 'srp+';
 n 
---
 0
(1 row)

-- 1257, LATIN7
SELECT * FROM "Unicode data" WHERE i = 'lav';
 i | t 
---+---
(0 rows)

SELECT * FROM "Unicode data" WHERE t LIKE 'Ķieģeļu%';
ERROR:  character with byte sequence 0xc4 0xb6 in encoding "UTF8" has no equivalent in encoding "WIN1252"
INSERT INTO "Unicode data" (i, t) VALUES ('lav+', 'Ķieģeļu cepējs Edgars Buls fraku un hūti žāvē uz čīkstošām eņģēm._');
ERROR:  character with byte sequence 0xc4 0xb6 in encoding "UTF8" has no equivalent in encoding "WIN1252"
SELECT * FROM "Unicode data" WHERE i = 'lav+';
 i | t 
---+---
(0 rows)

DELETE FROM "Unicode data" WHERE t = 'Ķieģeļu cepējs Edgars Buls fraku un hūti žāvē uz čīkstošām eņģēm._';
ERROR:  character with byte sequence 0xc4 0xb6 in encoding "UTF8" has no equivalent in encoding "WIN1252"
SELECT count(*) n FROM "Unicode data" WHERE i = 'lav+';
 n 
---
 0
(1 row)

-- EUC_KR
SELECT * FROM "Unicode data" WHERE i = 'kor';
 i | t 
---+---
(0 rows)

SELECT * FROM "Unicode data" WHERE t LIKE '키스의 고%';
ERROR:  character with byte sequence 0xed 0x82 0xa4 in encoding "UTF8" has no equivalent in encoding "WIN1252"
INSERT INTO "Unicode data" (i, t) VALUES ('kor+', '키스의 고유조건은 입술끼리 만나야 하고 특별한 기술은 필요치 않다._');
ERROR:  character with byte sequence 0xed 0x82 0xa4 in encoding "UTF8" has no equivalent in encoding "WIN1252"
SELECT * FROM "Unicode data" WHERE i = 'kor+';
 i | t 
---+---
(0 rows)

DELETE FROM "Unicode data" WHERE t = '키스의 고유조건은 입술끼리 만나야 하고 특별한 기술은 필요치 않다._';
ERROR:  character with byte sequence 0xed 0x82 0xa4 in encoding "UTF8" has no equivalent in encoding "WIN1252"
SELECT count(*) n FROM "Unicode data" WHERE i = 'kor+';
 n 
---
 0
(1 row)

-- 1254, LATIN5
SELECT * FROM "Unicode data" WHERE i = 'aze';
 i | t 
---+---
(0 rows)

SELECT * FROM "Unicode data" WHERE t LIKE 'Zəfər%';
ERROR:  character with byte sequence 0xc9 0x99 in encoding "UTF8" has no equivalent in encoding "WIN1252"
INSERT INTO "Unicode data" (i, t) VALUES ('aze+', 'Zəfər, jaketini də, papağını da götür, bu axşam hava çox soyuq olacaq._');
ERROR:  character with byte sequence 0xc9 0x99 in encoding "UTF8" has no equivalent in encoding "WIN1252"
SELECT * FROM "Unicode data" WHERE i = 'aze+';
 i | t 
---+---
(0 rows)

DELETE FROM "Unicode data" WHERE t = 'Zəfər, jaketini də, papağını da götür, bu axşam hava çox soyuq olacaq._';
ERROR:  character with byte sequence 0xc9 0x99 in encoding "UTF8" has no equivalent in encoding "WIN1252"
SELECT count(*) n FROM "Unicode data" WHERE i = 'aze+';
 n 
---
 0
(1 row)

-- etc
INSERT INTO "Unicode data" (i, t) VALUES ('arm+', 'Բել դղյակի ձախ ժամն օֆ ազգությանը ցպահանջ չճշտած վնաս էր եւ փառք։_');
ERROR:  character with byte sequence 0xd4 0xb2 in encoding "UTF8" has no equivalent in encoding "WIN1252"
SELECT * FROM "Unicode data" WHERE i = 'arm+';
 i | t 
---+---
(0 rows)

DELETE FROM "Unicode data" WHERE t = 'Բել դղյակի ձախ ժամն օֆ ազգությանը ցպահանջ չճշտած վնաս էր եւ փառք։_';
ERROR:  character with byte sequence 0xd4 0xb2 in encoding "UTF8" has no equivalent in encoding "WIN1252"
SELECT count(*) n FROM "Unicode data" WHERE i = 'arm+';
 n 
---
 0
(1 row)

INSERT INTO "Unicode data" (i, t) VALUES ('gle+', 'Chuaigh bé mhórshách le dlúthspád fíorfhinn trí hata mo dhea-phorcáin bhig._');
SELECT * FROM "Unicode data" WHERE i = 'gle+';
  i   |                                      t                                       
------+------------------------------------------------------------------------------
 gle+ | Chuaigh bé mhórshách le dlúthspád fíorfhinn trí hata mo dhea-phorcáin bhig._
(1 row)

DELETE FROM "Unicode data" WHERE t = 'Chuaigh bé mhórshách le dlúthspád fíorfhinn trí hata mo dhea-phorcáin bhig._';
SELECT count(*) n FROM "Unicode data" WHERE i = 'gle+';
 n 
---
 0
(1 row)

INSERT INTO "Unicode data" (i, t) VALUES ('epo+', 'Laŭ Ludoviko Zamenhof bongustas freŝa ĉeĥa manĝaĵo kun spicoj._');
ERROR:  character with byte sequence 0xc5 0xad in encoding "UTF8" has no equivalent in encoding "WIN1252"
SELECT * FROM "Unicode data" WHERE i = 'epo+';
 i | t 
---+---
(0 rows)

DELETE FROM "Unicode data" WHERE t = 'Laŭ Ludoviko Zamenhof bongustas freŝa ĉeĥa manĝaĵo kun spicoj._';
ERROR:  character with byte sequence 0xc5 0xad in encoding "UTF8" has no equivalent in encoding "WIN1252"
SELECT count(*) n FROM "Unicode data" WHERE i = 'epo+';
 n 
---
 0
(1 row)

DROP FOREIGN TABLE "Unicode data";
DROP SERVER redis_testing_server CASCADE;
NOTICE:  drop cascades to user mapping for public on server redis_testing_server
DROP EXTENSION redis_fdw;
\connect contrib_regression;
DROP DATABASE "contrib_regression_WIN1252";
-- cp1253
CREATE DATABASE "contrib_regression_WIN1253" ENCODING WIN1253 LC_CTYPE='POSIX' LC_COLLATE='POSIX' template template0;
\connect "contrib_regression_WIN1253"
CREATE EXTENSION redis_fdw;
CREATE SERVER redis_testing_server FOREIGN DATA WRAPPER redis_fdw;
CREATE FOREIGN TABLE "Unicode data"(i text, t text)
SERVER redis_testing_server
OPTIONS (database '15');
CREATE USER MAPPING FOR public SERVER redis_testing_server; 
-- EUC_JP
SELECT * FROM "Unicode data" WHERE i = 'jap';
 i | t 
---+---
(0 rows)

SELECT * FROM "Unicode data" WHERE t LIKE 'いろはにほ%';
ERROR:  character with byte sequence 0xe3 0x81 0x84 in encoding "UTF8" has no equivalent in encoding "WIN1253"
INSERT INTO "Unicode data" (i, t) VALUES ('jap+', 'いろはにほへと ちりぬるを わかよたれそ つねならむ うゐのおくやま けふこえて あさきゆめみし ゑひもせす._');
ERROR:  character with byte sequence 0xe3 0x81 0x84 in encoding "UTF8" has no equivalent in encoding "WIN1253"
DELETE FROM "Unicode data" WHERE t = 'いろはにほへと ちりぬるを わかよたれそ つねならむ うゐのおくやま けふこえて あさきゆめみし ゑひもせす._';
ERROR:  character with byte sequence 0xe3 0x81 0x84 in encoding "UTF8" has no equivalent in encoding "WIN1253"
SELECT count(*) n FROM "Unicode data" WHERE i = 'jap+';
 n 
---
 0
(1 row)

-- 1251, ISO_8859_5
SELECT * FROM "Unicode data" WHERE i = 'bel';
 i | t 
---+---
(0 rows)

SELECT * FROM "Unicode data" WHERE i = 'bul';
 i | t 
---+---
(0 rows)

SELECT * FROM "Unicode data" WHERE i = 'rus';
 i | t 
---+---
(0 rows)

SELECT * FROM "Unicode data" WHERE i = 'ukr';
 i | t 
---+---
(0 rows)

SELECT * FROM "Unicode data" WHERE t LIKE 'У руд%';
ERROR:  character with byte sequence 0xd0 0xa3 in encoding "UTF8" has no equivalent in encoding "WIN1253"
SELECT * FROM "Unicode data" WHERE t LIKE 'Ах, ч%';
ERROR:  character with byte sequence 0xd0 0x90 in encoding "UTF8" has no equivalent in encoding "WIN1253"
SELECT * FROM "Unicode data" WHERE t LIKE 'Широк%';
ERROR:  character with byte sequence 0xd0 0xa8 in encoding "UTF8" has no equivalent in encoding "WIN1253"
SELECT * FROM "Unicode data" WHERE t LIKE 'Гей, %';
ERROR:  character with byte sequence 0xd0 0x93 in encoding "UTF8" has no equivalent in encoding "WIN1253"
INSERT INTO "Unicode data" (i, t) VALUES ('bel+', 'У рудога вераб’я ў сховішчы пад фатэлем ляжаць нейкія гаючыя зёлкі._');
ERROR:  character with byte sequence 0xd0 0xa3 in encoding "UTF8" has no equivalent in encoding "WIN1253"
SELECT * FROM "Unicode data" WHERE i = 'bel+';
 i | t 
---+---
(0 rows)

DELETE FROM "Unicode data" WHERE t = 'У рудога вераб’я ў сховішчы пад фатэлем ляжаць нейкія гаючыя зёлкі._';
ERROR:  character with byte sequence 0xd0 0xa3 in encoding "UTF8" has no equivalent in encoding "WIN1253"
SELECT count(*) n FROM "Unicode data" WHERE i = 'bel+';
 n 
---
 0
(1 row)

INSERT INTO "Unicode data" (i, t) VALUES ('bul+', 'Ах, чудна българска земьо, полюшвай цъфтящи жита._');
ERROR:  character with byte sequence 0xd0 0x90 in encoding "UTF8" has no equivalent in encoding "WIN1253"
SELECT * FROM "Unicode data" WHERE i = 'bul+';
 i | t 
---+---
(0 rows)

DELETE FROM "Unicode data" WHERE t = 'Ах, чудна българска земьо, полюшвай цъфтящи жита._';
ERROR:  character with byte sequence 0xd0 0x90 in encoding "UTF8" has no equivalent in encoding "WIN1253"
SELECT count(*) n FROM "Unicode data" WHERE i = 'bul+';
 n 
---
 0
(1 row)

INSERT INTO "Unicode data" (i, t) VALUES ('rus+', 'Широкая электрификация южных губерний даст мощный толчок подъёму сельского хозяйства._');
ERROR:  character with byte sequence 0xd0 0xa8 in encoding "UTF8" has no equivalent in encoding "WIN1253"
SELECT * FROM "Unicode data" WHERE i = 'rus+';
 i | t 
---+---
(0 rows)

DELETE FROM "Unicode data" WHERE t = 'Широкая электрификация южных губерний даст мощный толчок подъёму сельского хозяйства._';
ERROR:  character with byte sequence 0xd0 0xa8 in encoding "UTF8" has no equivalent in encoding "WIN1253"
SELECT count(*) n FROM "Unicode data" WHERE i = 'rus+';
 n 
---
 0
(1 row)

INSERT INTO "Unicode data" (i, t) VALUES ('ukr+', 'Гей, хлопці, не вспію — на ґанку ваша файна їжа знищується бурундучком._');
ERROR:  character with byte sequence 0xd0 0x93 in encoding "UTF8" has no equivalent in encoding "WIN1253"
SELECT * FROM "Unicode data" WHERE i = 'ukr+';
 i | t 
---+---
(0 rows)

DELETE FROM "Unicode data" WHERE t = 'Гей, хлопці, не вспію — на ґанку ваша файна їжа знищується бурундучком._';
ERROR:  character with byte sequence 0xd0 0x93 in encoding "UTF8" has no equivalent in encoding "WIN1253"
SELECT count(*) n FROM "Unicode data" WHERE i = 'ukr+';
 n 
---
 0
(1 row)

-- 1256, ISO_8859_6
SELECT * FROM "Unicode data" WHERE i = 'ara';
 i | t 
---+---
(0 rows)

SELECT * FROM "Unicode data" WHERE t LIKE '%ضَظَغ%';
ERROR:  character with byte sequence 0xd8 0xb6 in encoding "UTF8" has no equivalent in encoding "WIN1253"
INSERT INTO "Unicode data" (i, t) VALUES ('ara+', 'أبجد هوَّز حُطّي كلَمُن سَعْفَص قُرِشَت ثَخَدٌ ضَظَغ_');
ERROR:  character with byte sequence 0xd8 0xa3 in encoding "UTF8" has no equivalent in encoding "WIN1253"
SELECT * FROM "Unicode data" WHERE i = 'ara+';
 i | t 
---+---
(0 rows)

DELETE FROM "Unicode data" WHERE t = 'أبجد هوَّز حُطّي كلَمُن سَعْفَص قُرِشَت ثَخَدٌ ضَظَغ_';
ERROR:  character with byte sequence 0xd8 0xa3 in encoding "UTF8" has no equivalent in encoding "WIN1253"
SELECT count(*) n FROM "Unicode data" WHERE i = 'ara+';
 n 
---
 0
(1 row)

-- 1253, ISO_8859_7
SELECT * FROM "Unicode data" WHERE i = 'gre';
 i | t 
---+---
(0 rows)

SELECT * FROM "Unicode data" WHERE t LIKE 'Τάχισ%';
 i | t 
---+---
(0 rows)

INSERT INTO "Unicode data" (i, t) VALUES ('gre+', 'Τάχιστη αλώπηξ βαφής ψημένη γη, δρασκελίζει υπέρ νωθρού κυνός_');
SELECT * FROM "Unicode data" WHERE i = 'gre+';
  i   |                               t                                
------+----------------------------------------------------------------
 gre+ | Τάχιστη αλώπηξ βαφής ψημένη γη, δρασκελίζει υπέρ νωθρού κυνός_
(1 row)

DELETE FROM "Unicode data" WHERE t = 'Τάχιστη αλώπηξ βαφής ψημένη γη, δρασκελίζει υπέρ νωθρού κυνός_';
-- 1255, ISO_8859_8
SELECT * FROM "Unicode data" WHERE i = 'heb';
 i | t 
---+---
(0 rows)

SELECT * FROM "Unicode data" WHERE t LIKE '%כי ח%';
ERROR:  character with byte sequence 0xd7 0x9b in encoding "UTF8" has no equivalent in encoding "WIN1253"
INSERT INTO "Unicode data" (i, t) VALUES ('heb+', 'עטלף אבק נס דרך מזגן שהתפוצץ כי חם_');
ERROR:  character with byte sequence 0xd7 0xa2 in encoding "UTF8" has no equivalent in encoding "WIN1253"
SELECT * FROM "Unicode data" WHERE i = 'heb+';
 i | t 
---+---
(0 rows)

DELETE FROM "Unicode data" WHERE t = 'עטלף אבק נס דרך מזגן שהתפוצץ כי חם_';
ERROR:  character with byte sequence 0xd7 0xa2 in encoding "UTF8" has no equivalent in encoding "WIN1253"
SELECT count(*) n FROM "Unicode data" WHERE i = 'heb+';
 n 
---
 0
(1 row)

-- 1252, LATIN1
SELECT * FROM "Unicode data" WHERE i = 'eus';
 i | t 
---+---
(0 rows)

SELECT * FROM "Unicode data" WHERE i = 'fra';
 i | t 
---+---
(0 rows)

SELECT * FROM "Unicode data" WHERE i = 'spa';
 i | t 
---+---
(0 rows)

SELECT * FROM "Unicode data" WHERE t LIKE 'Permi%';
    i    |              t               
---------+------------------------------
 utf_eus | Permin gox dabiltzu yoskiΓ±.
(1 row)

SELECT * FROM "Unicode data" WHERE t LIKE 'Dès N%';
ERROR:  character with byte sequence 0xc3 0xa8 in encoding "UTF8" has no equivalent in encoding "WIN1253"
SELECT * FROM "Unicode data" WHERE t LIKE 'Quier%';
    i    |                            t                             
---------+----------------------------------------------------------
 utf_spa | Quiere la boca exhausta vid, kiwi, piΓ±a y fugaz jamΓ³n.
(1 row)

INSERT INTO "Unicode data" (i, t) VALUES ('eus+', 'Permin gox dabiltzu yoskiñ._');
ERROR:  character with byte sequence 0xc3 0xb1 in encoding "UTF8" has no equivalent in encoding "WIN1253"
SELECT * FROM "Unicode data" WHERE i = 'eus+';
 i | t 
---+---
(0 rows)

DELETE FROM "Unicode data" WHERE t = 'Permin gox dabiltzu yoskiñ._';
ERROR:  character with byte sequence 0xc3 0xb1 in encoding "UTF8" has no equivalent in encoding "WIN1253"
SELECT count(*) n FROM "Unicode data" WHERE i = 'eus+';
 n 
---
 0
(1 row)

INSERT INTO "Unicode data" (i, t) VALUES ('fra+', 'Dès Noël où un zéphyr haï me vêt de glaçons würmiens je dîne d’exquis rôtis de bœuf au kir à l’aÿ d’âge mûr & cætera !_');
ERROR:  character with byte sequence 0xc3 0xa8 in encoding "UTF8" has no equivalent in encoding "WIN1253"
SELECT * FROM "Unicode data" WHERE i = 'fra+';
 i | t 
---+---
(0 rows)

DELETE FROM "Unicode data" WHERE t = 'Dès Noël où un zéphyr haï me vêt de glaçons würmiens je dîne d’exquis rôtis de bœuf au kir à l’aÿ d’âge mûr & cætera !_';
ERROR:  character with byte sequence 0xc3 0xa8 in encoding "UTF8" has no equivalent in encoding "WIN1253"
SELECT count(*) n FROM "Unicode data" WHERE i = 'fra+';
 n 
---
 0
(1 row)

INSERT INTO "Unicode data" (i, t) VALUES ('spa+', 'Quiere la boca exhausta vid, kiwi, piña y fugaz jamón._');
ERROR:  character with byte sequence 0xc3 0xb1 in encoding "UTF8" has no equivalent in encoding "WIN1253"
SELECT * FROM "Unicode data" WHERE i = 'spa+';
 i | t 
---+---
(0 rows)

DELETE FROM "Unicode data" WHERE t = 'Quiere la boca exhausta vid, kiwi, piña y fugaz jamón._';
ERROR:  character with byte sequence 0xc3 0xb1 in encoding "UTF8" has no equivalent in encoding "WIN1253"
SELECT count(*) n FROM "Unicode data" WHERE i = 'spa+';
 n 
---
 0
(1 row)

-- 1250, LATIN2
SELECT * FROM "Unicode data" WHERE i = 'cze';
 i | t 
---+---
(0 rows)

SELECT * FROM "Unicode data" WHERE i = 'pol';
 i | t 
---+---
(0 rows)

SELECT * FROM "Unicode data" WHERE i = 'srp';
 i | t 
---+---
(0 rows)

SELECT * FROM "Unicode data" WHERE t LIKE 'Zvláš%';
ERROR:  character with byte sequence 0xc3 0xa1 in encoding "UTF8" has no equivalent in encoding "WIN1253"
SELECT * FROM "Unicode data" WHERE t LIKE 'Pchną%';
ERROR:  character with byte sequence 0xc4 0x85 in encoding "UTF8" has no equivalent in encoding "WIN1253"
SELECT * FROM "Unicode data" WHERE t LIKE 'Ljuba%';
ERROR:  character with byte sequence 0x8d in encoding "WIN1253" has no equivalent in encoding "UTF8"
INSERT INTO "Unicode data" (i, t) VALUES ('cze+', 'Zvlášť zákeřný učeň s ďolíčky běží podél zóny úlů._');
ERROR:  character with byte sequence 0xc3 0xa1 in encoding "UTF8" has no equivalent in encoding "WIN1253"
SELECT * FROM "Unicode data" WHERE i = 'cze+';
 i | t 
---+---
(0 rows)

DELETE FROM "Unicode data" WHERE t = 'Zvlášť zákeřný učeň s ďolíčky běží podél zóny úlů._';
ERROR:  character with byte sequence 0xc3 0xa1 in encoding "UTF8" has no equivalent in encoding "WIN1253"
SELECT count(*) n FROM "Unicode data" WHERE i = 'cze+';
 n 
---
 0
(1 row)

INSERT INTO "Unicode data" (i, t) VALUES ('pol+', 'Pchnąć w tę łódź jeża lub ośm skrzyń fig._');
ERROR:  character with byte sequence 0xc4 0x85 in encoding "UTF8" has no equivalent in encoding "WIN1253"
SELECT * FROM "Unicode data" WHERE i = 'pol+';
 i | t 
---+---
(0 rows)

DELETE FROM "Unicode data" WHERE t = 'Pchnąć w tę łódź jeża lub ośm skrzyń fig._';
ERROR:  character with byte sequence 0xc4 0x85 in encoding "UTF8" has no equivalent in encoding "WIN1253"
SELECT count(*) n FROM "Unicode data" WHERE i = 'pol+';
 n 
---
 0
(1 row)

INSERT INTO "Unicode data" (i, t) VALUES ('srp+', 'Ljubavi, Olga, hajde pođi u Fudži i čut ćeš nježnu muziku srca._');
ERROR:  character with byte sequence 0xc4 0x91 in encoding "UTF8" has no equivalent in encoding "WIN1253"
SELECT * FROM "Unicode data" WHERE i = 'srp+';
 i | t 
---+---
(0 rows)

DELETE FROM "Unicode data" WHERE t = 'Ljubavi, Olga, hajde pođi u Fudži i čut ćeš nježnu muziku srca._';
ERROR:  character with byte sequence 0xc4 0x91 in encoding "UTF8" has no equivalent in encoding "WIN1253"
SELECT count(*) n FROM "Unicode data" WHERE i = 'srp+';
 n 
---
 0
(1 row)

-- 1257, LATIN7
SELECT * FROM "Unicode data" WHERE i = 'lav';
 i | t 
---+---
(0 rows)

SELECT * FROM "Unicode data" WHERE t LIKE 'Ķieģeļu%';
ERROR:  character with byte sequence 0xc4 0xb6 in encoding "UTF8" has no equivalent in encoding "WIN1253"
INSERT INTO "Unicode data" (i, t) VALUES ('lav+', 'Ķieģeļu cepējs Edgars Buls fraku un hūti žāvē uz čīkstošām eņģēm._');
ERROR:  character with byte sequence 0xc4 0xb6 in encoding "UTF8" has no equivalent in encoding "WIN1253"
SELECT * FROM "Unicode data" WHERE i = 'lav+';
 i | t 
---+---
(0 rows)

DELETE FROM "Unicode data" WHERE t = 'Ķieģeļu cepējs Edgars Buls fraku un hūti žāvē uz čīkstošām eņģēm._';
ERROR:  character with byte sequence 0xc4 0xb6 in encoding "UTF8" has no equivalent in encoding "WIN1253"
SELECT count(*) n FROM "Unicode data" WHERE i = 'lav+';
 n 
---
 0
(1 row)

-- EUC_KR
SELECT * FROM "Unicode data" WHERE i = 'kor';
 i | t 
---+---
(0 rows)

SELECT * FROM "Unicode data" WHERE t LIKE '키스의 고%';
ERROR:  character with byte sequence 0xed 0x82 0xa4 in encoding "UTF8" has no equivalent in encoding "WIN1253"
INSERT INTO "Unicode data" (i, t) VALUES ('kor+', '키스의 고유조건은 입술끼리 만나야 하고 특별한 기술은 필요치 않다._');
ERROR:  character with byte sequence 0xed 0x82 0xa4 in encoding "UTF8" has no equivalent in encoding "WIN1253"
SELECT * FROM "Unicode data" WHERE i = 'kor+';
 i | t 
---+---
(0 rows)

DELETE FROM "Unicode data" WHERE t = '키스의 고유조건은 입술끼리 만나야 하고 특별한 기술은 필요치 않다._';
ERROR:  character with byte sequence 0xed 0x82 0xa4 in encoding "UTF8" has no equivalent in encoding "WIN1253"
SELECT count(*) n FROM "Unicode data" WHERE i = 'kor+';
 n 
---
 0
(1 row)

-- 1254, LATIN5
SELECT * FROM "Unicode data" WHERE i = 'aze';
 i | t 
---+---
(0 rows)

SELECT * FROM "Unicode data" WHERE t LIKE 'Zəfər%';
ERROR:  character with byte sequence 0xc9 0x99 in encoding "UTF8" has no equivalent in encoding "WIN1253"
INSERT INTO "Unicode data" (i, t) VALUES ('aze+', 'Zəfər, jaketini də, papağını da götür, bu axşam hava çox soyuq olacaq._');
ERROR:  character with byte sequence 0xc9 0x99 in encoding "UTF8" has no equivalent in encoding "WIN1253"
SELECT * FROM "Unicode data" WHERE i = 'aze+';
 i | t 
---+---
(0 rows)

DELETE FROM "Unicode data" WHERE t = 'Zəfər, jaketini də, papağını da götür, bu axşam hava çox soyuq olacaq._';
ERROR:  character with byte sequence 0xc9 0x99 in encoding "UTF8" has no equivalent in encoding "WIN1253"
SELECT count(*) n FROM "Unicode data" WHERE i = 'aze+';
 n 
---
 0
(1 row)

-- etc
INSERT INTO "Unicode data" (i, t) VALUES ('arm+', 'Բել դղյակի ձախ ժամն օֆ ազգությանը ցպահանջ չճշտած վնաս էր եւ փառք։_');
ERROR:  character with byte sequence 0xd4 0xb2 in encoding "UTF8" has no equivalent in encoding "WIN1253"
SELECT * FROM "Unicode data" WHERE i = 'arm+';
 i | t 
---+---
(0 rows)

DELETE FROM "Unicode data" WHERE t = 'Բել դղյակի ձախ ժամն օֆ ազգությանը ցպահանջ չճշտած վնաս էր եւ փառք։_';
ERROR:  character with byte sequence 0xd4 0xb2 in encoding "UTF8" has no equivalent in encoding "WIN1253"
SELECT count(*) n FROM "Unicode data" WHERE i = 'arm+';
 n 
---
 0
(1 row)

INSERT INTO "Unicode data" (i, t) VALUES ('gle+', 'Chuaigh bé mhórshách le dlúthspád fíorfhinn trí hata mo dhea-phorcáin bhig._');
ERROR:  character with byte sequence 0xc3 0xa9 in encoding "UTF8" has no equivalent in encoding "WIN1253"
SELECT * FROM "Unicode data" WHERE i = 'gle+';
 i | t 
---+---
(0 rows)

DELETE FROM "Unicode data" WHERE t = 'Chuaigh bé mhórshách le dlúthspád fíorfhinn trí hata mo dhea-phorcáin bhig._';
ERROR:  character with byte sequence 0xc3 0xa9 in encoding "UTF8" has no equivalent in encoding "WIN1253"
SELECT count(*) n FROM "Unicode data" WHERE i = 'gle+';
 n 
---
 0
(1 row)

INSERT INTO "Unicode data" (i, t) VALUES ('epo+', 'Laŭ Ludoviko Zamenhof bongustas freŝa ĉeĥa manĝaĵo kun spicoj._');
ERROR:  character with byte sequence 0xc5 0xad in encoding "UTF8" has no equivalent in encoding "WIN1253"
SELECT * FROM "Unicode data" WHERE i = 'epo+';
 i | t 
---+---
(0 rows)

DELETE FROM "Unicode data" WHERE t = 'Laŭ Ludoviko Zamenhof bongustas freŝa ĉeĥa manĝaĵo kun spicoj._';
ERROR:  character with byte sequence 0xc5 0xad in encoding "UTF8" has no equivalent in encoding "WIN1253"
SELECT count(*) n FROM "Unicode data" WHERE i = 'epo+';
 n 
---
 0
(1 row)

DROP FOREIGN TABLE "Unicode data";
DROP SERVER redis_testing_server CASCADE;
NOTICE:  drop cascades to user mapping for public on server redis_testing_server
DROP EXTENSION redis_fdw;
\connect contrib_regression;
DROP DATABASE "contrib_regression_WIN1253";
-- cp1254
CREATE DATABASE "contrib_regression_WIN1254" ENCODING WIN1254 LC_CTYPE='POSIX' LC_COLLATE='POSIX' template template0;
\connect "contrib_regression_WIN1254"
CREATE EXTENSION redis_fdw;
CREATE SERVER redis_testing_server FOREIGN DATA WRAPPER redis_fdw;
CREATE FOREIGN TABLE "Unicode data"(i text, t text)
SERVER redis_testing_server
OPTIONS (database '15');
CREATE USER MAPPING FOR public SERVER redis_testing_server; 
-- EUC_JP
SELECT * FROM "Unicode data" WHERE i = 'jap';
 i | t 
---+---
(0 rows)

SELECT * FROM "Unicode data" WHERE t LIKE 'いろはにほ%';
ERROR:  character with byte sequence 0xe3 0x81 0x84 in encoding "UTF8" has no equivalent in encoding "WIN1254"
INSERT INTO "Unicode data" (i, t) VALUES ('jap+', 'いろはにほへと ちりぬるを わかよたれそ つねならむ うゐのおくやま けふこえて あさきゆめみし ゑひもせす._');
ERROR:  character with byte sequence 0xe3 0x81 0x84 in encoding "UTF8" has no equivalent in encoding "WIN1254"
DELETE FROM "Unicode data" WHERE t = 'いろはにほへと ちりぬるを わかよたれそ つねならむ うゐのおくやま けふこえて あさきゆめみし ゑひもせす._';
ERROR:  character with byte sequence 0xe3 0x81 0x84 in encoding "UTF8" has no equivalent in encoding "WIN1254"
SELECT count(*) n FROM "Unicode data" WHERE i = 'jap+';
 n 
---
 0
(1 row)

-- 1251, ISO_8859_5
SELECT * FROM "Unicode data" WHERE i = 'bel';
 i | t 
---+---
(0 rows)

SELECT * FROM "Unicode data" WHERE i = 'bul';
 i | t 
---+---
(0 rows)

SELECT * FROM "Unicode data" WHERE i = 'rus';
 i | t 
---+---
(0 rows)

SELECT * FROM "Unicode data" WHERE i = 'ukr';
 i | t 
---+---
(0 rows)

SELECT * FROM "Unicode data" WHERE t LIKE 'У руд%';
ERROR:  character with byte sequence 0xd0 0xa3 in encoding "UTF8" has no equivalent in encoding "WIN1254"
SELECT * FROM "Unicode data" WHERE t LIKE 'Ах, ч%';
ERROR:  character with byte sequence 0xd0 0x90 in encoding "UTF8" has no equivalent in encoding "WIN1254"
SELECT * FROM "Unicode data" WHERE t LIKE 'Широк%';
ERROR:  character with byte sequence 0xd0 0xa8 in encoding "UTF8" has no equivalent in encoding "WIN1254"
SELECT * FROM "Unicode data" WHERE t LIKE 'Гей, %';
ERROR:  character with byte sequence 0xd0 0x93 in encoding "UTF8" has no equivalent in encoding "WIN1254"
INSERT INTO "Unicode data" (i, t) VALUES ('bel+', 'У рудога вераб’я ў сховішчы пад фатэлем ляжаць нейкія гаючыя зёлкі._');
ERROR:  character with byte sequence 0xd0 0xa3 in encoding "UTF8" has no equivalent in encoding "WIN1254"
SELECT * FROM "Unicode data" WHERE i = 'bel+';
 i | t 
---+---
(0 rows)

DELETE FROM "Unicode data" WHERE t = 'У рудога вераб’я ў сховішчы пад фатэлем ляжаць нейкія гаючыя зёлкі._';
ERROR:  character with byte sequence 0xd0 0xa3 in encoding "UTF8" has no equivalent in encoding "WIN1254"
SELECT count(*) n FROM "Unicode data" WHERE i = 'bel+';
 n 
---
 0
(1 row)

INSERT INTO "Unicode data" (i, t) VALUES ('bul+', 'Ах, чудна българска земьо, полюшвай цъфтящи жита._');
ERROR:  character with byte sequence 0xd0 0x90 in encoding "UTF8" has no equivalent in encoding "WIN1254"
SELECT * FROM "Unicode data" WHERE i = 'bul+';
 i | t 
---+---
(0 rows)

DELETE FROM "Unicode data" WHERE t = 'Ах, чудна българска земьо, полюшвай цъфтящи жита._';
ERROR:  character with byte sequence 0xd0 0x90 in encoding "UTF8" has no equivalent in encoding "WIN1254"
SELECT count(*) n FROM "Unicode data" WHERE i = 'bul+';
 n 
---
 0
(1 row)

INSERT INTO "Unicode data" (i, t) VALUES ('rus+', 'Широкая электрификация южных губерний даст мощный толчок подъёму сельского хозяйства._');
ERROR:  character with byte sequence 0xd0 0xa8 in encoding "UTF8" has no equivalent in encoding "WIN1254"
SELECT * FROM "Unicode data" WHERE i = 'rus+';
 i | t 
---+---
(0 rows)

DELETE FROM "Unicode data" WHERE t = 'Широкая электрификация южных губерний даст мощный толчок подъёму сельского хозяйства._';
ERROR:  character with byte sequence 0xd0 0xa8 in encoding "UTF8" has no equivalent in encoding "WIN1254"
SELECT count(*) n FROM "Unicode data" WHERE i = 'rus+';
 n 
---
 0
(1 row)

INSERT INTO "Unicode data" (i, t) VALUES ('ukr+', 'Гей, хлопці, не вспію — на ґанку ваша файна їжа знищується бурундучком._');
ERROR:  character with byte sequence 0xd0 0x93 in encoding "UTF8" has no equivalent in encoding "WIN1254"
SELECT * FROM "Unicode data" WHERE i = 'ukr+';
 i | t 
---+---
(0 rows)

DELETE FROM "Unicode data" WHERE t = 'Гей, хлопці, не вспію — на ґанку ваша файна їжа знищується бурундучком._';
ERROR:  character with byte sequence 0xd0 0x93 in encoding "UTF8" has no equivalent in encoding "WIN1254"
SELECT count(*) n FROM "Unicode data" WHERE i = 'ukr+';
 n 
---
 0
(1 row)

-- 1256, ISO_8859_6
SELECT * FROM "Unicode data" WHERE i = 'ara';
 i | t 
---+---
(0 rows)

SELECT * FROM "Unicode data" WHERE t LIKE '%ضَظَغ%';
ERROR:  character with byte sequence 0xd8 0xb6 in encoding "UTF8" has no equivalent in encoding "WIN1254"
INSERT INTO "Unicode data" (i, t) VALUES ('ara+', 'أبجد هوَّز حُطّي كلَمُن سَعْفَص قُرِشَت ثَخَدٌ ضَظَغ_');
ERROR:  character with byte sequence 0xd8 0xa3 in encoding "UTF8" has no equivalent in encoding "WIN1254"
SELECT * FROM "Unicode data" WHERE i = 'ara+';
 i | t 
---+---
(0 rows)

DELETE FROM "Unicode data" WHERE t = 'أبجد هوَّز حُطّي كلَمُن سَعْفَص قُرِشَت ثَخَدٌ ضَظَغ_';
ERROR:  character with byte sequence 0xd8 0xa3 in encoding "UTF8" has no equivalent in encoding "WIN1254"
SELECT count(*) n FROM "Unicode data" WHERE i = 'ara+';
 n 
---
 0
(1 row)

-- 1253, ISO_8859_7
SELECT * FROM "Unicode data" WHERE i = 'gre';
 i | t 
---+---
(0 rows)

SELECT * FROM "Unicode data" WHERE t LIKE 'Τάχισ%';
ERROR:  character with byte sequence 0xce 0xa4 in encoding "UTF8" has no equivalent in encoding "WIN1254"
INSERT INTO "Unicode data" (i, t) VALUES ('gre+', 'Τάχιστη αλώπηξ βαφής ψημένη γη, δρασκελίζει υπέρ νωθρού κυνός_');
ERROR:  character with byte sequence 0xce 0xa4 in encoding "UTF8" has no equivalent in encoding "WIN1254"
SELECT * FROM "Unicode data" WHERE i = 'gre+';
 i | t 
---+---
(0 rows)

DELETE FROM "Unicode data" WHERE t = 'Τάχιστη αλώπηξ βαφής ψημένη γη, δρασκελίζει υπέρ νωθρού κυνός_';
ERROR:  character with byte sequence 0xce 0xa4 in encoding "UTF8" has no equivalent in encoding "WIN1254"
-- 1255, ISO_8859_8
SELECT * FROM "Unicode data" WHERE i = 'heb';
 i | t 
---+---
(0 rows)

SELECT * FROM "Unicode data" WHERE t LIKE '%כי ח%';
ERROR:  character with byte sequence 0xd7 0x9b in encoding "UTF8" has no equivalent in encoding "WIN1254"
INSERT INTO "Unicode data" (i, t) VALUES ('heb+', 'עטלף אבק נס דרך מזגן שהתפוצץ כי חם_');
ERROR:  character with byte sequence 0xd7 0xa2 in encoding "UTF8" has no equivalent in encoding "WIN1254"
SELECT * FROM "Unicode data" WHERE i = 'heb+';
 i | t 
---+---
(0 rows)

DELETE FROM "Unicode data" WHERE t = 'עטלף אבק נס דרך מזגן שהתפוצץ כי חם_';
ERROR:  character with byte sequence 0xd7 0xa2 in encoding "UTF8" has no equivalent in encoding "WIN1254"
SELECT count(*) n FROM "Unicode data" WHERE i = 'heb+';
 n 
---
 0
(1 row)

-- 1252, LATIN1
SELECT * FROM "Unicode data" WHERE i = 'eus';
 i | t 
---+---
(0 rows)

SELECT * FROM "Unicode data" WHERE i = 'fra';
 i | t 
---+---
(0 rows)

SELECT * FROM "Unicode data" WHERE i = 'spa';
 i | t 
---+---
(0 rows)

SELECT * FROM "Unicode data" WHERE t LIKE 'Permi%';
    i    |              t               
---------+------------------------------
 utf_eus | Permin gox dabiltzu yoskiÃ±.
(1 row)

SELECT * FROM "Unicode data" WHERE t LIKE 'Dès N%';
 i | t 
---+---
(0 rows)

SELECT * FROM "Unicode data" WHERE t LIKE 'Quier%';
    i    |                            t                             
---------+----------------------------------------------------------
 utf_spa | Quiere la boca exhausta vid, kiwi, piÃ±a y fugaz jamÃ³n.
(1 row)

INSERT INTO "Unicode data" (i, t) VALUES ('eus+', 'Permin gox dabiltzu yoskiñ._');
SELECT * FROM "Unicode data" WHERE i = 'eus+';
  i   |              t               
------+------------------------------
 eus+ | Permin gox dabiltzu yoskiñ._
(1 row)

DELETE FROM "Unicode data" WHERE t = 'Permin gox dabiltzu yoskiñ._';
SELECT count(*) n FROM "Unicode data" WHERE i = 'eus+';
 n 
---
 0
(1 row)

INSERT INTO "Unicode data" (i, t) VALUES ('fra+', 'Dès Noël où un zéphyr haï me vêt de glaçons würmiens je dîne d’exquis rôtis de bœuf au kir à l’aÿ d’âge mûr & cætera !_');
SELECT * FROM "Unicode data" WHERE i = 'fra+';
  i   |                                                            t                                                            
------+-------------------------------------------------------------------------------------------------------------------------
 fra+ | Dès Noël où un zéphyr haï me vêt de glaçons würmiens je dîne d’exquis rôtis de bœuf au kir à l’aÿ d’âge mûr & cætera !_
(1 row)

DELETE FROM "Unicode data" WHERE t = 'Dès Noël où un zéphyr haï me vêt de glaçons würmiens je dîne d’exquis rôtis de bœuf au kir à l’aÿ d’âge mûr & cætera !_';
SELECT count(*) n FROM "Unicode data" WHERE i = 'fra+';
 n 
---
 0
(1 row)

INSERT INTO "Unicode data" (i, t) VALUES ('spa+', 'Quiere la boca exhausta vid, kiwi, piña y fugaz jamón._');
SELECT * FROM "Unicode data" WHERE i = 'spa+';
  i   |                            t                            
------+---------------------------------------------------------
 spa+ | Quiere la boca exhausta vid, kiwi, piña y fugaz jamón._
(1 row)

DELETE FROM "Unicode data" WHERE t = 'Quiere la boca exhausta vid, kiwi, piña y fugaz jamón._';
SELECT count(*) n FROM "Unicode data" WHERE i = 'spa+';
 n 
---
 0
(1 row)

-- 1250, LATIN2
SELECT * FROM "Unicode data" WHERE i = 'cze';
 i | t 
---+---
(0 rows)

SELECT * FROM "Unicode data" WHERE i = 'pol';
 i | t 
---+---
(0 rows)

SELECT * FROM "Unicode data" WHERE i = 'srp';
 i | t 
---+---
(0 rows)

SELECT * FROM "Unicode data" WHERE t LIKE 'Zvláš%';
 i | t 
---+---
(0 rows)

SELECT * FROM "Unicode data" WHERE t LIKE 'Pchną%';
ERROR:  character with byte sequence 0xc4 0x85 in encoding "UTF8" has no equivalent in encoding "WIN1254"
SELECT * FROM "Unicode data" WHERE t LIKE 'Ljuba%';
ERROR:  character with byte sequence 0x8d in encoding "WIN1254" has no equivalent in encoding "UTF8"
INSERT INTO "Unicode data" (i, t) VALUES ('cze+', 'Zvlášť zákeřný učeň s ďolíčky běží podél zóny úlů._');
ERROR:  character with byte sequence 0xc5 0xa5 in encoding "UTF8" has no equivalent in encoding "WIN1254"
SELECT * FROM "Unicode data" WHERE i = 'cze+';
 i | t 
---+---
(0 rows)

DELETE FROM "Unicode data" WHERE t = 'Zvlášť zákeřný učeň s ďolíčky běží podél zóny úlů._';
ERROR:  character with byte sequence 0xc5 0xa5 in encoding "UTF8" has no equivalent in encoding "WIN1254"
SELECT count(*) n FROM "Unicode data" WHERE i = 'cze+';
 n 
---
 0
(1 row)

INSERT INTO "Unicode data" (i, t) VALUES ('pol+', 'Pchnąć w tę łódź jeża lub ośm skrzyń fig._');
ERROR:  character with byte sequence 0xc4 0x85 in encoding "UTF8" has no equivalent in encoding "WIN1254"
SELECT * FROM "Unicode data" WHERE i = 'pol+';
 i | t 
---+---
(0 rows)

DELETE FROM "Unicode data" WHERE t = 'Pchnąć w tę łódź jeża lub ośm skrzyń fig._';
ERROR:  character with byte sequence 0xc4 0x85 in encoding "UTF8" has no equivalent in encoding "WIN1254"
SELECT count(*) n FROM "Unicode data" WHERE i = 'pol+';
 n 
---
 0
(1 row)

INSERT INTO "Unicode data" (i, t) VALUES ('srp+', 'Ljubavi, Olga, hajde pođi u Fudži i čut ćeš nježnu muziku srca._');
ERROR:  character with byte sequence 0xc4 0x91 in encoding "UTF8" has no equivalent in encoding "WIN1254"
SELECT * FROM "Unicode data" WHERE i = 'srp+';
 i | t 
---+---
(0 rows)

DELETE FROM "Unicode data" WHERE t = 'Ljubavi, Olga, hajde pođi u Fudži i čut ćeš nježnu muziku srca._';
ERROR:  character with byte sequence 0xc4 0x91 in encoding "UTF8" has no equivalent in encoding "WIN1254"
SELECT count(*) n FROM "Unicode data" WHERE i = 'srp+';
 n 
---
 0
(1 row)

-- 1257, LATIN7
SELECT * FROM "Unicode data" WHERE i = 'lav';
 i | t 
---+---
(0 rows)

SELECT * FROM "Unicode data" WHERE t LIKE 'Ķieģeļu%';
ERROR:  character with byte sequence 0xc4 0xb6 in encoding "UTF8" has no equivalent in encoding "WIN1254"
INSERT INTO "Unicode data" (i, t) VALUES ('lav+', 'Ķieģeļu cepējs Edgars Buls fraku un hūti žāvē uz čīkstošām eņģēm._');
ERROR:  character with byte sequence 0xc4 0xb6 in encoding "UTF8" has no equivalent in encoding "WIN1254"
SELECT * FROM "Unicode data" WHERE i = 'lav+';
 i | t 
---+---
(0 rows)

DELETE FROM "Unicode data" WHERE t = 'Ķieģeļu cepējs Edgars Buls fraku un hūti žāvē uz čīkstošām eņģēm._';
ERROR:  character with byte sequence 0xc4 0xb6 in encoding "UTF8" has no equivalent in encoding "WIN1254"
SELECT count(*) n FROM "Unicode data" WHERE i = 'lav+';
 n 
---
 0
(1 row)

-- EUC_KR
SELECT * FROM "Unicode data" WHERE i = 'kor';
 i | t 
---+---
(0 rows)

SELECT * FROM "Unicode data" WHERE t LIKE '키스의 고%';
ERROR:  character with byte sequence 0xed 0x82 0xa4 in encoding "UTF8" has no equivalent in encoding "WIN1254"
INSERT INTO "Unicode data" (i, t) VALUES ('kor+', '키스의 고유조건은 입술끼리 만나야 하고 특별한 기술은 필요치 않다._');
ERROR:  character with byte sequence 0xed 0x82 0xa4 in encoding "UTF8" has no equivalent in encoding "WIN1254"
SELECT * FROM "Unicode data" WHERE i = 'kor+';
 i | t 
---+---
(0 rows)

DELETE FROM "Unicode data" WHERE t = '키스의 고유조건은 입술끼리 만나야 하고 특별한 기술은 필요치 않다._';
ERROR:  character with byte sequence 0xed 0x82 0xa4 in encoding "UTF8" has no equivalent in encoding "WIN1254"
SELECT count(*) n FROM "Unicode data" WHERE i = 'kor+';
 n 
---
 0
(1 row)

-- 1254, LATIN5
SELECT * FROM "Unicode data" WHERE i = 'aze';
 i | t 
---+---
(0 rows)

SELECT * FROM "Unicode data" WHERE t LIKE 'Zəfər%';
ERROR:  character with byte sequence 0xc9 0x99 in encoding "UTF8" has no equivalent in encoding "WIN1254"
INSERT INTO "Unicode data" (i, t) VALUES ('aze+', 'Zəfər, jaketini də, papağını da götür, bu axşam hava çox soyuq olacaq._');
ERROR:  character with byte sequence 0xc9 0x99 in encoding "UTF8" has no equivalent in encoding "WIN1254"
SELECT * FROM "Unicode data" WHERE i = 'aze+';
 i | t 
---+---
(0 rows)

DELETE FROM "Unicode data" WHERE t = 'Zəfər, jaketini də, papağını da götür, bu axşam hava çox soyuq olacaq._';
ERROR:  character with byte sequence 0xc9 0x99 in encoding "UTF8" has no equivalent in encoding "WIN1254"
SELECT count(*) n FROM "Unicode data" WHERE i = 'aze+';
 n 
---
 0
(1 row)

-- etc
INSERT INTO "Unicode data" (i, t) VALUES ('arm+', 'Բել դղյակի ձախ ժամն օֆ ազգությանը ցպահանջ չճշտած վնաս էր եւ փառք։_');
ERROR:  character with byte sequence 0xd4 0xb2 in encoding "UTF8" has no equivalent in encoding "WIN1254"
SELECT * FROM "Unicode data" WHERE i = 'arm+';
 i | t 
---+---
(0 rows)

DELETE FROM "Unicode data" WHERE t = 'Բել դղյակի ձախ ժամն օֆ ազգությանը ցպահանջ չճշտած վնաս էր եւ փառք։_';
ERROR:  character with byte sequence 0xd4 0xb2 in encoding "UTF8" has no equivalent in encoding "WIN1254"
SELECT count(*) n FROM "Unicode data" WHERE i = 'arm+';
 n 
---
 0
(1 row)

INSERT INTO "Unicode data" (i, t) VALUES ('gle+', 'Chuaigh bé mhórshách le dlúthspád fíorfhinn trí hata mo dhea-phorcáin bhig._');
SELECT * FROM "Unicode data" WHERE i = 'gle+';
  i   |                                      t                                       
------+------------------------------------------------------------------------------
 gle+ | Chuaigh bé mhórshách le dlúthspád fíorfhinn trí hata mo dhea-phorcáin bhig._
(1 row)

DELETE FROM "Unicode data" WHERE t = 'Chuaigh bé mhórshách le dlúthspád fíorfhinn trí hata mo dhea-phorcáin bhig._';
SELECT count(*) n FROM "Unicode data" WHERE i = 'gle+';
 n 
---
 0
(1 row)

INSERT INTO "Unicode data" (i, t) VALUES ('epo+', 'Laŭ Ludoviko Zamenhof bongustas freŝa ĉeĥa manĝaĵo kun spicoj._');
ERROR:  character with byte sequence 0xc5 0xad in encoding "UTF8" has no equivalent in encoding "WIN1254"
SELECT * FROM "Unicode data" WHERE i = 'epo+';
 i | t 
---+---
(0 rows)

DELETE FROM "Unicode data" WHERE t = 'Laŭ Ludoviko Zamenhof bongustas freŝa ĉeĥa manĝaĵo kun spicoj._';
ERROR:  character with byte sequence 0xc5 0xad in encoding "UTF8" has no equivalent in encoding "WIN1254"
SELECT count(*) n FROM "Unicode data" WHERE i = 'epo+';
 n 
---
 0
(1 row)

DROP FOREIGN TABLE "Unicode data";
DROP SERVER redis_testing_server CASCADE;
NOTICE:  drop cascades to user mapping for public on server redis_testing_server
DROP EXTENSION redis_fdw;
\connect contrib_regression;
DROP DATABASE "contrib_regression_WIN1254";
-- cp1255
CREATE DATABASE "contrib_regression_WIN1255" ENCODING WIN1255 LC_CTYPE='POSIX' LC_COLLATE='POSIX' template template0;
\connect "contrib_regression_WIN1255"
CREATE EXTENSION redis_fdw;
CREATE SERVER redis_testing_server FOREIGN DATA WRAPPER redis_fdw;
CREATE FOREIGN TABLE "Unicode data"(i text, t text)
SERVER redis_testing_server
OPTIONS (database '15');
CREATE USER MAPPING FOR public SERVER redis_testing_server; 
-- EUC_JP
SELECT * FROM "Unicode data" WHERE i = 'jap';
 i | t 
---+---
(0 rows)

SELECT * FROM "Unicode data" WHERE t LIKE 'いろはにほ%';
ERROR:  character with byte sequence 0xe3 0x81 0x84 in encoding "UTF8" has no equivalent in encoding "WIN1255"
INSERT INTO "Unicode data" (i, t) VALUES ('jap+', 'いろはにほへと ちりぬるを わかよたれそ つねならむ うゐのおくやま けふこえて あさきゆめみし ゑひもせす._');
ERROR:  character with byte sequence 0xe3 0x81 0x84 in encoding "UTF8" has no equivalent in encoding "WIN1255"
DELETE FROM "Unicode data" WHERE t = 'いろはにほへと ちりぬるを わかよたれそ つねならむ うゐのおくやま けふこえて あさきゆめみし ゑひもせす._';
ERROR:  character with byte sequence 0xe3 0x81 0x84 in encoding "UTF8" has no equivalent in encoding "WIN1255"
SELECT count(*) n FROM "Unicode data" WHERE i = 'jap+';
 n 
---
 0
(1 row)

-- 1251, ISO_8859_5
SELECT * FROM "Unicode data" WHERE i = 'bel';
 i | t 
---+---
(0 rows)

SELECT * FROM "Unicode data" WHERE i = 'bul';
 i | t 
---+---
(0 rows)

SELECT * FROM "Unicode data" WHERE i = 'rus';
 i | t 
---+---
(0 rows)

SELECT * FROM "Unicode data" WHERE i = 'ukr';
 i | t 
---+---
(0 rows)

SELECT * FROM "Unicode data" WHERE t LIKE 'У руд%';
ERROR:  character with byte sequence 0xd0 0xa3 in encoding "UTF8" has no equivalent in encoding "WIN1255"
SELECT * FROM "Unicode data" WHERE t LIKE 'Ах, ч%';
ERROR:  character with byte sequence 0xd0 0x90 in encoding "UTF8" has no equivalent in encoding "WIN1255"
SELECT * FROM "Unicode data" WHERE t LIKE 'Широк%';
ERROR:  character with byte sequence 0xd0 0xa8 in encoding "UTF8" has no equivalent in encoding "WIN1255"
SELECT * FROM "Unicode data" WHERE t LIKE 'Гей, %';
ERROR:  character with byte sequence 0xd0 0x93 in encoding "UTF8" has no equivalent in encoding "WIN1255"
INSERT INTO "Unicode data" (i, t) VALUES ('bel+', 'У рудога вераб’я ў сховішчы пад фатэлем ляжаць нейкія гаючыя зёлкі._');
ERROR:  character with byte sequence 0xd0 0xa3 in encoding "UTF8" has no equivalent in encoding "WIN1255"
SELECT * FROM "Unicode data" WHERE i = 'bel+';
 i | t 
---+---
(0 rows)

DELETE FROM "Unicode data" WHERE t = 'У рудога вераб’я ў сховішчы пад фатэлем ляжаць нейкія гаючыя зёлкі._';
ERROR:  character with byte sequence 0xd0 0xa3 in encoding "UTF8" has no equivalent in encoding "WIN1255"
SELECT count(*) n FROM "Unicode data" WHERE i = 'bel+';
 n 
---
 0
(1 row)

INSERT INTO "Unicode data" (i, t) VALUES ('bul+', 'Ах, чудна българска земьо, полюшвай цъфтящи жита._');
ERROR:  character with byte sequence 0xd0 0x90 in encoding "UTF8" has no equivalent in encoding "WIN1255"
SELECT * FROM "Unicode data" WHERE i = 'bul+';
 i | t 
---+---
(0 rows)

DELETE FROM "Unicode data" WHERE t = 'Ах, чудна българска земьо, полюшвай цъфтящи жита._';
ERROR:  character with byte sequence 0xd0 0x90 in encoding "UTF8" has no equivalent in encoding "WIN1255"
SELECT count(*) n FROM "Unicode data" WHERE i = 'bul+';
 n 
---
 0
(1 row)

INSERT INTO "Unicode data" (i, t) VALUES ('rus+', 'Широкая электрификация южных губерний даст мощный толчок подъёму сельского хозяйства._');
ERROR:  character with byte sequence 0xd0 0xa8 in encoding "UTF8" has no equivalent in encoding "WIN1255"
SELECT * FROM "Unicode data" WHERE i = 'rus+';
 i | t 
---+---
(0 rows)

DELETE FROM "Unicode data" WHERE t = 'Широкая электрификация южных губерний даст мощный толчок подъёму сельского хозяйства._';
ERROR:  character with byte sequence 0xd0 0xa8 in encoding "UTF8" has no equivalent in encoding "WIN1255"
SELECT count(*) n FROM "Unicode data" WHERE i = 'rus+';
 n 
---
 0
(1 row)

INSERT INTO "Unicode data" (i, t) VALUES ('ukr+', 'Гей, хлопці, не вспію — на ґанку ваша файна їжа знищується бурундучком._');
ERROR:  character with byte sequence 0xd0 0x93 in encoding "UTF8" has no equivalent in encoding "WIN1255"
SELECT * FROM "Unicode data" WHERE i = 'ukr+';
 i | t 
---+---
(0 rows)

DELETE FROM "Unicode data" WHERE t = 'Гей, хлопці, не вспію — на ґанку ваша файна їжа знищується бурундучком._';
ERROR:  character with byte sequence 0xd0 0x93 in encoding "UTF8" has no equivalent in encoding "WIN1255"
SELECT count(*) n FROM "Unicode data" WHERE i = 'ukr+';
 n 
---
 0
(1 row)

-- 1256, ISO_8859_6
SELECT * FROM "Unicode data" WHERE i = 'ara';
 i | t 
---+---
(0 rows)

SELECT * FROM "Unicode data" WHERE t LIKE '%ضَظَغ%';
ERROR:  character with byte sequence 0xd8 0xb6 in encoding "UTF8" has no equivalent in encoding "WIN1255"
INSERT INTO "Unicode data" (i, t) VALUES ('ara+', 'أبجد هوَّز حُطّي كلَمُن سَعْفَص قُرِشَت ثَخَدٌ ضَظَغ_');
ERROR:  character with byte sequence 0xd8 0xa3 in encoding "UTF8" has no equivalent in encoding "WIN1255"
SELECT * FROM "Unicode data" WHERE i = 'ara+';
 i | t 
---+---
(0 rows)

DELETE FROM "Unicode data" WHERE t = 'أبجد هوَّز حُطّي كلَمُن سَعْفَص قُرِشَت ثَخَدٌ ضَظَغ_';
ERROR:  character with byte sequence 0xd8 0xa3 in encoding "UTF8" has no equivalent in encoding "WIN1255"
SELECT count(*) n FROM "Unicode data" WHERE i = 'ara+';
 n 
---
 0
(1 row)

-- 1253, ISO_8859_7
SELECT * FROM "Unicode data" WHERE i = 'gre';
 i | t 
---+---
(0 rows)

SELECT * FROM "Unicode data" WHERE t LIKE 'Τάχισ%';
ERROR:  character with byte sequence 0xce 0xa4 in encoding "UTF8" has no equivalent in encoding "WIN1255"
INSERT INTO "Unicode data" (i, t) VALUES ('gre+', 'Τάχιστη αλώπηξ βαφής ψημένη γη, δρασκελίζει υπέρ νωθρού κυνός_');
ERROR:  character with byte sequence 0xce 0xa4 in encoding "UTF8" has no equivalent in encoding "WIN1255"
SELECT * FROM "Unicode data" WHERE i = 'gre+';
 i | t 
---+---
(0 rows)

DELETE FROM "Unicode data" WHERE t = 'Τάχιστη αλώπηξ βαφής ψημένη γη, δρασκελίζει υπέρ νωθρού κυνός_';
ERROR:  character with byte sequence 0xce 0xa4 in encoding "UTF8" has no equivalent in encoding "WIN1255"
-- 1255, ISO_8859_8
SELECT * FROM "Unicode data" WHERE i = 'heb';
 i | t 
---+---
(0 rows)

SELECT * FROM "Unicode data" WHERE t LIKE '%כי ח%';
 i | t 
---+---
(0 rows)

INSERT INTO "Unicode data" (i, t) VALUES ('heb+', 'עטלף אבק נס דרך מזגן שהתפוצץ כי חם_');
SELECT * FROM "Unicode data" WHERE i = 'heb+';
  i   |                  t                  
------+-------------------------------------
 heb+ | עטלף אבק נס דרך מזגן שהתפוצץ כי חם_
(1 row)

DELETE FROM "Unicode data" WHERE t = 'עטלף אבק נס דרך מזגן שהתפוצץ כי חם_';
SELECT count(*) n FROM "Unicode data" WHERE i = 'heb+';
 n 
---
 0
(1 row)

-- 1252, LATIN1
SELECT * FROM "Unicode data" WHERE i = 'eus';
 i | t 
---+---
(0 rows)

SELECT * FROM "Unicode data" WHERE i = 'fra';
 i | t 
---+---
(0 rows)

SELECT * FROM "Unicode data" WHERE i = 'spa';
 i | t 
---+---
(0 rows)

SELECT * FROM "Unicode data" WHERE t LIKE 'Permi%';
    i    |              t              
---------+-----------------------------
 utf_eus | Permin gox dabiltzu yoskiֳ±.
(1 row)

SELECT * FROM "Unicode data" WHERE t LIKE 'Dès N%';
ERROR:  character with byte sequence 0xc3 0xa8 in encoding "UTF8" has no equivalent in encoding "WIN1255"
SELECT * FROM "Unicode data" WHERE t LIKE 'Quier%';
    i    |                           t                            
---------+--------------------------------------------------------
 utf_spa | Quiere la boca exhausta vid, kiwi, piֳ±a y fugaz jamֳ³n.
(1 row)

INSERT INTO "Unicode data" (i, t) VALUES ('eus+', 'Permin gox dabiltzu yoskiñ._');
ERROR:  character with byte sequence 0xc3 0xb1 in encoding "UTF8" has no equivalent in encoding "WIN1255"
SELECT * FROM "Unicode data" WHERE i = 'eus+';
 i | t 
---+---
(0 rows)

DELETE FROM "Unicode data" WHERE t = 'Permin gox dabiltzu yoskiñ._';
ERROR:  character with byte sequence 0xc3 0xb1 in encoding "UTF8" has no equivalent in encoding "WIN1255"
SELECT count(*) n FROM "Unicode data" WHERE i = 'eus+';
 n 
---
 0
(1 row)

INSERT INTO "Unicode data" (i, t) VALUES ('fra+', 'Dès Noël où un zéphyr haï me vêt de glaçons würmiens je dîne d’exquis rôtis de bœuf au kir à l’aÿ d’âge mûr & cætera !_');
ERROR:  character with byte sequence 0xc3 0xa8 in encoding "UTF8" has no equivalent in encoding "WIN1255"
SELECT * FROM "Unicode data" WHERE i = 'fra+';
 i | t 
---+---
(0 rows)

DELETE FROM "Unicode data" WHERE t = 'Dès Noël où un zéphyr haï me vêt de glaçons würmiens je dîne d’exquis rôtis de bœuf au kir à l’aÿ d’âge mûr & cætera !_';
ERROR:  character with byte sequence 0xc3 0xa8 in encoding "UTF8" has no equivalent in encoding "WIN1255"
SELECT count(*) n FROM "Unicode data" WHERE i = 'fra+';
 n 
---
 0
(1 row)

INSERT INTO "Unicode data" (i, t) VALUES ('spa+', 'Quiere la boca exhausta vid, kiwi, piña y fugaz jamón._');
ERROR:  character with byte sequence 0xc3 0xb1 in encoding "UTF8" has no equivalent in encoding "WIN1255"
SELECT * FROM "Unicode data" WHERE i = 'spa+';
 i | t 
---+---
(0 rows)

DELETE FROM "Unicode data" WHERE t = 'Quiere la boca exhausta vid, kiwi, piña y fugaz jamón._';
ERROR:  character with byte sequence 0xc3 0xb1 in encoding "UTF8" has no equivalent in encoding "WIN1255"
SELECT count(*) n FROM "Unicode data" WHERE i = 'spa+';
 n 
---
 0
(1 row)

-- 1250, LATIN2
SELECT * FROM "Unicode data" WHERE i = 'cze';
 i | t 
---+---
(0 rows)

SELECT * FROM "Unicode data" WHERE i = 'pol';
 i | t 
---+---
(0 rows)

SELECT * FROM "Unicode data" WHERE i = 'srp';
 i | t 
---+---
(0 rows)

SELECT * FROM "Unicode data" WHERE t LIKE 'Zvláš%';
ERROR:  character with byte sequence 0xc3 0xa1 in encoding "UTF8" has no equivalent in encoding "WIN1255"
SELECT * FROM "Unicode data" WHERE t LIKE 'Pchną%';
ERROR:  character with byte sequence 0xc4 0x85 in encoding "UTF8" has no equivalent in encoding "WIN1255"
SELECT * FROM "Unicode data" WHERE t LIKE 'Ljuba%';
ERROR:  character with byte sequence 0x8d in encoding "WIN1255" has no equivalent in encoding "UTF8"
INSERT INTO "Unicode data" (i, t) VALUES ('cze+', 'Zvlášť zákeřný učeň s ďolíčky běží podél zóny úlů._');
ERROR:  character with byte sequence 0xc3 0xa1 in encoding "UTF8" has no equivalent in encoding "WIN1255"
SELECT * FROM "Unicode data" WHERE i = 'cze+';
 i | t 
---+---
(0 rows)

DELETE FROM "Unicode data" WHERE t = 'Zvlášť zákeřný učeň s ďolíčky běží podél zóny úlů._';
ERROR:  character with byte sequence 0xc3 0xa1 in encoding "UTF8" has no equivalent in encoding "WIN1255"
SELECT count(*) n FROM "Unicode data" WHERE i = 'cze+';
 n 
---
 0
(1 row)

INSERT INTO "Unicode data" (i, t) VALUES ('pol+', 'Pchnąć w tę łódź jeża lub ośm skrzyń fig._');
ERROR:  character with byte sequence 0xc4 0x85 in encoding "UTF8" has no equivalent in encoding "WIN1255"
SELECT * FROM "Unicode data" WHERE i = 'pol+';
 i | t 
---+---
(0 rows)

DELETE FROM "Unicode data" WHERE t = 'Pchnąć w tę łódź jeża lub ośm skrzyń fig._';
ERROR:  character with byte sequence 0xc4 0x85 in encoding "UTF8" has no equivalent in encoding "WIN1255"
SELECT count(*) n FROM "Unicode data" WHERE i = 'pol+';
 n 
---
 0
(1 row)

INSERT INTO "Unicode data" (i, t) VALUES ('srp+', 'Ljubavi, Olga, hajde pođi u Fudži i čut ćeš nježnu muziku srca._');
ERROR:  character with byte sequence 0xc4 0x91 in encoding "UTF8" has no equivalent in encoding "WIN1255"
SELECT * FROM "Unicode data" WHERE i = 'srp+';
 i | t 
---+---
(0 rows)

DELETE FROM "Unicode data" WHERE t = 'Ljubavi, Olga, hajde pođi u Fudži i čut ćeš nježnu muziku srca._';
ERROR:  character with byte sequence 0xc4 0x91 in encoding "UTF8" has no equivalent in encoding "WIN1255"
SELECT count(*) n FROM "Unicode data" WHERE i = 'srp+';
 n 
---
 0
(1 row)

-- 1257, LATIN7
SELECT * FROM "Unicode data" WHERE i = 'lav';
 i | t 
---+---
(0 rows)

SELECT * FROM "Unicode data" WHERE t LIKE 'Ķieģeļu%';
ERROR:  character with byte sequence 0xc4 0xb6 in encoding "UTF8" has no equivalent in encoding "WIN1255"
INSERT INTO "Unicode data" (i, t) VALUES ('lav+', 'Ķieģeļu cepējs Edgars Buls fraku un hūti žāvē uz čīkstošām eņģēm._');
ERROR:  character with byte sequence 0xc4 0xb6 in encoding "UTF8" has no equivalent in encoding "WIN1255"
SELECT * FROM "Unicode data" WHERE i = 'lav+';
 i | t 
---+---
(0 rows)

DELETE FROM "Unicode data" WHERE t = 'Ķieģeļu cepējs Edgars Buls fraku un hūti žāvē uz čīkstošām eņģēm._';
ERROR:  character with byte sequence 0xc4 0xb6 in encoding "UTF8" has no equivalent in encoding "WIN1255"
SELECT count(*) n FROM "Unicode data" WHERE i = 'lav+';
 n 
---
 0
(1 row)

-- EUC_KR
SELECT * FROM "Unicode data" WHERE i = 'kor';
 i | t 
---+---
(0 rows)

SELECT * FROM "Unicode data" WHERE t LIKE '키스의 고%';
ERROR:  character with byte sequence 0xed 0x82 0xa4 in encoding "UTF8" has no equivalent in encoding "WIN1255"
INSERT INTO "Unicode data" (i, t) VALUES ('kor+', '키스의 고유조건은 입술끼리 만나야 하고 특별한 기술은 필요치 않다._');
ERROR:  character with byte sequence 0xed 0x82 0xa4 in encoding "UTF8" has no equivalent in encoding "WIN1255"
SELECT * FROM "Unicode data" WHERE i = 'kor+';
 i | t 
---+---
(0 rows)

DELETE FROM "Unicode data" WHERE t = '키스의 고유조건은 입술끼리 만나야 하고 특별한 기술은 필요치 않다._';
ERROR:  character with byte sequence 0xed 0x82 0xa4 in encoding "UTF8" has no equivalent in encoding "WIN1255"
SELECT count(*) n FROM "Unicode data" WHERE i = 'kor+';
 n 
---
 0
(1 row)

-- 1254, LATIN5
SELECT * FROM "Unicode data" WHERE i = 'aze';
 i | t 
---+---
(0 rows)

SELECT * FROM "Unicode data" WHERE t LIKE 'Zəfər%';
ERROR:  character with byte sequence 0xc9 0x99 in encoding "UTF8" has no equivalent in encoding "WIN1255"
INSERT INTO "Unicode data" (i, t) VALUES ('aze+', 'Zəfər, jaketini də, papağını da götür, bu axşam hava çox soyuq olacaq._');
ERROR:  character with byte sequence 0xc9 0x99 in encoding "UTF8" has no equivalent in encoding "WIN1255"
SELECT * FROM "Unicode data" WHERE i = 'aze+';
 i | t 
---+---
(0 rows)

DELETE FROM "Unicode data" WHERE t = 'Zəfər, jaketini də, papağını da götür, bu axşam hava çox soyuq olacaq._';
ERROR:  character with byte sequence 0xc9 0x99 in encoding "UTF8" has no equivalent in encoding "WIN1255"
SELECT count(*) n FROM "Unicode data" WHERE i = 'aze+';
 n 
---
 0
(1 row)

-- etc
INSERT INTO "Unicode data" (i, t) VALUES ('arm+', 'Բել դղյակի ձախ ժամն օֆ ազգությանը ցպահանջ չճշտած վնաս էր եւ փառք։_');
ERROR:  character with byte sequence 0xd4 0xb2 in encoding "UTF8" has no equivalent in encoding "WIN1255"
SELECT * FROM "Unicode data" WHERE i = 'arm+';
 i | t 
---+---
(0 rows)

DELETE FROM "Unicode data" WHERE t = 'Բել դղյակի ձախ ժամն օֆ ազգությանը ցպահանջ չճշտած վնաս էր եւ փառք։_';
ERROR:  character with byte sequence 0xd4 0xb2 in encoding "UTF8" has no equivalent in encoding "WIN1255"
SELECT count(*) n FROM "Unicode data" WHERE i = 'arm+';
 n 
---
 0
(1 row)

INSERT INTO "Unicode data" (i, t) VALUES ('gle+', 'Chuaigh bé mhórshách le dlúthspád fíorfhinn trí hata mo dhea-phorcáin bhig._');
ERROR:  character with byte sequence 0xc3 0xa9 in encoding "UTF8" has no equivalent in encoding "WIN1255"
SELECT * FROM "Unicode data" WHERE i = 'gle+';
 i | t 
---+---
(0 rows)

DELETE FROM "Unicode data" WHERE t = 'Chuaigh bé mhórshách le dlúthspád fíorfhinn trí hata mo dhea-phorcáin bhig._';
ERROR:  character with byte sequence 0xc3 0xa9 in encoding "UTF8" has no equivalent in encoding "WIN1255"
SELECT count(*) n FROM "Unicode data" WHERE i = 'gle+';
 n 
---
 0
(1 row)

INSERT INTO "Unicode data" (i, t) VALUES ('epo+', 'Laŭ Ludoviko Zamenhof bongustas freŝa ĉeĥa manĝaĵo kun spicoj._');
ERROR:  character with byte sequence 0xc5 0xad in encoding "UTF8" has no equivalent in encoding "WIN1255"
SELECT * FROM "Unicode data" WHERE i = 'epo+';
 i | t 
---+---
(0 rows)

DELETE FROM "Unicode data" WHERE t = 'Laŭ Ludoviko Zamenhof bongustas freŝa ĉeĥa manĝaĵo kun spicoj._';
ERROR:  character with byte sequence 0xc5 0xad in encoding "UTF8" has no equivalent in encoding "WIN1255"
SELECT count(*) n FROM "Unicode data" WHERE i = 'epo+';
 n 
---
 0
(1 row)

DROP FOREIGN TABLE "Unicode data";
DROP SERVER redis_testing_server CASCADE;
NOTICE:  drop cascades to user mapping for public on server redis_testing_server
DROP EXTENSION redis_fdw;
\connect contrib_regression;
DROP DATABASE "contrib_regression_WIN1255";
-- cp1256
CREATE DATABASE "contrib_regression_WIN1256" ENCODING WIN1256 LC_CTYPE='POSIX' LC_COLLATE='POSIX' template template0;
\connect "contrib_regression_WIN1256"
CREATE EXTENSION redis_fdw;
CREATE SERVER redis_testing_server FOREIGN DATA WRAPPER redis_fdw;
CREATE FOREIGN TABLE "Unicode data"(i text, t text)
SERVER redis_testing_server
OPTIONS (database '15');
CREATE USER MAPPING FOR public SERVER redis_testing_server; 
-- EUC_JP
SELECT * FROM "Unicode data" WHERE i = 'jap';
 i | t 
---+---
(0 rows)

SELECT * FROM "Unicode data" WHERE t LIKE 'いろはにほ%';
ERROR:  character with byte sequence 0xe3 0x81 0x84 in encoding "UTF8" has no equivalent in encoding "WIN1256"
INSERT INTO "Unicode data" (i, t) VALUES ('jap+', 'いろはにほへと ちりぬるを わかよたれそ つねならむ うゐのおくやま けふこえて あさきゆめみし ゑひもせす._');
ERROR:  character with byte sequence 0xe3 0x81 0x84 in encoding "UTF8" has no equivalent in encoding "WIN1256"
DELETE FROM "Unicode data" WHERE t = 'いろはにほへと ちりぬるを わかよたれそ つねならむ うゐのおくやま けふこえて あさきゆめみし ゑひもせす._';
ERROR:  character with byte sequence 0xe3 0x81 0x84 in encoding "UTF8" has no equivalent in encoding "WIN1256"
SELECT count(*) n FROM "Unicode data" WHERE i = 'jap+';
 n 
---
 0
(1 row)

SELECT count(*) n FROM "Unicode data" WHERE i = 'jap+';
 n 
---
 0
(1 row)

-- 1251, ISO_8859_5
SELECT * FROM "Unicode data" WHERE i = 'bel';
 i | t 
---+---
(0 rows)

SELECT * FROM "Unicode data" WHERE i = 'bul';
 i | t 
---+---
(0 rows)

SELECT * FROM "Unicode data" WHERE i = 'rus';
 i | t 
---+---
(0 rows)

SELECT * FROM "Unicode data" WHERE i = 'ukr';
 i | t 
---+---
(0 rows)

SELECT * FROM "Unicode data" WHERE t LIKE 'У руд%';
ERROR:  character with byte sequence 0xd0 0xa3 in encoding "UTF8" has no equivalent in encoding "WIN1256"
SELECT * FROM "Unicode data" WHERE t LIKE 'Ах, ч%';
ERROR:  character with byte sequence 0xd0 0x90 in encoding "UTF8" has no equivalent in encoding "WIN1256"
SELECT * FROM "Unicode data" WHERE t LIKE 'Широк%';
ERROR:  character with byte sequence 0xd0 0xa8 in encoding "UTF8" has no equivalent in encoding "WIN1256"
SELECT * FROM "Unicode data" WHERE t LIKE 'Гей, %';
ERROR:  character with byte sequence 0xd0 0x93 in encoding "UTF8" has no equivalent in encoding "WIN1256"
INSERT INTO "Unicode data" (i, t) VALUES ('bel+', 'У рудога вераб’я ў сховішчы пад фатэлем ляжаць нейкія гаючыя зёлкі._');
ERROR:  character with byte sequence 0xd0 0xa3 in encoding "UTF8" has no equivalent in encoding "WIN1256"
SELECT * FROM "Unicode data" WHERE i = 'bel+';
 i | t 
---+---
(0 rows)

DELETE FROM "Unicode data" WHERE t = 'У рудога вераб’я ў сховішчы пад фатэлем ляжаць нейкія гаючыя зёлкі._';
ERROR:  character with byte sequence 0xd0 0xa3 in encoding "UTF8" has no equivalent in encoding "WIN1256"
SELECT count(*) n FROM "Unicode data" WHERE i = 'bel+';
 n 
---
 0
(1 row)

INSERT INTO "Unicode data" (i, t) VALUES ('bul+', 'Ах, чудна българска земьо, полюшвай цъфтящи жита._');
ERROR:  character with byte sequence 0xd0 0x90 in encoding "UTF8" has no equivalent in encoding "WIN1256"
SELECT * FROM "Unicode data" WHERE i = 'bul+';
 i | t 
---+---
(0 rows)

DELETE FROM "Unicode data" WHERE t = 'Ах, чудна българска земьо, полюшвай цъфтящи жита._';
ERROR:  character with byte sequence 0xd0 0x90 in encoding "UTF8" has no equivalent in encoding "WIN1256"
SELECT count(*) n FROM "Unicode data" WHERE i = 'bul+';
 n 
---
 0
(1 row)

INSERT INTO "Unicode data" (i, t) VALUES ('rus+', 'Широкая электрификация южных губерний даст мощный толчок подъёму сельского хозяйства._');
ERROR:  character with byte sequence 0xd0 0xa8 in encoding "UTF8" has no equivalent in encoding "WIN1256"
SELECT * FROM "Unicode data" WHERE i = 'rus+';
 i | t 
---+---
(0 rows)

DELETE FROM "Unicode data" WHERE t = 'Широкая электрификация южных губерний даст мощный толчок подъёму сельского хозяйства._';
ERROR:  character with byte sequence 0xd0 0xa8 in encoding "UTF8" has no equivalent in encoding "WIN1256"
SELECT count(*) n FROM "Unicode data" WHERE i = 'rus+';
 n 
---
 0
(1 row)

INSERT INTO "Unicode data" (i, t) VALUES ('ukr+', 'Гей, хлопці, не вспію — на ґанку ваша файна їжа знищується бурундучком._');
ERROR:  character with byte sequence 0xd0 0x93 in encoding "UTF8" has no equivalent in encoding "WIN1256"
SELECT * FROM "Unicode data" WHERE i = 'ukr+';
 i | t 
---+---
(0 rows)

DELETE FROM "Unicode data" WHERE t = 'Гей, хлопці, не вспію — на ґанку ваша файна їжа знищується бурундучком._';
ERROR:  character with byte sequence 0xd0 0x93 in encoding "UTF8" has no equivalent in encoding "WIN1256"
SELECT count(*) n FROM "Unicode data" WHERE i = 'ukr+';
 n 
---
 0
(1 row)

-- 1256, ISO_8859_6
SELECT * FROM "Unicode data" WHERE i = 'ara';
 i | t 
---+---
(0 rows)

SELECT * FROM "Unicode data" WHERE t LIKE '%ضَظَغ%';
 i | t 
---+---
(0 rows)

INSERT INTO "Unicode data" (i, t) VALUES ('ara+', 'أبجد هوَّز حُطّي كلَمُن سَعْفَص قُرِشَت ثَخَدٌ ضَظَغ_');
SELECT * FROM "Unicode data" WHERE i = 'ara+';
  i   |                  t                   
------+--------------------------------------
 ara+ | أبجد هوَّز حُطّي كلَمُن سَعْفَص قُرِشَت ثَخَدٌ ضَظَغ_
(1 row)

DELETE FROM "Unicode data" WHERE t = 'أبجد هوَّز حُطّي كلَمُن سَعْفَص قُرِشَت ثَخَدٌ ضَظَغ_';
SELECT count(*) n FROM "Unicode data" WHERE i = 'ara+';
 n 
---
 0
(1 row)

-- 1253, ISO_8859_7
SELECT * FROM "Unicode data" WHERE i = 'gre';
 i | t 
---+---
(0 rows)

SELECT * FROM "Unicode data" WHERE t LIKE 'Τάχισ%';
ERROR:  character with byte sequence 0xce 0xa4 in encoding "UTF8" has no equivalent in encoding "WIN1256"
INSERT INTO "Unicode data" (i, t) VALUES ('gre+', 'Τάχιστη αλώπηξ βαφής ψημένη γη, δρασκελίζει υπέρ νωθρού κυνός_');
ERROR:  character with byte sequence 0xce 0xa4 in encoding "UTF8" has no equivalent in encoding "WIN1256"
SELECT * FROM "Unicode data" WHERE i = 'gre+';
 i | t 
---+---
(0 rows)

DELETE FROM "Unicode data" WHERE t = 'Τάχιστη αλώπηξ βαφής ψημένη γη, δρασκελίζει υπέρ νωθρού κυνός_';
ERROR:  character with byte sequence 0xce 0xa4 in encoding "UTF8" has no equivalent in encoding "WIN1256"
-- 1255, ISO_8859_8
SELECT * FROM "Unicode data" WHERE i = 'heb';
 i | t 
---+---
(0 rows)

SELECT * FROM "Unicode data" WHERE t LIKE '%כי ח%';
ERROR:  character with byte sequence 0xd7 0x9b in encoding "UTF8" has no equivalent in encoding "WIN1256"
INSERT INTO "Unicode data" (i, t) VALUES ('heb+', 'עטלף אבק נס דרך מזגן שהתפוצץ כי חם_');
ERROR:  character with byte sequence 0xd7 0xa2 in encoding "UTF8" has no equivalent in encoding "WIN1256"
SELECT * FROM "Unicode data" WHERE i = 'heb+';
 i | t 
---+---
(0 rows)

DELETE FROM "Unicode data" WHERE t = 'עטלף אבק נס דרך מזגן שהתפוצץ כי חם_';
ERROR:  character with byte sequence 0xd7 0xa2 in encoding "UTF8" has no equivalent in encoding "WIN1256"
SELECT count(*) n FROM "Unicode data" WHERE i = 'heb+';
 n 
---
 0
(1 row)

-- 1252, LATIN1
SELECT * FROM "Unicode data" WHERE i = 'eus';
 i | t 
---+---
(0 rows)

SELECT * FROM "Unicode data" WHERE i = 'fra';
 i | t 
---+---
(0 rows)

SELECT * FROM "Unicode data" WHERE i = 'spa';
 i | t 
---+---
(0 rows)

SELECT * FROM "Unicode data" WHERE t LIKE 'Permi%';
    i    |              t               
---------+------------------------------
 utf_eus | Permin gox dabiltzu yoskiأ±.
(1 row)

SELECT * FROM "Unicode data" WHERE t LIKE 'Dès N%';
 i | t 
---+---
(0 rows)

SELECT * FROM "Unicode data" WHERE t LIKE 'Quier%';
    i    |                            t                             
---------+----------------------------------------------------------
 utf_spa | Quiere la boca exhausta vid, kiwi, piأ±a y fugaz jamأ³n.
(1 row)

INSERT INTO "Unicode data" (i, t) VALUES ('eus+', 'Permin gox dabiltzu yoskiñ._');
ERROR:  character with byte sequence 0xc3 0xb1 in encoding "UTF8" has no equivalent in encoding "WIN1256"
SELECT * FROM "Unicode data" WHERE i = 'eus+';
 i | t 
---+---
(0 rows)

DELETE FROM "Unicode data" WHERE t = 'Permin gox dabiltzu yoskiñ._';
ERROR:  character with byte sequence 0xc3 0xb1 in encoding "UTF8" has no equivalent in encoding "WIN1256"
SELECT count(*) n FROM "Unicode data" WHERE i = 'eus+';
 n 
---
 0
(1 row)

INSERT INTO "Unicode data" (i, t) VALUES ('fra+', 'Dès Noël où un zéphyr haï me vêt de glaçons würmiens je dîne d’exquis rôtis de bœuf au kir à l’aÿ d’âge mûr & cætera !_');
ERROR:  character with byte sequence 0xc3 0xbf in encoding "UTF8" has no equivalent in encoding "WIN1256"
SELECT * FROM "Unicode data" WHERE i = 'fra+';
 i | t 
---+---
(0 rows)

DELETE FROM "Unicode data" WHERE t = 'Dès Noël où un zéphyr haï me vêt de glaçons würmiens je dîne d’exquis rôtis de bœuf au kir à l’aÿ d’âge mûr & cætera !_';
ERROR:  character with byte sequence 0xc3 0xbf in encoding "UTF8" has no equivalent in encoding "WIN1256"
SELECT count(*) n FROM "Unicode data" WHERE i = 'fra+';
 n 
---
 0
(1 row)

INSERT INTO "Unicode data" (i, t) VALUES ('spa+', 'Quiere la boca exhausta vid, kiwi, piña y fugaz jamón._');
ERROR:  character with byte sequence 0xc3 0xb1 in encoding "UTF8" has no equivalent in encoding "WIN1256"
SELECT * FROM "Unicode data" WHERE i = 'spa+';
 i | t 
---+---
(0 rows)

DELETE FROM "Unicode data" WHERE t = 'Quiere la boca exhausta vid, kiwi, piña y fugaz jamón._';
ERROR:  character with byte sequence 0xc3 0xb1 in encoding "UTF8" has no equivalent in encoding "WIN1256"
SELECT count(*) n FROM "Unicode data" WHERE i = 'spa+';
 n 
---
 0
(1 row)

-- 1250, LATIN2
SELECT * FROM "Unicode data" WHERE i = 'cze';
 i | t 
---+---
(0 rows)

SELECT * FROM "Unicode data" WHERE i = 'pol';
 i | t 
---+---
(0 rows)

SELECT * FROM "Unicode data" WHERE i = 'srp';
 i | t 
---+---
(0 rows)

SELECT * FROM "Unicode data" WHERE t LIKE 'Zvláš%';
ERROR:  character with byte sequence 0xc3 0xa1 in encoding "UTF8" has no equivalent in encoding "WIN1256"
SELECT * FROM "Unicode data" WHERE t LIKE 'Pchną%';
ERROR:  character with byte sequence 0xc4 0x85 in encoding "UTF8" has no equivalent in encoding "WIN1256"
SELECT * FROM "Unicode data" WHERE t LIKE 'Ljuba%';
    i    |                                   t                                   
---------+-----------------------------------------------------------------------
 utf_srp | Ljubavi, Olga, hajde poؤ‘i u Fudإ¾i i ؤچut ؤ‡eإ، njeإ¾nu muziku srca.
(1 row)

INSERT INTO "Unicode data" (i, t) VALUES ('cze+', 'Zvlášť zákeřný učeň s ďolíčky běží podél zóny úlů._');
ERROR:  character with byte sequence 0xc3 0xa1 in encoding "UTF8" has no equivalent in encoding "WIN1256"
SELECT * FROM "Unicode data" WHERE i = 'cze+';
 i | t 
---+---
(0 rows)

DELETE FROM "Unicode data" WHERE t = 'Zvlášť zákeřný učeň s ďolíčky běží podél zóny úlů._';
ERROR:  character with byte sequence 0xc3 0xa1 in encoding "UTF8" has no equivalent in encoding "WIN1256"
SELECT count(*) n FROM "Unicode data" WHERE i = 'cze+';
 n 
---
 0
(1 row)

INSERT INTO "Unicode data" (i, t) VALUES ('pol+', 'Pchnąć w tę łódź jeża lub ośm skrzyń fig._');
ERROR:  character with byte sequence 0xc4 0x85 in encoding "UTF8" has no equivalent in encoding "WIN1256"
SELECT * FROM "Unicode data" WHERE i = 'pol+';
 i | t 
---+---
(0 rows)

DELETE FROM "Unicode data" WHERE t = 'Pchnąć w tę łódź jeża lub ośm skrzyń fig._';
ERROR:  character with byte sequence 0xc4 0x85 in encoding "UTF8" has no equivalent in encoding "WIN1256"
SELECT count(*) n FROM "Unicode data" WHERE i = 'pol+';
 n 
---
 0
(1 row)

INSERT INTO "Unicode data" (i, t) VALUES ('srp+', 'Ljubavi, Olga, hajde pođi u Fudži i čut ćeš nježnu muziku srca._');
ERROR:  character with byte sequence 0xc4 0x91 in encoding "UTF8" has no equivalent in encoding "WIN1256"
SELECT * FROM "Unicode data" WHERE i = 'srp+';
 i | t 
---+---
(0 rows)

DELETE FROM "Unicode data" WHERE t = 'Ljubavi, Olga, hajde pođi u Fudži i čut ćeš nježnu muziku srca._';
ERROR:  character with byte sequence 0xc4 0x91 in encoding "UTF8" has no equivalent in encoding "WIN1256"
SELECT count(*) n FROM "Unicode data" WHERE i = 'srp+';
 n 
---
 0
(1 row)

-- 1257, LATIN7
SELECT * FROM "Unicode data" WHERE i = 'lav';
 i | t 
---+---
(0 rows)

SELECT * FROM "Unicode data" WHERE t LIKE 'Ķieģeļu%';
ERROR:  character with byte sequence 0xc4 0xb6 in encoding "UTF8" has no equivalent in encoding "WIN1256"
INSERT INTO "Unicode data" (i, t) VALUES ('lav+', 'Ķieģeļu cepējs Edgars Buls fraku un hūti žāvē uz čīkstošām eņģēm._');
ERROR:  character with byte sequence 0xc4 0xb6 in encoding "UTF8" has no equivalent in encoding "WIN1256"
SELECT * FROM "Unicode data" WHERE i = 'lav+';
 i | t 
---+---
(0 rows)

DELETE FROM "Unicode data" WHERE t = 'Ķieģeļu cepējs Edgars Buls fraku un hūti žāvē uz čīkstošām eņģēm._';
ERROR:  character with byte sequence 0xc4 0xb6 in encoding "UTF8" has no equivalent in encoding "WIN1256"
SELECT count(*) n FROM "Unicode data" WHERE i = 'lav+';
 n 
---
 0
(1 row)

-- EUC_KR
SELECT * FROM "Unicode data" WHERE i = 'kor';
 i | t 
---+---
(0 rows)

SELECT * FROM "Unicode data" WHERE t LIKE '키스의 고%';
ERROR:  character with byte sequence 0xed 0x82 0xa4 in encoding "UTF8" has no equivalent in encoding "WIN1256"
INSERT INTO "Unicode data" (i, t) VALUES ('kor+', '키스의 고유조건은 입술끼리 만나야 하고 특별한 기술은 필요치 않다._');
ERROR:  character with byte sequence 0xed 0x82 0xa4 in encoding "UTF8" has no equivalent in encoding "WIN1256"
SELECT * FROM "Unicode data" WHERE i = 'kor+';
 i | t 
---+---
(0 rows)

DELETE FROM "Unicode data" WHERE t = '키스의 고유조건은 입술끼리 만나야 하고 특별한 기술은 필요치 않다._';
ERROR:  character with byte sequence 0xed 0x82 0xa4 in encoding "UTF8" has no equivalent in encoding "WIN1256"
SELECT count(*) n FROM "Unicode data" WHERE i = 'kor+';
 n 
---
 0
(1 row)

-- 1254, LATIN5
SELECT * FROM "Unicode data" WHERE i = 'aze';
 i | t 
---+---
(0 rows)

SELECT * FROM "Unicode data" WHERE t LIKE 'Zəfər%';
ERROR:  character with byte sequence 0xc9 0x99 in encoding "UTF8" has no equivalent in encoding "WIN1256"
INSERT INTO "Unicode data" (i, t) VALUES ('aze+', 'Zəfər, jaketini də, papağını da götür, bu axşam hava çox soyuq olacaq._');
ERROR:  character with byte sequence 0xc9 0x99 in encoding "UTF8" has no equivalent in encoding "WIN1256"
SELECT * FROM "Unicode data" WHERE i = 'aze+';
 i | t 
---+---
(0 rows)

DELETE FROM "Unicode data" WHERE t = 'Zəfər, jaketini də, papağını da götür, bu axşam hava çox soyuq olacaq._';
ERROR:  character with byte sequence 0xc9 0x99 in encoding "UTF8" has no equivalent in encoding "WIN1256"
SELECT count(*) n FROM "Unicode data" WHERE i = 'aze+';
 n 
---
 0
(1 row)

-- etc
INSERT INTO "Unicode data" (i, t) VALUES ('arm+', 'Բել դղյակի ձախ ժամն օֆ ազգությանը ցպահանջ չճշտած վնաս էր եւ փառք։_');
ERROR:  character with byte sequence 0xd4 0xb2 in encoding "UTF8" has no equivalent in encoding "WIN1256"
SELECT * FROM "Unicode data" WHERE i = 'arm+';
 i | t 
---+---
(0 rows)

DELETE FROM "Unicode data" WHERE t = 'Բել դղյակի ձախ ժամն օֆ ազգությանը ցպահանջ չճշտած վնաս էր եւ փառք։_';
ERROR:  character with byte sequence 0xd4 0xb2 in encoding "UTF8" has no equivalent in encoding "WIN1256"
SELECT count(*) n FROM "Unicode data" WHERE i = 'arm+';
 n 
---
 0
(1 row)

INSERT INTO "Unicode data" (i, t) VALUES ('gle+', 'Chuaigh bé mhórshách le dlúthspád fíorfhinn trí hata mo dhea-phorcáin bhig._');
ERROR:  character with byte sequence 0xc3 0xb3 in encoding "UTF8" has no equivalent in encoding "WIN1256"
SELECT * FROM "Unicode data" WHERE i = 'gle+';
 i | t 
---+---
(0 rows)

DELETE FROM "Unicode data" WHERE t = 'Chuaigh bé mhórshách le dlúthspád fíorfhinn trí hata mo dhea-phorcáin bhig._';
ERROR:  character with byte sequence 0xc3 0xb3 in encoding "UTF8" has no equivalent in encoding "WIN1256"
SELECT count(*) n FROM "Unicode data" WHERE i = 'gle+';
 n 
---
 0
(1 row)

INSERT INTO "Unicode data" (i, t) VALUES ('epo+', 'Laŭ Ludoviko Zamenhof bongustas freŝa ĉeĥa manĝaĵo kun spicoj._');
ERROR:  character with byte sequence 0xc5 0xad in encoding "UTF8" has no equivalent in encoding "WIN1256"
SELECT * FROM "Unicode data" WHERE i = 'epo+';
 i | t 
---+---
(0 rows)

DELETE FROM "Unicode data" WHERE t = 'Laŭ Ludoviko Zamenhof bongustas freŝa ĉeĥa manĝaĵo kun spicoj._';
ERROR:  character with byte sequence 0xc5 0xad in encoding "UTF8" has no equivalent in encoding "WIN1256"
SELECT count(*) n FROM "Unicode data" WHERE i = 'epo+';
 n 
---
 0
(1 row)

DROP FOREIGN TABLE "Unicode data";
DROP SERVER redis_testing_server CASCADE;
NOTICE:  drop cascades to user mapping for public on server redis_testing_server
DROP EXTENSION redis_fdw;
\connect contrib_regression;
DROP DATABASE "contrib_regression_WIN1256";
-- cp1257
CREATE DATABASE "contrib_regression_WIN1257" ENCODING WIN1257 LC_CTYPE='POSIX' LC_COLLATE='POSIX' template template0;
\connect "contrib_regression_WIN1257"
CREATE EXTENSION redis_fdw;
CREATE SERVER redis_testing_server FOREIGN DATA WRAPPER redis_fdw;
CREATE FOREIGN TABLE "Unicode data"(i text, t text)
SERVER redis_testing_server
OPTIONS (database '15');
CREATE USER MAPPING FOR public SERVER redis_testing_server; 
-- EUC_JP
SELECT * FROM "Unicode data" WHERE i = 'jap';
 i | t 
---+---
(0 rows)

SELECT * FROM "Unicode data" WHERE t LIKE 'いろはにほ%';
ERROR:  character with byte sequence 0xe3 0x81 0x84 in encoding "UTF8" has no equivalent in encoding "WIN1257"
INSERT INTO "Unicode data" (i, t) VALUES ('jap+', 'いろはにほへと ちりぬるを わかよたれそ つねならむ うゐのおくやま けふこえて あさきゆめみし ゑひもせす._');
ERROR:  character with byte sequence 0xe3 0x81 0x84 in encoding "UTF8" has no equivalent in encoding "WIN1257"
DELETE FROM "Unicode data" WHERE t = 'いろはにほへと ちりぬるを わかよたれそ つねならむ うゐのおくやま けふこえて あさきゆめみし ゑひもせす._';
ERROR:  character with byte sequence 0xe3 0x81 0x84 in encoding "UTF8" has no equivalent in encoding "WIN1257"
SELECT count(*) n FROM "Unicode data" WHERE i = 'jap+';
 n 
---
 0
(1 row)

-- 1251, ISO_8859_5
SELECT * FROM "Unicode data" WHERE i = 'bel';
 i | t 
---+---
(0 rows)

SELECT * FROM "Unicode data" WHERE i = 'bul';
 i | t 
---+---
(0 rows)

SELECT * FROM "Unicode data" WHERE i = 'rus';
 i | t 
---+---
(0 rows)

SELECT * FROM "Unicode data" WHERE i = 'ukr';
 i | t 
---+---
(0 rows)

SELECT * FROM "Unicode data" WHERE t LIKE 'У руд%';
ERROR:  character with byte sequence 0xd0 0xa3 in encoding "UTF8" has no equivalent in encoding "WIN1257"
SELECT * FROM "Unicode data" WHERE t LIKE 'Ах, ч%';
ERROR:  character with byte sequence 0xd0 0x90 in encoding "UTF8" has no equivalent in encoding "WIN1257"
SELECT * FROM "Unicode data" WHERE t LIKE 'Широк%';
ERROR:  character with byte sequence 0xd0 0xa8 in encoding "UTF8" has no equivalent in encoding "WIN1257"
SELECT * FROM "Unicode data" WHERE t LIKE 'Гей, %';
ERROR:  character with byte sequence 0xd0 0x93 in encoding "UTF8" has no equivalent in encoding "WIN1257"
INSERT INTO "Unicode data" (i, t) VALUES ('bel+', 'У рудога вераб’я ў сховішчы пад фатэлем ляжаць нейкія гаючыя зёлкі._');
ERROR:  character with byte sequence 0xd0 0xa3 in encoding "UTF8" has no equivalent in encoding "WIN1257"
SELECT * FROM "Unicode data" WHERE i = 'bel+';
 i | t 
---+---
(0 rows)

DELETE FROM "Unicode data" WHERE t = 'У рудога вераб’я ў сховішчы пад фатэлем ляжаць нейкія гаючыя зёлкі._';
ERROR:  character with byte sequence 0xd0 0xa3 in encoding "UTF8" has no equivalent in encoding "WIN1257"
SELECT count(*) n FROM "Unicode data" WHERE i = 'bel+';
 n 
---
 0
(1 row)

INSERT INTO "Unicode data" (i, t) VALUES ('bul+', 'Ах, чудна българска земьо, полюшвай цъфтящи жита._');
ERROR:  character with byte sequence 0xd0 0x90 in encoding "UTF8" has no equivalent in encoding "WIN1257"
SELECT * FROM "Unicode data" WHERE i = 'bul+';
 i | t 
---+---
(0 rows)

DELETE FROM "Unicode data" WHERE t = 'Ах, чудна българска земьо, полюшвай цъфтящи жита._';
ERROR:  character with byte sequence 0xd0 0x90 in encoding "UTF8" has no equivalent in encoding "WIN1257"
SELECT count(*) n FROM "Unicode data" WHERE i = 'bul+';
 n 
---
 0
(1 row)

INSERT INTO "Unicode data" (i, t) VALUES ('rus+', 'Широкая электрификация южных губерний даст мощный толчок подъёму сельского хозяйства._');
ERROR:  character with byte sequence 0xd0 0xa8 in encoding "UTF8" has no equivalent in encoding "WIN1257"
SELECT * FROM "Unicode data" WHERE i = 'rus+';
 i | t 
---+---
(0 rows)

DELETE FROM "Unicode data" WHERE t = 'Широкая электрификация южных губерний даст мощный толчок подъёму сельского хозяйства._';
ERROR:  character with byte sequence 0xd0 0xa8 in encoding "UTF8" has no equivalent in encoding "WIN1257"
SELECT count(*) n FROM "Unicode data" WHERE i = 'rus+';
 n 
---
 0
(1 row)

INSERT INTO "Unicode data" (i, t) VALUES ('ukr+', 'Гей, хлопці, не вспію — на ґанку ваша файна їжа знищується бурундучком._');
ERROR:  character with byte sequence 0xd0 0x93 in encoding "UTF8" has no equivalent in encoding "WIN1257"
SELECT * FROM "Unicode data" WHERE i = 'ukr+';
 i | t 
---+---
(0 rows)

DELETE FROM "Unicode data" WHERE t = 'Гей, хлопці, не вспію — на ґанку ваша файна їжа знищується бурундучком._';
ERROR:  character with byte sequence 0xd0 0x93 in encoding "UTF8" has no equivalent in encoding "WIN1257"
SELECT count(*) n FROM "Unicode data" WHERE i = 'ukr+';
 n 
---
 0
(1 row)

-- 1256, ISO_8859_6
SELECT * FROM "Unicode data" WHERE i = 'ara';
 i | t 
---+---
(0 rows)

SELECT * FROM "Unicode data" WHERE t LIKE '%ضَظَغ%';
ERROR:  character with byte sequence 0xd8 0xb6 in encoding "UTF8" has no equivalent in encoding "WIN1257"
INSERT INTO "Unicode data" (i, t) VALUES ('ara+', 'أبجد هوَّز حُطّي كلَمُن سَعْفَص قُرِشَت ثَخَدٌ ضَظَغ_');
ERROR:  character with byte sequence 0xd8 0xa3 in encoding "UTF8" has no equivalent in encoding "WIN1257"
SELECT * FROM "Unicode data" WHERE i = 'ara+';
 i | t 
---+---
(0 rows)

DELETE FROM "Unicode data" WHERE t = 'أبجد هوَّز حُطّي كلَمُن سَعْفَص قُرِشَت ثَخَدٌ ضَظَغ_';
ERROR:  character with byte sequence 0xd8 0xa3 in encoding "UTF8" has no equivalent in encoding "WIN1257"
SELECT count(*) n FROM "Unicode data" WHERE i = 'ara+';
 n 
---
 0
(1 row)

-- 1253, ISO_8859_7
SELECT * FROM "Unicode data" WHERE i = 'gre';
 i | t 
---+---
(0 rows)

SELECT * FROM "Unicode data" WHERE t LIKE 'Τάχισ%';
ERROR:  character with byte sequence 0xce 0xa4 in encoding "UTF8" has no equivalent in encoding "WIN1257"
INSERT INTO "Unicode data" (i, t) VALUES ('gre+', 'Τάχιστη αλώπηξ βαφής ψημένη γη, δρασκελίζει υπέρ νωθρού κυνός_');
ERROR:  character with byte sequence 0xce 0xa4 in encoding "UTF8" has no equivalent in encoding "WIN1257"
SELECT * FROM "Unicode data" WHERE i = 'gre+';
 i | t 
---+---
(0 rows)

DELETE FROM "Unicode data" WHERE t = 'Τάχιστη αλώπηξ βαφής ψημένη γη, δρασκελίζει υπέρ νωθρού κυνός_';
ERROR:  character with byte sequence 0xce 0xa4 in encoding "UTF8" has no equivalent in encoding "WIN1257"
-- 1255, ISO_8859_8
SELECT * FROM "Unicode data" WHERE i = 'heb';
 i | t 
---+---
(0 rows)

SELECT * FROM "Unicode data" WHERE t LIKE '%כי ח%';
ERROR:  character with byte sequence 0xd7 0x9b in encoding "UTF8" has no equivalent in encoding "WIN1257"
INSERT INTO "Unicode data" (i, t) VALUES ('heb+', 'עטלף אבק נס דרך מזגן שהתפוצץ כי חם_');
ERROR:  character with byte sequence 0xd7 0xa2 in encoding "UTF8" has no equivalent in encoding "WIN1257"
SELECT * FROM "Unicode data" WHERE i = 'heb+';
 i | t 
---+---
(0 rows)

DELETE FROM "Unicode data" WHERE t = 'עטלף אבק נס דרך מזגן שהתפוצץ כי חם_';
ERROR:  character with byte sequence 0xd7 0xa2 in encoding "UTF8" has no equivalent in encoding "WIN1257"
SELECT count(*) n FROM "Unicode data" WHERE i = 'heb+';
 n 
---
 0
(1 row)

-- 1252, LATIN1
SELECT * FROM "Unicode data" WHERE i = 'eus';
 i | t 
---+---
(0 rows)

SELECT * FROM "Unicode data" WHERE i = 'fra';
 i | t 
---+---
(0 rows)

SELECT * FROM "Unicode data" WHERE i = 'spa';
 i | t 
---+---
(0 rows)

SELECT * FROM "Unicode data" WHERE t LIKE 'Permi%';
    i    |              t               
---------+------------------------------
 utf_eus | Permin gox dabiltzu yoskiĆ±.
(1 row)

SELECT * FROM "Unicode data" WHERE t LIKE 'Dès N%';
ERROR:  character with byte sequence 0xc3 0xa8 in encoding "UTF8" has no equivalent in encoding "WIN1257"
SELECT * FROM "Unicode data" WHERE t LIKE 'Quier%';
    i    |                            t                             
---------+----------------------------------------------------------
 utf_spa | Quiere la boca exhausta vid, kiwi, piĆ±a y fugaz jamĆ³n.
(1 row)

INSERT INTO "Unicode data" (i, t) VALUES ('eus+', 'Permin gox dabiltzu yoskiñ._');
ERROR:  character with byte sequence 0xc3 0xb1 in encoding "UTF8" has no equivalent in encoding "WIN1257"
SELECT * FROM "Unicode data" WHERE i = 'eus+';
 i | t 
---+---
(0 rows)

DELETE FROM "Unicode data" WHERE t = 'Permin gox dabiltzu yoskiñ._';
ERROR:  character with byte sequence 0xc3 0xb1 in encoding "UTF8" has no equivalent in encoding "WIN1257"
SELECT count(*) n FROM "Unicode data" WHERE i = 'eus+';
 n 
---
 0
(1 row)

INSERT INTO "Unicode data" (i, t) VALUES ('fra+', 'Dès Noël où un zéphyr haï me vêt de glaçons würmiens je dîne d’exquis rôtis de bœuf au kir à l’aÿ d’âge mûr & cætera !_');
ERROR:  character with byte sequence 0xc3 0xa8 in encoding "UTF8" has no equivalent in encoding "WIN1257"
SELECT * FROM "Unicode data" WHERE i = 'fra+';
 i | t 
---+---
(0 rows)

DELETE FROM "Unicode data" WHERE t = 'Dès Noël où un zéphyr haï me vêt de glaçons würmiens je dîne d’exquis rôtis de bœuf au kir à l’aÿ d’âge mûr & cætera !_';
ERROR:  character with byte sequence 0xc3 0xa8 in encoding "UTF8" has no equivalent in encoding "WIN1257"
SELECT count(*) n FROM "Unicode data" WHERE i = 'fra+';
 n 
---
 0
(1 row)

INSERT INTO "Unicode data" (i, t) VALUES ('spa+', 'Quiere la boca exhausta vid, kiwi, piña y fugaz jamón._');
ERROR:  character with byte sequence 0xc3 0xb1 in encoding "UTF8" has no equivalent in encoding "WIN1257"
SELECT * FROM "Unicode data" WHERE i = 'spa+';
 i | t 
---+---
(0 rows)

DELETE FROM "Unicode data" WHERE t = 'Quiere la boca exhausta vid, kiwi, piña y fugaz jamón._';
ERROR:  character with byte sequence 0xc3 0xb1 in encoding "UTF8" has no equivalent in encoding "WIN1257"
SELECT count(*) n FROM "Unicode data" WHERE i = 'spa+';
 n 
---
 0
(1 row)

-- 1250, LATIN2
SELECT * FROM "Unicode data" WHERE i = 'cze';
 i | t 
---+---
(0 rows)

SELECT * FROM "Unicode data" WHERE i = 'pol';
 i | t 
---+---
(0 rows)

SELECT * FROM "Unicode data" WHERE i = 'srp';
 i | t 
---+---
(0 rows)

SELECT * FROM "Unicode data" WHERE t LIKE 'Zvláš%';
ERROR:  character with byte sequence 0xc3 0xa1 in encoding "UTF8" has no equivalent in encoding "WIN1257"
SELECT * FROM "Unicode data" WHERE t LIKE 'Pchną%';
 i | t 
---+---
(0 rows)

SELECT * FROM "Unicode data" WHERE t LIKE 'Ljuba%';
ERROR:  character with byte sequence 0xa1 in encoding "WIN1257" has no equivalent in encoding "UTF8"
INSERT INTO "Unicode data" (i, t) VALUES ('cze+', 'Zvlášť zákeřný učeň s ďolíčky běží podél zóny úlů._');
ERROR:  character with byte sequence 0xc3 0xa1 in encoding "UTF8" has no equivalent in encoding "WIN1257"
SELECT * FROM "Unicode data" WHERE i = 'cze+';
 i | t 
---+---
(0 rows)

DELETE FROM "Unicode data" WHERE t = 'Zvlášť zákeřný učeň s ďolíčky běží podél zóny úlů._';
ERROR:  character with byte sequence 0xc3 0xa1 in encoding "UTF8" has no equivalent in encoding "WIN1257"
SELECT count(*) n FROM "Unicode data" WHERE i = 'cze+';
 n 
---
 0
(1 row)

INSERT INTO "Unicode data" (i, t) VALUES ('pol+', 'Pchnąć w tę łódź jeża lub ośm skrzyń fig._');
SELECT * FROM "Unicode data" WHERE i = 'pol+';
  i   |                     t                      
------+--------------------------------------------
 pol+ | Pchnąć w tę łódź jeża lub ośm skrzyń fig._
(1 row)

DELETE FROM "Unicode data" WHERE t = 'Pchnąć w tę łódź jeża lub ośm skrzyń fig._';
SELECT count(*) n FROM "Unicode data" WHERE i = 'pol+';
 n 
---
 0
(1 row)

INSERT INTO "Unicode data" (i, t) VALUES ('srp+', 'Ljubavi, Olga, hajde pođi u Fudži i čut ćeš nježnu muziku srca._');
ERROR:  character with byte sequence 0xc4 0x91 in encoding "UTF8" has no equivalent in encoding "WIN1257"
SELECT * FROM "Unicode data" WHERE i = 'srp+';
 i | t 
---+---
(0 rows)

DELETE FROM "Unicode data" WHERE t = 'Ljubavi, Olga, hajde pođi u Fudži i čut ćeš nježnu muziku srca._';
ERROR:  character with byte sequence 0xc4 0x91 in encoding "UTF8" has no equivalent in encoding "WIN1257"
SELECT count(*) n FROM "Unicode data" WHERE i = 'srp+';
 n 
---
 0
(1 row)

-- 1257, LATIN7
SELECT * FROM "Unicode data" WHERE i = 'lav';
 i | t 
---+---
(0 rows)

SELECT * FROM "Unicode data" WHERE t LIKE 'Ķieģeļu%';
 i | t 
---+---
(0 rows)

INSERT INTO "Unicode data" (i, t) VALUES ('lav+', 'Ķieģeļu cepējs Edgars Buls fraku un hūti žāvē uz čīkstošām eņģēm._');
SELECT * FROM "Unicode data" WHERE i = 'lav+';
  i   |                                 t                                  
------+--------------------------------------------------------------------
 lav+ | Ķieģeļu cepējs Edgars Buls fraku un hūti žāvē uz čīkstošām eņģēm._
(1 row)

DELETE FROM "Unicode data" WHERE t = 'Ķieģeļu cepējs Edgars Buls fraku un hūti žāvē uz čīkstošām eņģēm._';
SELECT count(*) n FROM "Unicode data" WHERE i = 'lav+';
 n 
---
 0
(1 row)

-- EUC_KR
SELECT * FROM "Unicode data" WHERE i = 'kor';
 i | t 
---+---
(0 rows)

SELECT * FROM "Unicode data" WHERE t LIKE '키스의 고%';
ERROR:  character with byte sequence 0xed 0x82 0xa4 in encoding "UTF8" has no equivalent in encoding "WIN1257"
INSERT INTO "Unicode data" (i, t) VALUES ('kor+', '키스의 고유조건은 입술끼리 만나야 하고 특별한 기술은 필요치 않다._');
ERROR:  character with byte sequence 0xed 0x82 0xa4 in encoding "UTF8" has no equivalent in encoding "WIN1257"
SELECT * FROM "Unicode data" WHERE i = 'kor+';
 i | t 
---+---
(0 rows)

DELETE FROM "Unicode data" WHERE t = '키스의 고유조건은 입술끼리 만나야 하고 특별한 기술은 필요치 않다._';
ERROR:  character with byte sequence 0xed 0x82 0xa4 in encoding "UTF8" has no equivalent in encoding "WIN1257"
SELECT count(*) n FROM "Unicode data" WHERE i = 'kor+';
 n 
---
 0
(1 row)

-- 1254, LATIN5
SELECT * FROM "Unicode data" WHERE i = 'aze';
 i | t 
---+---
(0 rows)

SELECT * FROM "Unicode data" WHERE t LIKE 'Zəfər%';
ERROR:  character with byte sequence 0xc9 0x99 in encoding "UTF8" has no equivalent in encoding "WIN1257"
INSERT INTO "Unicode data" (i, t) VALUES ('aze+', 'Zəfər, jaketini də, papağını da götür, bu axşam hava çox soyuq olacaq._');
ERROR:  character with byte sequence 0xc9 0x99 in encoding "UTF8" has no equivalent in encoding "WIN1257"
SELECT * FROM "Unicode data" WHERE i = 'aze+';
 i | t 
---+---
(0 rows)

DELETE FROM "Unicode data" WHERE t = 'Zəfər, jaketini də, papağını da götür, bu axşam hava çox soyuq olacaq._';
ERROR:  character with byte sequence 0xc9 0x99 in encoding "UTF8" has no equivalent in encoding "WIN1257"
SELECT count(*) n FROM "Unicode data" WHERE i = 'aze+';
 n 
---
 0
(1 row)

-- etc
INSERT INTO "Unicode data" (i, t) VALUES ('arm+', 'Բել դղյակի ձախ ժամն օֆ ազգությանը ցպահանջ չճշտած վնաս էր եւ փառք։_');
ERROR:  character with byte sequence 0xd4 0xb2 in encoding "UTF8" has no equivalent in encoding "WIN1257"
SELECT * FROM "Unicode data" WHERE i = 'arm+';
 i | t 
---+---
(0 rows)

DELETE FROM "Unicode data" WHERE t = 'Բել դղյակի ձախ ժամն օֆ ազգությանը ցպահանջ չճշտած վնաս էր եւ փառք։_';
ERROR:  character with byte sequence 0xd4 0xb2 in encoding "UTF8" has no equivalent in encoding "WIN1257"
SELECT count(*) n FROM "Unicode data" WHERE i = 'arm+';
 n 
---
 0
(1 row)

INSERT INTO "Unicode data" (i, t) VALUES ('gle+', 'Chuaigh bé mhórshách le dlúthspád fíorfhinn trí hata mo dhea-phorcáin bhig._');
ERROR:  character with byte sequence 0xc3 0xa1 in encoding "UTF8" has no equivalent in encoding "WIN1257"
SELECT * FROM "Unicode data" WHERE i = 'gle+';
 i | t 
---+---
(0 rows)

DELETE FROM "Unicode data" WHERE t = 'Chuaigh bé mhórshách le dlúthspád fíorfhinn trí hata mo dhea-phorcáin bhig._';
ERROR:  character with byte sequence 0xc3 0xa1 in encoding "UTF8" has no equivalent in encoding "WIN1257"
SELECT count(*) n FROM "Unicode data" WHERE i = 'gle+';
 n 
---
 0
(1 row)

INSERT INTO "Unicode data" (i, t) VALUES ('epo+', 'Laŭ Ludoviko Zamenhof bongustas freŝa ĉeĥa manĝaĵo kun spicoj._');
ERROR:  character with byte sequence 0xc5 0xad in encoding "UTF8" has no equivalent in encoding "WIN1257"
SELECT * FROM "Unicode data" WHERE i = 'epo+';
 i | t 
---+---
(0 rows)

DELETE FROM "Unicode data" WHERE t = 'Laŭ Ludoviko Zamenhof bongustas freŝa ĉeĥa manĝaĵo kun spicoj._';
ERROR:  character with byte sequence 0xc5 0xad in encoding "UTF8" has no equivalent in encoding "WIN1257"
SELECT count(*) n FROM "Unicode data" WHERE i = 'epo+';
 n 
---
 0
(1 row)

DROP FOREIGN TABLE "Unicode data";
DROP SERVER redis_testing_server CASCADE;
NOTICE:  drop cascades to user mapping for public on server redis_testing_server
DROP EXTENSION redis_fdw;
\connect contrib_regression;
DROP DATABASE "contrib_regression_WIN1257";
-- SQL_ASCII
CREATE DATABASE "contrib_regression_SQL_ASCII" ENCODING SQL_ASCII LC_CTYPE='POSIX' LC_COLLATE='POSIX' template template0;
\connect "contrib_regression_SQL_ASCII"
CREATE EXTENSION redis_fdw;
CREATE SERVER redis_testing_server FOREIGN DATA WRAPPER redis_fdw;
CREATE FOREIGN TABLE "Unicode data"(i text, t text)
SERVER redis_testing_server
OPTIONS (database '15');
CREATE USER MAPPING FOR public SERVER redis_testing_server; 
-- EUC_JP
SELECT * FROM "Unicode data" WHERE i = 'jap';
 i | t 
---+---
(0 rows)

SELECT * FROM "Unicode data" WHERE t LIKE 'いろはにほ%';
    i    |                                                   t                                                    
---------+--------------------------------------------------------------------------------------------------------
 utf_jap | いろはにほへと ちりぬるを わかよたれそ つねならむ うゐのおくやま けふこえて あさきゆめみし ゑひもせす.
(1 row)

INSERT INTO "Unicode data" (i, t) VALUES ('jap+', 'いろはにほへと ちりぬるを わかよたれそ つねならむ うゐのおくやま けふこえて あさきゆめみし ゑひもせす._');
DELETE FROM "Unicode data" WHERE t = 'いろはにほへと ちりぬるを わかよたれそ つねならむ うゐのおくやま けふこえて あさきゆめみし ゑひもせす._';
SELECT count(*) n FROM "Unicode data" WHERE i = 'jap+';
 n 
---
 0
(1 row)

-- 1251, ISO_8859_5
SELECT * FROM "Unicode data" WHERE i = 'bel';
 i | t 
---+---
(0 rows)

SELECT * FROM "Unicode data" WHERE i = 'bul';
 i | t 
---+---
(0 rows)

SELECT * FROM "Unicode data" WHERE i = 'rus';
 i | t 
---+---
(0 rows)

SELECT * FROM "Unicode data" WHERE i = 'ukr';
 i | t 
---+---
(0 rows)

SELECT * FROM "Unicode data" WHERE t LIKE 'У руд%';
    i    |                                  t                                  
---------+---------------------------------------------------------------------
 utf_bel | У рудога вераб’я ў сховішчы пад фатэлем ляжаць нейкія гаючыя зёлкі.
(1 row)

SELECT * FROM "Unicode data" WHERE t LIKE 'Ах, ч%';
    i    |                         t                         
---------+---------------------------------------------------
 utf_bul | Ах, чудна българска земьо, полюшвай цъфтящи жита.
(1 row)

SELECT * FROM "Unicode data" WHERE t LIKE 'Широк%';
    i    |                                           t                                           
---------+---------------------------------------------------------------------------------------
 utf_rus | Широкая электрификация южных губерний даст мощный толчок подъёму сельского хозяйства.
(1 row)

SELECT * FROM "Unicode data" WHERE t LIKE 'Гей, %';
    i    |                                    t                                    
---------+-------------------------------------------------------------------------
 utf_ukr | Гей, хлопці, не вспію — на ґанку ваша файна їжа знищується бурундучком.
(1 row)

INSERT INTO "Unicode data" (i, t) VALUES ('bel+', 'У рудога вераб’я ў сховішчы пад фатэлем ляжаць нейкія гаючыя зёлкі._');
SELECT * FROM "Unicode data" WHERE i = 'bel+';
  i   |                                  t                                   
------+----------------------------------------------------------------------
 bel+ | У рудога вераб’я ў сховішчы пад фатэлем ляжаць нейкія гаючыя зёлкі._
(1 row)

DELETE FROM "Unicode data" WHERE t = 'У рудога вераб’я ў сховішчы пад фатэлем ляжаць нейкія гаючыя зёлкі._';
SELECT count(*) n FROM "Unicode data" WHERE i = 'bel+';
 n 
---
 0
(1 row)

INSERT INTO "Unicode data" (i, t) VALUES ('bul+', 'Ах, чудна българска земьо, полюшвай цъфтящи жита._');
SELECT * FROM "Unicode data" WHERE i = 'bul+';
  i   |                         t                          
------+----------------------------------------------------
 bul+ | Ах, чудна българска земьо, полюшвай цъфтящи жита._
(1 row)

DELETE FROM "Unicode data" WHERE t = 'Ах, чудна българска земьо, полюшвай цъфтящи жита._';
SELECT count(*) n FROM "Unicode data" WHERE i = 'bul+';
 n 
---
 0
(1 row)

INSERT INTO "Unicode data" (i, t) VALUES ('rus+', 'Широкая электрификация южных губерний даст мощный толчок подъёму сельского хозяйства._');
SELECT * FROM "Unicode data" WHERE i = 'rus+';
  i   |                                           t                                            
------+----------------------------------------------------------------------------------------
 rus+ | Широкая электрификация южных губерний даст мощный толчок подъёму сельского хозяйства._
(1 row)

DELETE FROM "Unicode data" WHERE t = 'Широкая электрификация южных губерний даст мощный толчок подъёму сельского хозяйства._';
SELECT count(*) n FROM "Unicode data" WHERE i = 'rus+';
 n 
---
 0
(1 row)

INSERT INTO "Unicode data" (i, t) VALUES ('ukr+', 'Гей, хлопці, не вспію — на ґанку ваша файна їжа знищується бурундучком._');
SELECT * FROM "Unicode data" WHERE i = 'ukr+';
  i   |                                    t                                     
------+--------------------------------------------------------------------------
 ukr+ | Гей, хлопці, не вспію — на ґанку ваша файна їжа знищується бурундучком._
(1 row)

DELETE FROM "Unicode data" WHERE t = 'Гей, хлопці, не вспію — на ґанку ваша файна їжа знищується бурундучком._';
SELECT count(*) n FROM "Unicode data" WHERE i = 'ukr+';
 n 
---
 0
(1 row)

-- 1256, ISO_8859_6
SELECT * FROM "Unicode data" WHERE i = 'ara';
 i | t 
---+---
(0 rows)

SELECT * FROM "Unicode data" WHERE t LIKE '%ضَظَغ%';
    i    |                  t                  
---------+-------------------------------------
 utf_ara | أبجد هوَّز حُطّي كلَمُن سَعْفَص قُرِشَت ثَخَدٌ ضَظَغ
(1 row)

INSERT INTO "Unicode data" (i, t) VALUES ('ara+', 'أبجد هوَّز حُطّي كلَمُن سَعْفَص قُرِشَت ثَخَدٌ ضَظَغ_');
SELECT * FROM "Unicode data" WHERE i = 'ara+';
  i   |                  t                   
------+--------------------------------------
 ara+ | أبجد هوَّز حُطّي كلَمُن سَعْفَص قُرِشَت ثَخَدٌ ضَظَغ_
(1 row)

DELETE FROM "Unicode data" WHERE t = 'أبجد هوَّز حُطّي كلَمُن سَعْفَص قُرِشَت ثَخَدٌ ضَظَغ_';
SELECT count(*) n FROM "Unicode data" WHERE i = 'ara+';
 n 
---
 0
(1 row)

-- 1253, ISO_8859_7
SELECT * FROM "Unicode data" WHERE i = 'gre';
 i | t 
---+---
(0 rows)

SELECT * FROM "Unicode data" WHERE t LIKE 'Τάχισ%';
    i    |                               t                               
---------+---------------------------------------------------------------
 utf_gre | Τάχιστη αλώπηξ βαφής ψημένη γη, δρασκελίζει υπέρ νωθρού κυνός
(1 row)

INSERT INTO "Unicode data" (i, t) VALUES ('gre+', 'Τάχιστη αλώπηξ βαφής ψημένη γη, δρασκελίζει υπέρ νωθρού κυνός_');
SELECT * FROM "Unicode data" WHERE i = 'gre+';
  i   |                               t                                
------+----------------------------------------------------------------
 gre+ | Τάχιστη αλώπηξ βαφής ψημένη γη, δρασκελίζει υπέρ νωθρού κυνός_
(1 row)

DELETE FROM "Unicode data" WHERE t = 'Τάχιστη αλώπηξ βαφής ψημένη γη, δρασκελίζει υπέρ νωθρού κυνός_';
-- 1255, ISO_8859_8
SELECT * FROM "Unicode data" WHERE i = 'heb';
 i | t 
---+---
(0 rows)

SELECT * FROM "Unicode data" WHERE t LIKE '%כי ח%';
    i    |                 t                  
---------+------------------------------------
 utf_heb | עטלף אבק נס דרך מזגן שהתפוצץ כי חם
(1 row)

INSERT INTO "Unicode data" (i, t) VALUES ('heb+', 'עטלף אבק נס דרך מזגן שהתפוצץ כי חם_');
SELECT * FROM "Unicode data" WHERE i = 'heb+';
  i   |                  t                  
------+-------------------------------------
 heb+ | עטלף אבק נס דרך מזגן שהתפוצץ כי חם_
(1 row)

DELETE FROM "Unicode data" WHERE t = 'עטלף אבק נס דרך מזגן שהתפוצץ כי חם_';
SELECT count(*) n FROM "Unicode data" WHERE i = 'heb+';
 n 
---
 0
(1 row)

-- 1252, LATIN1
SELECT * FROM "Unicode data" WHERE i = 'eus';
 i | t 
---+---
(0 rows)

SELECT * FROM "Unicode data" WHERE i = 'fra';
 i | t 
---+---
(0 rows)

SELECT * FROM "Unicode data" WHERE i = 'spa';
 i | t 
---+---
(0 rows)

SELECT * FROM "Unicode data" WHERE t LIKE 'Permi%';
    i    |              t              
---------+-----------------------------
 utf_eus | Permin gox dabiltzu yoskiñ.
(1 row)

SELECT * FROM "Unicode data" WHERE t LIKE 'Dès N%';
    i    |                                                           t                                                            
---------+------------------------------------------------------------------------------------------------------------------------
 utf_fra | Dès Noël où un zéphyr haï me vêt de glaçons würmiens je dîne d’exquis rôtis de bœuf au kir à l’aÿ d’âge mûr & cætera !
(1 row)

SELECT * FROM "Unicode data" WHERE t LIKE 'Quier%';
    i    |                           t                            
---------+--------------------------------------------------------
 utf_spa | Quiere la boca exhausta vid, kiwi, piña y fugaz jamón.
(1 row)

INSERT INTO "Unicode data" (i, t) VALUES ('eus+', 'Permin gox dabiltzu yoskiñ._');
SELECT * FROM "Unicode data" WHERE i = 'eus+';
  i   |              t               
------+------------------------------
 eus+ | Permin gox dabiltzu yoskiñ._
(1 row)

DELETE FROM "Unicode data" WHERE t = 'Permin gox dabiltzu yoskiñ._';
SELECT count(*) n FROM "Unicode data" WHERE i = 'eus+';
 n 
---
 0
(1 row)

INSERT INTO "Unicode data" (i, t) VALUES ('fra+', 'Dès Noël où un zéphyr haï me vêt de glaçons würmiens je dîne d’exquis rôtis de bœuf au kir à l’aÿ d’âge mûr & cætera !_');
SELECT * FROM "Unicode data" WHERE i = 'fra+';
  i   |                                                            t                                                            
------+-------------------------------------------------------------------------------------------------------------------------
 fra+ | Dès Noël où un zéphyr haï me vêt de glaçons würmiens je dîne d’exquis rôtis de bœuf au kir à l’aÿ d’âge mûr & cætera !_
(1 row)

DELETE FROM "Unicode data" WHERE t = 'Dès Noël où un zéphyr haï me vêt de glaçons würmiens je dîne d’exquis rôtis de bœuf au kir à l’aÿ d’âge mûr & cætera !_';
SELECT count(*) n FROM "Unicode data" WHERE i = 'fra+';
 n 
---
 0
(1 row)

INSERT INTO "Unicode data" (i, t) VALUES ('spa+', 'Quiere la boca exhausta vid, kiwi, piña y fugaz jamón._');
SELECT * FROM "Unicode data" WHERE i = 'spa+';
  i   |                            t                            
------+---------------------------------------------------------
 spa+ | Quiere la boca exhausta vid, kiwi, piña y fugaz jamón._
(1 row)

DELETE FROM "Unicode data" WHERE t = 'Quiere la boca exhausta vid, kiwi, piña y fugaz jamón._';
SELECT count(*) n FROM "Unicode data" WHERE i = 'spa+';
 n 
---
 0
(1 row)

-- 1250, LATIN2
SELECT * FROM "Unicode data" WHERE i = 'cze';
 i | t 
---+---
(0 rows)

SELECT * FROM "Unicode data" WHERE i = 'pol';
 i | t 
---+---
(0 rows)

SELECT * FROM "Unicode data" WHERE i = 'srp';
 i | t 
---+---
(0 rows)

SELECT * FROM "Unicode data" WHERE t LIKE 'Zvláš%';
    i    |                         t                          
---------+----------------------------------------------------
 utf_cze | Zvlášť zákeřný učeň s ďolíčky běží podél zóny úlů.
(1 row)

SELECT * FROM "Unicode data" WHERE t LIKE 'Pchną%';
    i    |                     t                     
---------+-------------------------------------------
 utf_pol | Pchnąć w tę łódź jeża lub ośm skrzyń fig.
(1 row)

SELECT * FROM "Unicode data" WHERE t LIKE 'Ljuba%';
    i    |                                t                                
---------+-----------------------------------------------------------------
 utf_srp | Ljubavi, Olga, hajde pođi u Fudži i čut ćeš nježnu muziku srca.
(1 row)

INSERT INTO "Unicode data" (i, t) VALUES ('cze+', 'Zvlášť zákeřný učeň s ďolíčky běží podél zóny úlů._');
SELECT * FROM "Unicode data" WHERE i = 'cze+';
  i   |                          t                          
------+-----------------------------------------------------
 cze+ | Zvlášť zákeřný učeň s ďolíčky běží podél zóny úlů._
(1 row)

DELETE FROM "Unicode data" WHERE t = 'Zvlášť zákeřný učeň s ďolíčky běží podél zóny úlů._';
SELECT count(*) n FROM "Unicode data" WHERE i = 'cze+';
 n 
---
 0
(1 row)

INSERT INTO "Unicode data" (i, t) VALUES ('pol+', 'Pchnąć w tę łódź jeża lub ośm skrzyń fig._');
SELECT * FROM "Unicode data" WHERE i = 'pol+';
  i   |                     t                      
------+--------------------------------------------
 pol+ | Pchnąć w tę łódź jeża lub ośm skrzyń fig._
(1 row)

DELETE FROM "Unicode data" WHERE t = 'Pchnąć w tę łódź jeża lub ośm skrzyń fig._';
SELECT count(*) n FROM "Unicode data" WHERE i = 'pol+';
 n 
---
 0
(1 row)

INSERT INTO "Unicode data" (i, t) VALUES ('srp+', 'Ljubavi, Olga, hajde pođi u Fudži i čut ćeš nježnu muziku srca._');
SELECT * FROM "Unicode data" WHERE i = 'srp+';
  i   |                                t                                 
------+------------------------------------------------------------------
 srp+ | Ljubavi, Olga, hajde pođi u Fudži i čut ćeš nježnu muziku srca._
(1 row)

DELETE FROM "Unicode data" WHERE t = 'Ljubavi, Olga, hajde pođi u Fudži i čut ćeš nježnu muziku srca._';
SELECT count(*) n FROM "Unicode data" WHERE i = 'srp+';
 n 
---
 0
(1 row)

-- 1257, LATIN7
SELECT * FROM "Unicode data" WHERE i = 'lav';
 i | t 
---+---
(0 rows)

SELECT * FROM "Unicode data" WHERE t LIKE 'Ķieģeļu%';
    i    |                                 t                                 
---------+-------------------------------------------------------------------
 utf_lav | Ķieģeļu cepējs Edgars Buls fraku un hūti žāvē uz čīkstošām eņģēm.
(1 row)

INSERT INTO "Unicode data" (i, t) VALUES ('lav+', 'Ķieģeļu cepējs Edgars Buls fraku un hūti žāvē uz čīkstošām eņģēm._');
SELECT * FROM "Unicode data" WHERE i = 'lav+';
  i   |                                 t                                  
------+--------------------------------------------------------------------
 lav+ | Ķieģeļu cepējs Edgars Buls fraku un hūti žāvē uz čīkstošām eņģēm._
(1 row)

DELETE FROM "Unicode data" WHERE t = 'Ķieģeļu cepējs Edgars Buls fraku un hūti žāvē uz čīkstošām eņģēm._';
SELECT count(*) n FROM "Unicode data" WHERE i = 'lav+';
 n 
---
 0
(1 row)

-- EUC_KR
SELECT * FROM "Unicode data" WHERE i = 'kor';
 i | t 
---+---
(0 rows)

SELECT * FROM "Unicode data" WHERE t LIKE '키스의 고%';
    i    |                                 t                                 
---------+-------------------------------------------------------------------
 utf_kor | 키스의 고유조건은 입술끼리 만나야 하고 특별한 기술은 필요치 않다.
(1 row)

INSERT INTO "Unicode data" (i, t) VALUES ('kor+', '키스의 고유조건은 입술끼리 만나야 하고 특별한 기술은 필요치 않다._');
SELECT * FROM "Unicode data" WHERE i = 'kor+';
  i   |                                 t                                  
------+--------------------------------------------------------------------
 kor+ | 키스의 고유조건은 입술끼리 만나야 하고 특별한 기술은 필요치 않다._
(1 row)

DELETE FROM "Unicode data" WHERE t = '키스의 고유조건은 입술끼리 만나야 하고 특별한 기술은 필요치 않다._';
SELECT count(*) n FROM "Unicode data" WHERE i = 'kor+';
 n 
---
 0
(1 row)

-- 1254, LATIN5
SELECT * FROM "Unicode data" WHERE i = 'aze';
 i | t 
---+---
(0 rows)

SELECT * FROM "Unicode data" WHERE t LIKE 'Zəfər%';
    i    |                                   t                                    
---------+------------------------------------------------------------------------
 utf_aze | Zəfər, jaketini də, papağını da götür, bu axşam hava çox soyuq olacaq.
(1 row)

INSERT INTO "Unicode data" (i, t) VALUES ('aze+', 'Zəfər, jaketini də, papağını da götür, bu axşam hava çox soyuq olacaq._');
SELECT * FROM "Unicode data" WHERE i = 'aze+';
  i   |                                    t                                    
------+-------------------------------------------------------------------------
 aze+ | Zəfər, jaketini də, papağını da götür, bu axşam hava çox soyuq olacaq._
(1 row)

DELETE FROM "Unicode data" WHERE t = 'Zəfər, jaketini də, papağını da götür, bu axşam hava çox soyuq olacaq._';
SELECT count(*) n FROM "Unicode data" WHERE i = 'aze+';
 n 
---
 0
(1 row)

-- etc
INSERT INTO "Unicode data" (i, t) VALUES ('arm+', 'Բել դղյակի ձախ ժամն օֆ ազգությանը ցպահանջ չճշտած վնաս էր եւ փառք։_');
SELECT * FROM "Unicode data" WHERE i = 'arm+';
  i   |                                 t                                  
------+--------------------------------------------------------------------
 arm+ | Բել դղյակի ձախ ժամն օֆ ազգությանը ցպահանջ չճշտած վնաս էր եւ փառք։_
(1 row)

DELETE FROM "Unicode data" WHERE t = 'Բել դղյակի ձախ ժամն օֆ ազգությանը ցպահանջ չճշտած վնաս էր եւ փառք։_';
SELECT count(*) n FROM "Unicode data" WHERE i = 'arm+';
 n 
---
 0
(1 row)

INSERT INTO "Unicode data" (i, t) VALUES ('gle+', 'Chuaigh bé mhórshách le dlúthspád fíorfhinn trí hata mo dhea-phorcáin bhig._');
SELECT * FROM "Unicode data" WHERE i = 'gle+';
  i   |                                      t                                       
------+------------------------------------------------------------------------------
 gle+ | Chuaigh bé mhórshách le dlúthspád fíorfhinn trí hata mo dhea-phorcáin bhig._
(1 row)

DELETE FROM "Unicode data" WHERE t = 'Chuaigh bé mhórshách le dlúthspád fíorfhinn trí hata mo dhea-phorcáin bhig._';
SELECT count(*) n FROM "Unicode data" WHERE i = 'gle+';
 n 
---
 0
(1 row)

INSERT INTO "Unicode data" (i, t) VALUES ('epo+', 'Laŭ Ludoviko Zamenhof bongustas freŝa ĉeĥa manĝaĵo kun spicoj._');
SELECT * FROM "Unicode data" WHERE i = 'epo+';
  i   |                                t                                
------+-----------------------------------------------------------------
 epo+ | Laŭ Ludoviko Zamenhof bongustas freŝa ĉeĥa manĝaĵo kun spicoj._
(1 row)

DELETE FROM "Unicode data" WHERE t = 'Laŭ Ludoviko Zamenhof bongustas freŝa ĉeĥa manĝaĵo kun spicoj._';
SELECT count(*) n FROM "Unicode data" WHERE i = 'epo+';
 n 
---
 0
(1 row)

DROP FOREIGN TABLE "Unicode data";
DROP SERVER redis_testing_server CASCADE;
NOTICE:  drop cascades to user mapping for public on server redis_testing_server
DROP EXTENSION redis_fdw;
\connect contrib_regression;
DROP DATABASE "contrib_regression_SQL_ASCII";
\! redis-cli < test/redis_clean
OK
OK
